{
    "componentChunkName": "component---node-modules-gatsby-theme-primer-wiki-src-templates-post-query-js",
    "path": "/awesome-tech-anwser/",
    "result": {"data":{"mdx":{"id":"03177117-d445-5055-bec9-bcf07465e099","tableOfContents":{"items":[{"url":"#serverless","title":"Serverless"}]},"fields":{"title":"收集一些有用的技术/环境问题的解决方案","slug":"/awesome-tech-anwser/","url":"https://wiki.owenyoung.com/awesome-tech-anwser/","editUrl":"https://github.com/theowenyoung/wiki/tree/main/awesome-tech-anwser.md","lastUpdatedAt":"2021-09-10T09:43:29.000Z","lastUpdated":"9/10/2021","gitCreatedAt":"2021-09-10T09:43:29.000Z","shouldShowTitle":true},"frontmatter":{"title":"收集一些有用的技术/环境问题的解决方案","description":null,"imageAlt":null,"tags":["Awesome","FAQ","Tech","Serverless"],"date":null,"dateModified":null,"language":null,"seoTitle":null,"image":null},"body":"var _excluded = [\"components\"];\n\nfunction _extends() { _extends = Object.assign || function (target) { for (var i = 1; i < arguments.length; i++) { var source = arguments[i]; for (var key in source) { if (Object.prototype.hasOwnProperty.call(source, key)) { target[key] = source[key]; } } } return target; }; return _extends.apply(this, arguments); }\n\nfunction _objectWithoutProperties(source, excluded) { if (source == null) return {}; var target = _objectWithoutPropertiesLoose(source, excluded); var key, i; if (Object.getOwnPropertySymbols) { var sourceSymbolKeys = Object.getOwnPropertySymbols(source); for (i = 0; i < sourceSymbolKeys.length; i++) { key = sourceSymbolKeys[i]; if (excluded.indexOf(key) >= 0) continue; if (!Object.prototype.propertyIsEnumerable.call(source, key)) continue; target[key] = source[key]; } } return target; }\n\nfunction _objectWithoutPropertiesLoose(source, excluded) { if (source == null) return {}; var target = {}; var sourceKeys = Object.keys(source); var key, i; for (i = 0; i < sourceKeys.length; i++) { key = sourceKeys[i]; if (excluded.indexOf(key) >= 0) continue; target[key] = source[key]; } return target; }\n\n/* @jsxRuntime classic */\n\n/* @jsx mdx */\nvar _frontmatter = {\n  \"title\": \"收集一些有用的技术/环境问题的解决方案\",\n  \"tags\": [\"Awesome\", \"FAQ\", \"Tech\", \"Serverless\"]\n};\nvar layoutProps = {\n  _frontmatter: _frontmatter\n};\nvar MDXLayout = \"wrapper\";\nreturn function MDXContent(_ref) {\n  var components = _ref.components,\n      props = _objectWithoutProperties(_ref, _excluded);\n\n  return mdx(MDXLayout, _extends({}, layoutProps, props, {\n    components: components,\n    mdxType: \"MDXLayout\"\n  }), mdx(\"p\", null, \"\\u6536\\u96C6\\u4E00\\u4E9B\\u6709\\u7528\\u7684\\u6280\\u672F/\\u73AF\\u5883\\u95EE\\u9898\\u7684\\u89E3\\u51B3\\u65B9\\u6848\\u3002\"), mdx(\"h2\", {\n    \"id\": \"serverless\"\n  }, \"Serverless\"), mdx(\"ul\", null, mdx(\"li\", {\n    parentName: \"ul\"\n  }, mdx(\"a\", {\n    parentName: \"li\",\n    \"href\": \"https://developer.aliyun.com/article/645670?spm=5176.smartservice_service_chat.0.0.6a33709aQ2zFPh\"\n  }, \"\\u963F\\u91CC\\u4E91\\u51FD\\u6570\\u8BA1\\u7B97 php \\u73AF\\u5883\\u5982\\u4F55\\u81EA\\u5B9A\\u4E49\\u5185\\u7F6E\\u6269\\u5C55\\uFF0C\\u8986\\u76D6\\u7CFB\\u7EDF\\u81EA\\u5E26\\u6269\\u5C55\"))));\n}\n;\nMDXContent.isMDXComponent = true;","rawBody":"---\ntitle: 收集一些有用的技术/环境问题的解决方案\ntags:\n  - Awesome\n  - FAQ\n  - Tech\n  - Serverless\n---\n\n收集一些有用的技术/环境问题的解决方案。\n\n## Serverless\n\n- [阿里云函数计算 php 环境如何自定义内置扩展，覆盖系统自带扩展](https://developer.aliyun.com/article/645670?spm=5176.smartservice_service_chat.0.0.6a33709aQ2zFPh)\n","excerpt":"收集一些有用的技术/环境问题的解决方案。 Serverless 阿里云函数计算 php 环境如何自定义内置扩展，覆盖系统自带扩展","outboundReferences":[],"inboundReferences":[]},"tagsOutbound":{"nodes":[{"frontmatter":{"title":"Awesome Algorithm","tags":["Awesome","Algorithm","Recommend"]},"fields":{"slug":"/awesome-algorithm/","title":"Awesome Algorithm","lastUpdated":"9/5/2021","lastUpdatedAt":"2021-09-05T06:09:14.000Z","gitCreatedAt":"2021-09-05T06:09:14.000Z"}},{"frontmatter":{"title":"Awesome Alternatives","tags":["Awesome","Alternatives"]},"fields":{"slug":"/awesome-alternatives/","title":"Awesome Alternatives","lastUpdated":"1/28/2022","lastUpdatedAt":"2022-01-28T15:56:55.000Z","gitCreatedAt":"2021-09-12T18:29:05.000Z"}},{"frontmatter":{"title":"有意思的问题收集","tags":["Awesome","FAQ","Answer","中文","Ask"]},"fields":{"slug":"/awesome-answers/","title":"有意思的问题收集","lastUpdated":"3/8/2022","lastUpdatedAt":"2022-03-08T15:54:49.000Z","gitCreatedAt":"2021-09-05T04:49:34.000Z"}},{"frontmatter":{"title":"Awesome APIs","tags":["Awesome","API"]},"fields":{"slug":"/awesome-apis/","title":"Awesome APIs","lastUpdated":"2/19/2022","lastUpdatedAt":"2022-02-19T04:56:53.000Z","gitCreatedAt":"2021-10-12T07:22:35.000Z"}},{"frontmatter":{"title":"Awesome Applications","tags":["Awesome","Applications"]},"fields":{"slug":"/awesome-applications/","title":"Awesome Applications","lastUpdated":"3/8/2022","lastUpdatedAt":"2022-03-08T11:22:55.000Z","gitCreatedAt":"2021-09-12T18:29:05.000Z"}},{"frontmatter":{"title":"值得一看的文章列表","tags":["Awesome","Articles"]},"fields":{"slug":"/awesome-articles/","title":"值得一看的文章列表","lastUpdated":"3/9/2022","lastUpdatedAt":"2022-03-09T07:54:15.000Z","gitCreatedAt":"2021-12-19T22:36:06.000Z"}},{"frontmatter":{"title":"Awesome Automations","tags":["Awesome","Automations","Self-Hosted"]},"fields":{"slug":"/awesome-automations/","title":"Awesome Automations","lastUpdated":"9/12/2021","lastUpdatedAt":"2021-09-12T07:41:32.000Z","gitCreatedAt":"2021-09-03T05:53:38.000Z"}},{"frontmatter":{"title":"","tags":["Awesome"]},"fields":{"slug":"/awesome-backup/","title":"Awesome Backup","lastUpdated":"8/27/2021","lastUpdatedAt":"2021-08-27T02:25:34.000Z","gitCreatedAt":"2021-08-27T02:25:34.000Z"}},{"frontmatter":{"title":"","tags":["Benchmark","Proxies","Bash","Awesome"]},"fields":{"slug":"/awesome-benchmark/","title":"Awesome Benchmark","lastUpdated":"9/28/2021","lastUpdatedAt":"2021-09-28T07:14:03.000Z","gitCreatedAt":"2021-08-27T02:25:34.000Z"}},{"frontmatter":{"title":"","tags":["Awesome"]},"fields":{"slug":"/awesome-bookmarks/","title":"Awesome Bookmarks","lastUpdated":"8/27/2021","lastUpdatedAt":"2021-08-27T02:25:34.000Z","gitCreatedAt":"2021-08-27T02:25:34.000Z"}},{"frontmatter":{"title":"Awesome Chat","tags":["Awesome","Chat"]},"fields":{"slug":"/awesome-chat/","title":"Awesome Chat","lastUpdated":"11/20/2021","lastUpdatedAt":"2021-11-20T14:04:22.000Z","gitCreatedAt":"2021-10-12T07:22:35.000Z"}},{"frontmatter":{"title":"","tags":["Awesome","Browser"]},"fields":{"slug":"/awesome-browsers/","title":"Awesome Browsers","lastUpdated":"3/10/2022","lastUpdatedAt":"2022-03-10T16:43:18.000Z","gitCreatedAt":"2021-09-04T02:41:10.000Z"}},{"frontmatter":{"title":"Awesome Command Tools","tags":["Awesome","Tools","Command"]},"fields":{"slug":"/awesome-cli/","title":"Awesome Command Tools","lastUpdated":"3/8/2022","lastUpdatedAt":"2022-03-08T04:17:56.000Z","gitCreatedAt":"2022-03-08T04:17:56.000Z"}},{"frontmatter":{"title":"在中国买房之前，你需要了解的信息汇总","tags":["Awesome","House","China"]},"fields":{"slug":"/awesome-cn-house/","title":"在中国买房之前，你需要了解的信息汇总","lastUpdated":"2/11/2022","lastUpdatedAt":"2022-02-11T11:54:43.000Z","gitCreatedAt":"2022-02-11T11:54:43.000Z"}},{"frontmatter":{"title":"","tags":["Awesome","Code","Learning"]},"fields":{"slug":"/awesome-code-learning/","title":"Awesome Code Learning","lastUpdated":"12/13/2021","lastUpdatedAt":"2021-12-13T14:27:33.000Z","gitCreatedAt":"2021-09-04T07:51:54.000Z"}},{"frontmatter":{"title":"Awesome Dashboard","tags":["Awesome","Admin","Dashboard"]},"fields":{"slug":"/awesome-dashboard/","title":"Awesome Dashboard","lastUpdated":"1/28/2022","lastUpdatedAt":"2022-01-28T15:56:55.000Z","gitCreatedAt":"2022-01-28T15:56:55.000Z"}},{"frontmatter":{"title":"","tags":["Awesome","Communities","Social","中文"]},"fields":{"slug":"/awesome-communities/","title":"收集一些有意思的社区","lastUpdated":"2/15/2022","lastUpdatedAt":"2022-02-15T03:43:44.000Z","gitCreatedAt":"2021-09-04T07:51:54.000Z"}},{"frontmatter":{"title":"有趣的数据","tags":["Data","Awesome","中文"]},"fields":{"slug":"/awesome-data/","title":"有趣的数据","lastUpdated":"3/6/2022","lastUpdatedAt":"2022-03-06T09:09:39.000Z","gitCreatedAt":"2022-02-21T01:59:18.000Z"}},{"frontmatter":{"title":"Awesome Databases","tags":["Awesome","Database"]},"fields":{"slug":"/awesome-databases/","title":"Awesome Databases","lastUpdated":"1/30/2022","lastUpdatedAt":"2022-01-30T07:47:59.000Z","gitCreatedAt":"2021-09-28T07:14:03.000Z"}},{"frontmatter":{"title":"Awesome Decentralization","tags":["Awesome","Decentralization"]},"fields":{"slug":"/awesome-decentralization/","title":"Awesome Decentralization","lastUpdated":"3/7/2022","lastUpdatedAt":"2022-03-07T15:47:04.000Z","gitCreatedAt":"2021-09-24T11:05:17.000Z"}},{"frontmatter":{"title":"Awesome Deno","tags":["Awesome","Deno"]},"fields":{"slug":"/awesome-deno/","title":"Awesome Deno","lastUpdated":"1/22/2022","lastUpdatedAt":"2022-01-22T11:04:34.000Z","gitCreatedAt":"2021-09-25T19:02:30.000Z"}},{"frontmatter":{"title":"Awesome Editors","tags":["Awesome","Editors","Tools"]},"fields":{"slug":"/awesome-editors/","title":"Awesome Editors","lastUpdated":"1/24/2022","lastUpdatedAt":"2022-01-24T14:37:03.000Z","gitCreatedAt":"2021-09-04T02:41:10.000Z"}},{"frontmatter":{"title":"Awesome Emails","tags":["Awesome","Email"]},"fields":{"slug":"/awesome-emails.md/","title":"Awesome Emails","lastUpdated":"10/10/2021","lastUpdatedAt":"2021-10-10T23:24:14.000Z","gitCreatedAt":"2021-10-10T23:24:14.000Z"}},{"frontmatter":{"title":"","tags":["Awesome","English","Learning"]},"fields":{"slug":"/awesome-english-learning/","title":"收集英语学习工具","lastUpdated":"2/27/2022","lastUpdatedAt":"2022-02-27T02:48:28.000Z","gitCreatedAt":"2021-09-04T02:41:10.000Z"}},{"frontmatter":{"title":"Awesome Extensions","tags":["Awesome","Extensions"]},"fields":{"slug":"/awesome-extensions/","title":"Awesome Extensions","lastUpdated":"1/29/2022","lastUpdatedAt":"2022-01-29T17:28:39.000Z","gitCreatedAt":"2022-01-29T17:28:39.000Z"}},{"frontmatter":{"title":"Awesome Flutter","tags":["Awesome","Flutter"]},"fields":{"slug":"/awesome-flutter/","title":"Awesome Flutter","lastUpdated":"2/13/2022","lastUpdatedAt":"2022-02-13T17:40:05.000Z","gitCreatedAt":"2021-10-11T13:41:00.000Z"}},{"frontmatter":{"title":"","tags":["Awesome","Files"]},"fields":{"slug":"/awesome-file-managers/","title":"Awesome File Managers","lastUpdated":"8/27/2021","lastUpdatedAt":"2021-08-27T03:43:35.000Z","gitCreatedAt":"2021-08-27T02:25:34.000Z"}},{"frontmatter":{"title":"Awesome Free","tags":["Free","Awesome","Tools"]},"fields":{"slug":"/awesome-free/","title":"Awesome Free","lastUpdated":"3/7/2022","lastUpdatedAt":"2022-03-07T15:47:04.000Z","gitCreatedAt":"2021-08-29T20:06:24.000Z"}},{"frontmatter":{"title":"Awesome Frontend","tags":["Awesome","Frontend","Application"]},"fields":{"slug":"/awesome-frontend/","title":"Awesome Frontend","lastUpdated":"3/6/2022","lastUpdatedAt":"2022-03-06T08:07:02.000Z","gitCreatedAt":"2022-03-06T08:07:02.000Z"}},{"frontmatter":{"title":"","tags":["Awesome"]},"fields":{"slug":"/awesome-gatsby/","title":"Awesome Gatsby","lastUpdated":"8/29/2021","lastUpdatedAt":"2021-08-29T20:06:24.000Z","gitCreatedAt":"2021-08-27T02:25:34.000Z"}},{"frontmatter":{"title":"智能家居方案汇总","tags":["Awesome","Home"]},"fields":{"slug":"/awesome-home/","title":"智能家居方案汇总","lastUpdated":"2/2/2022","lastUpdatedAt":"2022-02-02T17:59:25.000Z","gitCreatedAt":"2022-02-02T17:59:25.000Z"}},{"frontmatter":{"title":"Awesome ID generator","tags":["Awesome","ID"]},"fields":{"slug":"/awesome-id/","title":"Awesome ID generator","lastUpdated":"1/10/2022","lastUpdatedAt":"2022-01-10T20:56:53.000Z","gitCreatedAt":"2021-11-13T06:51:26.000Z"}},{"frontmatter":{"title":"互联网目录汇总","tags":["Awesome","Indexes","Trends"]},"fields":{"slug":"/awesome-indexes/","title":"互联网目录汇总","lastUpdated":"3/9/2022","lastUpdatedAt":"2022-03-09T08:25:23.000Z","gitCreatedAt":"2021-09-12T10:34:26.000Z"}},{"frontmatter":{"title":"Awesome Interview","tags":["Awesome","Interview"]},"fields":{"slug":"/awesome-interview/","title":"Awesome Interview","lastUpdated":"9/5/2021","lastUpdatedAt":"2021-09-05T04:49:34.000Z","gitCreatedAt":"2021-09-05T04:49:34.000Z"}},{"frontmatter":{"title":"","tags":["Awesome","Investing","Stocks"]},"fields":{"slug":"/awesome-investing/","title":"Awesome Investing","lastUpdated":"9/4/2021","lastUpdatedAt":"2021-09-04T07:51:54.000Z","gitCreatedAt":"2021-09-04T07:51:54.000Z"}},{"frontmatter":{"title":"","tags":["Awesome"]},"fields":{"slug":"/awesome-jackett-indexes/","title":"Awesome Jackett Indexes","lastUpdated":"8/27/2021","lastUpdatedAt":"2021-08-27T02:25:34.000Z","gitCreatedAt":"2021-08-27T02:25:34.000Z"}},{"frontmatter":{"title":"","tags":["Awesome","Javascript","Date"]},"fields":{"slug":"/awesome-js-date/","title":"Awesome JS Date","lastUpdated":"8/27/2021","lastUpdatedAt":"2021-08-27T02:25:34.000Z","gitCreatedAt":"2021-08-27T02:25:34.000Z"}},{"frontmatter":{"title":"Awesome Jobs","tags":["Awesome","Jobs"]},"fields":{"slug":"/awesome-jobs/","title":"Awesome Jobs","lastUpdated":"2/2/2022","lastUpdatedAt":"2022-02-02T17:59:25.000Z","gitCreatedAt":"2021-10-12T07:22:35.000Z"}},{"frontmatter":{"title":"收集 Javascript 里好用的库","tags":["Awesome","Javascript","中文"]},"fields":{"slug":"/awesome-js/","title":"收集 Javascript 里好用的库","lastUpdated":"1/28/2022","lastUpdatedAt":"2022-01-28T15:56:55.000Z","gitCreatedAt":"2021-08-29T20:06:24.000Z"}},{"frontmatter":{"title":"Awesome KOL","tags":["Awesome","KOL"]},"fields":{"slug":"/awesome-kol/","title":"Awesome KOL","lastUpdated":"10/4/2021","lastUpdatedAt":"2021-10-04T19:24:25.000Z","gitCreatedAt":"2021-10-04T19:24:25.000Z"}},{"frontmatter":{"title":"Awesome List","tags":["Awesome","List"]},"fields":{"slug":"/awesome-list/","title":"Awesome List","lastUpdated":"2/25/2022","lastUpdatedAt":"2022-02-25T04:21:26.000Z","gitCreatedAt":"2021-08-29T20:06:24.000Z"}},{"frontmatter":{"title":"常见的低代码/无代码列表","tags":["Awesome","Low-Code"]},"fields":{"slug":"/awesome-low-code/","title":"常见的低代码/无代码列表","lastUpdated":"10/12/2021","lastUpdatedAt":"2021-10-12T07:22:35.000Z","gitCreatedAt":"2021-10-12T07:22:35.000Z"}},{"frontmatter":{"title":"值得定期关注的独立开发者/创造者","tags":["Awesome","Maker"]},"fields":{"slug":"/awesome-maker/","title":"值得定期关注的独立开发者/创造者","lastUpdated":"2/15/2022","lastUpdatedAt":"2022-02-15T22:03:41.000Z","gitCreatedAt":"2022-02-15T03:43:44.000Z"}},{"frontmatter":{"title":"国内镜像资源汇总","tags":["Awesome","Mirrors"]},"fields":{"slug":"/awesome-mirrors/","title":"国内镜像资源汇总","lastUpdated":"11/21/2021","lastUpdatedAt":"2021-11-21T16:27:36.000Z","gitCreatedAt":"2021-11-01T22:47:18.000Z"}},{"frontmatter":{"title":"值得观看的电影","tags":["Movies","Awesome","中文"]},"fields":{"slug":"/awesome-movies/","title":"值得观看的电影","lastUpdated":"9/3/2021","lastUpdatedAt":"2021-09-03T05:53:38.000Z","gitCreatedAt":"2021-09-03T05:53:38.000Z"}},{"frontmatter":{"title":"Awesome News","tags":["Awesome","News"]},"fields":{"slug":"/awesome-news/","title":"Awesome News","lastUpdated":"9/25/2021","lastUpdatedAt":"2021-09-25T12:40:57.000Z","gitCreatedAt":"2021-09-25T12:40:57.000Z"}},{"frontmatter":{"title":"Awesome NSFW","tags":["NSFW","Awesome"]},"fields":{"slug":"/awesome-nsfw/","title":"Awesome NSFW","lastUpdated":"1/28/2022","lastUpdatedAt":"2022-01-28T13:23:56.000Z","gitCreatedAt":"2022-01-28T13:23:56.000Z"}},{"frontmatter":{"title":"Awesome Notes","tags":["Awesome","Notes","Tools"]},"fields":{"slug":"/awesome-notes/","title":"Awesome Notes","lastUpdated":"8/31/2021","lastUpdatedAt":"2021-08-31T04:16:33.000Z","gitCreatedAt":"2021-08-31T00:37:15.000Z"}},{"frontmatter":{"title":"收集可以在线阅读的书籍","tags":["Awesome","Books"]},"fields":{"slug":"/awesome-online-books/","title":"收集可以在线阅读的书籍","lastUpdated":"11/13/2021","lastUpdatedAt":"2021-11-13T06:51:26.000Z","gitCreatedAt":"2021-11-13T06:51:26.000Z"}},{"frontmatter":{"title":"Awesome Open Source","tags":["Awesome","Open Source"]},"fields":{"slug":"/awesome-open-source/","title":"Awesome Open Source","lastUpdated":"2/22/2022","lastUpdatedAt":"2022-02-22T11:53:07.000Z","gitCreatedAt":"2022-01-12T06:26:27.000Z"}},{"frontmatter":{"title":"","tags":["Awesome","P2P"]},"fields":{"slug":"/awesome-p2p/","title":"Awesome P2P","lastUpdated":"3/6/2022","lastUpdatedAt":"2022-03-06T14:32:32.000Z","gitCreatedAt":"2021-09-04T07:51:54.000Z"}},{"frontmatter":{"title":"","tags":["Awesome","Social","Products"]},"fields":{"slug":"/awesome-products/","title":"Awesome Products","lastUpdated":"9/5/2021","lastUpdatedAt":"2021-09-05T04:49:34.000Z","gitCreatedAt":"2021-09-05T04:49:34.000Z"}},{"frontmatter":{"title":"Awesome Privacy","tags":["Awesome","Privacy"]},"fields":{"slug":"/awesome-privacy/","title":"Awesome Privacy","lastUpdated":"10/11/2021","lastUpdatedAt":"2021-10-11T15:49:10.000Z","gitCreatedAt":"2021-09-05T04:49:34.000Z"}},{"frontmatter":{"title":"高质量的资源网站收集（电子书，电影，电视剧等）","tags":["Awesome","Resource"]},"fields":{"slug":"/awesome-resources/","title":"高质量的资源网站收集（电子书，电影，电视剧等）","lastUpdated":"3/8/2022","lastUpdatedAt":"2022-03-08T08:33:09.000Z","gitCreatedAt":"2022-03-05T03:45:03.000Z"}},{"frontmatter":{"title":"Awesome RSS","tags":["RSS","Awesome"]},"fields":{"slug":"/awesome-rss/","title":"Awesome RSS","lastUpdated":"9/25/2021","lastUpdatedAt":"2021-09-25T06:38:19.000Z","gitCreatedAt":"2021-09-25T06:38:19.000Z"}},{"frontmatter":{"title":"收集发人深省的话","tags":["Awesome","Quotes","中文"]},"fields":{"slug":"/awesome-quotes/","title":"收集发人深省的话","lastUpdated":"3/10/2022","lastUpdatedAt":"2022-03-10T10:31:57.000Z","gitCreatedAt":"2021-09-05T04:49:34.000Z"}},{"frontmatter":{"title":"Awesome Rust","tags":["Awesome","Rust","Learning"]},"fields":{"slug":"/awesome-rust/","title":"Awesome Rust","lastUpdated":"2/6/2022","lastUpdatedAt":"2022-02-06T12:12:58.000Z","gitCreatedAt":"2021-09-05T10:08:42.000Z"}},{"frontmatter":{"title":"Awesome Schema","tags":["Awesome","Schema","JSOn"]},"fields":{"slug":"/awesome-schema/","title":"Awesome Schema","lastUpdated":"1/15/2022","lastUpdatedAt":"2022-01-15T09:57:32.000Z","gitCreatedAt":"2022-01-15T08:46:05.000Z"}},{"frontmatter":{"title":"","tags":["Awesome","Self-Hosted","Tools"]},"fields":{"slug":"/awesome-selfhosted/","title":"Awesome Self-hosted","lastUpdated":"2/18/2022","lastUpdatedAt":"2022-02-18T02:50:04.000Z","gitCreatedAt":"2021-09-04T01:08:18.000Z"}},{"frontmatter":{"title":"Awesome Semantic","tags":["Awesome","Semantic"]},"fields":{"slug":"/awesome-semantic/","title":"Awesome Semantic","lastUpdated":"1/21/2022","lastUpdatedAt":"2022-01-21T08:49:36.000Z","gitCreatedAt":"2022-01-15T08:46:05.000Z"}},{"frontmatter":{"title":"Awesome SEO Tools","tags":["SEO","Awesome","Tools"]},"fields":{"slug":"/awesome-seo/","title":"Awesome SEO Tools","lastUpdated":"8/30/2021","lastUpdatedAt":"2021-08-30T16:14:42.000Z","gitCreatedAt":"2021-08-30T16:14:42.000Z"}},{"frontmatter":{"title":"","tags":["Social","Awesome"]},"fields":{"slug":"/awesome-socials/","title":"收集有意思的社交应用","lastUpdated":"12/19/2021","lastUpdatedAt":"2021-12-19T22:36:06.000Z","gitCreatedAt":"2021-08-27T02:25:34.000Z"}},{"frontmatter":{"title":"Awesome Services","tags":["Awesome","Service"]},"fields":{"slug":"/awesome-service/","title":"Awesome Services","lastUpdated":"10/19/2021","lastUpdatedAt":"2021-10-19T06:38:57.000Z","gitCreatedAt":"2021-09-10T07:25:10.000Z"}},{"frontmatter":{"title":"Awesome Speed","tags":["Awesome","Speed","Netwok"]},"fields":{"slug":"/awesome-speed/","title":"Awesome Speed","lastUpdated":"9/6/2021","lastUpdatedAt":"2021-09-06T16:52:24.000Z","gitCreatedAt":"2021-09-06T16:52:24.000Z"}},{"frontmatter":{"title":"","tags":["Awesome","Explore","Sources"]},"fields":{"slug":"/awesome-sources/","title":"探索互联网上高质量的内容","lastUpdated":"3/11/2022","lastUpdatedAt":"2022-03-11T06:11:57.000Z","gitCreatedAt":"2022-03-08T11:45:37.000Z"}},{"frontmatter":{"title":"有意思的协议收集","tags":["Awesome","Protocol","Standard"]},"fields":{"slug":"/awesome-standards/","title":"有意思的协议收集","lastUpdated":"2/15/2022","lastUpdatedAt":"2022-02-15T17:46:31.000Z","gitCreatedAt":"2022-02-15T17:46:31.000Z"}},{"frontmatter":{"title":"","tags":["Awesome","Startups","Tools"]},"fields":{"slug":"/awesome-startups/","title":"Awesome Startups","lastUpdated":"3/8/2022","lastUpdatedAt":"2022-03-08T08:33:09.000Z","gitCreatedAt":"2021-09-04T01:08:18.000Z"}},{"frontmatter":{"title":"","tags":["Awesome","Static-Site-Generator"]},"fields":{"slug":"/awesome-static-site-generator/","title":"Awesome Static Site Generator","lastUpdated":"12/31/2021","lastUpdatedAt":"2021-12-31T03:02:42.000Z","gitCreatedAt":"2021-08-27T02:25:34.000Z"}},{"frontmatter":{"title":"收集股市相关的资源","tags":["Awesome","Stocks"]},"fields":{"slug":"/awesome-stocks/","title":"收集股市相关的资源","lastUpdated":"3/8/2022","lastUpdatedAt":"2022-03-08T11:22:55.000Z","gitCreatedAt":"2022-03-08T11:22:55.000Z"}},{"frontmatter":{"title":"Awesome Swift","tags":["Awesome","Swift"]},"fields":{"slug":"/awesome-swift/","title":"Awesome Swift","lastUpdated":"10/1/2021","lastUpdatedAt":"2021-10-01T07:50:27.000Z","gitCreatedAt":"2021-09-29T09:48:05.000Z"}},{"frontmatter":{"title":"收集一些有用的技术/环境问题的解决方案","tags":["Awesome","FAQ","Tech","Serverless"]},"fields":{"slug":"/awesome-tech-anwser/","title":"收集一些有用的技术/环境问题的解决方案","lastUpdated":"9/10/2021","lastUpdatedAt":"2021-09-10T09:43:29.000Z","gitCreatedAt":"2021-09-10T09:43:29.000Z"}},{"frontmatter":{"title":"Awesome Templates","tags":["Awesome","Templates"]},"fields":{"slug":"/awesome-templates/","title":"Awesome Templates","lastUpdated":"1/29/2022","lastUpdatedAt":"2022-01-29T17:28:39.000Z","gitCreatedAt":"2021-09-22T15:17:38.000Z"}},{"frontmatter":{"title":"最好用的工具集合","tags":["Awesome","Tools","中文"]},"fields":{"slug":"/awesome-tools/","title":"最好用的工具集合","lastUpdated":"3/8/2022","lastUpdatedAt":"2022-03-08T08:33:09.000Z","gitCreatedAt":"2021-08-29T20:06:24.000Z"}},{"frontmatter":{"title":"值得观看的电视剧","tags":["Awesome","TV","List","中文"]},"fields":{"slug":"/awesome-tv-shows/","title":"值得观看的电视剧","lastUpdated":"9/13/2021","lastUpdatedAt":"2021-09-13T11:34:16.000Z","gitCreatedAt":"2021-09-03T05:53:38.000Z"}},{"frontmatter":{"title":"","tags":["Awesome","UI","Front-End"]},"fields":{"slug":"/awesome-ui/","title":"Awesome UI","lastUpdated":"3/9/2022","lastUpdatedAt":"2022-03-09T07:54:15.000Z","gitCreatedAt":"2021-08-27T02:25:34.000Z"}},{"frontmatter":{"title":"Awesome What Was Your Moment","tags":["Awesome"]},"fields":{"slug":"/awesome-what-was-your-moment/","title":"Awesome What Was Your Moment","lastUpdated":"9/5/2021","lastUpdatedAt":"2021-09-05T10:08:42.000Z","gitCreatedAt":"2021-09-05T10:08:42.000Z"}},{"frontmatter":{"title":"收集一些有意思的网站","tags":["Awesome","Tools","中文"]},"fields":{"slug":"/awesome-websites/","title":"收集一些有意思的网站","lastUpdated":"3/8/2022","lastUpdatedAt":"2022-03-08T11:22:55.000Z","gitCreatedAt":"2021-08-29T20:06:24.000Z"}},{"frontmatter":{"title":"收集Windows上好玩，好用的东西","tags":["Windows","Awesome","Tools","Development-Environment","中文"]},"fields":{"slug":"/awesome-windows/","title":"收集Windows上好玩，好用的东西","lastUpdated":"9/13/2021","lastUpdatedAt":"2021-09-13T11:34:16.000Z","gitCreatedAt":"2021-08-31T23:51:23.000Z"}},{"frontmatter":{"title":"Awesome workflows","tags":["Awesome","Workflows"]},"fields":{"slug":"/awesome-workflows/","title":"Awesome workflows","lastUpdated":"2/15/2022","lastUpdatedAt":"2022-02-15T03:43:44.000Z","gitCreatedAt":"2021-10-12T07:22:35.000Z"}}]}},"pageContext":{"tags":["Awesome","FAQ","Tech","Serverless"],"slug":"/awesome-tech-anwser/","sidebarItems":[{"title":"","items":[{"title":"Recently Updated","url":"/latest/","collapse":true,"indent":false,"items":[{"title":"03-11: 探索互联网上高质量的内容","url":"/awesome-sources/"},{"title":"03-10: Everything I Know by Owen","url":"/"},{"title":"03-10: Awesome Browsers","url":"/awesome-browsers/"},{"title":"03-10: 读书笔记","url":"/books/"},{"title":"03-10: 所思所想","url":"/thoughts/"},{"title":"03-10: 2022年读书笔记","url":"/books-2022/"},{"title":"03-10: 收集发人深省的话","url":"/awesome-quotes/"},{"title":"03-10: 讽刺言论收集","url":"/satire-quotes/"},{"title":"03-09: 电影笔记","url":"/movies/"},{"title":"03-09: 互联网目录汇总","url":"/awesome-indexes/"},{"title":"03-09: 值得一看的文章列表","url":"/awesome-articles/"},{"title":"03-09: Awesome UI","url":"/awesome-ui/"},{"title":"03-08: 有意思的问题收集","url":"/awesome-answers/"},{"title":"03-08: About Me and the Wiki","url":"/about/"},{"title":"03-08: Awesome Applications","url":"/awesome-applications/"}]}]},{"title":"Tags","items":[{"title":"API","type":"tag","url":"/tags/api/","items":[{"title":"API Tokens","url":"/api-tokens/"},{"title":"Awesome APIs","url":"/awesome-apis/"}]},{"title":"Actions","type":"tag","url":"/tags/actions/","items":[{"title":"How to check if there are uncommited changes in Github Actions?","url":"/github-actions-workflow-check-if-there-is-uncommited-changes/"}]},{"title":"Admin","type":"tag","url":"/tags/admin/","items":[{"title":"Awesome Dashboard","url":"/awesome-dashboard/"}]},{"title":"Algorithm","type":"tag","url":"/tags/algorithm/","items":[{"title":"Awesome Algorithm","url":"/awesome-algorithm/"}]},{"title":"Alternatives","type":"tag","url":"/tags/alternatives/","items":[{"title":"Awesome Alternatives","url":"/awesome-alternatives/"}]},{"title":"Answer","type":"tag","url":"/tags/answer/","items":[{"title":"有意思的问题收集","url":"/awesome-answers/"}]},{"title":"Application","type":"tag","url":"/tags/application/","items":[{"title":"Awesome Frontend","url":"/awesome-frontend/"}]},{"title":"Applications","type":"tag","url":"/tags/applications/","items":[{"title":"Awesome Applications","url":"/awesome-applications/"}]},{"title":"Approvals","type":"tag","url":"/tags/approvals/","items":[{"title":"旅行手续","url":"/travel-approvals/"}]},{"title":"Articles","type":"tag","url":"/tags/articles/","items":[{"title":"值得一看的文章列表","url":"/awesome-articles/"}]},{"title":"Ask","type":"tag","url":"/tags/ask/","items":[{"title":"有意思的问题收集","url":"/awesome-answers/"}]},{"title":"Auth","type":"tag","url":"/tags/auth/","items":[{"title":"API Tokens","url":"/api-tokens/"},{"title":"Auth Gateway","url":"/auth-gateway/"},{"title":"Use ssh key for Git","url":"/git-sshkey/"}]},{"title":"Automations","type":"tag","url":"/tags/automations/","items":[{"title":"Awesome Automations","url":"/awesome-automations/"}]},{"title":"Awesome","type":"tag","url":"/tags/awesome/","items":[{"title":"Awesome Algorithm","url":"/awesome-algorithm/"},{"title":"Awesome Alternatives","url":"/awesome-alternatives/"},{"title":"有意思的问题收集","url":"/awesome-answers/"},{"title":"Awesome APIs","url":"/awesome-apis/"},{"title":"Awesome Applications","url":"/awesome-applications/"},{"title":"值得一看的文章列表","url":"/awesome-articles/"},{"title":"Awesome Automations","url":"/awesome-automations/"},{"title":"Awesome Backup","url":"/awesome-backup/"},{"title":"Awesome Benchmark","url":"/awesome-benchmark/"},{"title":"Awesome Bookmarks","url":"/awesome-bookmarks/"},{"title":"Awesome Chat","url":"/awesome-chat/"},{"title":"Awesome Browsers","url":"/awesome-browsers/"},{"title":"Awesome Command Tools","url":"/awesome-cli/"},{"title":"在中国买房之前，你需要了解的信息汇总","url":"/awesome-cn-house/"},{"title":"Awesome Code Learning","url":"/awesome-code-learning/"},{"title":"Awesome Dashboard","url":"/awesome-dashboard/"},{"title":"收集一些有意思的社区","url":"/awesome-communities/"},{"title":"有趣的数据","url":"/awesome-data/"},{"title":"Awesome Databases","url":"/awesome-databases/"},{"title":"Awesome Decentralization","url":"/awesome-decentralization/"},{"title":"Awesome Deno","url":"/awesome-deno/"},{"title":"Awesome Editors","url":"/awesome-editors/"},{"title":"Awesome Emails","url":"/awesome-emails.md/"},{"title":"收集英语学习工具","url":"/awesome-english-learning/"},{"title":"Awesome Extensions","url":"/awesome-extensions/"},{"title":"Awesome Flutter","url":"/awesome-flutter/"},{"title":"Awesome File Managers","url":"/awesome-file-managers/"},{"title":"Awesome Free","url":"/awesome-free/"},{"title":"Awesome Frontend","url":"/awesome-frontend/"},{"title":"Awesome Gatsby","url":"/awesome-gatsby/"},{"title":"智能家居方案汇总","url":"/awesome-home/"},{"title":"Awesome ID generator","url":"/awesome-id/"},{"title":"互联网目录汇总","url":"/awesome-indexes/"},{"title":"Awesome Interview","url":"/awesome-interview/"},{"title":"Awesome Investing","url":"/awesome-investing/"},{"title":"Awesome Jackett Indexes","url":"/awesome-jackett-indexes/"},{"title":"Awesome JS Date","url":"/awesome-js-date/"},{"title":"Awesome Jobs","url":"/awesome-jobs/"},{"title":"收集 Javascript 里好用的库","url":"/awesome-js/"},{"title":"Awesome KOL","url":"/awesome-kol/"},{"title":"Awesome List","url":"/awesome-list/"},{"title":"常见的低代码/无代码列表","url":"/awesome-low-code/"},{"title":"值得定期关注的独立开发者/创造者","url":"/awesome-maker/"},{"title":"国内镜像资源汇总","url":"/awesome-mirrors/"},{"title":"值得观看的电影","url":"/awesome-movies/"},{"title":"Awesome News","url":"/awesome-news/"},{"title":"Awesome NSFW","url":"/awesome-nsfw/"},{"title":"Awesome Notes","url":"/awesome-notes/"},{"title":"收集可以在线阅读的书籍","url":"/awesome-online-books/"},{"title":"Awesome Open Source","url":"/awesome-open-source/"},{"title":"Awesome P2P","url":"/awesome-p2p/"},{"title":"Awesome Products","url":"/awesome-products/"},{"title":"Awesome Privacy","url":"/awesome-privacy/"},{"title":"高质量的资源网站收集（电子书，电影，电视剧等）","url":"/awesome-resources/"},{"title":"Awesome RSS","url":"/awesome-rss/"},{"title":"收集发人深省的话","url":"/awesome-quotes/"},{"title":"Awesome Rust","url":"/awesome-rust/"},{"title":"Awesome Schema","url":"/awesome-schema/"},{"title":"Awesome Self-hosted","url":"/awesome-selfhosted/"},{"title":"Awesome Semantic","url":"/awesome-semantic/"},{"title":"Awesome SEO Tools","url":"/awesome-seo/"},{"title":"收集有意思的社交应用","url":"/awesome-socials/"},{"title":"Awesome Services","url":"/awesome-service/"},{"title":"Awesome Speed","url":"/awesome-speed/"},{"title":"探索互联网上高质量的内容","url":"/awesome-sources/"},{"title":"有意思的协议收集","url":"/awesome-standards/"},{"title":"Awesome Startups","url":"/awesome-startups/"},{"title":"Awesome Static Site Generator","url":"/awesome-static-site-generator/"},{"title":"收集股市相关的资源","url":"/awesome-stocks/"},{"title":"Awesome Swift","url":"/awesome-swift/"},{"title":"收集一些有用的技术/环境问题的解决方案","url":"/awesome-tech-anwser/"},{"title":"Awesome Templates","url":"/awesome-templates/"},{"title":"最好用的工具集合","url":"/awesome-tools/"},{"title":"值得观看的电视剧","url":"/awesome-tv-shows/"},{"title":"Awesome UI","url":"/awesome-ui/"},{"title":"Awesome What Was Your Moment","url":"/awesome-what-was-your-moment/"},{"title":"收集一些有意思的网站","url":"/awesome-websites/"},{"title":"收集Windows上好玩，好用的东西","url":"/awesome-windows/"},{"title":"Awesome workflows","url":"/awesome-workflows/"}]},{"title":"BBR","type":"tag","url":"/tags/bbr/","items":[{"title":"Open BBR for Debian","url":"/open-bbr-for-debian/"}]},{"title":"BT","type":"tag","url":"/tags/bt/","items":[{"title":"Jackett Setup","url":"/jackett-setup/"},{"title":"qBittorrent setup for Debian","url":"/qbittorrent-setup-for-debian/"}]},{"title":"Bash","type":"tag","url":"/tags/bash/","items":[{"title":"Awesome Benchmark","url":"/awesome-benchmark/"},{"title":"Bash Tips","url":"/bash-tips/"},{"title":"Linux Common Commands","url":"/linux-common-commands/"}]},{"title":"Benchmark","type":"tag","url":"/tags/benchmark/","items":[{"title":"Awesome Benchmark","url":"/awesome-benchmark/"}]},{"title":"Books","type":"tag","url":"/tags/books/","items":[{"title":"收集可以在线阅读的书籍","url":"/awesome-online-books/"},{"title":"2022年读书笔记","url":"/books-2022/"},{"title":"读书笔记","url":"/books/"}]},{"title":"Browser","type":"tag","url":"/tags/browser/","items":[{"title":"Awesome Browsers","url":"/awesome-browsers/"}]},{"title":"CSS","type":"tag","url":"/tags/css/","items":[{"title":"Mini Reset CSS","url":"/mini-reset-css/"},{"title":"Smart word break in CSS","url":"/smart-word-break-in-css/"}]},{"title":"Caddy","type":"tag","url":"/tags/caddy/","items":[{"title":"Caddy2 Setup for Debian","url":"/caddy2-setup-for-debian/"}]},{"title":"CentOS","type":"tag","url":"/tags/cent-os/","items":[{"title":"Install PHP 8.0 On CentOS 7 / RHEL 7","url":"/install-php8-on-centos7/"}]},{"title":"Chat","type":"tag","url":"/tags/chat/","items":[{"title":"Awesome Chat","url":"/awesome-chat/"}]},{"title":"China","type":"tag","url":"/tags/china/","items":[{"title":"在中国买房之前，你需要了解的信息汇总","url":"/awesome-cn-house/"}]},{"title":"Code","type":"tag","url":"/tags/code/","items":[{"title":"Awesome Code Learning","url":"/awesome-code-learning/"}]},{"title":"Command","type":"tag","url":"/tags/command/","items":[{"title":"Awesome Command Tools","url":"/awesome-cli/"}]},{"title":"Commands","type":"tag","url":"/tags/commands/","items":[{"title":"Linux Common Commands","url":"/linux-common-commands/"}]},{"title":"Communities","type":"tag","url":"/tags/communities/","items":[{"title":"收集一些有意思的社区","url":"/awesome-communities/"}]},{"title":"Comparison","type":"tag","url":"/tags/comparison/","items":[{"title":"License比较","url":"/license-comparison/"}]},{"title":"DDos","type":"tag","url":"/tags/d-dos/","items":[{"title":"Linux Anti DDos","url":"/linux-network/"}]},{"title":"Dashboard","type":"tag","url":"/tags/dashboard/","items":[{"title":"Awesome Dashboard","url":"/awesome-dashboard/"}]},{"title":"Data","type":"tag","url":"/tags/data/","items":[{"title":"有趣的数据","url":"/awesome-data/"}]},{"title":"Database","type":"tag","url":"/tags/database/","items":[{"title":"Awesome Databases","url":"/awesome-databases/"}]},{"title":"Date","type":"tag","url":"/tags/date/","items":[{"title":"Awesome JS Date","url":"/awesome-js-date/"}]},{"title":"Debian","type":"tag","url":"/tags/debian/","items":[{"title":"Caddy2 Setup for Debian","url":"/caddy2-setup-for-debian/"},{"title":"Debian Server Setup","url":"/debian-server-setup/"},{"title":"Netdata Setup for Debian","url":"/netdata-setup-for-debian/"},{"title":"Nginx Setup for Debian","url":"/nginx-setup-for-debian/"},{"title":"Nodejs Setup for Debian","url":"/nodejs-setup-for-debian/"},{"title":"Open BBR for Debian","url":"/open-bbr-for-debian/"},{"title":"Postgres Setup for Debian","url":"/postgres-setup-for-debian/"},{"title":"qBittorrent setup for Debian","url":"/qbittorrent-setup-for-debian/"},{"title":"Rust Environment Setup for Debian","url":"/rust-enviroment-setup-for-debian/"},{"title":"Shadowsocks Rust Setup for Debian","url":"/shadowsocks-rust-setup-for-debian/"}]},{"title":"Decentralization","type":"tag","url":"/tags/decentralization/","items":[{"title":"Awesome Decentralization","url":"/awesome-decentralization/"}]},{"title":"Deno","type":"tag","url":"/tags/deno/","items":[{"title":"Awesome Deno","url":"/awesome-deno/"},{"title":"Deno Tips","url":"/deno-tips/"}]},{"title":"Development-Environment","type":"tag","url":"/tags/development-environment/","items":[{"title":"收集Windows上好玩，好用的东西","url":"/awesome-windows/"}]},{"title":"Docker","type":"tag","url":"/tags/docker/","items":[{"title":"Docker Common Commands","url":"/docker-common-commands/"},{"title":"Docker Setup","url":"/docker-setup/"}]},{"title":"Downloads","type":"tag","url":"/tags/downloads/","items":[{"title":"qBittorrent setup for Debian","url":"/qbittorrent-setup-for-debian/"},{"title":"Youtube Download","url":"/youtube-download/"}]},{"title":"Editors","type":"tag","url":"/tags/editors/","items":[{"title":"Awesome Editors","url":"/awesome-editors/"},{"title":"Vim Tips","url":"/vim-tips/"},{"title":"VS Code Tips","url":"/vscode-tips/"}]},{"title":"Email","type":"tag","url":"/tags/email/","items":[{"title":"Awesome Emails","url":"/awesome-emails.md/"}]},{"title":"English","type":"tag","url":"/tags/english/","items":[{"title":"收集英语学习工具","url":"/awesome-english-learning/"}]},{"title":"Explore","type":"tag","url":"/tags/explore/","items":[{"title":"探索互联网上高质量的内容","url":"/awesome-sources/"}]},{"title":"Extensions","type":"tag","url":"/tags/extensions/","items":[{"title":"Awesome Extensions","url":"/awesome-extensions/"}]},{"title":"FAQ","type":"tag","url":"/tags/faq/","items":[{"title":"有意思的问题收集","url":"/awesome-answers/"},{"title":"收集一些有用的技术/环境问题的解决方案","url":"/awesome-tech-anwser/"}]},{"title":"Files","type":"tag","url":"/tags/files/","items":[{"title":"Awesome File Managers","url":"/awesome-file-managers/"},{"title":"Caddy File Server Browser with URL Scheme","url":"/caddy-file-server-url-scheme/"},{"title":"FileBrowser Setup","url":"/filebrowser-setup/"},{"title":"Rclone Setup","url":"/rclone-setup/"}]},{"title":"Flutter","type":"tag","url":"/tags/flutter/","items":[{"title":"Awesome Flutter","url":"/awesome-flutter/"}]},{"title":"Free","type":"tag","url":"/tags/free/","items":[{"title":"Awesome Free","url":"/awesome-free/"}]},{"title":"Front-End","type":"tag","url":"/tags/front-end/","items":[{"title":"Awesome UI","url":"/awesome-ui/"},{"title":"SVG","url":"/svg/"}]},{"title":"Frontend","type":"tag","url":"/tags/frontend/","items":[{"title":"Awesome Frontend","url":"/awesome-frontend/"}]},{"title":"Git","type":"tag","url":"/tags/git/","items":[{"title":"Use ssh key for Git","url":"/git-sshkey/"},{"title":"收集常用Git技巧","url":"/git-tips/"},{"title":"Git workflows","url":"/git-workflows/"},{"title":"How to check if there are uncommited changes in Github Actions?","url":"/github-actions-workflow-check-if-there-is-uncommited-changes/"}]},{"title":"Github","type":"tag","url":"/tags/github/","items":[{"title":"How to check if there are uncommited changes in Github Actions?","url":"/github-actions-workflow-check-if-there-is-uncommited-changes/"}]},{"title":"Go","type":"tag","url":"/tags/go/","items":[{"title":"Go Template Tips","url":"/go-template-tips/"}]},{"title":"HTTPS","type":"tag","url":"/tags/https/","items":[{"title":"在中国自动生成免费HTTPS证书的最佳方案","url":"/auto-https-ssl-in-china/"}]},{"title":"Home","type":"tag","url":"/tags/home/","items":[{"title":"智能家居方案汇总","url":"/awesome-home/"}]},{"title":"House","type":"tag","url":"/tags/house/","items":[{"title":"在中国买房之前，你需要了解的信息汇总","url":"/awesome-cn-house/"}]},{"title":"ID","type":"tag","url":"/tags/id/","items":[{"title":"Awesome ID generator","url":"/awesome-id/"}]},{"title":"Indexes","type":"tag","url":"/tags/indexes/","items":[{"title":"互联网目录汇总","url":"/awesome-indexes/"}]},{"title":"Interview","type":"tag","url":"/tags/interview/","items":[{"title":"Awesome Interview","url":"/awesome-interview/"}]},{"title":"Investing","type":"tag","url":"/tags/investing/","items":[{"title":"Awesome Investing","url":"/awesome-investing/"}]},{"title":"JSOn","type":"tag","url":"/tags/js-on/","items":[{"title":"Awesome Schema","url":"/awesome-schema/"}]},{"title":"Jackett","type":"tag","url":"/tags/jackett/","items":[{"title":"Jackett Setup","url":"/jackett-setup/"},{"title":"qBittorrent setup for Debian","url":"/qbittorrent-setup-for-debian/"}]},{"title":"Javascript","type":"tag","url":"/tags/javascript/","items":[{"title":"Awesome JS Date","url":"/awesome-js-date/"},{"title":"收集 Javascript 里好用的库","url":"/awesome-js/"},{"title":"Nodejs Monorepo","url":"/nodejs-monorepo/"},{"title":"Nodejs Setup for Debian","url":"/nodejs-setup-for-debian/"},{"title":"Nodejs Tips","url":"/nodejs-tips/"}]},{"title":"Jellyfin","type":"tag","url":"/tags/jellyfin/","items":[{"title":"Jellyfin setup","url":"/jellyfin-setup/"}]},{"title":"Jobs","type":"tag","url":"/tags/jobs/","items":[{"title":"Awesome Jobs","url":"/awesome-jobs/"}]},{"title":"Journal","type":"tag","url":"/tags/journal/","items":[{"title":"2021年的一些记录","url":"/journal-2021/"},{"title":"2022年的一些记录","url":"/journal-2022/"},{"title":"What I’m doing now?","url":"/now/"}]},{"title":"KOL","type":"tag","url":"/tags/kol/","items":[{"title":"Awesome KOL","url":"/awesome-kol/"}]},{"title":"Language","type":"tag","url":"/tags/language/","items":[{"title":"出国，这几句话必须学会用当地语言怎么说","url":"/basic-language/"}]},{"title":"Learning","type":"tag","url":"/tags/learning/","items":[{"title":"Awesome Code Learning","url":"/awesome-code-learning/"},{"title":"收集英语学习工具","url":"/awesome-english-learning/"},{"title":"Awesome Rust","url":"/awesome-rust/"}]},{"title":"License","type":"tag","url":"/tags/license/","items":[{"title":"License比较","url":"/license-comparison/"}]},{"title":"Life","type":"tag","url":"/tags/life/","items":[{"title":"提升生活质量的东西列表","url":"/life-pro/"},{"title":"高质量生活方式推荐","url":"/life-tips/"}]},{"title":"Linux","type":"tag","url":"/tags/linux/","items":[{"title":"Linux Common Commands","url":"/linux-common-commands/"},{"title":"Linux Log","url":"/linux-log/"},{"title":"Linux Anti DDos","url":"/linux-network/"}]},{"title":"List","type":"tag","url":"/tags/list/","items":[{"title":"Awesome List","url":"/awesome-list/"},{"title":"值得观看的电视剧","url":"/awesome-tv-shows/"},{"title":"提升生活质量的东西列表","url":"/life-pro/"},{"title":"想买的东西列表","url":"/wish-lists/"}]},{"title":"Log","type":"tag","url":"/tags/log/","items":[{"title":"Linux Log","url":"/linux-log/"}]},{"title":"Low-Code","type":"tag","url":"/tags/low-code/","items":[{"title":"常见的低代码/无代码列表","url":"/awesome-low-code/"}]},{"title":"MacOS","type":"tag","url":"/tags/mac-os/","items":[{"title":"Postgres Setup for Macos","url":"/postgres-setup-for-macos/"}]},{"title":"Makefile - Templates - Workflows","type":"tag","url":"/tags/makefile-templates-workflows/","items":[{"title":"Makefile Templates","url":"/makefile-templates/"}]},{"title":"Maker","type":"tag","url":"/tags/maker/","items":[{"title":"值得定期关注的独立开发者/创造者","url":"/awesome-maker/"}]},{"title":"Mastdon","type":"tag","url":"/tags/mastdon/","items":[{"title":"Mastdon Development Setup","url":"/mastdon-development-setup/"}]},{"title":"Me","type":"tag","url":"/tags/me/","items":[{"title":"Everything I Know by Owen","url":"/"},{"title":"About Me and the Wiki","url":"/about/"},{"title":"What I’m doing now?","url":"/now/"},{"title":"Projects","url":"/projects/"}]},{"title":"Medias","type":"tag","url":"/tags/medias/","items":[{"title":"Bazarr Setup","url":"/bazarr-setup/"},{"title":"Caddy File Server Browser with URL Scheme","url":"/caddy-file-server-url-scheme/"},{"title":"Jackett Setup","url":"/jackett-setup/"},{"title":"Jellyfin setup","url":"/jellyfin-setup/"},{"title":"Radarr Setup","url":"/radarr-setup/"},{"title":"Rclone Setup","url":"/rclone-setup/"},{"title":"Sonarr Setup","url":"/sonarr-setup/"},{"title":"Subtitles","url":"/subtitles/"},{"title":"Youtube Download","url":"/youtube-download/"}]},{"title":"Metube","type":"tag","url":"/tags/metube/","items":[{"title":"Youtube Download","url":"/youtube-download/"}]},{"title":"Mirrors","type":"tag","url":"/tags/mirrors/","items":[{"title":"国内镜像资源汇总","url":"/awesome-mirrors/"}]},{"title":"Monitor","type":"tag","url":"/tags/monitor/","items":[{"title":"Netdata Setup for Debian","url":"/netdata-setup-for-debian/"}]},{"title":"Monorepo","type":"tag","url":"/tags/monorepo/","items":[{"title":"Nodejs Monorepo","url":"/nodejs-monorepo/"}]},{"title":"Movies","type":"tag","url":"/tags/movies/","items":[{"title":"值得观看的电影","url":"/awesome-movies/"},{"title":"电影笔记","url":"/movies/"}]},{"title":"Music","type":"tag","url":"/tags/music/","items":[{"title":"音乐收藏","url":"/music/"}]},{"title":"NSFW","type":"tag","url":"/tags/nsfw/","items":[{"title":"Awesome NSFW","url":"/awesome-nsfw/"}]},{"title":"Netdata","type":"tag","url":"/tags/netdata/","items":[{"title":"Netdata Setup for Debian","url":"/netdata-setup-for-debian/"}]},{"title":"Netwok","type":"tag","url":"/tags/netwok/","items":[{"title":"Awesome Speed","url":"/awesome-speed/"}]},{"title":"News","type":"tag","url":"/tags/news/","items":[{"title":"Awesome News","url":"/awesome-news/"}]},{"title":"Nginx","type":"tag","url":"/tags/nginx/","items":[{"title":"Nginx Setup for Debian","url":"/nginx-setup-for-debian/"}]},{"title":"Notes","type":"tag","url":"/tags/notes/","items":[{"title":"Awesome Notes","url":"/awesome-notes/"},{"title":"2022年读书笔记","url":"/books-2022/"},{"title":"读书笔记","url":"/books/"},{"title":"电影笔记","url":"/movies/"},{"title":"电视剧笔记","url":"/tv-shows/"}]},{"title":"Now","type":"tag","url":"/tags/now/","items":[{"title":"What I’m doing now?","url":"/now/"}]},{"title":"Open Source","type":"tag","url":"/tags/open-source/","items":[{"title":"Awesome Open Source","url":"/awesome-open-source/"}]},{"title":"P2P","type":"tag","url":"/tags/p-2-p/","items":[{"title":"Awesome P2P","url":"/awesome-p2p/"}]},{"title":"PHP","type":"tag","url":"/tags/php/","items":[{"title":"Install PHP 8.0 On CentOS 7 / RHEL 7","url":"/install-php8-on-centos7/"}]},{"title":"Peertube","type":"tag","url":"/tags/peertube/","items":[{"title":"Peertube Setup with Caddy Server","url":"/peertube-setup/"}]},{"title":"Postgres","type":"tag","url":"/tags/postgres/","items":[{"title":"Postgres Setup for Debian","url":"/postgres-setup-for-debian/"},{"title":"Postgres Setup for Macos","url":"/postgres-setup-for-macos/"}]},{"title":"Postgresql","type":"tag","url":"/tags/postgresql/","items":[{"title":"Postgresql Tips","url":"/postgresql-tips/"}]},{"title":"Privacy","type":"tag","url":"/tags/privacy/","items":[{"title":"Awesome Privacy","url":"/awesome-privacy/"}]},{"title":"Products","type":"tag","url":"/tags/products/","items":[{"title":"Awesome Products","url":"/awesome-products/"}]},{"title":"Programming-Languages","type":"tag","url":"/tags/programming-languages/","items":[{"title":"Go Template Tips","url":"/go-template-tips/"},{"title":"Nodejs Setup for Debian","url":"/nodejs-setup-for-debian/"},{"title":"Nodejs Tips","url":"/nodejs-tips/"}]},{"title":"Projects","type":"tag","url":"/tags/projects/","items":[{"title":"Projects","url":"/projects/"}]},{"title":"Protocol","type":"tag","url":"/tags/protocol/","items":[{"title":"有意思的协议收集","url":"/awesome-standards/"}]},{"title":"Proxies","type":"tag","url":"/tags/proxies/","items":[{"title":"Awesome Benchmark","url":"/awesome-benchmark/"},{"title":"Caddy File Server Browser with URL Scheme","url":"/caddy-file-server-url-scheme/"},{"title":"Caddy2 Setup for Debian","url":"/caddy2-setup-for-debian/"},{"title":"Open BBR for Debian","url":"/open-bbr-for-debian/"},{"title":"Shadowsocks Rust Setup for Debian","url":"/shadowsocks-rust-setup-for-debian/"}]},{"title":"Quotes","type":"tag","url":"/tags/quotes/","items":[{"title":"收集发人深省的话","url":"/awesome-quotes/"},{"title":"划线的电视剧截图","url":"/awesome-tv-quotes/"}]},{"title":"RSS","type":"tag","url":"/tags/rss/","items":[{"title":"Awesome RSS","url":"/awesome-rss/"}]},{"title":"Radarr","type":"tag","url":"/tags/radarr/","items":[{"title":"Radarr Setup","url":"/radarr-setup/"}]},{"title":"Rclone","type":"tag","url":"/tags/rclone/","items":[{"title":"Rclone Setup","url":"/rclone-setup/"}]},{"title":"Recommend","type":"tag","url":"/tags/recommend/","items":[{"title":"Awesome Algorithm","url":"/awesome-algorithm/"}]},{"title":"Resource","type":"tag","url":"/tags/resource/","items":[{"title":"高质量的资源网站收集（电子书，电影，电视剧等）","url":"/awesome-resources/"}]},{"title":"Ruby","type":"tag","url":"/tags/ruby/","items":[{"title":"Ruby Setup for MacOS","url":"/ruby-setup/"}]},{"title":"Rust","type":"tag","url":"/tags/rust/","items":[{"title":"Awesome Rust","url":"/awesome-rust/"},{"title":"Rust Environment Setup for Debian","url":"/rust-enviroment-setup-for-debian/"},{"title":"Rust Tips","url":"/rust-tips/"},{"title":"Shadowsocks Rust Setup for Debian","url":"/shadowsocks-rust-setup-for-debian/"}]},{"title":"SEO","type":"tag","url":"/tags/seo/","items":[{"title":"Awesome SEO Tools","url":"/awesome-seo/"}]},{"title":"SSH","type":"tag","url":"/tags/ssh/","items":[{"title":"Use ssh key for Git","url":"/git-sshkey/"}]},{"title":"SSL","type":"tag","url":"/tags/ssl/","items":[{"title":"在中国自动生成免费HTTPS证书的最佳方案","url":"/auto-https-ssl-in-china/"}]},{"title":"SVG","type":"tag","url":"/tags/svg/","items":[{"title":"SVG","url":"/svg/"}]},{"title":"Satire","type":"tag","url":"/tags/satire/","items":[{"title":"讽刺言论收集","url":"/satire-quotes/"}]},{"title":"Schema","type":"tag","url":"/tags/schema/","items":[{"title":"Awesome Schema","url":"/awesome-schema/"}]},{"title":"Self-Hosted","type":"tag","url":"/tags/self-hosted/","items":[{"title":"Awesome Automations","url":"/awesome-automations/"},{"title":"Awesome Self-hosted","url":"/awesome-selfhosted/"},{"title":"Bazarr Setup","url":"/bazarr-setup/"},{"title":"Jackett Setup","url":"/jackett-setup/"},{"title":"Jellyfin setup","url":"/jellyfin-setup/"},{"title":"Radarr Setup","url":"/radarr-setup/"},{"title":"Sonarr Setup","url":"/sonarr-setup/"},{"title":"Youtube Download","url":"/youtube-download/"}]},{"title":"Semantic","type":"tag","url":"/tags/semantic/","items":[{"title":"Awesome Semantic","url":"/awesome-semantic/"}]},{"title":"Server","type":"tag","url":"/tags/server/","items":[{"title":"Caddy File Server Browser with URL Scheme","url":"/caddy-file-server-url-scheme/"},{"title":"Caddy2 Setup for Debian","url":"/caddy2-setup-for-debian/"},{"title":"Debian Server Setup","url":"/debian-server-setup/"},{"title":"Nodejs Setup for Debian","url":"/nodejs-setup-for-debian/"},{"title":"Open BBR for Debian","url":"/open-bbr-for-debian/"},{"title":"qBittorrent setup for Debian","url":"/qbittorrent-setup-for-debian/"}]},{"title":"Serverless","type":"tag","url":"/tags/serverless/","items":[{"title":"收集一些有用的技术/环境问题的解决方案","url":"/awesome-tech-anwser/"}]},{"title":"Service","type":"tag","url":"/tags/service/","items":[{"title":"Awesome Services","url":"/awesome-service/"}]},{"title":"Setup","type":"tag","url":"/tags/setup/","items":[{"title":"Bazarr Setup","url":"/bazarr-setup/"},{"title":"Caddy2 Setup for Debian","url":"/caddy2-setup-for-debian/"},{"title":"Docker Setup","url":"/docker-setup/"},{"title":"FileBrowser Setup","url":"/filebrowser-setup/"},{"title":"Debian Server Setup","url":"/debian-server-setup/"},{"title":"Install PHP 8.0 On CentOS 7 / RHEL 7","url":"/install-php8-on-centos7/"},{"title":"Jackett Setup","url":"/jackett-setup/"},{"title":"Jellyfin setup","url":"/jellyfin-setup/"},{"title":"Mastdon Development Setup","url":"/mastdon-development-setup/"},{"title":"Nginx Setup for Debian","url":"/nginx-setup-for-debian/"},{"title":"Nodejs Setup for Debian","url":"/nodejs-setup-for-debian/"},{"title":"Peertube Setup with Caddy Server","url":"/peertube-setup/"},{"title":"Postgres Setup for Debian","url":"/postgres-setup-for-debian/"},{"title":"Postgres Setup for Macos","url":"/postgres-setup-for-macos/"},{"title":"qBittorrent setup for Debian","url":"/qbittorrent-setup-for-debian/"},{"title":"Radarr Setup","url":"/radarr-setup/"},{"title":"Rclone Setup","url":"/rclone-setup/"},{"title":"Ruby Setup for MacOS","url":"/ruby-setup/"},{"title":"Rust Environment Setup for Debian","url":"/rust-enviroment-setup-for-debian/"},{"title":"Shadowsocks Rust Setup for Debian","url":"/shadowsocks-rust-setup-for-debian/"}]},{"title":"Shadowsocks","type":"tag","url":"/tags/shadowsocks/","items":[{"title":"Shadowsocks Rust Setup for Debian","url":"/shadowsocks-rust-setup-for-debian/"}]},{"title":"Social","type":"tag","url":"/tags/social/","items":[{"title":"收集一些有意思的社区","url":"/awesome-communities/"},{"title":"Awesome Products","url":"/awesome-products/"},{"title":"收集有意思的社交应用","url":"/awesome-socials/"}]},{"title":"Sonarr","type":"tag","url":"/tags/sonarr/","items":[{"title":"Sonarr Setup","url":"/sonarr-setup/"}]},{"title":"Sources","type":"tag","url":"/tags/sources/","items":[{"title":"探索互联网上高质量的内容","url":"/awesome-sources/"}]},{"title":"Speed","type":"tag","url":"/tags/speed/","items":[{"title":"Awesome Speed","url":"/awesome-speed/"}]},{"title":"Standard","type":"tag","url":"/tags/standard/","items":[{"title":"有意思的协议收集","url":"/awesome-standards/"}]},{"title":"Startups","type":"tag","url":"/tags/startups/","items":[{"title":"Awesome Startups","url":"/awesome-startups/"}]},{"title":"Static-Site-Generator","type":"tag","url":"/tags/static-site-generator/","items":[{"title":"Awesome Static Site Generator","url":"/awesome-static-site-generator/"}]},{"title":"Stocks","type":"tag","url":"/tags/stocks/","items":[{"title":"Awesome Investing","url":"/awesome-investing/"},{"title":"收集股市相关的资源","url":"/awesome-stocks/"}]},{"title":"Stop","type":"tag","url":"/tags/stop/","items":[{"title":"你应该立即停止做的事","url":"/stop/"}]},{"title":"Subtitles","type":"tag","url":"/tags/subtitles/","items":[{"title":"Bazarr Setup","url":"/bazarr-setup/"},{"title":"Subtitles","url":"/subtitles/"}]},{"title":"Swift","type":"tag","url":"/tags/swift/","items":[{"title":"Awesome Swift","url":"/awesome-swift/"}]},{"title":"TV","type":"tag","url":"/tags/tv/","items":[{"title":"划线的电视剧截图","url":"/awesome-tv-quotes/"},{"title":"值得观看的电视剧","url":"/awesome-tv-shows/"},{"title":"电视剧笔记","url":"/tv-shows/"}]},{"title":"Tech","type":"tag","url":"/tags/tech/","items":[{"title":"收集一些有用的技术/环境问题的解决方案","url":"/awesome-tech-anwser/"}]},{"title":"Templates","type":"tag","url":"/tags/templates/","items":[{"title":"Awesome Templates","url":"/awesome-templates/"},{"title":"Caddy File Server Browser with URL Scheme","url":"/caddy-file-server-url-scheme/"},{"title":"Go Template Tips","url":"/go-template-tips/"}]},{"title":"Thinking","type":"tag","url":"/tags/thinking/","items":[{"title":"所思所想","url":"/thoughts/"}]},{"title":"Tips","type":"tag","url":"/tags/tips/","items":[{"title":"Bash Tips","url":"/bash-tips/"},{"title":"Common URL Scheme","url":"/common-url-scheme/"},{"title":"Deno Tips","url":"/deno-tips/"},{"title":"Docker Common Commands","url":"/docker-common-commands/"},{"title":"收集常用Git技巧","url":"/git-tips/"},{"title":"Go Template Tips","url":"/go-template-tips/"},{"title":"提升生活质量的东西列表","url":"/life-pro/"},{"title":"高质量生活方式推荐","url":"/life-tips/"},{"title":"Linux Common Commands","url":"/linux-common-commands/"},{"title":"Nodejs Tips","url":"/nodejs-tips/"},{"title":"Postgresql Tips","url":"/postgresql-tips/"},{"title":"Rust Tips","url":"/rust-tips/"},{"title":"Vim Tips","url":"/vim-tips/"},{"title":"VS Code Tips","url":"/vscode-tips/"}]},{"title":"Todo","type":"tag","url":"/tags/todo/","items":[{"title":"2022 Goals","url":"/goals-2022/"},{"title":"Todos","url":"/todo/"},{"title":"2021 Goals","url":"/goals-2021/"}]},{"title":"Tools","type":"tag","url":"/tags/tools/","items":[{"title":"Awesome Command Tools","url":"/awesome-cli/"},{"title":"Awesome Editors","url":"/awesome-editors/"},{"title":"Awesome Free","url":"/awesome-free/"},{"title":"Awesome Notes","url":"/awesome-notes/"},{"title":"Awesome Self-hosted","url":"/awesome-selfhosted/"},{"title":"Awesome SEO Tools","url":"/awesome-seo/"},{"title":"Awesome Startups","url":"/awesome-startups/"},{"title":"最好用的工具集合","url":"/awesome-tools/"},{"title":"收集一些有意思的网站","url":"/awesome-websites/"},{"title":"收集Windows上好玩，好用的东西","url":"/awesome-windows/"}]},{"title":"Torrents","type":"tag","url":"/tags/torrents/","items":[{"title":"Jackett Setup","url":"/jackett-setup/"},{"title":"qBittorrent setup for Debian","url":"/qbittorrent-setup-for-debian/"}]},{"title":"Travel","type":"tag","url":"/tags/travel/","items":[{"title":"旅行手续","url":"/travel-approvals/"}]},{"title":"Trends","type":"tag","url":"/tags/trends/","items":[{"title":"互联网目录汇总","url":"/awesome-indexes/"}]},{"title":"Tweet","type":"tag","url":"/tags/tweet/","items":[{"title":"所思所想","url":"/thoughts/"}]},{"title":"UI","type":"tag","url":"/tags/ui/","items":[{"title":"Awesome UI","url":"/awesome-ui/"}]},{"title":"URL","type":"tag","url":"/tags/url/","items":[{"title":"Common URL Scheme","url":"/common-url-scheme/"}]},{"title":"VS Code","type":"tag","url":"/tags/vs-code/","items":[{"title":"VS Code Tips","url":"/vscode-tips/"}]},{"title":"Vim","type":"tag","url":"/tags/vim/","items":[{"title":"Vim Tips","url":"/vim-tips/"}]},{"title":"Wikipedia","type":"tag","url":"/tags/wikipedia/","items":[{"title":"收录一些有意思的维基百科","url":"/awesome-wikipedia/"}]},{"title":"Windows","type":"tag","url":"/tags/windows/","items":[{"title":"收集Windows上好玩，好用的东西","url":"/awesome-windows/"}]},{"title":"Wish","type":"tag","url":"/tags/wish/","items":[{"title":"想买的东西列表","url":"/wish-lists/"}]},{"title":"Workflows","type":"tag","url":"/tags/workflows/","items":[{"title":"Awesome workflows","url":"/awesome-workflows/"},{"title":"Git workflows","url":"/git-workflows/"},{"title":"Nodejs Monorepo","url":"/nodejs-monorepo/"}]},{"title":"Writing","type":"tag","url":"/tags/writing/","items":[{"title":"如何写作？","url":"/how-to-write/"}]},{"title":"Year2021","type":"tag","url":"/tags/year-2021/","items":[{"title":"2021年的一些记录","url":"/journal-2021/"},{"title":"2021 Goals","url":"/goals-2021/"}]},{"title":"Year2022","type":"tag","url":"/tags/year-2022/","items":[{"title":"2022 Goals","url":"/goals-2022/"},{"title":"2022年的一些记录","url":"/journal-2022/"}]},{"title":"Youtube","type":"tag","url":"/tags/youtube/","items":[{"title":"Youtube Download","url":"/youtube-download/"}]},{"title":"depression","type":"tag","url":"/tags/depression/","items":[{"title":"抑郁症相关资料汇总","url":"/depression/"}]},{"title":"mac","type":"tag","url":"/tags/mac/","items":[{"title":"Mac Setup","url":"/mac-setup/"}]},{"title":"qBittorrent","type":"tag","url":"/tags/q-bittorrent/","items":[{"title":"qBittorrent setup for Debian","url":"/qbittorrent-setup-for-debian/"}]},{"title":"setup","type":"tag","url":"/tags/setup/","items":[{"title":"Mac Setup","url":"/mac-setup/"}]},{"title":"中文","type":"tag","url":"/tags/中文/","items":[{"title":"有意思的问题收集","url":"/awesome-answers/"},{"title":"收集一些有意思的社区","url":"/awesome-communities/"},{"title":"有趣的数据","url":"/awesome-data/"},{"title":"收集 Javascript 里好用的库","url":"/awesome-js/"},{"title":"值得观看的电影","url":"/awesome-movies/"},{"title":"收集发人深省的话","url":"/awesome-quotes/"},{"title":"划线的电视剧截图","url":"/awesome-tv-quotes/"},{"title":"最好用的工具集合","url":"/awesome-tools/"},{"title":"值得观看的电视剧","url":"/awesome-tv-shows/"},{"title":"收集一些有意思的网站","url":"/awesome-websites/"},{"title":"收集Windows上好玩，好用的东西","url":"/awesome-windows/"},{"title":"2022年读书笔记","url":"/books-2022/"},{"title":"读书笔记","url":"/books/"},{"title":"收集常用Git技巧","url":"/git-tips/"},{"title":"License比较","url":"/license-comparison/"},{"title":"电影笔记","url":"/movies/"},{"title":"旅行手续","url":"/travel-approvals/"},{"title":"电视剧笔记","url":"/tv-shows/"}]},{"title":"冷知识","type":"tag","url":"/tags/冷知识/","items":[{"title":"冷知识","url":"/trivia/"}]}]}],"tagsGroups":[{"title":"API","type":"tag","url":"/tags/api/","items":[{"title":"API Tokens","url":"/api-tokens/"},{"title":"Awesome APIs","url":"/awesome-apis/"}]},{"title":"Actions","type":"tag","url":"/tags/actions/","items":[{"title":"How to check if there are uncommited changes in Github Actions?","url":"/github-actions-workflow-check-if-there-is-uncommited-changes/"}]},{"title":"Admin","type":"tag","url":"/tags/admin/","items":[{"title":"Awesome Dashboard","url":"/awesome-dashboard/"}]},{"title":"Algorithm","type":"tag","url":"/tags/algorithm/","items":[{"title":"Awesome Algorithm","url":"/awesome-algorithm/"}]},{"title":"Alternatives","type":"tag","url":"/tags/alternatives/","items":[{"title":"Awesome Alternatives","url":"/awesome-alternatives/"}]},{"title":"Answer","type":"tag","url":"/tags/answer/","items":[{"title":"有意思的问题收集","url":"/awesome-answers/"}]},{"title":"Application","type":"tag","url":"/tags/application/","items":[{"title":"Awesome Frontend","url":"/awesome-frontend/"}]},{"title":"Applications","type":"tag","url":"/tags/applications/","items":[{"title":"Awesome Applications","url":"/awesome-applications/"}]},{"title":"Approvals","type":"tag","url":"/tags/approvals/","items":[{"title":"旅行手续","url":"/travel-approvals/"}]},{"title":"Articles","type":"tag","url":"/tags/articles/","items":[{"title":"值得一看的文章列表","url":"/awesome-articles/"}]},{"title":"Ask","type":"tag","url":"/tags/ask/","items":[{"title":"有意思的问题收集","url":"/awesome-answers/"}]},{"title":"Auth","type":"tag","url":"/tags/auth/","items":[{"title":"API Tokens","url":"/api-tokens/"},{"title":"Auth Gateway","url":"/auth-gateway/"},{"title":"Use ssh key for Git","url":"/git-sshkey/"}]},{"title":"Automations","type":"tag","url":"/tags/automations/","items":[{"title":"Awesome Automations","url":"/awesome-automations/"}]},{"title":"Awesome","type":"tag","url":"/tags/awesome/","items":[{"title":"Awesome Algorithm","url":"/awesome-algorithm/"},{"title":"Awesome Alternatives","url":"/awesome-alternatives/"},{"title":"有意思的问题收集","url":"/awesome-answers/"},{"title":"Awesome APIs","url":"/awesome-apis/"},{"title":"Awesome Applications","url":"/awesome-applications/"},{"title":"值得一看的文章列表","url":"/awesome-articles/"},{"title":"Awesome Automations","url":"/awesome-automations/"},{"title":"Awesome Backup","url":"/awesome-backup/"},{"title":"Awesome Benchmark","url":"/awesome-benchmark/"},{"title":"Awesome Bookmarks","url":"/awesome-bookmarks/"},{"title":"Awesome Chat","url":"/awesome-chat/"},{"title":"Awesome Browsers","url":"/awesome-browsers/"},{"title":"Awesome Command Tools","url":"/awesome-cli/"},{"title":"在中国买房之前，你需要了解的信息汇总","url":"/awesome-cn-house/"},{"title":"Awesome Code Learning","url":"/awesome-code-learning/"},{"title":"Awesome Dashboard","url":"/awesome-dashboard/"},{"title":"收集一些有意思的社区","url":"/awesome-communities/"},{"title":"有趣的数据","url":"/awesome-data/"},{"title":"Awesome Databases","url":"/awesome-databases/"},{"title":"Awesome Decentralization","url":"/awesome-decentralization/"},{"title":"Awesome Deno","url":"/awesome-deno/"},{"title":"Awesome Editors","url":"/awesome-editors/"},{"title":"Awesome Emails","url":"/awesome-emails.md/"},{"title":"收集英语学习工具","url":"/awesome-english-learning/"},{"title":"Awesome Extensions","url":"/awesome-extensions/"},{"title":"Awesome Flutter","url":"/awesome-flutter/"},{"title":"Awesome File Managers","url":"/awesome-file-managers/"},{"title":"Awesome Free","url":"/awesome-free/"},{"title":"Awesome Frontend","url":"/awesome-frontend/"},{"title":"Awesome Gatsby","url":"/awesome-gatsby/"},{"title":"智能家居方案汇总","url":"/awesome-home/"},{"title":"Awesome ID generator","url":"/awesome-id/"},{"title":"互联网目录汇总","url":"/awesome-indexes/"},{"title":"Awesome Interview","url":"/awesome-interview/"},{"title":"Awesome Investing","url":"/awesome-investing/"},{"title":"Awesome Jackett Indexes","url":"/awesome-jackett-indexes/"},{"title":"Awesome JS Date","url":"/awesome-js-date/"},{"title":"Awesome Jobs","url":"/awesome-jobs/"},{"title":"收集 Javascript 里好用的库","url":"/awesome-js/"},{"title":"Awesome KOL","url":"/awesome-kol/"},{"title":"Awesome List","url":"/awesome-list/"},{"title":"常见的低代码/无代码列表","url":"/awesome-low-code/"},{"title":"值得定期关注的独立开发者/创造者","url":"/awesome-maker/"},{"title":"国内镜像资源汇总","url":"/awesome-mirrors/"},{"title":"值得观看的电影","url":"/awesome-movies/"},{"title":"Awesome News","url":"/awesome-news/"},{"title":"Awesome NSFW","url":"/awesome-nsfw/"},{"title":"Awesome Notes","url":"/awesome-notes/"},{"title":"收集可以在线阅读的书籍","url":"/awesome-online-books/"},{"title":"Awesome Open Source","url":"/awesome-open-source/"},{"title":"Awesome P2P","url":"/awesome-p2p/"},{"title":"Awesome Products","url":"/awesome-products/"},{"title":"Awesome Privacy","url":"/awesome-privacy/"},{"title":"高质量的资源网站收集（电子书，电影，电视剧等）","url":"/awesome-resources/"},{"title":"Awesome RSS","url":"/awesome-rss/"},{"title":"收集发人深省的话","url":"/awesome-quotes/"},{"title":"Awesome Rust","url":"/awesome-rust/"},{"title":"Awesome Schema","url":"/awesome-schema/"},{"title":"Awesome Self-hosted","url":"/awesome-selfhosted/"},{"title":"Awesome Semantic","url":"/awesome-semantic/"},{"title":"Awesome SEO Tools","url":"/awesome-seo/"},{"title":"收集有意思的社交应用","url":"/awesome-socials/"},{"title":"Awesome Services","url":"/awesome-service/"},{"title":"Awesome Speed","url":"/awesome-speed/"},{"title":"探索互联网上高质量的内容","url":"/awesome-sources/"},{"title":"有意思的协议收集","url":"/awesome-standards/"},{"title":"Awesome Startups","url":"/awesome-startups/"},{"title":"Awesome Static Site Generator","url":"/awesome-static-site-generator/"},{"title":"收集股市相关的资源","url":"/awesome-stocks/"},{"title":"Awesome Swift","url":"/awesome-swift/"},{"title":"收集一些有用的技术/环境问题的解决方案","url":"/awesome-tech-anwser/"},{"title":"Awesome Templates","url":"/awesome-templates/"},{"title":"最好用的工具集合","url":"/awesome-tools/"},{"title":"值得观看的电视剧","url":"/awesome-tv-shows/"},{"title":"Awesome UI","url":"/awesome-ui/"},{"title":"Awesome What Was Your Moment","url":"/awesome-what-was-your-moment/"},{"title":"收集一些有意思的网站","url":"/awesome-websites/"},{"title":"收集Windows上好玩，好用的东西","url":"/awesome-windows/"},{"title":"Awesome workflows","url":"/awesome-workflows/"}]},{"title":"BBR","type":"tag","url":"/tags/bbr/","items":[{"title":"Open BBR for Debian","url":"/open-bbr-for-debian/"}]},{"title":"BT","type":"tag","url":"/tags/bt/","items":[{"title":"Jackett Setup","url":"/jackett-setup/"},{"title":"qBittorrent setup for Debian","url":"/qbittorrent-setup-for-debian/"}]},{"title":"Bash","type":"tag","url":"/tags/bash/","items":[{"title":"Awesome Benchmark","url":"/awesome-benchmark/"},{"title":"Bash Tips","url":"/bash-tips/"},{"title":"Linux Common Commands","url":"/linux-common-commands/"}]},{"title":"Benchmark","type":"tag","url":"/tags/benchmark/","items":[{"title":"Awesome Benchmark","url":"/awesome-benchmark/"}]},{"title":"Books","type":"tag","url":"/tags/books/","items":[{"title":"收集可以在线阅读的书籍","url":"/awesome-online-books/"},{"title":"2022年读书笔记","url":"/books-2022/"},{"title":"读书笔记","url":"/books/"}]},{"title":"Browser","type":"tag","url":"/tags/browser/","items":[{"title":"Awesome Browsers","url":"/awesome-browsers/"}]},{"title":"CSS","type":"tag","url":"/tags/css/","items":[{"title":"Mini Reset CSS","url":"/mini-reset-css/"},{"title":"Smart word break in CSS","url":"/smart-word-break-in-css/"}]},{"title":"Caddy","type":"tag","url":"/tags/caddy/","items":[{"title":"Caddy2 Setup for Debian","url":"/caddy2-setup-for-debian/"}]},{"title":"CentOS","type":"tag","url":"/tags/cent-os/","items":[{"title":"Install PHP 8.0 On CentOS 7 / RHEL 7","url":"/install-php8-on-centos7/"}]},{"title":"Chat","type":"tag","url":"/tags/chat/","items":[{"title":"Awesome Chat","url":"/awesome-chat/"}]},{"title":"China","type":"tag","url":"/tags/china/","items":[{"title":"在中国买房之前，你需要了解的信息汇总","url":"/awesome-cn-house/"}]},{"title":"Code","type":"tag","url":"/tags/code/","items":[{"title":"Awesome Code Learning","url":"/awesome-code-learning/"}]},{"title":"Command","type":"tag","url":"/tags/command/","items":[{"title":"Awesome Command Tools","url":"/awesome-cli/"}]},{"title":"Commands","type":"tag","url":"/tags/commands/","items":[{"title":"Linux Common Commands","url":"/linux-common-commands/"}]},{"title":"Communities","type":"tag","url":"/tags/communities/","items":[{"title":"收集一些有意思的社区","url":"/awesome-communities/"}]},{"title":"Comparison","type":"tag","url":"/tags/comparison/","items":[{"title":"License比较","url":"/license-comparison/"}]},{"title":"DDos","type":"tag","url":"/tags/d-dos/","items":[{"title":"Linux Anti DDos","url":"/linux-network/"}]},{"title":"Dashboard","type":"tag","url":"/tags/dashboard/","items":[{"title":"Awesome Dashboard","url":"/awesome-dashboard/"}]},{"title":"Data","type":"tag","url":"/tags/data/","items":[{"title":"有趣的数据","url":"/awesome-data/"}]},{"title":"Database","type":"tag","url":"/tags/database/","items":[{"title":"Awesome Databases","url":"/awesome-databases/"}]},{"title":"Date","type":"tag","url":"/tags/date/","items":[{"title":"Awesome JS Date","url":"/awesome-js-date/"}]},{"title":"Debian","type":"tag","url":"/tags/debian/","items":[{"title":"Caddy2 Setup for Debian","url":"/caddy2-setup-for-debian/"},{"title":"Debian Server Setup","url":"/debian-server-setup/"},{"title":"Netdata Setup for Debian","url":"/netdata-setup-for-debian/"},{"title":"Nginx Setup for Debian","url":"/nginx-setup-for-debian/"},{"title":"Nodejs Setup for Debian","url":"/nodejs-setup-for-debian/"},{"title":"Open BBR for Debian","url":"/open-bbr-for-debian/"},{"title":"Postgres Setup for Debian","url":"/postgres-setup-for-debian/"},{"title":"qBittorrent setup for Debian","url":"/qbittorrent-setup-for-debian/"},{"title":"Rust Environment Setup for Debian","url":"/rust-enviroment-setup-for-debian/"},{"title":"Shadowsocks Rust Setup for Debian","url":"/shadowsocks-rust-setup-for-debian/"}]},{"title":"Decentralization","type":"tag","url":"/tags/decentralization/","items":[{"title":"Awesome Decentralization","url":"/awesome-decentralization/"}]},{"title":"Deno","type":"tag","url":"/tags/deno/","items":[{"title":"Awesome Deno","url":"/awesome-deno/"},{"title":"Deno Tips","url":"/deno-tips/"}]},{"title":"Development-Environment","type":"tag","url":"/tags/development-environment/","items":[{"title":"收集Windows上好玩，好用的东西","url":"/awesome-windows/"}]},{"title":"Docker","type":"tag","url":"/tags/docker/","items":[{"title":"Docker Common Commands","url":"/docker-common-commands/"},{"title":"Docker Setup","url":"/docker-setup/"}]},{"title":"Downloads","type":"tag","url":"/tags/downloads/","items":[{"title":"qBittorrent setup for Debian","url":"/qbittorrent-setup-for-debian/"},{"title":"Youtube Download","url":"/youtube-download/"}]},{"title":"Editors","type":"tag","url":"/tags/editors/","items":[{"title":"Awesome Editors","url":"/awesome-editors/"},{"title":"Vim Tips","url":"/vim-tips/"},{"title":"VS Code Tips","url":"/vscode-tips/"}]},{"title":"Email","type":"tag","url":"/tags/email/","items":[{"title":"Awesome Emails","url":"/awesome-emails.md/"}]},{"title":"English","type":"tag","url":"/tags/english/","items":[{"title":"收集英语学习工具","url":"/awesome-english-learning/"}]},{"title":"Explore","type":"tag","url":"/tags/explore/","items":[{"title":"探索互联网上高质量的内容","url":"/awesome-sources/"}]},{"title":"Extensions","type":"tag","url":"/tags/extensions/","items":[{"title":"Awesome Extensions","url":"/awesome-extensions/"}]},{"title":"FAQ","type":"tag","url":"/tags/faq/","items":[{"title":"有意思的问题收集","url":"/awesome-answers/"},{"title":"收集一些有用的技术/环境问题的解决方案","url":"/awesome-tech-anwser/"}]},{"title":"Files","type":"tag","url":"/tags/files/","items":[{"title":"Awesome File Managers","url":"/awesome-file-managers/"},{"title":"Caddy File Server Browser with URL Scheme","url":"/caddy-file-server-url-scheme/"},{"title":"FileBrowser Setup","url":"/filebrowser-setup/"},{"title":"Rclone Setup","url":"/rclone-setup/"}]},{"title":"Flutter","type":"tag","url":"/tags/flutter/","items":[{"title":"Awesome Flutter","url":"/awesome-flutter/"}]},{"title":"Free","type":"tag","url":"/tags/free/","items":[{"title":"Awesome Free","url":"/awesome-free/"}]},{"title":"Front-End","type":"tag","url":"/tags/front-end/","items":[{"title":"Awesome UI","url":"/awesome-ui/"},{"title":"SVG","url":"/svg/"}]},{"title":"Frontend","type":"tag","url":"/tags/frontend/","items":[{"title":"Awesome Frontend","url":"/awesome-frontend/"}]},{"title":"Git","type":"tag","url":"/tags/git/","items":[{"title":"Use ssh key for Git","url":"/git-sshkey/"},{"title":"收集常用Git技巧","url":"/git-tips/"},{"title":"Git workflows","url":"/git-workflows/"},{"title":"How to check if there are uncommited changes in Github Actions?","url":"/github-actions-workflow-check-if-there-is-uncommited-changes/"}]},{"title":"Github","type":"tag","url":"/tags/github/","items":[{"title":"How to check if there are uncommited changes in Github Actions?","url":"/github-actions-workflow-check-if-there-is-uncommited-changes/"}]},{"title":"Go","type":"tag","url":"/tags/go/","items":[{"title":"Go Template Tips","url":"/go-template-tips/"}]},{"title":"HTTPS","type":"tag","url":"/tags/https/","items":[{"title":"在中国自动生成免费HTTPS证书的最佳方案","url":"/auto-https-ssl-in-china/"}]},{"title":"Home","type":"tag","url":"/tags/home/","items":[{"title":"智能家居方案汇总","url":"/awesome-home/"}]},{"title":"House","type":"tag","url":"/tags/house/","items":[{"title":"在中国买房之前，你需要了解的信息汇总","url":"/awesome-cn-house/"}]},{"title":"ID","type":"tag","url":"/tags/id/","items":[{"title":"Awesome ID generator","url":"/awesome-id/"}]},{"title":"Indexes","type":"tag","url":"/tags/indexes/","items":[{"title":"互联网目录汇总","url":"/awesome-indexes/"}]},{"title":"Interview","type":"tag","url":"/tags/interview/","items":[{"title":"Awesome Interview","url":"/awesome-interview/"}]},{"title":"Investing","type":"tag","url":"/tags/investing/","items":[{"title":"Awesome Investing","url":"/awesome-investing/"}]},{"title":"JSOn","type":"tag","url":"/tags/js-on/","items":[{"title":"Awesome Schema","url":"/awesome-schema/"}]},{"title":"Jackett","type":"tag","url":"/tags/jackett/","items":[{"title":"Jackett Setup","url":"/jackett-setup/"},{"title":"qBittorrent setup for Debian","url":"/qbittorrent-setup-for-debian/"}]},{"title":"Javascript","type":"tag","url":"/tags/javascript/","items":[{"title":"Awesome JS Date","url":"/awesome-js-date/"},{"title":"收集 Javascript 里好用的库","url":"/awesome-js/"},{"title":"Nodejs Monorepo","url":"/nodejs-monorepo/"},{"title":"Nodejs Setup for Debian","url":"/nodejs-setup-for-debian/"},{"title":"Nodejs Tips","url":"/nodejs-tips/"}]},{"title":"Jellyfin","type":"tag","url":"/tags/jellyfin/","items":[{"title":"Jellyfin setup","url":"/jellyfin-setup/"}]},{"title":"Jobs","type":"tag","url":"/tags/jobs/","items":[{"title":"Awesome Jobs","url":"/awesome-jobs/"}]},{"title":"Journal","type":"tag","url":"/tags/journal/","items":[{"title":"2021年的一些记录","url":"/journal-2021/"},{"title":"2022年的一些记录","url":"/journal-2022/"},{"title":"What I’m doing now?","url":"/now/"}]},{"title":"KOL","type":"tag","url":"/tags/kol/","items":[{"title":"Awesome KOL","url":"/awesome-kol/"}]},{"title":"Language","type":"tag","url":"/tags/language/","items":[{"title":"出国，这几句话必须学会用当地语言怎么说","url":"/basic-language/"}]},{"title":"Learning","type":"tag","url":"/tags/learning/","items":[{"title":"Awesome Code Learning","url":"/awesome-code-learning/"},{"title":"收集英语学习工具","url":"/awesome-english-learning/"},{"title":"Awesome Rust","url":"/awesome-rust/"}]},{"title":"License","type":"tag","url":"/tags/license/","items":[{"title":"License比较","url":"/license-comparison/"}]},{"title":"Life","type":"tag","url":"/tags/life/","items":[{"title":"提升生活质量的东西列表","url":"/life-pro/"},{"title":"高质量生活方式推荐","url":"/life-tips/"}]},{"title":"Linux","type":"tag","url":"/tags/linux/","items":[{"title":"Linux Common Commands","url":"/linux-common-commands/"},{"title":"Linux Log","url":"/linux-log/"},{"title":"Linux Anti DDos","url":"/linux-network/"}]},{"title":"List","type":"tag","url":"/tags/list/","items":[{"title":"Awesome List","url":"/awesome-list/"},{"title":"值得观看的电视剧","url":"/awesome-tv-shows/"},{"title":"提升生活质量的东西列表","url":"/life-pro/"},{"title":"想买的东西列表","url":"/wish-lists/"}]},{"title":"Log","type":"tag","url":"/tags/log/","items":[{"title":"Linux Log","url":"/linux-log/"}]},{"title":"Low-Code","type":"tag","url":"/tags/low-code/","items":[{"title":"常见的低代码/无代码列表","url":"/awesome-low-code/"}]},{"title":"MacOS","type":"tag","url":"/tags/mac-os/","items":[{"title":"Postgres Setup for Macos","url":"/postgres-setup-for-macos/"}]},{"title":"Makefile - Templates - Workflows","type":"tag","url":"/tags/makefile-templates-workflows/","items":[{"title":"Makefile Templates","url":"/makefile-templates/"}]},{"title":"Maker","type":"tag","url":"/tags/maker/","items":[{"title":"值得定期关注的独立开发者/创造者","url":"/awesome-maker/"}]},{"title":"Mastdon","type":"tag","url":"/tags/mastdon/","items":[{"title":"Mastdon Development Setup","url":"/mastdon-development-setup/"}]},{"title":"Me","type":"tag","url":"/tags/me/","items":[{"title":"Everything I Know by Owen","url":"/"},{"title":"About Me and the Wiki","url":"/about/"},{"title":"What I’m doing now?","url":"/now/"},{"title":"Projects","url":"/projects/"}]},{"title":"Medias","type":"tag","url":"/tags/medias/","items":[{"title":"Bazarr Setup","url":"/bazarr-setup/"},{"title":"Caddy File Server Browser with URL Scheme","url":"/caddy-file-server-url-scheme/"},{"title":"Jackett Setup","url":"/jackett-setup/"},{"title":"Jellyfin setup","url":"/jellyfin-setup/"},{"title":"Radarr Setup","url":"/radarr-setup/"},{"title":"Rclone Setup","url":"/rclone-setup/"},{"title":"Sonarr Setup","url":"/sonarr-setup/"},{"title":"Subtitles","url":"/subtitles/"},{"title":"Youtube Download","url":"/youtube-download/"}]},{"title":"Metube","type":"tag","url":"/tags/metube/","items":[{"title":"Youtube Download","url":"/youtube-download/"}]},{"title":"Mirrors","type":"tag","url":"/tags/mirrors/","items":[{"title":"国内镜像资源汇总","url":"/awesome-mirrors/"}]},{"title":"Monitor","type":"tag","url":"/tags/monitor/","items":[{"title":"Netdata Setup for Debian","url":"/netdata-setup-for-debian/"}]},{"title":"Monorepo","type":"tag","url":"/tags/monorepo/","items":[{"title":"Nodejs Monorepo","url":"/nodejs-monorepo/"}]},{"title":"Movies","type":"tag","url":"/tags/movies/","items":[{"title":"值得观看的电影","url":"/awesome-movies/"},{"title":"电影笔记","url":"/movies/"}]},{"title":"Music","type":"tag","url":"/tags/music/","items":[{"title":"音乐收藏","url":"/music/"}]},{"title":"NSFW","type":"tag","url":"/tags/nsfw/","items":[{"title":"Awesome NSFW","url":"/awesome-nsfw/"}]},{"title":"Netdata","type":"tag","url":"/tags/netdata/","items":[{"title":"Netdata Setup for Debian","url":"/netdata-setup-for-debian/"}]},{"title":"Netwok","type":"tag","url":"/tags/netwok/","items":[{"title":"Awesome Speed","url":"/awesome-speed/"}]},{"title":"News","type":"tag","url":"/tags/news/","items":[{"title":"Awesome News","url":"/awesome-news/"}]},{"title":"Nginx","type":"tag","url":"/tags/nginx/","items":[{"title":"Nginx Setup for Debian","url":"/nginx-setup-for-debian/"}]},{"title":"Notes","type":"tag","url":"/tags/notes/","items":[{"title":"Awesome Notes","url":"/awesome-notes/"},{"title":"2022年读书笔记","url":"/books-2022/"},{"title":"读书笔记","url":"/books/"},{"title":"电影笔记","url":"/movies/"},{"title":"电视剧笔记","url":"/tv-shows/"}]},{"title":"Now","type":"tag","url":"/tags/now/","items":[{"title":"What I’m doing now?","url":"/now/"}]},{"title":"Open Source","type":"tag","url":"/tags/open-source/","items":[{"title":"Awesome Open Source","url":"/awesome-open-source/"}]},{"title":"P2P","type":"tag","url":"/tags/p-2-p/","items":[{"title":"Awesome P2P","url":"/awesome-p2p/"}]},{"title":"PHP","type":"tag","url":"/tags/php/","items":[{"title":"Install PHP 8.0 On CentOS 7 / RHEL 7","url":"/install-php8-on-centos7/"}]},{"title":"Peertube","type":"tag","url":"/tags/peertube/","items":[{"title":"Peertube Setup with Caddy Server","url":"/peertube-setup/"}]},{"title":"Postgres","type":"tag","url":"/tags/postgres/","items":[{"title":"Postgres Setup for Debian","url":"/postgres-setup-for-debian/"},{"title":"Postgres Setup for Macos","url":"/postgres-setup-for-macos/"}]},{"title":"Postgresql","type":"tag","url":"/tags/postgresql/","items":[{"title":"Postgresql Tips","url":"/postgresql-tips/"}]},{"title":"Privacy","type":"tag","url":"/tags/privacy/","items":[{"title":"Awesome Privacy","url":"/awesome-privacy/"}]},{"title":"Products","type":"tag","url":"/tags/products/","items":[{"title":"Awesome Products","url":"/awesome-products/"}]},{"title":"Programming-Languages","type":"tag","url":"/tags/programming-languages/","items":[{"title":"Go Template Tips","url":"/go-template-tips/"},{"title":"Nodejs Setup for Debian","url":"/nodejs-setup-for-debian/"},{"title":"Nodejs Tips","url":"/nodejs-tips/"}]},{"title":"Projects","type":"tag","url":"/tags/projects/","items":[{"title":"Projects","url":"/projects/"}]},{"title":"Protocol","type":"tag","url":"/tags/protocol/","items":[{"title":"有意思的协议收集","url":"/awesome-standards/"}]},{"title":"Proxies","type":"tag","url":"/tags/proxies/","items":[{"title":"Awesome Benchmark","url":"/awesome-benchmark/"},{"title":"Caddy File Server Browser with URL Scheme","url":"/caddy-file-server-url-scheme/"},{"title":"Caddy2 Setup for Debian","url":"/caddy2-setup-for-debian/"},{"title":"Open BBR for Debian","url":"/open-bbr-for-debian/"},{"title":"Shadowsocks Rust Setup for Debian","url":"/shadowsocks-rust-setup-for-debian/"}]},{"title":"Quotes","type":"tag","url":"/tags/quotes/","items":[{"title":"收集发人深省的话","url":"/awesome-quotes/"},{"title":"划线的电视剧截图","url":"/awesome-tv-quotes/"}]},{"title":"RSS","type":"tag","url":"/tags/rss/","items":[{"title":"Awesome RSS","url":"/awesome-rss/"}]},{"title":"Radarr","type":"tag","url":"/tags/radarr/","items":[{"title":"Radarr Setup","url":"/radarr-setup/"}]},{"title":"Rclone","type":"tag","url":"/tags/rclone/","items":[{"title":"Rclone Setup","url":"/rclone-setup/"}]},{"title":"Recommend","type":"tag","url":"/tags/recommend/","items":[{"title":"Awesome Algorithm","url":"/awesome-algorithm/"}]},{"title":"Resource","type":"tag","url":"/tags/resource/","items":[{"title":"高质量的资源网站收集（电子书，电影，电视剧等）","url":"/awesome-resources/"}]},{"title":"Ruby","type":"tag","url":"/tags/ruby/","items":[{"title":"Ruby Setup for MacOS","url":"/ruby-setup/"}]},{"title":"Rust","type":"tag","url":"/tags/rust/","items":[{"title":"Awesome Rust","url":"/awesome-rust/"},{"title":"Rust Environment Setup for Debian","url":"/rust-enviroment-setup-for-debian/"},{"title":"Rust Tips","url":"/rust-tips/"},{"title":"Shadowsocks Rust Setup for Debian","url":"/shadowsocks-rust-setup-for-debian/"}]},{"title":"SEO","type":"tag","url":"/tags/seo/","items":[{"title":"Awesome SEO Tools","url":"/awesome-seo/"}]},{"title":"SSH","type":"tag","url":"/tags/ssh/","items":[{"title":"Use ssh key for Git","url":"/git-sshkey/"}]},{"title":"SSL","type":"tag","url":"/tags/ssl/","items":[{"title":"在中国自动生成免费HTTPS证书的最佳方案","url":"/auto-https-ssl-in-china/"}]},{"title":"SVG","type":"tag","url":"/tags/svg/","items":[{"title":"SVG","url":"/svg/"}]},{"title":"Satire","type":"tag","url":"/tags/satire/","items":[{"title":"讽刺言论收集","url":"/satire-quotes/"}]},{"title":"Schema","type":"tag","url":"/tags/schema/","items":[{"title":"Awesome Schema","url":"/awesome-schema/"}]},{"title":"Self-Hosted","type":"tag","url":"/tags/self-hosted/","items":[{"title":"Awesome Automations","url":"/awesome-automations/"},{"title":"Awesome Self-hosted","url":"/awesome-selfhosted/"},{"title":"Bazarr Setup","url":"/bazarr-setup/"},{"title":"Jackett Setup","url":"/jackett-setup/"},{"title":"Jellyfin setup","url":"/jellyfin-setup/"},{"title":"Radarr Setup","url":"/radarr-setup/"},{"title":"Sonarr Setup","url":"/sonarr-setup/"},{"title":"Youtube Download","url":"/youtube-download/"}]},{"title":"Semantic","type":"tag","url":"/tags/semantic/","items":[{"title":"Awesome Semantic","url":"/awesome-semantic/"}]},{"title":"Server","type":"tag","url":"/tags/server/","items":[{"title":"Caddy File Server Browser with URL Scheme","url":"/caddy-file-server-url-scheme/"},{"title":"Caddy2 Setup for Debian","url":"/caddy2-setup-for-debian/"},{"title":"Debian Server Setup","url":"/debian-server-setup/"},{"title":"Nodejs Setup for Debian","url":"/nodejs-setup-for-debian/"},{"title":"Open BBR for Debian","url":"/open-bbr-for-debian/"},{"title":"qBittorrent setup for Debian","url":"/qbittorrent-setup-for-debian/"}]},{"title":"Serverless","type":"tag","url":"/tags/serverless/","items":[{"title":"收集一些有用的技术/环境问题的解决方案","url":"/awesome-tech-anwser/"}]},{"title":"Service","type":"tag","url":"/tags/service/","items":[{"title":"Awesome Services","url":"/awesome-service/"}]},{"title":"Setup","type":"tag","url":"/tags/setup/","items":[{"title":"Bazarr Setup","url":"/bazarr-setup/"},{"title":"Caddy2 Setup for Debian","url":"/caddy2-setup-for-debian/"},{"title":"Docker Setup","url":"/docker-setup/"},{"title":"FileBrowser Setup","url":"/filebrowser-setup/"},{"title":"Debian Server Setup","url":"/debian-server-setup/"},{"title":"Install PHP 8.0 On CentOS 7 / RHEL 7","url":"/install-php8-on-centos7/"},{"title":"Jackett Setup","url":"/jackett-setup/"},{"title":"Jellyfin setup","url":"/jellyfin-setup/"},{"title":"Mastdon Development Setup","url":"/mastdon-development-setup/"},{"title":"Nginx Setup for Debian","url":"/nginx-setup-for-debian/"},{"title":"Nodejs Setup for Debian","url":"/nodejs-setup-for-debian/"},{"title":"Peertube Setup with Caddy Server","url":"/peertube-setup/"},{"title":"Postgres Setup for Debian","url":"/postgres-setup-for-debian/"},{"title":"Postgres Setup for Macos","url":"/postgres-setup-for-macos/"},{"title":"qBittorrent setup for Debian","url":"/qbittorrent-setup-for-debian/"},{"title":"Radarr Setup","url":"/radarr-setup/"},{"title":"Rclone Setup","url":"/rclone-setup/"},{"title":"Ruby Setup for MacOS","url":"/ruby-setup/"},{"title":"Rust Environment Setup for Debian","url":"/rust-enviroment-setup-for-debian/"},{"title":"Shadowsocks Rust Setup for Debian","url":"/shadowsocks-rust-setup-for-debian/"}]},{"title":"Shadowsocks","type":"tag","url":"/tags/shadowsocks/","items":[{"title":"Shadowsocks Rust Setup for Debian","url":"/shadowsocks-rust-setup-for-debian/"}]},{"title":"Social","type":"tag","url":"/tags/social/","items":[{"title":"收集一些有意思的社区","url":"/awesome-communities/"},{"title":"Awesome Products","url":"/awesome-products/"},{"title":"收集有意思的社交应用","url":"/awesome-socials/"}]},{"title":"Sonarr","type":"tag","url":"/tags/sonarr/","items":[{"title":"Sonarr Setup","url":"/sonarr-setup/"}]},{"title":"Sources","type":"tag","url":"/tags/sources/","items":[{"title":"探索互联网上高质量的内容","url":"/awesome-sources/"}]},{"title":"Speed","type":"tag","url":"/tags/speed/","items":[{"title":"Awesome Speed","url":"/awesome-speed/"}]},{"title":"Standard","type":"tag","url":"/tags/standard/","items":[{"title":"有意思的协议收集","url":"/awesome-standards/"}]},{"title":"Startups","type":"tag","url":"/tags/startups/","items":[{"title":"Awesome Startups","url":"/awesome-startups/"}]},{"title":"Static-Site-Generator","type":"tag","url":"/tags/static-site-generator/","items":[{"title":"Awesome Static Site Generator","url":"/awesome-static-site-generator/"}]},{"title":"Stocks","type":"tag","url":"/tags/stocks/","items":[{"title":"Awesome Investing","url":"/awesome-investing/"},{"title":"收集股市相关的资源","url":"/awesome-stocks/"}]},{"title":"Stop","type":"tag","url":"/tags/stop/","items":[{"title":"你应该立即停止做的事","url":"/stop/"}]},{"title":"Subtitles","type":"tag","url":"/tags/subtitles/","items":[{"title":"Bazarr Setup","url":"/bazarr-setup/"},{"title":"Subtitles","url":"/subtitles/"}]},{"title":"Swift","type":"tag","url":"/tags/swift/","items":[{"title":"Awesome Swift","url":"/awesome-swift/"}]},{"title":"TV","type":"tag","url":"/tags/tv/","items":[{"title":"划线的电视剧截图","url":"/awesome-tv-quotes/"},{"title":"值得观看的电视剧","url":"/awesome-tv-shows/"},{"title":"电视剧笔记","url":"/tv-shows/"}]},{"title":"Tech","type":"tag","url":"/tags/tech/","items":[{"title":"收集一些有用的技术/环境问题的解决方案","url":"/awesome-tech-anwser/"}]},{"title":"Templates","type":"tag","url":"/tags/templates/","items":[{"title":"Awesome Templates","url":"/awesome-templates/"},{"title":"Caddy File Server Browser with URL Scheme","url":"/caddy-file-server-url-scheme/"},{"title":"Go Template Tips","url":"/go-template-tips/"}]},{"title":"Thinking","type":"tag","url":"/tags/thinking/","items":[{"title":"所思所想","url":"/thoughts/"}]},{"title":"Tips","type":"tag","url":"/tags/tips/","items":[{"title":"Bash Tips","url":"/bash-tips/"},{"title":"Common URL Scheme","url":"/common-url-scheme/"},{"title":"Deno Tips","url":"/deno-tips/"},{"title":"Docker Common Commands","url":"/docker-common-commands/"},{"title":"收集常用Git技巧","url":"/git-tips/"},{"title":"Go Template Tips","url":"/go-template-tips/"},{"title":"提升生活质量的东西列表","url":"/life-pro/"},{"title":"高质量生活方式推荐","url":"/life-tips/"},{"title":"Linux Common Commands","url":"/linux-common-commands/"},{"title":"Nodejs Tips","url":"/nodejs-tips/"},{"title":"Postgresql Tips","url":"/postgresql-tips/"},{"title":"Rust Tips","url":"/rust-tips/"},{"title":"Vim Tips","url":"/vim-tips/"},{"title":"VS Code Tips","url":"/vscode-tips/"}]},{"title":"Todo","type":"tag","url":"/tags/todo/","items":[{"title":"2022 Goals","url":"/goals-2022/"},{"title":"Todos","url":"/todo/"},{"title":"2021 Goals","url":"/goals-2021/"}]},{"title":"Tools","type":"tag","url":"/tags/tools/","items":[{"title":"Awesome Command Tools","url":"/awesome-cli/"},{"title":"Awesome Editors","url":"/awesome-editors/"},{"title":"Awesome Free","url":"/awesome-free/"},{"title":"Awesome Notes","url":"/awesome-notes/"},{"title":"Awesome Self-hosted","url":"/awesome-selfhosted/"},{"title":"Awesome SEO Tools","url":"/awesome-seo/"},{"title":"Awesome Startups","url":"/awesome-startups/"},{"title":"最好用的工具集合","url":"/awesome-tools/"},{"title":"收集一些有意思的网站","url":"/awesome-websites/"},{"title":"收集Windows上好玩，好用的东西","url":"/awesome-windows/"}]},{"title":"Torrents","type":"tag","url":"/tags/torrents/","items":[{"title":"Jackett Setup","url":"/jackett-setup/"},{"title":"qBittorrent setup for Debian","url":"/qbittorrent-setup-for-debian/"}]},{"title":"Travel","type":"tag","url":"/tags/travel/","items":[{"title":"旅行手续","url":"/travel-approvals/"}]},{"title":"Trends","type":"tag","url":"/tags/trends/","items":[{"title":"互联网目录汇总","url":"/awesome-indexes/"}]},{"title":"Tweet","type":"tag","url":"/tags/tweet/","items":[{"title":"所思所想","url":"/thoughts/"}]},{"title":"UI","type":"tag","url":"/tags/ui/","items":[{"title":"Awesome UI","url":"/awesome-ui/"}]},{"title":"URL","type":"tag","url":"/tags/url/","items":[{"title":"Common URL Scheme","url":"/common-url-scheme/"}]},{"title":"VS Code","type":"tag","url":"/tags/vs-code/","items":[{"title":"VS Code Tips","url":"/vscode-tips/"}]},{"title":"Vim","type":"tag","url":"/tags/vim/","items":[{"title":"Vim Tips","url":"/vim-tips/"}]},{"title":"Wikipedia","type":"tag","url":"/tags/wikipedia/","items":[{"title":"收录一些有意思的维基百科","url":"/awesome-wikipedia/"}]},{"title":"Windows","type":"tag","url":"/tags/windows/","items":[{"title":"收集Windows上好玩，好用的东西","url":"/awesome-windows/"}]},{"title":"Wish","type":"tag","url":"/tags/wish/","items":[{"title":"想买的东西列表","url":"/wish-lists/"}]},{"title":"Workflows","type":"tag","url":"/tags/workflows/","items":[{"title":"Awesome workflows","url":"/awesome-workflows/"},{"title":"Git workflows","url":"/git-workflows/"},{"title":"Nodejs Monorepo","url":"/nodejs-monorepo/"}]},{"title":"Writing","type":"tag","url":"/tags/writing/","items":[{"title":"如何写作？","url":"/how-to-write/"}]},{"title":"Year2021","type":"tag","url":"/tags/year-2021/","items":[{"title":"2021年的一些记录","url":"/journal-2021/"},{"title":"2021 Goals","url":"/goals-2021/"}]},{"title":"Year2022","type":"tag","url":"/tags/year-2022/","items":[{"title":"2022 Goals","url":"/goals-2022/"},{"title":"2022年的一些记录","url":"/journal-2022/"}]},{"title":"Youtube","type":"tag","url":"/tags/youtube/","items":[{"title":"Youtube Download","url":"/youtube-download/"}]},{"title":"depression","type":"tag","url":"/tags/depression/","items":[{"title":"抑郁症相关资料汇总","url":"/depression/"}]},{"title":"mac","type":"tag","url":"/tags/mac/","items":[{"title":"Mac Setup","url":"/mac-setup/"}]},{"title":"qBittorrent","type":"tag","url":"/tags/q-bittorrent/","items":[{"title":"qBittorrent setup for Debian","url":"/qbittorrent-setup-for-debian/"}]},{"title":"setup","type":"tag","url":"/tags/setup/","items":[{"title":"Mac Setup","url":"/mac-setup/"}]},{"title":"中文","type":"tag","url":"/tags/中文/","items":[{"title":"有意思的问题收集","url":"/awesome-answers/"},{"title":"收集一些有意思的社区","url":"/awesome-communities/"},{"title":"有趣的数据","url":"/awesome-data/"},{"title":"收集 Javascript 里好用的库","url":"/awesome-js/"},{"title":"值得观看的电影","url":"/awesome-movies/"},{"title":"收集发人深省的话","url":"/awesome-quotes/"},{"title":"划线的电视剧截图","url":"/awesome-tv-quotes/"},{"title":"最好用的工具集合","url":"/awesome-tools/"},{"title":"值得观看的电视剧","url":"/awesome-tv-shows/"},{"title":"收集一些有意思的网站","url":"/awesome-websites/"},{"title":"收集Windows上好玩，好用的东西","url":"/awesome-windows/"},{"title":"2022年读书笔记","url":"/books-2022/"},{"title":"读书笔记","url":"/books/"},{"title":"收集常用Git技巧","url":"/git-tips/"},{"title":"License比较","url":"/license-comparison/"},{"title":"电影笔记","url":"/movies/"},{"title":"旅行手续","url":"/travel-approvals/"},{"title":"电视剧笔记","url":"/tv-shows/"}]},{"title":"冷知识","type":"tag","url":"/tags/冷知识/","items":[{"title":"冷知识","url":"/trivia/"}]}],"latestPosts":[{"fields":{"slug":"/awesome-sources/","title":"探索互联网上高质量的内容","lastUpdatedAt":"2022-03-11T06:11:57.000Z","lastUpdated":"3/11/2022"},"frontmatter":{"draft":false,"tags":["Awesome","Explore","Sources"]}},{"fields":{"slug":"/","title":"Everything I Know by Owen","lastUpdatedAt":"2022-03-10T17:07:06.000Z","lastUpdated":"3/10/2022"},"frontmatter":{"draft":false,"tags":["Me"]}},{"fields":{"slug":"/awesome-browsers/","title":"Awesome Browsers","lastUpdatedAt":"2022-03-10T16:43:18.000Z","lastUpdated":"3/10/2022"},"frontmatter":{"draft":false,"tags":["Awesome","Browser"]}},{"fields":{"slug":"/books/","title":"读书笔记","lastUpdatedAt":"2022-03-10T16:43:18.000Z","lastUpdated":"3/10/2022"},"frontmatter":{"draft":false,"tags":["Books","Notes","中文"]}},{"fields":{"slug":"/thoughts/","title":"所思所想","lastUpdatedAt":"2022-03-10T16:43:18.000Z","lastUpdated":"3/10/2022"},"frontmatter":{"draft":false,"tags":["Thinking","Tweet"]}},{"fields":{"slug":"/books-2022/","title":"2022年读书笔记","lastUpdatedAt":"2022-03-10T10:51:17.000Z","lastUpdated":"3/10/2022"},"frontmatter":{"draft":false,"tags":["Books","Notes","中文"]}},{"fields":{"slug":"/awesome-quotes/","title":"收集发人深省的话","lastUpdatedAt":"2022-03-10T10:31:57.000Z","lastUpdated":"3/10/2022"},"frontmatter":{"draft":false,"tags":["Awesome","Quotes","中文"]}},{"fields":{"slug":"/satire-quotes/","title":"讽刺言论收集","lastUpdatedAt":"2022-03-10T10:31:57.000Z","lastUpdated":"3/10/2022"},"frontmatter":{"draft":false,"tags":["Satire"]}},{"fields":{"slug":"/movies/","title":"电影笔记","lastUpdatedAt":"2022-03-09T16:09:47.000Z","lastUpdated":"3/9/2022"},"frontmatter":{"draft":false,"tags":["Movies","Notes","中文"]}},{"fields":{"slug":"/awesome-indexes/","title":"互联网目录汇总","lastUpdatedAt":"2022-03-09T08:25:23.000Z","lastUpdated":"3/9/2022"},"frontmatter":{"draft":false,"tags":["Awesome","Indexes","Trends"]}},{"fields":{"slug":"/awesome-articles/","title":"值得一看的文章列表","lastUpdatedAt":"2022-03-09T07:54:15.000Z","lastUpdated":"3/9/2022"},"frontmatter":{"draft":false,"tags":["Awesome","Articles"]}},{"fields":{"slug":"/awesome-ui/","title":"Awesome UI","lastUpdatedAt":"2022-03-09T07:54:15.000Z","lastUpdated":"3/9/2022"},"frontmatter":{"draft":false,"tags":["Awesome","UI","Front-End"]}},{"fields":{"slug":"/awesome-answers/","title":"有意思的问题收集","lastUpdatedAt":"2022-03-08T15:54:49.000Z","lastUpdated":"3/8/2022"},"frontmatter":{"draft":false,"tags":["Awesome","FAQ","Answer","中文","Ask"]}},{"fields":{"slug":"/about/","title":"About Me and the Wiki","lastUpdatedAt":"2022-03-08T11:45:37.000Z","lastUpdated":"3/8/2022"},"frontmatter":{"draft":false,"tags":["Me"]}},{"fields":{"slug":"/awesome-applications/","title":"Awesome Applications","lastUpdatedAt":"2022-03-08T11:22:55.000Z","lastUpdated":"3/8/2022"},"frontmatter":{"draft":false,"tags":["Awesome","Applications"]}}]}},
    "staticQueryHashes": ["2230547434","2320115945","3495835395","451533639"]}