{
    "componentChunkName": "component---node-modules-gatsby-theme-primer-wiki-src-templates-post-query-js",
    "path": "/awesome-flutter/",
    "result": {"data":{"mdx":{"id":"024b1474-b272-5e80-98f6-53856127a094","tableOfContents":{"items":[{"url":"#cros","title":"Cros"},{"url":"#articles","title":"Articles"},{"url":"#books","title":"Books"},{"url":"#list","title":"List"},{"url":"#roadmap","title":"Roadmap"},{"url":"#ä¸­æ–‡èµ„æº","title":"ä¸­æ–‡èµ„æº"},{"url":"#libraries","title":"Libraries"},{"url":"#apps","title":"Apps"},{"url":"#templates","title":"Templates"}]},"fields":{"title":"Awesome Flutter","slug":"/awesome-flutter/","url":"https://wiki.owenyoung.com/awesome-flutter/","editUrl":"https://github.com/theowenyoung/wiki/tree/main/awesome-flutter.md","lastUpdatedAt":"2022-02-13T17:40:05.000Z","lastUpdated":"2/13/2022","gitCreatedAt":"2021-10-11T13:41:00.000Z","shouldShowTitle":true},"frontmatter":{"title":"Awesome Flutter","description":null,"imageAlt":null,"tags":["Awesome","Flutter"],"date":null,"dateModified":null,"language":null,"seoTitle":null,"image":null},"body":"var _excluded = [\"components\"];\n\nfunction _extends() { _extends = Object.assign || function (target) { for (var i = 1; i < arguments.length; i++) { var source = arguments[i]; for (var key in source) { if (Object.prototype.hasOwnProperty.call(source, key)) { target[key] = source[key]; } } } return target; }; return _extends.apply(this, arguments); }\n\nfunction _objectWithoutProperties(source, excluded) { if (source == null) return {}; var target = _objectWithoutPropertiesLoose(source, excluded); var key, i; if (Object.getOwnPropertySymbols) { var sourceSymbolKeys = Object.getOwnPropertySymbols(source); for (i = 0; i < sourceSymbolKeys.length; i++) { key = sourceSymbolKeys[i]; if (excluded.indexOf(key) >= 0) continue; if (!Object.prototype.propertyIsEnumerable.call(source, key)) continue; target[key] = source[key]; } } return target; }\n\nfunction _objectWithoutPropertiesLoose(source, excluded) { if (source == null) return {}; var target = {}; var sourceKeys = Object.keys(source); var key, i; for (i = 0; i < sourceKeys.length; i++) { key = sourceKeys[i]; if (excluded.indexOf(key) >= 0) continue; target[key] = source[key]; } return target; }\n\n/* @jsxRuntime classic */\n\n/* @jsx mdx */\nvar _frontmatter = {\n  \"title\": \"Awesome Flutter\",\n  \"tags\": [\"Awesome\", \"Flutter\"]\n};\nvar layoutProps = {\n  _frontmatter: _frontmatter\n};\nvar MDXLayout = \"wrapper\";\nreturn function MDXContent(_ref) {\n  var components = _ref.components,\n      props = _objectWithoutProperties(_ref, _excluded);\n\n  return mdx(MDXLayout, _extends({}, layoutProps, props, {\n    components: components,\n    mdxType: \"MDXLayout\"\n  }), mdx(\"p\", null, \"Curating Flutter resources.\"), mdx(\"h2\", {\n    \"id\": \"cros\"\n  }, \"Cros\"), mdx(\"ul\", null, mdx(\"li\", {\n    parentName: \"ul\"\n  }, mdx(\"a\", {\n    parentName: \"li\",\n    \"href\": \"https://betterprogramming.pub/flutter-failed-to-solve-the-biggest-challenge-for-our-cross-platform-app-c551afa0ef18\"\n  }, \"Flutter Failed To Solve the Biggest Challenge for Our Cross-Platform App\"))), mdx(\"h2\", {\n    \"id\": \"articles\"\n  }, \"Articles\"), mdx(\"ul\", null, mdx(\"li\", {\n    parentName: \"ul\"\n  }, mdx(\"a\", {\n    parentName: \"li\",\n    \"href\": \"https://github.com/ahammer/dart_board\"\n  }, \"Dart Board\"), \" - Dart Board is a Framework/Architecture pattern for Flutter applications.\"), mdx(\"li\", {\n    parentName: \"ul\"\n  }, mdx(\"a\", {\n    parentName: \"li\",\n    \"href\": \"https://flutter.dev/docs/development/data-and-backend/json#code-generation\"\n  }, \"Dart JSON and serialization\"))), mdx(\"h2\", {\n    \"id\": \"books\"\n  }, \"Books\"), mdx(\"ul\", null, mdx(\"li\", {\n    parentName: \"ul\"\n  }, \"[Flutter in action]\", \"](\", mdx(\"a\", {\n    parentName: \"li\",\n    \"href\": \"https://livebook.manning.com/book/flutter-in-action/\"\n  }, \"https://livebook.manning.com/book/flutter-in-action/\"), \")\")), mdx(\"h2\", {\n    \"id\": \"list\"\n  }, \"List\"), mdx(\"ul\", null, mdx(\"li\", {\n    parentName: \"ul\"\n  }, mdx(\"a\", {\n    parentName: \"li\",\n    \"href\": \"https://github.com/Solido/awesome-flutter\"\n  }, \"awesome flutter\"), mdx(\"ul\", {\n    parentName: \"li\"\n  }, mdx(\"li\", {\n    parentName: \"ul\"\n  }, mdx(\"a\", {\n    parentName: \"li\",\n    \"href\": \"https://www.trackawesomelist.com/Solido/awesome-flutter/readme/\"\n  }, \"track\")))), mdx(\"li\", {\n    parentName: \"ul\"\n  }, mdx(\"a\", {\n    parentName: \"li\",\n    \"href\": \"https://github.com/tortuvshin/open-source-flutter-apps\"\n  }, \"open-source-flutter-apps\"), \" - \\uD83D\\uDCF1 List of open source Flutter applications :octocat:\"), mdx(\"li\", {\n    parentName: \"ul\"\n  }, mdx(\"a\", {\n    parentName: \"li\",\n    \"href\": \"https://github.com/iampawan/FlutterExampleApps\"\n  }, \"flutter example apps\")), mdx(\"li\", {\n    parentName: \"ul\"\n  }, mdx(\"a\", {\n    parentName: \"li\",\n    \"href\": \"https://github.com/flutter/samples\"\n  }, \"flutter official sample apps\"), mdx(\"ul\", {\n    parentName: \"li\"\n  }, mdx(\"li\", {\n    parentName: \"ul\"\n  }, mdx(\"a\", {\n    parentName: \"li\",\n    \"href\": \"https://github.com/diegoveloper/flutter-samples\"\n  }, \"flutter sample apps\"))))), mdx(\"h2\", {\n    \"id\": \"roadmap\"\n  }, \"Roadmap\"), mdx(\"ul\", null, mdx(\"li\", {\n    parentName: \"ul\"\n  }, mdx(\"a\", {\n    parentName: \"li\",\n    \"href\": \"https://github.com/olexale/flutter_roadmap\"\n  }, \"flutter roadmap\"))), mdx(\"h2\", {\n    \"id\": \"ä¸­æ–‡èµ„æº\"\n  }, \"\\u4E2D\\u6587\\u8D44\\u6E90\"), mdx(\"ul\", null, mdx(\"li\", {\n    parentName: \"ul\"\n  }, mdx(\"a\", {\n    parentName: \"li\",\n    \"href\": \"https://book.flutterchina.club/\"\n  }, \"Flutter \\u5B9E\\u6218\")), mdx(\"li\", {\n    parentName: \"ul\"\n  }, mdx(\"a\", {\n    parentName: \"li\",\n    \"href\": \"https://www.bilibili.com/video/BV1pp4y187w6?p=2\"\n  }, \"Flutter \\u89C6\\u9891\\u6559\\u7A0B-\\u4ECE\\u96F6\\u5230\\u4E0A\\u67B6\")), mdx(\"li\", {\n    parentName: \"ul\"\n  }, mdx(\"a\", {\n    parentName: \"li\",\n    \"href\": \"https://codelabs.developers.google.com/codelabs/flutter/#0\"\n  }, \"\\u7528 flutter \\u6784\\u5EFA\\u4E00\\u4E2A\\u804A\\u5929\\u5E94\\u7528\\u754C\\u9762-\\u8C37\\u6B4C\\u5B98\\u65B9\\u51FA\\u54C1\")), mdx(\"li\", {\n    parentName: \"ul\"\n  }, mdx(\"a\", {\n    parentName: \"li\",\n    \"href\": \"https://www.dartcn.com/guides/language/language-tour\"\n  }, \"Dart \\u8BED\\u8A00\\u6982\\u89C8\")), mdx(\"li\", {\n    parentName: \"ul\"\n  }, mdx(\"a\", {\n    parentName: \"li\",\n    \"href\": \"https://flutterchina.club/tutorials/layout/\"\n  }, \"flutter \\u5E03\\u5C40\\u6559\\u7A0B\"))), mdx(\"h2\", {\n    \"id\": \"libraries\"\n  }, \"Libraries\"), mdx(\"ul\", null, mdx(\"li\", {\n    parentName: \"ul\"\n  }, mdx(\"a\", {\n    parentName: \"li\",\n    \"href\": \"https://github.com/e-oj/visa\"\n  }, \"visa\"), \" - Easy third party authentication (OAuth 2.0) for Flutter apps.\"), mdx(\"li\", {\n    parentName: \"ul\"\n  }, mdx(\"a\", {\n    parentName: \"li\",\n    \"href\": \"https://github.com/fluttercandies/flutter_wechat_assets_picker\"\n  }, \"wechat-assets-picker\")), mdx(\"li\", {\n    parentName: \"ul\"\n  }, mdx(\"a\", {\n    parentName: \"li\",\n    \"href\": \"https://pub.dev/packages/flutter_platform_widgets\"\n  }, \"flutter platform widgets\")), mdx(\"li\", {\n    parentName: \"ul\"\n  }, mdx(\"a\", {\n    parentName: \"li\",\n    \"href\": \"https://github.com/LiewJunTung/pin_code_text_field\"\n  }, \"pin code\")), mdx(\"li\", {\n    parentName: \"ul\"\n  }, mdx(\"a\", {\n    parentName: \"li\",\n    \"href\": \"https://github.com/aagarwal1012/Liquid-Pull-To-Refresh\"\n  }, \"pull refresh\")), mdx(\"li\", {\n    parentName: \"ul\"\n  }, mdx(\"a\", {\n    parentName: \"li\",\n    \"href\": \"https://github.com/jaweii/Flutter_beautiful_popup/blob/master/README_CN.md\"\n  }, \"advanced popup\")), mdx(\"li\", {\n    parentName: \"ul\"\n  }, mdx(\"a\", {\n    parentName: \"li\",\n    \"href\": \"https://github.com/chrisedg87/flutter_rounded_loading_button\"\n  }, \"loading button\")), mdx(\"li\", {\n    parentName: \"ul\"\n  }, mdx(\"a\", {\n    parentName: \"li\",\n    \"href\": \"https://github.com/pedromassango/titled_navigation_bar\"\n  }, \"titled navigation bar\")), mdx(\"li\", {\n    parentName: \"ul\"\n  }, mdx(\"a\", {\n    parentName: \"li\",\n    \"href\": \"https://github.com/jamesblasco/modal_bottom_sheet\"\n  }, \"modal_bottom_sheet\")), mdx(\"li\", {\n    parentName: \"ul\"\n  }, mdx(\"a\", {\n    parentName: \"li\",\n    \"href\": \"https://github.com/jogboms/flutter_offline\"\n  }, \"flutter offline\")), mdx(\"li\", {\n    parentName: \"ul\"\n  }, mdx(\"a\", {\n    parentName: \"li\",\n    \"href\": \"https://github.com/rvamsikrishna/inview_notifier_list\"\n  }, \"inview_notifier_list\")), mdx(\"li\", {\n    parentName: \"ul\"\n  }, mdx(\"a\", {\n    parentName: \"li\",\n    \"href\": \"https://github.com/SimformSolutionsPvtLtd/flutter_showcaseview\"\n  }, \"show case view\")), mdx(\"li\", {\n    parentName: \"ul\"\n  }, mdx(\"a\", {\n    parentName: \"li\",\n    \"href\": \"https://github.com/letsar/flutter_slidable\"\n  }, \"sliable actions\")), mdx(\"li\", {\n    parentName: \"ul\"\n  }, mdx(\"a\", {\n    parentName: \"li\",\n    \"href\": \"https://github.com/aliyigitbireroglu/flutter-peek-and-pop#media\"\n  }, \"peek and pop\")), mdx(\"li\", {\n    parentName: \"ul\"\n  }, mdx(\"a\", {\n    parentName: \"li\",\n    \"href\": \"https://github.com/hnvn/flutter_shimmer\"\n  }, \"shimmer\"), \" - blingbling effet\"), mdx(\"li\", {\n    parentName: \"ul\"\n  }, mdx(\"a\", {\n    parentName: \"li\",\n    \"href\": \"https://github.com/i-protoss/wave\"\n  }, \"wave effect\")), mdx(\"li\", {\n    parentName: \"ul\"\n  }, mdx(\"a\", {\n    parentName: \"li\",\n    \"href\": \"https://github.com/GeekyAnts/flutter-login-home-animation\"\n  }, \"signin effect\")), mdx(\"li\", {\n    parentName: \"ul\"\n  }, mdx(\"a\", {\n    parentName: \"li\",\n    \"href\": \"https://github.com/serenader2014/flutter_carousel_slider\"\n  }, \"image slider\")), mdx(\"li\", {\n    parentName: \"ul\"\n  }, mdx(\"a\", {\n    parentName: \"li\",\n    \"href\": \"https://github.com/bluefireteam/photo_view\"\n  }, \"photo view\")), mdx(\"li\", {\n    parentName: \"ul\"\n  }, mdx(\"a\", {\n    parentName: \"li\",\n    \"href\": \"https://github.com/dnfield/flutter_svg\"\n  }, \"flutter svg\")), mdx(\"li\", {\n    parentName: \"ul\"\n  }, mdx(\"a\", {\n    parentName: \"li\",\n    \"href\": \"https://github.com/hnvn/flutter_image_cropper\"\n  }, \"flutter image crop\")), mdx(\"li\", {\n    parentName: \"ul\"\n  }, mdx(\"a\", {\n    parentName: \"li\",\n    \"href\": \"https://github.com/Baseflow/flutter_cached_network_image\"\n  }, \"image cache\")), mdx(\"li\", {\n    parentName: \"ul\"\n  }, mdx(\"a\", {\n    parentName: \"li\",\n    \"href\": \"https://github.com/flutter/plugins/tree/master/packages/url_launcher/url_launcher\"\n  }, \"url launcher\")), mdx(\"li\", {\n    parentName: \"ul\"\n  }, mdx(\"a\", {\n    parentName: \"li\",\n    \"href\": \"https://github.com/flutter/plugins\"\n  }, \"flutter plugins\"), \" - official plugins\"), mdx(\"li\", {\n    parentName: \"ul\"\n  }, mdx(\"a\", {\n    parentName: \"li\",\n    \"href\": \"https://github.com/jonataslaw/getx\"\n  }, \"getx\"), \" - router, navigation\"), mdx(\"li\", {\n    parentName: \"ul\"\n  }, mdx(\"a\", {\n    parentName: \"li\",\n    \"href\": \"https://github.com/leisim/auto_size_text\"\n  }, \"auto sized text\")), mdx(\"li\", {\n    parentName: \"ul\"\n  }, mdx(\"a\", {\n    parentName: \"li\",\n    \"href\": \"https://github.com/dart-lang/usage\"\n  }, \"gooble anylyze\")), mdx(\"li\", {\n    parentName: \"ul\"\n  }, mdx(\"a\", {\n    parentName: \"li\",\n    \"href\": \"https://github.com/baseflow/flutter-permission-handler\"\n  }, \"permission handler\")), mdx(\"li\", {\n    parentName: \"ul\"\n  }, mdx(\"a\", {\n    parentName: \"li\",\n    \"href\": \"https://github.com/tekartik/sqflite\"\n  }, \"flutter sqlite\"), mdx(\"ul\", {\n    parentName: \"li\"\n  }, mdx(\"li\", {\n    parentName: \"ul\"\n  }, mdx(\"a\", {\n    parentName: \"li\",\n    \"href\": \"https://github.com/simolus3/moor\"\n  }, \"drift\")))), mdx(\"li\", {\n    parentName: \"ul\"\n  }, mdx(\"a\", {\n    parentName: \"li\",\n    \"href\": \"https://github.com/aagarwal1012/Animated-Text-Kit\"\n  }, \"animated text kit\")), mdx(\"li\", {\n    parentName: \"ul\"\n  }, mdx(\"a\", {\n    parentName: \"li\",\n    \"href\": \"https://github.com/OpenFlutter/fluwx\"\n  }, \"flutter wechat\"), \" - flutter \\u5FAE\\u4FE1 sdk\"), mdx(\"li\", {\n    parentName: \"ul\"\n  }, mdx(\"a\", {\n    parentName: \"li\",\n    \"href\": \"https://pub.dev/packages/tiktoklikescroller\"\n  }, \"tiktoklike scrooler\")), mdx(\"li\", {\n    parentName: \"ul\"\n  }, mdx(\"a\", {\n    parentName: \"li\",\n    \"href\": \"https://github.com/rrousselgit/river_pod\"\n  }, \"river_pod\"), \" - A simple way to access state while robust and testable.\"), mdx(\"li\", {\n    parentName: \"ul\"\n  }, mdx(\"a\", {\n    parentName: \"li\",\n    \"href\": \"https://pub.dev/packages/very_good_cli\"\n  }, \"very good cli\"), \" - create kool template flutter cli\"), mdx(\"li\", {\n    parentName: \"ul\"\n  }, mdx(\"a\", {\n    parentName: \"li\",\n    \"href\": \"https://github.com/birjuvachhani/adaptive_theme\"\n  }, \"adptive theme\"), \" - Easiest way to add support for light and dark theme in your flutter app.\"), mdx(\"li\", {\n    parentName: \"ul\"\n  }, mdx(\"a\", {\n    parentName: \"li\",\n    \"href\": \"https://pub.dev/packages/responsive_framework\"\n  }, \"responsive_framework\")), mdx(\"li\", {\n    parentName: \"ul\"\n  }, mdx(\"a\", {\n    parentName: \"li\",\n    \"href\": \"https://pub.dev/packages/flutter_secure_storage\"\n  }, \"flutter secure storage\"), \" - Flutter Secure Storage provides API to store data in secure storage. Keychain is used in iOS, KeyStore based solution is used in Android.\"), mdx(\"li\", {\n    parentName: \"ul\"\n  }, mdx(\"a\", {\n    parentName: \"li\",\n    \"href\": \"https://github.com/java-james/flutter_dotenv\"\n  }, \"flutter dotenv\")), mdx(\"li\", {\n    parentName: \"ul\"\n  }, mdx(\"a\", {\n    parentName: \"li\",\n    \"href\": \"https://github.com/flutter-webrtc/flutter-webrtc\"\n  }, \"flutter webrtc\")), mdx(\"li\", {\n    parentName: \"ul\"\n  }, mdx(\"a\", {\n    parentName: \"li\",\n    \"href\": \"https://github.com/flyerhq/flutter_chat_ui\"\n  }, \"flutter chat ui\")), mdx(\"li\", {\n    parentName: \"ul\"\n  }, mdx(\"a\", {\n    parentName: \"li\",\n    \"href\": \"https://pub.dev/packages/flutter_markdown\"\n  }, \"flutter_markdown\")), mdx(\"li\", {\n    parentName: \"ul\"\n  }, mdx(\"a\", {\n    parentName: \"li\",\n    \"href\": \"https://github.com/bcgit/pc-dart\"\n  }, \"pointycastle\"), \" - flutter encode, decode, sha1, sha3, hmac...\"), mdx(\"li\", {\n    parentName: \"ul\"\n  }, mdx(\"a\", {\n    parentName: \"li\",\n    \"href\": \"https://github.com/ch-muhammad-adil/flutter-plugin-circular_profile_avatar\"\n  }, \"avatar \")), mdx(\"li\", {\n    parentName: \"ul\"\n  }, mdx(\"a\", {\n    parentName: \"li\",\n    \"href\": \"https://pub.dev/packages/uni_links\"\n  }, \"uni_links\"), \" -- uni links\"), mdx(\"li\", {\n    parentName: \"ul\"\n  }, mdx(\"a\", {\n    parentName: \"li\",\n    \"href\": \"https://github.com/mobiten/flutter_phoenix\"\n  }, \"phoenix\"), \" -- app restart lifetime\"), mdx(\"li\", {\n    parentName: \"ul\"\n  }, mdx(\"a\", {\n    parentName: \"li\",\n    \"href\": \"https://pub.dev/packages/text_editor\"\n  }, \"text_editor\"), \" - Instagram like text editor\"), mdx(\"li\", {\n    parentName: \"ul\"\n  }, mdx(\"a\", {\n    parentName: \"li\",\n    \"href\": \"https://github.com/leisim/auto_size_text\"\n  }, \"auto size text\"), \" - auto size text\"), mdx(\"li\", {\n    parentName: \"ul\"\n  }, mdx(\"a\", {\n    parentName: \"li\",\n    \"href\": \"https://github.com/malikwang/custom_pop_up_menu\"\n  }, \"custom pop up menu\"), \" - \\u4EFF\\u5FAE\\u4FE1\\u6D88\\u606F\\u5F39\\u51FA\\u83DC\\u5355\")), mdx(\"h2\", {\n    \"id\": \"apps\"\n  }, \"Apps\"), mdx(\"ul\", null, mdx(\"li\", {\n    parentName: \"ul\"\n  }, mdx(\"a\", {\n    parentName: \"li\",\n    \"href\": \"https://github.com/Ivaskuu/tinder_cards\"\n  }, \"flutter-tinder\"), mdx(\"ul\", {\n    parentName: \"li\"\n  }, mdx(\"li\", {\n    parentName: \"ul\"\n  }, mdx(\"a\", {\n    parentName: \"li\",\n    \"href\": \"https://github.com/geekruchika/FlutterCardSwipe\"\n  }, \"card swipe\")))), mdx(\"li\", {\n    parentName: \"ul\"\n  }, mdx(\"a\", {\n    parentName: \"li\",\n    \"href\": \"https://gitlab.com/famedly/fluffychat\"\n  }, \"flutty chat\"), \" - FluffyChat is a multi-platform Matrix client written in Dart/Flutter. It compiles to native code on Android, iOS, macOS, Windows and Linux and renders with Skia on the web. FluffyChat is just a hobby project from the developers of Famedly and licensed under AGPLv3. It follows a design philosophy to be minimalistic, inclusive and easy to use.\"), mdx(\"li\", {\n    parentName: \"ul\"\n  }, mdx(\"a\", {\n    parentName: \"li\",\n    \"href\": \"https://github.com/flutter/gallery\"\n  }, \"flutter gallery\"), \" - A full components by official\"), mdx(\"li\", {\n    parentName: \"ul\"\n  }, mdx(\"a\", {\n    parentName: \"li\",\n    \"href\": \"https://github.com/Ivaskuu/tinder_cards\"\n  }, \"tinder cards\")), mdx(\"li\", {\n    parentName: \"ul\"\n  }, mdx(\"a\", {\n    parentName: \"li\",\n    \"href\": \"https://github.com/duytq94/flutter-fb-reactions-animation\"\n  }, \"facebook reactions\")), mdx(\"li\", {\n    parentName: \"ul\"\n  }, mdx(\"a\", {\n    parentName: \"li\",\n    \"href\": \"https://github.com/iampawan/FlutterWhatsAppClone\"\n  }, \"whatsapp clone\")), mdx(\"li\", {\n    parentName: \"ul\"\n  }, mdx(\"a\", {\n    parentName: \"li\",\n    \"href\": \"https://github.com/JideGuru/FlutterFoodybite\"\n  }, \"flutter food bite\"), \" - \\u633A\\u597D\\u770B\\u7684\"), mdx(\"li\", {\n    parentName: \"ul\"\n  }, mdx(\"a\", {\n    parentName: \"li\",\n    \"href\": \"https://github.com/zubairehman/flutter-boilerplate-project\"\n  }, \"flutgter boilerplate\"), mdx(\"ul\", {\n    parentName: \"li\"\n  }, mdx(\"li\", {\n    parentName: \"ul\"\n  }, mdx(\"a\", {\n    parentName: \"li\",\n    \"href\": \"https://github.com/bizz84/starter_architecture_flutter_firebase\"\n  }, \"https://github.com/bizz84/starter_architecture_flutter_firebase\"))))), mdx(\"h2\", {\n    \"id\": \"templates\"\n  }, \"Templates\"), mdx(\"ul\", null, mdx(\"li\", {\n    parentName: \"ul\"\n  }, mdx(\"a\", {\n    parentName: \"li\",\n    \"href\": \"https://github.com/nhancv/nft\"\n  }, \"nft template\")), mdx(\"li\", {\n    parentName: \"ul\"\n  }, mdx(\"a\", {\n    parentName: \"li\",\n    \"href\": \"https://github.com/wem2017/flutter_bloc_boilerplate\"\n  }, \"bloc boilerplate\"))));\n}\n;\nMDXContent.isMDXComponent = true;","rawBody":"---\ntitle: Awesome Flutter\ntags:\n  - Awesome\n  - Flutter\n---\n\nCurating Flutter resources.\n\n## Cros\n\n- [Flutter Failed To Solve the Biggest Challenge for Our Cross-Platform App](https://betterprogramming.pub/flutter-failed-to-solve-the-biggest-challenge-for-our-cross-platform-app-c551afa0ef18)\n\n## Articles\n\n- [Dart Board](https://github.com/ahammer/dart_board) - Dart Board is a Framework/Architecture pattern for Flutter applications.\n- [Dart JSON and serialization](https://flutter.dev/docs/development/data-and-backend/json#code-generation)\n\n## Books\n\n- [Flutter in action]](https://livebook.manning.com/book/flutter-in-action/)\n\n## List\n\n- [awesome flutter](https://github.com/Solido/awesome-flutter)\n  - [track](https://www.trackawesomelist.com/Solido/awesome-flutter/readme/)\n- [open-source-flutter-apps](https://github.com/tortuvshin/open-source-flutter-apps) - ğŸ“± List of open source Flutter applications :octocat:\n- [flutter example apps](https://github.com/iampawan/FlutterExampleApps)\n- [flutter official sample apps](https://github.com/flutter/samples)\n  - [flutter sample apps](https://github.com/diegoveloper/flutter-samples)\n\n## Roadmap\n\n- [flutter roadmap](https://github.com/olexale/flutter_roadmap)\n\n## ä¸­æ–‡èµ„æº\n\n- [Flutter å®æˆ˜](https://book.flutterchina.club/)\n- [Flutter è§†é¢‘æ•™ç¨‹-ä»é›¶åˆ°ä¸Šæ¶](https://www.bilibili.com/video/BV1pp4y187w6?p=2)\n- [ç”¨ flutter æ„å»ºä¸€ä¸ªèŠå¤©åº”ç”¨ç•Œé¢-è°·æ­Œå®˜æ–¹å‡ºå“](https://codelabs.developers.google.com/codelabs/flutter/#0)\n- [Dart è¯­è¨€æ¦‚è§ˆ](https://www.dartcn.com/guides/language/language-tour)\n- [flutter å¸ƒå±€æ•™ç¨‹](https://flutterchina.club/tutorials/layout/)\n\n## Libraries\n\n- [visa](https://github.com/e-oj/visa) - Easy third party authentication (OAuth 2.0) for Flutter apps.\n- [wechat-assets-picker](https://github.com/fluttercandies/flutter_wechat_assets_picker)\n- [flutter platform widgets](https://pub.dev/packages/flutter_platform_widgets)\n- [pin code](https://github.com/LiewJunTung/pin_code_text_field)\n- [pull refresh](https://github.com/aagarwal1012/Liquid-Pull-To-Refresh)\n- [advanced popup](https://github.com/jaweii/Flutter_beautiful_popup/blob/master/README_CN.md)\n- [loading button](https://github.com/chrisedg87/flutter_rounded_loading_button)\n- [titled navigation bar](https://github.com/pedromassango/titled_navigation_bar)\n- [modal_bottom_sheet](https://github.com/jamesblasco/modal_bottom_sheet)\n- [flutter offline](https://github.com/jogboms/flutter_offline)\n- [inview_notifier_list](https://github.com/rvamsikrishna/inview_notifier_list)\n- [show case view](https://github.com/SimformSolutionsPvtLtd/flutter_showcaseview)\n- [sliable actions](https://github.com/letsar/flutter_slidable)\n- [peek and pop](https://github.com/aliyigitbireroglu/flutter-peek-and-pop#media)\n- [shimmer](https://github.com/hnvn/flutter_shimmer) - blingbling effet\n- [wave effect](https://github.com/i-protoss/wave)\n- [signin effect](https://github.com/GeekyAnts/flutter-login-home-animation)\n- [image slider](https://github.com/serenader2014/flutter_carousel_slider)\n- [photo view](https://github.com/bluefireteam/photo_view)\n- [flutter svg](https://github.com/dnfield/flutter_svg)\n- [flutter image crop](https://github.com/hnvn/flutter_image_cropper)\n- [image cache](https://github.com/Baseflow/flutter_cached_network_image)\n- [url launcher](https://github.com/flutter/plugins/tree/master/packages/url_launcher/url_launcher)\n- [flutter plugins](https://github.com/flutter/plugins) - official plugins\n- [getx](https://github.com/jonataslaw/getx) - router, navigation\n- [auto sized text](https://github.com/leisim/auto_size_text)\n- [gooble anylyze](https://github.com/dart-lang/usage)\n- [permission handler](https://github.com/baseflow/flutter-permission-handler)\n- [flutter sqlite](https://github.com/tekartik/sqflite)\n  - [drift](https://github.com/simolus3/moor)\n- [animated text kit](https://github.com/aagarwal1012/Animated-Text-Kit)\n- [flutter wechat](https://github.com/OpenFlutter/fluwx) - flutter å¾®ä¿¡ sdk\n- [tiktoklike scrooler](https://pub.dev/packages/tiktoklikescroller)\n- [river_pod](https://github.com/rrousselgit/river_pod) - A simple way to access state while robust and testable.\n- [very good cli](https://pub.dev/packages/very_good_cli) - create kool template flutter cli\n- [adptive theme](https://github.com/birjuvachhani/adaptive_theme) - Easiest way to add support for light and dark theme in your flutter app.\n- [responsive_framework](https://pub.dev/packages/responsive_framework)\n- [flutter secure storage](https://pub.dev/packages/flutter_secure_storage) - Flutter Secure Storage provides API to store data in secure storage. Keychain is used in iOS, KeyStore based solution is used in Android.\n- [flutter dotenv](https://github.com/java-james/flutter_dotenv)\n- [flutter webrtc](https://github.com/flutter-webrtc/flutter-webrtc)\n- [flutter chat ui](https://github.com/flyerhq/flutter_chat_ui)\n- [flutter_markdown](https://pub.dev/packages/flutter_markdown)\n- [pointycastle](https://github.com/bcgit/pc-dart) - flutter encode, decode, sha1, sha3, hmac...\n- [avatar ](https://github.com/ch-muhammad-adil/flutter-plugin-circular_profile_avatar)\n- [uni_links](https://pub.dev/packages/uni_links) -- uni links\n- [phoenix](https://github.com/mobiten/flutter_phoenix) -- app restart lifetime\n- [text_editor](https://pub.dev/packages/text_editor) - Instagram like text editor\n- [auto size text](https://github.com/leisim/auto_size_text) - auto size text\n- [custom pop up menu](https://github.com/malikwang/custom_pop_up_menu) - ä»¿å¾®ä¿¡æ¶ˆæ¯å¼¹å‡ºèœå•\n\n## Apps\n\n- [flutter-tinder](https://github.com/Ivaskuu/tinder_cards)\n  - [card swipe](https://github.com/geekruchika/FlutterCardSwipe)\n- [flutty chat](https://gitlab.com/famedly/fluffychat) - FluffyChat is a multi-platform Matrix client written in Dart/Flutter. It compiles to native code on Android, iOS, macOS, Windows and Linux and renders with Skia on the web. FluffyChat is just a hobby project from the developers of Famedly and licensed under AGPLv3. It follows a design philosophy to be minimalistic, inclusive and easy to use.\n- [flutter gallery](https://github.com/flutter/gallery) - A full components by official\n- [tinder cards](https://github.com/Ivaskuu/tinder_cards)\n- [facebook reactions](https://github.com/duytq94/flutter-fb-reactions-animation)\n- [whatsapp clone](https://github.com/iampawan/FlutterWhatsAppClone)\n- [flutter food bite](https://github.com/JideGuru/FlutterFoodybite) - æŒºå¥½çœ‹çš„\n- [flutgter boilerplate](https://github.com/zubairehman/flutter-boilerplate-project)\n  - <https://github.com/bizz84/starter_architecture_flutter_firebase>\n\n## Templates\n\n- [nft template](https://github.com/nhancv/nft)\n- [bloc boilerplate](https://github.com/wem2017/flutter_bloc_boilerplate)\n","excerpt":"Curating Flutter resources. Cros Flutter Failed To Solve the Biggest Challenge for Our Cross-Platform App Articles Dart Board  - Dart Boardâ€¦","outboundReferences":[],"inboundReferences":[]},"tagsOutbound":{"nodes":[{"frontmatter":{"title":"Awesome Algorithm","tags":["Awesome","Algorithm","Recommend"]},"fields":{"slug":"/awesome-algorithm/","title":"Awesome Algorithm","lastUpdated":"9/5/2021","lastUpdatedAt":"2021-09-05T06:09:14.000Z","gitCreatedAt":"2021-09-05T06:09:14.000Z"}},{"frontmatter":{"title":"Awesome Alternatives","tags":["Awesome","Alternatives"]},"fields":{"slug":"/awesome-alternatives/","title":"Awesome Alternatives","lastUpdated":"1/28/2022","lastUpdatedAt":"2022-01-28T15:56:55.000Z","gitCreatedAt":"2021-09-12T18:29:05.000Z"}},{"frontmatter":{"title":"æœ‰æ„æ€çš„é—®é¢˜æ”¶é›†","tags":["Awesome","FAQ","Answer","ä¸­æ–‡","Ask"]},"fields":{"slug":"/awesome-answers/","title":"æœ‰æ„æ€çš„é—®é¢˜æ”¶é›†","lastUpdated":"3/11/2022","lastUpdatedAt":"2022-03-11T17:03:26.000Z","gitCreatedAt":"2021-09-05T04:49:34.000Z"}},{"frontmatter":{"title":"Awesome APIs","tags":["Awesome","API"]},"fields":{"slug":"/awesome-apis/","title":"Awesome APIs","lastUpdated":"2/19/2022","lastUpdatedAt":"2022-02-19T04:56:53.000Z","gitCreatedAt":"2021-10-12T07:22:35.000Z"}},{"frontmatter":{"title":"Awesome Applications","tags":["Awesome","Applications"]},"fields":{"slug":"/awesome-applications/","title":"Awesome Applications","lastUpdated":"3/8/2022","lastUpdatedAt":"2022-03-08T11:22:55.000Z","gitCreatedAt":"2021-09-12T18:29:05.000Z"}},{"frontmatter":{"title":"å€¼å¾—ä¸€çœ‹çš„æ–‡ç« åˆ—è¡¨","tags":["Awesome","Articles"]},"fields":{"slug":"/awesome-articles/","title":"å€¼å¾—ä¸€çœ‹çš„æ–‡ç« åˆ—è¡¨","lastUpdated":"3/11/2022","lastUpdatedAt":"2022-03-11T13:57:22.000Z","gitCreatedAt":"2021-12-19T22:36:06.000Z"}},{"frontmatter":{"title":"Awesome Automations","tags":["Awesome","Automations","Self-Hosted"]},"fields":{"slug":"/awesome-automations/","title":"Awesome Automations","lastUpdated":"9/12/2021","lastUpdatedAt":"2021-09-12T07:41:32.000Z","gitCreatedAt":"2021-09-03T05:53:38.000Z"}},{"frontmatter":{"title":"","tags":["Awesome"]},"fields":{"slug":"/awesome-backup/","title":"Awesome Backup","lastUpdated":"8/27/2021","lastUpdatedAt":"2021-08-27T02:25:34.000Z","gitCreatedAt":"2021-08-27T02:25:34.000Z"}},{"frontmatter":{"title":"","tags":["Benchmark","Proxies","Bash","Awesome"]},"fields":{"slug":"/awesome-benchmark/","title":"Awesome Benchmark","lastUpdated":"9/28/2021","lastUpdatedAt":"2021-09-28T07:14:03.000Z","gitCreatedAt":"2021-08-27T02:25:34.000Z"}},{"frontmatter":{"title":"","tags":["Awesome"]},"fields":{"slug":"/awesome-bookmarks/","title":"Awesome Bookmarks","lastUpdated":"8/27/2021","lastUpdatedAt":"2021-08-27T02:25:34.000Z","gitCreatedAt":"2021-08-27T02:25:34.000Z"}},{"frontmatter":{"title":"","tags":["Awesome","Browser"]},"fields":{"slug":"/awesome-browsers/","title":"Awesome Browsers","lastUpdated":"3/10/2022","lastUpdatedAt":"2022-03-10T16:43:18.000Z","gitCreatedAt":"2021-09-04T02:41:10.000Z"}},{"frontmatter":{"title":"Awesome Chat","tags":["Awesome","Chat"]},"fields":{"slug":"/awesome-chat/","title":"Awesome Chat","lastUpdated":"11/20/2021","lastUpdatedAt":"2021-11-20T14:04:22.000Z","gitCreatedAt":"2021-10-12T07:22:35.000Z"}},{"frontmatter":{"title":"Awesome Command Tools","tags":["Awesome","Tools","Command"]},"fields":{"slug":"/awesome-cli/","title":"Awesome Command Tools","lastUpdated":"3/8/2022","lastUpdatedAt":"2022-03-08T04:17:56.000Z","gitCreatedAt":"2022-03-08T04:17:56.000Z"}},{"frontmatter":{"title":"åœ¨ä¸­å›½ä¹°æˆ¿ä¹‹å‰ï¼Œä½ éœ€è¦äº†è§£çš„ä¿¡æ¯æ±‡æ€»","tags":["Awesome","House","China"]},"fields":{"slug":"/awesome-cn-house/","title":"åœ¨ä¸­å›½ä¹°æˆ¿ä¹‹å‰ï¼Œä½ éœ€è¦äº†è§£çš„ä¿¡æ¯æ±‡æ€»","lastUpdated":"2/11/2022","lastUpdatedAt":"2022-02-11T11:54:43.000Z","gitCreatedAt":"2022-02-11T11:54:43.000Z"}},{"frontmatter":{"title":"","tags":["Awesome","Code","Learning"]},"fields":{"slug":"/awesome-code-learning/","title":"Awesome Code Learning","lastUpdated":"12/13/2021","lastUpdatedAt":"2021-12-13T14:27:33.000Z","gitCreatedAt":"2021-09-04T07:51:54.000Z"}},{"frontmatter":{"title":"","tags":["Awesome","Communities","Social","ä¸­æ–‡"]},"fields":{"slug":"/awesome-communities/","title":"æ”¶é›†ä¸€äº›æœ‰æ„æ€çš„ç¤¾åŒº","lastUpdated":"2/15/2022","lastUpdatedAt":"2022-02-15T03:43:44.000Z","gitCreatedAt":"2021-09-04T07:51:54.000Z"}},{"frontmatter":{"title":"Awesome Dashboard","tags":["Awesome","Admin","Dashboard"]},"fields":{"slug":"/awesome-dashboard/","title":"Awesome Dashboard","lastUpdated":"1/28/2022","lastUpdatedAt":"2022-01-28T15:56:55.000Z","gitCreatedAt":"2022-01-28T15:56:55.000Z"}},{"frontmatter":{"title":"æœ‰è¶£çš„æ•°æ®","tags":["Data","Awesome","ä¸­æ–‡"]},"fields":{"slug":"/awesome-data/","title":"æœ‰è¶£çš„æ•°æ®","lastUpdated":"3/6/2022","lastUpdatedAt":"2022-03-06T09:09:39.000Z","gitCreatedAt":"2022-02-21T01:59:18.000Z"}},{"frontmatter":{"title":"Awesome Databases","tags":["Awesome","Database"]},"fields":{"slug":"/awesome-databases/","title":"Awesome Databases","lastUpdated":"1/30/2022","lastUpdatedAt":"2022-01-30T07:47:59.000Z","gitCreatedAt":"2021-09-28T07:14:03.000Z"}},{"frontmatter":{"title":"Awesome Decentralization","tags":["Awesome","Decentralization"]},"fields":{"slug":"/awesome-decentralization/","title":"Awesome Decentralization","lastUpdated":"3/7/2022","lastUpdatedAt":"2022-03-07T15:47:04.000Z","gitCreatedAt":"2021-09-24T11:05:17.000Z"}},{"frontmatter":{"title":"Awesome Deno","tags":["Awesome","Deno"]},"fields":{"slug":"/awesome-deno/","title":"Awesome Deno","lastUpdated":"1/22/2022","lastUpdatedAt":"2022-01-22T11:04:34.000Z","gitCreatedAt":"2021-09-25T19:02:30.000Z"}},{"frontmatter":{"title":"Awesome Editors","tags":["Awesome","Editors","Tools"]},"fields":{"slug":"/awesome-editors/","title":"Awesome Editors","lastUpdated":"1/24/2022","lastUpdatedAt":"2022-01-24T14:37:03.000Z","gitCreatedAt":"2021-09-04T02:41:10.000Z"}},{"frontmatter":{"title":"Awesome Emails","tags":["Awesome","Email"]},"fields":{"slug":"/awesome-emails.md/","title":"Awesome Emails","lastUpdated":"10/10/2021","lastUpdatedAt":"2021-10-10T23:24:14.000Z","gitCreatedAt":"2021-10-10T23:24:14.000Z"}},{"frontmatter":{"title":"","tags":["Awesome","English","Learning"]},"fields":{"slug":"/awesome-english-learning/","title":"æ”¶é›†è‹±è¯­å­¦ä¹ å·¥å…·","lastUpdated":"2/27/2022","lastUpdatedAt":"2022-02-27T02:48:28.000Z","gitCreatedAt":"2021-09-04T02:41:10.000Z"}},{"frontmatter":{"title":"Awesome Extensions","tags":["Awesome","Extensions"]},"fields":{"slug":"/awesome-extensions/","title":"Awesome Extensions","lastUpdated":"1/29/2022","lastUpdatedAt":"2022-01-29T17:28:39.000Z","gitCreatedAt":"2022-01-29T17:28:39.000Z"}},{"frontmatter":{"title":"","tags":["Awesome","Files"]},"fields":{"slug":"/awesome-file-managers/","title":"Awesome File Managers","lastUpdated":"8/27/2021","lastUpdatedAt":"2021-08-27T03:43:35.000Z","gitCreatedAt":"2021-08-27T02:25:34.000Z"}},{"frontmatter":{"title":"Awesome Flutter","tags":["Awesome","Flutter"]},"fields":{"slug":"/awesome-flutter/","title":"Awesome Flutter","lastUpdated":"2/13/2022","lastUpdatedAt":"2022-02-13T17:40:05.000Z","gitCreatedAt":"2021-10-11T13:41:00.000Z"}},{"frontmatter":{"title":"Awesome Free","tags":["Free","Awesome","Tools"]},"fields":{"slug":"/awesome-free/","title":"Awesome Free","lastUpdated":"3/7/2022","lastUpdatedAt":"2022-03-07T15:47:04.000Z","gitCreatedAt":"2021-08-29T20:06:24.000Z"}},{"frontmatter":{"title":"Awesome Frontend","tags":["Awesome","Frontend","Application"]},"fields":{"slug":"/awesome-frontend/","title":"Awesome Frontend","lastUpdated":"3/6/2022","lastUpdatedAt":"2022-03-06T08:07:02.000Z","gitCreatedAt":"2022-03-06T08:07:02.000Z"}},{"frontmatter":{"title":"","tags":["Awesome"]},"fields":{"slug":"/awesome-gatsby/","title":"Awesome Gatsby","lastUpdated":"8/29/2021","lastUpdatedAt":"2021-08-29T20:06:24.000Z","gitCreatedAt":"2021-08-27T02:25:34.000Z"}},{"frontmatter":{"title":"æ™ºèƒ½å®¶å±…æ–¹æ¡ˆæ±‡æ€»","tags":["Awesome","Home"]},"fields":{"slug":"/awesome-home/","title":"æ™ºèƒ½å®¶å±…æ–¹æ¡ˆæ±‡æ€»","lastUpdated":"2/2/2022","lastUpdatedAt":"2022-02-02T17:59:25.000Z","gitCreatedAt":"2022-02-02T17:59:25.000Z"}},{"frontmatter":{"title":"Awesome ID generator","tags":["Awesome","ID"]},"fields":{"slug":"/awesome-id/","title":"Awesome ID generator","lastUpdated":"1/10/2022","lastUpdatedAt":"2022-01-10T20:56:53.000Z","gitCreatedAt":"2021-11-13T06:51:26.000Z"}},{"frontmatter":{"title":"äº’è”ç½‘ç›®å½•æ±‡æ€»","tags":["Awesome","Indexes","Trends"]},"fields":{"slug":"/awesome-indexes/","title":"äº’è”ç½‘ç›®å½•æ±‡æ€»","lastUpdated":"3/9/2022","lastUpdatedAt":"2022-03-09T08:25:23.000Z","gitCreatedAt":"2021-09-12T10:34:26.000Z"}},{"frontmatter":{"title":"Awesome Interview","tags":["Awesome","Interview"]},"fields":{"slug":"/awesome-interview/","title":"Awesome Interview","lastUpdated":"9/5/2021","lastUpdatedAt":"2021-09-05T04:49:34.000Z","gitCreatedAt":"2021-09-05T04:49:34.000Z"}},{"frontmatter":{"title":"","tags":["Awesome","Investing","Stocks"]},"fields":{"slug":"/awesome-investing/","title":"Awesome Investing","lastUpdated":"9/4/2021","lastUpdatedAt":"2021-09-04T07:51:54.000Z","gitCreatedAt":"2021-09-04T07:51:54.000Z"}},{"frontmatter":{"title":"","tags":["Awesome"]},"fields":{"slug":"/awesome-jackett-indexes/","title":"Awesome Jackett Indexes","lastUpdated":"8/27/2021","lastUpdatedAt":"2021-08-27T02:25:34.000Z","gitCreatedAt":"2021-08-27T02:25:34.000Z"}},{"frontmatter":{"title":"Awesome Jobs","tags":["Awesome","Jobs"]},"fields":{"slug":"/awesome-jobs/","title":"Awesome Jobs","lastUpdated":"2/2/2022","lastUpdatedAt":"2022-02-02T17:59:25.000Z","gitCreatedAt":"2021-10-12T07:22:35.000Z"}},{"frontmatter":{"title":"","tags":["Awesome","Javascript","Date"]},"fields":{"slug":"/awesome-js-date/","title":"Awesome JS Date","lastUpdated":"8/27/2021","lastUpdatedAt":"2021-08-27T02:25:34.000Z","gitCreatedAt":"2021-08-27T02:25:34.000Z"}},{"frontmatter":{"title":"æ”¶é›† Javascript é‡Œå¥½ç”¨çš„åº“","tags":["Awesome","Javascript","ä¸­æ–‡"]},"fields":{"slug":"/awesome-js/","title":"æ”¶é›† Javascript é‡Œå¥½ç”¨çš„åº“","lastUpdated":"1/28/2022","lastUpdatedAt":"2022-01-28T15:56:55.000Z","gitCreatedAt":"2021-08-29T20:06:24.000Z"}},{"frontmatter":{"title":"Awesome KOL","tags":["Awesome","KOL"]},"fields":{"slug":"/awesome-kol/","title":"Awesome KOL","lastUpdated":"10/4/2021","lastUpdatedAt":"2021-10-04T19:24:25.000Z","gitCreatedAt":"2021-10-04T19:24:25.000Z"}},{"frontmatter":{"title":"Awesome List","tags":["Awesome","List"]},"fields":{"slug":"/awesome-list/","title":"Awesome List","lastUpdated":"2/25/2022","lastUpdatedAt":"2022-02-25T04:21:26.000Z","gitCreatedAt":"2021-08-29T20:06:24.000Z"}},{"frontmatter":{"title":"å¸¸è§çš„ä½ä»£ç /æ— ä»£ç åˆ—è¡¨","tags":["Awesome","Low-Code"]},"fields":{"slug":"/awesome-low-code/","title":"å¸¸è§çš„ä½ä»£ç /æ— ä»£ç åˆ—è¡¨","lastUpdated":"10/12/2021","lastUpdatedAt":"2021-10-12T07:22:35.000Z","gitCreatedAt":"2021-10-12T07:22:35.000Z"}},{"frontmatter":{"title":"å€¼å¾—å®šæœŸå…³æ³¨çš„ç‹¬ç«‹å¼€å‘è€…/åˆ›é€ è€…","tags":["Awesome","Maker"]},"fields":{"slug":"/awesome-maker/","title":"å€¼å¾—å®šæœŸå…³æ³¨çš„ç‹¬ç«‹å¼€å‘è€…/åˆ›é€ è€…","lastUpdated":"2/15/2022","lastUpdatedAt":"2022-02-15T22:03:41.000Z","gitCreatedAt":"2022-02-15T03:43:44.000Z"}},{"frontmatter":{"title":"å›½å†…é•œåƒèµ„æºæ±‡æ€»","tags":["Awesome","Mirrors"]},"fields":{"slug":"/awesome-mirrors/","title":"å›½å†…é•œåƒèµ„æºæ±‡æ€»","lastUpdated":"11/21/2021","lastUpdatedAt":"2021-11-21T16:27:36.000Z","gitCreatedAt":"2021-11-01T22:47:18.000Z"}},{"frontmatter":{"title":"å€¼å¾—è§‚çœ‹çš„ç”µå½±","tags":["Movies","Awesome","ä¸­æ–‡"]},"fields":{"slug":"/awesome-movies/","title":"å€¼å¾—è§‚çœ‹çš„ç”µå½±","lastUpdated":"9/3/2021","lastUpdatedAt":"2021-09-03T05:53:38.000Z","gitCreatedAt":"2021-09-03T05:53:38.000Z"}},{"frontmatter":{"title":"Awesome News","tags":["Awesome","News"]},"fields":{"slug":"/awesome-news/","title":"Awesome News","lastUpdated":"9/25/2021","lastUpdatedAt":"2021-09-25T12:40:57.000Z","gitCreatedAt":"2021-09-25T12:40:57.000Z"}},{"frontmatter":{"title":"Awesome Notes","tags":["Awesome","Notes","Tools"]},"fields":{"slug":"/awesome-notes/","title":"Awesome Notes","lastUpdated":"8/31/2021","lastUpdatedAt":"2021-08-31T04:16:33.000Z","gitCreatedAt":"2021-08-31T00:37:15.000Z"}},{"frontmatter":{"title":"Awesome NSFW","tags":["NSFW","Awesome"]},"fields":{"slug":"/awesome-nsfw/","title":"Awesome NSFW","lastUpdated":"1/28/2022","lastUpdatedAt":"2022-01-28T13:23:56.000Z","gitCreatedAt":"2022-01-28T13:23:56.000Z"}},{"frontmatter":{"title":"æ”¶é›†å¯ä»¥åœ¨çº¿é˜…è¯»çš„ä¹¦ç±","tags":["Awesome","Books"]},"fields":{"slug":"/awesome-online-books/","title":"æ”¶é›†å¯ä»¥åœ¨çº¿é˜…è¯»çš„ä¹¦ç±","lastUpdated":"11/13/2021","lastUpdatedAt":"2021-11-13T06:51:26.000Z","gitCreatedAt":"2021-11-13T06:51:26.000Z"}},{"frontmatter":{"title":"Awesome Open Source","tags":["Awesome","Open Source"]},"fields":{"slug":"/awesome-open-source/","title":"Awesome Open Source","lastUpdated":"2/22/2022","lastUpdatedAt":"2022-02-22T11:53:07.000Z","gitCreatedAt":"2022-01-12T06:26:27.000Z"}},{"frontmatter":{"title":"","tags":["Awesome","P2P"]},"fields":{"slug":"/awesome-p2p/","title":"Awesome P2P","lastUpdated":"3/6/2022","lastUpdatedAt":"2022-03-06T14:32:32.000Z","gitCreatedAt":"2021-09-04T07:51:54.000Z"}},{"frontmatter":{"title":"Awesome Privacy","tags":["Awesome","Privacy"]},"fields":{"slug":"/awesome-privacy/","title":"Awesome Privacy","lastUpdated":"10/11/2021","lastUpdatedAt":"2021-10-11T15:49:10.000Z","gitCreatedAt":"2021-09-05T04:49:34.000Z"}},{"frontmatter":{"title":"","tags":["Awesome","Social","Products"]},"fields":{"slug":"/awesome-products/","title":"Awesome Products","lastUpdated":"9/5/2021","lastUpdatedAt":"2021-09-05T04:49:34.000Z","gitCreatedAt":"2021-09-05T04:49:34.000Z"}},{"frontmatter":{"title":"æ”¶é›†å‘äººæ·±çœçš„è¯","tags":["Awesome","Quotes","ä¸­æ–‡"]},"fields":{"slug":"/awesome-quotes/","title":"æ”¶é›†å‘äººæ·±çœçš„è¯","lastUpdated":"3/12/2022","lastUpdatedAt":"2022-03-12T18:11:51.000Z","gitCreatedAt":"2021-09-05T04:49:34.000Z"}},{"frontmatter":{"title":"é«˜è´¨é‡çš„èµ„æºç½‘ç«™æ”¶é›†ï¼ˆç”µå­ä¹¦ï¼Œç”µå½±ï¼Œç”µè§†å‰§ç­‰ï¼‰","tags":["Awesome","Resource"]},"fields":{"slug":"/awesome-resources/","title":"é«˜è´¨é‡çš„èµ„æºç½‘ç«™æ”¶é›†ï¼ˆç”µå­ä¹¦ï¼Œç”µå½±ï¼Œç”µè§†å‰§ç­‰ï¼‰","lastUpdated":"3/8/2022","lastUpdatedAt":"2022-03-08T08:33:09.000Z","gitCreatedAt":"2022-03-05T03:45:03.000Z"}},{"frontmatter":{"title":"Awesome RSS","tags":["RSS","Awesome"]},"fields":{"slug":"/awesome-rss/","title":"Awesome RSS","lastUpdated":"9/25/2021","lastUpdatedAt":"2021-09-25T06:38:19.000Z","gitCreatedAt":"2021-09-25T06:38:19.000Z"}},{"frontmatter":{"title":"Awesome Rust","tags":["Awesome","Rust","Learning"]},"fields":{"slug":"/awesome-rust/","title":"Awesome Rust","lastUpdated":"2/6/2022","lastUpdatedAt":"2022-02-06T12:12:58.000Z","gitCreatedAt":"2021-09-05T10:08:42.000Z"}},{"frontmatter":{"title":"Awesome Schema","tags":["Awesome","Schema","JSOn"]},"fields":{"slug":"/awesome-schema/","title":"Awesome Schema","lastUpdated":"1/15/2022","lastUpdatedAt":"2022-01-15T09:57:32.000Z","gitCreatedAt":"2022-01-15T08:46:05.000Z"}},{"frontmatter":{"title":"","tags":["Awesome","Self-Hosted","Tools"]},"fields":{"slug":"/awesome-selfhosted/","title":"Awesome Self-hosted","lastUpdated":"2/18/2022","lastUpdatedAt":"2022-02-18T02:50:04.000Z","gitCreatedAt":"2021-09-04T01:08:18.000Z"}},{"frontmatter":{"title":"Awesome Semantic","tags":["Awesome","Semantic"]},"fields":{"slug":"/awesome-semantic/","title":"Awesome Semantic","lastUpdated":"1/21/2022","lastUpdatedAt":"2022-01-21T08:49:36.000Z","gitCreatedAt":"2022-01-15T08:46:05.000Z"}},{"frontmatter":{"title":"Awesome SEO Tools","tags":["SEO","Awesome","Tools"]},"fields":{"slug":"/awesome-seo/","title":"Awesome SEO Tools","lastUpdated":"8/30/2021","lastUpdatedAt":"2021-08-30T16:14:42.000Z","gitCreatedAt":"2021-08-30T16:14:42.000Z"}},{"frontmatter":{"title":"Awesome Services","tags":["Awesome","Service"]},"fields":{"slug":"/awesome-service/","title":"Awesome Services","lastUpdated":"10/19/2021","lastUpdatedAt":"2021-10-19T06:38:57.000Z","gitCreatedAt":"2021-09-10T07:25:10.000Z"}},{"frontmatter":{"title":"","tags":["Social","Awesome"]},"fields":{"slug":"/awesome-socials/","title":"æ”¶é›†æœ‰æ„æ€çš„ç¤¾äº¤åº”ç”¨","lastUpdated":"12/19/2021","lastUpdatedAt":"2021-12-19T22:36:06.000Z","gitCreatedAt":"2021-08-27T02:25:34.000Z"}},{"frontmatter":{"title":"","tags":["Awesome","Explore","Sources"]},"fields":{"slug":"/awesome-sources/","title":"æ¢ç´¢äº’è”ç½‘ä¸Šé«˜è´¨é‡çš„å†…å®¹","lastUpdated":"3/11/2022","lastUpdatedAt":"2022-03-11T06:11:57.000Z","gitCreatedAt":"2022-03-08T11:45:37.000Z"}},{"frontmatter":{"title":"Awesome Speed","tags":["Awesome","Speed","Netwok"]},"fields":{"slug":"/awesome-speed/","title":"Awesome Speed","lastUpdated":"9/6/2021","lastUpdatedAt":"2021-09-06T16:52:24.000Z","gitCreatedAt":"2021-09-06T16:52:24.000Z"}},{"frontmatter":{"title":"æœ‰æ„æ€çš„åè®®æ”¶é›†","tags":["Awesome","Protocol","Standard"]},"fields":{"slug":"/awesome-standards/","title":"æœ‰æ„æ€çš„åè®®æ”¶é›†","lastUpdated":"2/15/2022","lastUpdatedAt":"2022-02-15T17:46:31.000Z","gitCreatedAt":"2022-02-15T17:46:31.000Z"}},{"frontmatter":{"title":"","tags":["Awesome","Startups","Tools"]},"fields":{"slug":"/awesome-startups/","title":"Awesome Startups","lastUpdated":"3/8/2022","lastUpdatedAt":"2022-03-08T08:33:09.000Z","gitCreatedAt":"2021-09-04T01:08:18.000Z"}},{"frontmatter":{"title":"","tags":["Awesome","Static-Site-Generator"]},"fields":{"slug":"/awesome-static-site-generator/","title":"Awesome Static Site Generator","lastUpdated":"12/31/2021","lastUpdatedAt":"2021-12-31T03:02:42.000Z","gitCreatedAt":"2021-08-27T02:25:34.000Z"}},{"frontmatter":{"title":"æ”¶é›†è‚¡å¸‚ç›¸å…³çš„èµ„æº","tags":["Awesome","Stocks"]},"fields":{"slug":"/awesome-stocks/","title":"æ”¶é›†è‚¡å¸‚ç›¸å…³çš„èµ„æº","lastUpdated":"3/8/2022","lastUpdatedAt":"2022-03-08T11:22:55.000Z","gitCreatedAt":"2022-03-08T11:22:55.000Z"}},{"frontmatter":{"title":"Awesome Swift","tags":["Awesome","Swift"]},"fields":{"slug":"/awesome-swift/","title":"Awesome Swift","lastUpdated":"10/1/2021","lastUpdatedAt":"2021-10-01T07:50:27.000Z","gitCreatedAt":"2021-09-29T09:48:05.000Z"}},{"frontmatter":{"title":"æ”¶é›†ä¸€äº›æœ‰ç”¨çš„æŠ€æœ¯/ç¯å¢ƒé—®é¢˜çš„è§£å†³æ–¹æ¡ˆ","tags":["Awesome","FAQ","Tech","Serverless"]},"fields":{"slug":"/awesome-tech-anwser/","title":"æ”¶é›†ä¸€äº›æœ‰ç”¨çš„æŠ€æœ¯/ç¯å¢ƒé—®é¢˜çš„è§£å†³æ–¹æ¡ˆ","lastUpdated":"9/10/2021","lastUpdatedAt":"2021-09-10T09:43:29.000Z","gitCreatedAt":"2021-09-10T09:43:29.000Z"}},{"frontmatter":{"title":"Awesome Templates","tags":["Awesome","Templates"]},"fields":{"slug":"/awesome-templates/","title":"Awesome Templates","lastUpdated":"1/29/2022","lastUpdatedAt":"2022-01-29T17:28:39.000Z","gitCreatedAt":"2021-09-22T15:17:38.000Z"}},{"frontmatter":{"title":"æœ€å¥½ç”¨çš„å·¥å…·é›†åˆ","tags":["Awesome","Tools","ä¸­æ–‡"]},"fields":{"slug":"/awesome-tools/","title":"æœ€å¥½ç”¨çš„å·¥å…·é›†åˆ","lastUpdated":"3/8/2022","lastUpdatedAt":"2022-03-08T08:33:09.000Z","gitCreatedAt":"2021-08-29T20:06:24.000Z"}},{"frontmatter":{"title":"å€¼å¾—è§‚çœ‹çš„ç”µè§†å‰§","tags":["Awesome","TV","List","ä¸­æ–‡"]},"fields":{"slug":"/awesome-tv-shows/","title":"å€¼å¾—è§‚çœ‹çš„ç”µè§†å‰§","lastUpdated":"9/13/2021","lastUpdatedAt":"2021-09-13T11:34:16.000Z","gitCreatedAt":"2021-09-03T05:53:38.000Z"}},{"frontmatter":{"title":"","tags":["Awesome","UI","Front-End"]},"fields":{"slug":"/awesome-ui/","title":"Awesome UI","lastUpdated":"3/9/2022","lastUpdatedAt":"2022-03-09T07:54:15.000Z","gitCreatedAt":"2021-08-27T02:25:34.000Z"}},{"frontmatter":{"title":"æ”¶é›†ä¸€äº›æœ‰æ„æ€çš„ç½‘ç«™","tags":["Awesome","Tools","ä¸­æ–‡"]},"fields":{"slug":"/awesome-websites/","title":"æ”¶é›†ä¸€äº›æœ‰æ„æ€çš„ç½‘ç«™","lastUpdated":"3/8/2022","lastUpdatedAt":"2022-03-08T11:22:55.000Z","gitCreatedAt":"2021-08-29T20:06:24.000Z"}},{"frontmatter":{"title":"Awesome What Was Your Moment","tags":["Awesome"]},"fields":{"slug":"/awesome-what-was-your-moment/","title":"Awesome What Was Your Moment","lastUpdated":"9/5/2021","lastUpdatedAt":"2021-09-05T10:08:42.000Z","gitCreatedAt":"2021-09-05T10:08:42.000Z"}},{"frontmatter":{"title":"æ”¶é›†Windowsä¸Šå¥½ç©ï¼Œå¥½ç”¨çš„ä¸œè¥¿","tags":["Windows","Awesome","Tools","Development-Environment","ä¸­æ–‡"]},"fields":{"slug":"/awesome-windows/","title":"æ”¶é›†Windowsä¸Šå¥½ç©ï¼Œå¥½ç”¨çš„ä¸œè¥¿","lastUpdated":"9/13/2021","lastUpdatedAt":"2021-09-13T11:34:16.000Z","gitCreatedAt":"2021-08-31T23:51:23.000Z"}},{"frontmatter":{"title":"Awesome workflows","tags":["Awesome","Workflows"]},"fields":{"slug":"/awesome-workflows/","title":"Awesome workflows","lastUpdated":"2/15/2022","lastUpdatedAt":"2022-02-15T03:43:44.000Z","gitCreatedAt":"2021-10-12T07:22:35.000Z"}}]}},"pageContext":{"tags":["Awesome","Flutter"],"slug":"/awesome-flutter/","sidebarItems":[{"title":"","items":[{"title":"Recently Updated","url":"/latest/","collapse":true,"indent":false,"items":[{"title":"03-13: ç”µå½±ç¬”è®°","url":"/movies/"},{"title":"03-13: ç”µè§†å‰§ç¬”è®°","url":"/tv-shows/"},{"title":"03-12: æ”¶é›†å‘äººæ·±çœçš„è¯","url":"/awesome-quotes/"},{"title":"03-12: æ‰€æ€æ‰€æƒ³","url":"/thoughts/"},{"title":"03-12: 2022å¹´è¯»ä¹¦ç¬”è®°","url":"/books-2022/"},{"title":"03-12: è¯»ä¹¦ç¬”è®°","url":"/books/"},{"title":"03-11: æœ‰æ„æ€çš„é—®é¢˜æ”¶é›†","url":"/awesome-answers/"},{"title":"03-11: å€¼å¾—ä¸€çœ‹çš„æ–‡ç« åˆ—è¡¨","url":"/awesome-articles/"},{"title":"03-11: æ¢ç´¢äº’è”ç½‘ä¸Šé«˜è´¨é‡çš„å†…å®¹","url":"/awesome-sources/"},{"title":"03-10: Everything I Know by Owen","url":"/"},{"title":"03-10: Awesome Browsers","url":"/awesome-browsers/"},{"title":"03-10: è®½åˆºè¨€è®ºæ”¶é›†","url":"/satire-quotes/"},{"title":"03-09: äº’è”ç½‘ç›®å½•æ±‡æ€»","url":"/awesome-indexes/"},{"title":"03-09: Awesome UI","url":"/awesome-ui/"},{"title":"03-08: About Me and the Wiki","url":"/about/"}]}]},{"title":"Tags","items":[{"title":"API","type":"tag","url":"/tags/api/","items":[{"title":"API Tokens","url":"/api-tokens/"},{"title":"Awesome APIs","url":"/awesome-apis/"}]},{"title":"Actions","type":"tag","url":"/tags/actions/","items":[{"title":"How to check if there are uncommited changes in Github Actions?","url":"/github-actions-workflow-check-if-there-is-uncommited-changes/"}]},{"title":"Admin","type":"tag","url":"/tags/admin/","items":[{"title":"Awesome Dashboard","url":"/awesome-dashboard/"}]},{"title":"Algorithm","type":"tag","url":"/tags/algorithm/","items":[{"title":"Awesome Algorithm","url":"/awesome-algorithm/"}]},{"title":"Alternatives","type":"tag","url":"/tags/alternatives/","items":[{"title":"Awesome Alternatives","url":"/awesome-alternatives/"}]},{"title":"Answer","type":"tag","url":"/tags/answer/","items":[{"title":"æœ‰æ„æ€çš„é—®é¢˜æ”¶é›†","url":"/awesome-answers/"}]},{"title":"Application","type":"tag","url":"/tags/application/","items":[{"title":"Awesome Frontend","url":"/awesome-frontend/"}]},{"title":"Applications","type":"tag","url":"/tags/applications/","items":[{"title":"Awesome Applications","url":"/awesome-applications/"}]},{"title":"Approvals","type":"tag","url":"/tags/approvals/","items":[{"title":"æ—…è¡Œæ‰‹ç»­","url":"/travel-approvals/"}]},{"title":"Articles","type":"tag","url":"/tags/articles/","items":[{"title":"å€¼å¾—ä¸€çœ‹çš„æ–‡ç« åˆ—è¡¨","url":"/awesome-articles/"}]},{"title":"Ask","type":"tag","url":"/tags/ask/","items":[{"title":"æœ‰æ„æ€çš„é—®é¢˜æ”¶é›†","url":"/awesome-answers/"}]},{"title":"Auth","type":"tag","url":"/tags/auth/","items":[{"title":"API Tokens","url":"/api-tokens/"},{"title":"Auth Gateway","url":"/auth-gateway/"},{"title":"Use ssh key for Git","url":"/git-sshkey/"}]},{"title":"Automations","type":"tag","url":"/tags/automations/","items":[{"title":"Awesome Automations","url":"/awesome-automations/"}]},{"title":"Awesome","type":"tag","url":"/tags/awesome/","items":[{"title":"Awesome Algorithm","url":"/awesome-algorithm/"},{"title":"Awesome Alternatives","url":"/awesome-alternatives/"},{"title":"æœ‰æ„æ€çš„é—®é¢˜æ”¶é›†","url":"/awesome-answers/"},{"title":"Awesome APIs","url":"/awesome-apis/"},{"title":"Awesome Applications","url":"/awesome-applications/"},{"title":"å€¼å¾—ä¸€çœ‹çš„æ–‡ç« åˆ—è¡¨","url":"/awesome-articles/"},{"title":"Awesome Automations","url":"/awesome-automations/"},{"title":"Awesome Backup","url":"/awesome-backup/"},{"title":"Awesome Benchmark","url":"/awesome-benchmark/"},{"title":"Awesome Bookmarks","url":"/awesome-bookmarks/"},{"title":"Awesome Browsers","url":"/awesome-browsers/"},{"title":"Awesome Chat","url":"/awesome-chat/"},{"title":"Awesome Command Tools","url":"/awesome-cli/"},{"title":"åœ¨ä¸­å›½ä¹°æˆ¿ä¹‹å‰ï¼Œä½ éœ€è¦äº†è§£çš„ä¿¡æ¯æ±‡æ€»","url":"/awesome-cn-house/"},{"title":"Awesome Code Learning","url":"/awesome-code-learning/"},{"title":"æ”¶é›†ä¸€äº›æœ‰æ„æ€çš„ç¤¾åŒº","url":"/awesome-communities/"},{"title":"Awesome Dashboard","url":"/awesome-dashboard/"},{"title":"æœ‰è¶£çš„æ•°æ®","url":"/awesome-data/"},{"title":"Awesome Databases","url":"/awesome-databases/"},{"title":"Awesome Decentralization","url":"/awesome-decentralization/"},{"title":"Awesome Deno","url":"/awesome-deno/"},{"title":"Awesome Editors","url":"/awesome-editors/"},{"title":"Awesome Emails","url":"/awesome-emails.md/"},{"title":"æ”¶é›†è‹±è¯­å­¦ä¹ å·¥å…·","url":"/awesome-english-learning/"},{"title":"Awesome Extensions","url":"/awesome-extensions/"},{"title":"Awesome File Managers","url":"/awesome-file-managers/"},{"title":"Awesome Flutter","url":"/awesome-flutter/"},{"title":"Awesome Free","url":"/awesome-free/"},{"title":"Awesome Frontend","url":"/awesome-frontend/"},{"title":"Awesome Gatsby","url":"/awesome-gatsby/"},{"title":"æ™ºèƒ½å®¶å±…æ–¹æ¡ˆæ±‡æ€»","url":"/awesome-home/"},{"title":"Awesome ID generator","url":"/awesome-id/"},{"title":"äº’è”ç½‘ç›®å½•æ±‡æ€»","url":"/awesome-indexes/"},{"title":"Awesome Interview","url":"/awesome-interview/"},{"title":"Awesome Investing","url":"/awesome-investing/"},{"title":"Awesome Jackett Indexes","url":"/awesome-jackett-indexes/"},{"title":"Awesome Jobs","url":"/awesome-jobs/"},{"title":"Awesome JS Date","url":"/awesome-js-date/"},{"title":"æ”¶é›† Javascript é‡Œå¥½ç”¨çš„åº“","url":"/awesome-js/"},{"title":"Awesome KOL","url":"/awesome-kol/"},{"title":"Awesome List","url":"/awesome-list/"},{"title":"å¸¸è§çš„ä½ä»£ç /æ— ä»£ç åˆ—è¡¨","url":"/awesome-low-code/"},{"title":"å€¼å¾—å®šæœŸå…³æ³¨çš„ç‹¬ç«‹å¼€å‘è€…/åˆ›é€ è€…","url":"/awesome-maker/"},{"title":"å›½å†…é•œåƒèµ„æºæ±‡æ€»","url":"/awesome-mirrors/"},{"title":"å€¼å¾—è§‚çœ‹çš„ç”µå½±","url":"/awesome-movies/"},{"title":"Awesome News","url":"/awesome-news/"},{"title":"Awesome Notes","url":"/awesome-notes/"},{"title":"Awesome NSFW","url":"/awesome-nsfw/"},{"title":"æ”¶é›†å¯ä»¥åœ¨çº¿é˜…è¯»çš„ä¹¦ç±","url":"/awesome-online-books/"},{"title":"Awesome Open Source","url":"/awesome-open-source/"},{"title":"Awesome P2P","url":"/awesome-p2p/"},{"title":"Awesome Privacy","url":"/awesome-privacy/"},{"title":"Awesome Products","url":"/awesome-products/"},{"title":"æ”¶é›†å‘äººæ·±çœçš„è¯","url":"/awesome-quotes/"},{"title":"é«˜è´¨é‡çš„èµ„æºç½‘ç«™æ”¶é›†ï¼ˆç”µå­ä¹¦ï¼Œç”µå½±ï¼Œç”µè§†å‰§ç­‰ï¼‰","url":"/awesome-resources/"},{"title":"Awesome RSS","url":"/awesome-rss/"},{"title":"Awesome Rust","url":"/awesome-rust/"},{"title":"Awesome Schema","url":"/awesome-schema/"},{"title":"Awesome Self-hosted","url":"/awesome-selfhosted/"},{"title":"Awesome Semantic","url":"/awesome-semantic/"},{"title":"Awesome SEO Tools","url":"/awesome-seo/"},{"title":"Awesome Services","url":"/awesome-service/"},{"title":"æ”¶é›†æœ‰æ„æ€çš„ç¤¾äº¤åº”ç”¨","url":"/awesome-socials/"},{"title":"æ¢ç´¢äº’è”ç½‘ä¸Šé«˜è´¨é‡çš„å†…å®¹","url":"/awesome-sources/"},{"title":"Awesome Speed","url":"/awesome-speed/"},{"title":"æœ‰æ„æ€çš„åè®®æ”¶é›†","url":"/awesome-standards/"},{"title":"Awesome Startups","url":"/awesome-startups/"},{"title":"Awesome Static Site Generator","url":"/awesome-static-site-generator/"},{"title":"æ”¶é›†è‚¡å¸‚ç›¸å…³çš„èµ„æº","url":"/awesome-stocks/"},{"title":"Awesome Swift","url":"/awesome-swift/"},{"title":"æ”¶é›†ä¸€äº›æœ‰ç”¨çš„æŠ€æœ¯/ç¯å¢ƒé—®é¢˜çš„è§£å†³æ–¹æ¡ˆ","url":"/awesome-tech-anwser/"},{"title":"Awesome Templates","url":"/awesome-templates/"},{"title":"æœ€å¥½ç”¨çš„å·¥å…·é›†åˆ","url":"/awesome-tools/"},{"title":"å€¼å¾—è§‚çœ‹çš„ç”µè§†å‰§","url":"/awesome-tv-shows/"},{"title":"Awesome UI","url":"/awesome-ui/"},{"title":"æ”¶é›†ä¸€äº›æœ‰æ„æ€çš„ç½‘ç«™","url":"/awesome-websites/"},{"title":"Awesome What Was Your Moment","url":"/awesome-what-was-your-moment/"},{"title":"æ”¶é›†Windowsä¸Šå¥½ç©ï¼Œå¥½ç”¨çš„ä¸œè¥¿","url":"/awesome-windows/"},{"title":"Awesome workflows","url":"/awesome-workflows/"}]},{"title":"BBR","type":"tag","url":"/tags/bbr/","items":[{"title":"Open BBR for Debian","url":"/open-bbr-for-debian/"}]},{"title":"BT","type":"tag","url":"/tags/bt/","items":[{"title":"Jackett Setup","url":"/jackett-setup/"},{"title":"qBittorrent setup for Debian","url":"/qbittorrent-setup-for-debian/"}]},{"title":"Bash","type":"tag","url":"/tags/bash/","items":[{"title":"Awesome Benchmark","url":"/awesome-benchmark/"},{"title":"Bash Tips","url":"/bash-tips/"},{"title":"Linux Common Commands","url":"/linux-common-commands/"}]},{"title":"Benchmark","type":"tag","url":"/tags/benchmark/","items":[{"title":"Awesome Benchmark","url":"/awesome-benchmark/"}]},{"title":"Books","type":"tag","url":"/tags/books/","items":[{"title":"æ”¶é›†å¯ä»¥åœ¨çº¿é˜…è¯»çš„ä¹¦ç±","url":"/awesome-online-books/"},{"title":"2022å¹´è¯»ä¹¦ç¬”è®°","url":"/books-2022/"},{"title":"è¯»ä¹¦ç¬”è®°","url":"/books/"}]},{"title":"Browser","type":"tag","url":"/tags/browser/","items":[{"title":"Awesome Browsers","url":"/awesome-browsers/"}]},{"title":"CSS","type":"tag","url":"/tags/css/","items":[{"title":"Mini Reset CSS","url":"/mini-reset-css/"},{"title":"Smart word break in CSS","url":"/smart-word-break-in-css/"}]},{"title":"Caddy","type":"tag","url":"/tags/caddy/","items":[{"title":"Caddy2 Setup for Debian","url":"/caddy2-setup-for-debian/"}]},{"title":"CentOS","type":"tag","url":"/tags/cent-os/","items":[{"title":"Install PHP 8.0 On CentOS 7 / RHEL 7","url":"/install-php8-on-centos7/"}]},{"title":"Chat","type":"tag","url":"/tags/chat/","items":[{"title":"Awesome Chat","url":"/awesome-chat/"}]},{"title":"China","type":"tag","url":"/tags/china/","items":[{"title":"åœ¨ä¸­å›½ä¹°æˆ¿ä¹‹å‰ï¼Œä½ éœ€è¦äº†è§£çš„ä¿¡æ¯æ±‡æ€»","url":"/awesome-cn-house/"}]},{"title":"Code","type":"tag","url":"/tags/code/","items":[{"title":"Awesome Code Learning","url":"/awesome-code-learning/"}]},{"title":"Command","type":"tag","url":"/tags/command/","items":[{"title":"Awesome Command Tools","url":"/awesome-cli/"}]},{"title":"Commands","type":"tag","url":"/tags/commands/","items":[{"title":"Linux Common Commands","url":"/linux-common-commands/"}]},{"title":"Communities","type":"tag","url":"/tags/communities/","items":[{"title":"æ”¶é›†ä¸€äº›æœ‰æ„æ€çš„ç¤¾åŒº","url":"/awesome-communities/"}]},{"title":"Comparison","type":"tag","url":"/tags/comparison/","items":[{"title":"Licenseæ¯”è¾ƒ","url":"/license-comparison/"}]},{"title":"DDos","type":"tag","url":"/tags/d-dos/","items":[{"title":"Linux Anti DDos","url":"/linux-network/"}]},{"title":"Dashboard","type":"tag","url":"/tags/dashboard/","items":[{"title":"Awesome Dashboard","url":"/awesome-dashboard/"}]},{"title":"Data","type":"tag","url":"/tags/data/","items":[{"title":"æœ‰è¶£çš„æ•°æ®","url":"/awesome-data/"}]},{"title":"Database","type":"tag","url":"/tags/database/","items":[{"title":"Awesome Databases","url":"/awesome-databases/"}]},{"title":"Date","type":"tag","url":"/tags/date/","items":[{"title":"Awesome JS Date","url":"/awesome-js-date/"}]},{"title":"Debian","type":"tag","url":"/tags/debian/","items":[{"title":"Caddy2 Setup for Debian","url":"/caddy2-setup-for-debian/"},{"title":"Debian Server Setup","url":"/debian-server-setup/"},{"title":"Netdata Setup for Debian","url":"/netdata-setup-for-debian/"},{"title":"Nginx Setup for Debian","url":"/nginx-setup-for-debian/"},{"title":"Nodejs Setup for Debian","url":"/nodejs-setup-for-debian/"},{"title":"Open BBR for Debian","url":"/open-bbr-for-debian/"},{"title":"Postgres Setup for Debian","url":"/postgres-setup-for-debian/"},{"title":"Rust Environment Setup for Debian","url":"/rust-enviroment-setup-for-debian/"},{"title":"Shadowsocks Rust Setup for Debian","url":"/shadowsocks-rust-setup-for-debian/"},{"title":"qBittorrent setup for Debian","url":"/qbittorrent-setup-for-debian/"}]},{"title":"Decentralization","type":"tag","url":"/tags/decentralization/","items":[{"title":"Awesome Decentralization","url":"/awesome-decentralization/"}]},{"title":"Deno","type":"tag","url":"/tags/deno/","items":[{"title":"Awesome Deno","url":"/awesome-deno/"},{"title":"Deno Tips","url":"/deno-tips/"}]},{"title":"Development-Environment","type":"tag","url":"/tags/development-environment/","items":[{"title":"æ”¶é›†Windowsä¸Šå¥½ç©ï¼Œå¥½ç”¨çš„ä¸œè¥¿","url":"/awesome-windows/"}]},{"title":"Docker","type":"tag","url":"/tags/docker/","items":[{"title":"Docker Common Commands","url":"/docker-common-commands/"},{"title":"Docker Setup","url":"/docker-setup/"}]},{"title":"Downloads","type":"tag","url":"/tags/downloads/","items":[{"title":"qBittorrent setup for Debian","url":"/qbittorrent-setup-for-debian/"},{"title":"Youtube Download","url":"/youtube-download/"}]},{"title":"Editors","type":"tag","url":"/tags/editors/","items":[{"title":"Awesome Editors","url":"/awesome-editors/"},{"title":"Vim Tips","url":"/vim-tips/"},{"title":"VS Code Tips","url":"/vscode-tips/"}]},{"title":"Email","type":"tag","url":"/tags/email/","items":[{"title":"Awesome Emails","url":"/awesome-emails.md/"}]},{"title":"English","type":"tag","url":"/tags/english/","items":[{"title":"æ”¶é›†è‹±è¯­å­¦ä¹ å·¥å…·","url":"/awesome-english-learning/"}]},{"title":"Explore","type":"tag","url":"/tags/explore/","items":[{"title":"æ¢ç´¢äº’è”ç½‘ä¸Šé«˜è´¨é‡çš„å†…å®¹","url":"/awesome-sources/"}]},{"title":"Extensions","type":"tag","url":"/tags/extensions/","items":[{"title":"Awesome Extensions","url":"/awesome-extensions/"}]},{"title":"FAQ","type":"tag","url":"/tags/faq/","items":[{"title":"æœ‰æ„æ€çš„é—®é¢˜æ”¶é›†","url":"/awesome-answers/"},{"title":"æ”¶é›†ä¸€äº›æœ‰ç”¨çš„æŠ€æœ¯/ç¯å¢ƒé—®é¢˜çš„è§£å†³æ–¹æ¡ˆ","url":"/awesome-tech-anwser/"}]},{"title":"Files","type":"tag","url":"/tags/files/","items":[{"title":"Awesome File Managers","url":"/awesome-file-managers/"},{"title":"Caddy File Server Browser with URL Scheme","url":"/caddy-file-server-url-scheme/"},{"title":"FileBrowser Setup","url":"/filebrowser-setup/"},{"title":"Rclone Setup","url":"/rclone-setup/"}]},{"title":"Flutter","type":"tag","url":"/tags/flutter/","items":[{"title":"Awesome Flutter","url":"/awesome-flutter/"}]},{"title":"Free","type":"tag","url":"/tags/free/","items":[{"title":"Awesome Free","url":"/awesome-free/"}]},{"title":"Front-End","type":"tag","url":"/tags/front-end/","items":[{"title":"Awesome UI","url":"/awesome-ui/"},{"title":"SVG","url":"/svg/"}]},{"title":"Frontend","type":"tag","url":"/tags/frontend/","items":[{"title":"Awesome Frontend","url":"/awesome-frontend/"}]},{"title":"Git","type":"tag","url":"/tags/git/","items":[{"title":"Use ssh key for Git","url":"/git-sshkey/"},{"title":"æ”¶é›†å¸¸ç”¨GitæŠ€å·§","url":"/git-tips/"},{"title":"Git workflows","url":"/git-workflows/"},{"title":"How to check if there are uncommited changes in Github Actions?","url":"/github-actions-workflow-check-if-there-is-uncommited-changes/"}]},{"title":"Github","type":"tag","url":"/tags/github/","items":[{"title":"How to check if there are uncommited changes in Github Actions?","url":"/github-actions-workflow-check-if-there-is-uncommited-changes/"}]},{"title":"Go","type":"tag","url":"/tags/go/","items":[{"title":"Go Template Tips","url":"/go-template-tips/"}]},{"title":"HTTPS","type":"tag","url":"/tags/https/","items":[{"title":"åœ¨ä¸­å›½è‡ªåŠ¨ç”Ÿæˆå…è´¹HTTPSè¯ä¹¦çš„æœ€ä½³æ–¹æ¡ˆ","url":"/auto-https-ssl-in-china/"}]},{"title":"Home","type":"tag","url":"/tags/home/","items":[{"title":"æ™ºèƒ½å®¶å±…æ–¹æ¡ˆæ±‡æ€»","url":"/awesome-home/"}]},{"title":"House","type":"tag","url":"/tags/house/","items":[{"title":"åœ¨ä¸­å›½ä¹°æˆ¿ä¹‹å‰ï¼Œä½ éœ€è¦äº†è§£çš„ä¿¡æ¯æ±‡æ€»","url":"/awesome-cn-house/"}]},{"title":"ID","type":"tag","url":"/tags/id/","items":[{"title":"Awesome ID generator","url":"/awesome-id/"}]},{"title":"Indexes","type":"tag","url":"/tags/indexes/","items":[{"title":"äº’è”ç½‘ç›®å½•æ±‡æ€»","url":"/awesome-indexes/"}]},{"title":"Interview","type":"tag","url":"/tags/interview/","items":[{"title":"Awesome Interview","url":"/awesome-interview/"}]},{"title":"Investing","type":"tag","url":"/tags/investing/","items":[{"title":"Awesome Investing","url":"/awesome-investing/"}]},{"title":"JSOn","type":"tag","url":"/tags/js-on/","items":[{"title":"Awesome Schema","url":"/awesome-schema/"}]},{"title":"Jackett","type":"tag","url":"/tags/jackett/","items":[{"title":"Jackett Setup","url":"/jackett-setup/"},{"title":"qBittorrent setup for Debian","url":"/qbittorrent-setup-for-debian/"}]},{"title":"Javascript","type":"tag","url":"/tags/javascript/","items":[{"title":"Awesome JS Date","url":"/awesome-js-date/"},{"title":"æ”¶é›† Javascript é‡Œå¥½ç”¨çš„åº“","url":"/awesome-js/"},{"title":"Nodejs Monorepo","url":"/nodejs-monorepo/"},{"title":"Nodejs Setup for Debian","url":"/nodejs-setup-for-debian/"},{"title":"Nodejs Tips","url":"/nodejs-tips/"}]},{"title":"Jellyfin","type":"tag","url":"/tags/jellyfin/","items":[{"title":"Jellyfin setup","url":"/jellyfin-setup/"}]},{"title":"Jobs","type":"tag","url":"/tags/jobs/","items":[{"title":"Awesome Jobs","url":"/awesome-jobs/"}]},{"title":"Journal","type":"tag","url":"/tags/journal/","items":[{"title":"2021å¹´çš„ä¸€äº›è®°å½•","url":"/journal-2021/"},{"title":"2022å¹´çš„ä¸€äº›è®°å½•","url":"/journal-2022/"},{"title":"What Iâ€™m doing now?","url":"/now/"}]},{"title":"KOL","type":"tag","url":"/tags/kol/","items":[{"title":"Awesome KOL","url":"/awesome-kol/"}]},{"title":"Language","type":"tag","url":"/tags/language/","items":[{"title":"å‡ºå›½ï¼Œè¿™å‡ å¥è¯å¿…é¡»å­¦ä¼šç”¨å½“åœ°è¯­è¨€æ€ä¹ˆè¯´","url":"/basic-language/"}]},{"title":"Learning","type":"tag","url":"/tags/learning/","items":[{"title":"Awesome Code Learning","url":"/awesome-code-learning/"},{"title":"æ”¶é›†è‹±è¯­å­¦ä¹ å·¥å…·","url":"/awesome-english-learning/"},{"title":"Awesome Rust","url":"/awesome-rust/"}]},{"title":"License","type":"tag","url":"/tags/license/","items":[{"title":"Licenseæ¯”è¾ƒ","url":"/license-comparison/"}]},{"title":"Life","type":"tag","url":"/tags/life/","items":[{"title":"æå‡ç”Ÿæ´»è´¨é‡çš„ä¸œè¥¿åˆ—è¡¨","url":"/life-pro/"},{"title":"é«˜è´¨é‡ç”Ÿæ´»æ–¹å¼æ¨è","url":"/life-tips/"}]},{"title":"Linux","type":"tag","url":"/tags/linux/","items":[{"title":"Linux Common Commands","url":"/linux-common-commands/"},{"title":"Linux Log","url":"/linux-log/"},{"title":"Linux Anti DDos","url":"/linux-network/"}]},{"title":"List","type":"tag","url":"/tags/list/","items":[{"title":"Awesome List","url":"/awesome-list/"},{"title":"å€¼å¾—è§‚çœ‹çš„ç”µè§†å‰§","url":"/awesome-tv-shows/"},{"title":"æå‡ç”Ÿæ´»è´¨é‡çš„ä¸œè¥¿åˆ—è¡¨","url":"/life-pro/"},{"title":"æƒ³ä¹°çš„ä¸œè¥¿åˆ—è¡¨","url":"/wish-lists/"}]},{"title":"Log","type":"tag","url":"/tags/log/","items":[{"title":"Linux Log","url":"/linux-log/"}]},{"title":"Low-Code","type":"tag","url":"/tags/low-code/","items":[{"title":"å¸¸è§çš„ä½ä»£ç /æ— ä»£ç åˆ—è¡¨","url":"/awesome-low-code/"}]},{"title":"MacOS","type":"tag","url":"/tags/mac-os/","items":[{"title":"Postgres Setup for Macos","url":"/postgres-setup-for-macos/"}]},{"title":"Makefile - Templates - Workflows","type":"tag","url":"/tags/makefile-templates-workflows/","items":[{"title":"Makefile Templates","url":"/makefile-templates/"}]},{"title":"Maker","type":"tag","url":"/tags/maker/","items":[{"title":"å€¼å¾—å®šæœŸå…³æ³¨çš„ç‹¬ç«‹å¼€å‘è€…/åˆ›é€ è€…","url":"/awesome-maker/"}]},{"title":"Mastdon","type":"tag","url":"/tags/mastdon/","items":[{"title":"Mastdon Development Setup","url":"/mastdon-development-setup/"}]},{"title":"Me","type":"tag","url":"/tags/me/","items":[{"title":"Everything I Know by Owen","url":"/"},{"title":"About Me and the Wiki","url":"/about/"},{"title":"What Iâ€™m doing now?","url":"/now/"},{"title":"Projects","url":"/projects/"}]},{"title":"Medias","type":"tag","url":"/tags/medias/","items":[{"title":"Bazarr Setup","url":"/bazarr-setup/"},{"title":"Caddy File Server Browser with URL Scheme","url":"/caddy-file-server-url-scheme/"},{"title":"Jackett Setup","url":"/jackett-setup/"},{"title":"Jellyfin setup","url":"/jellyfin-setup/"},{"title":"Radarr Setup","url":"/radarr-setup/"},{"title":"Rclone Setup","url":"/rclone-setup/"},{"title":"Sonarr Setup","url":"/sonarr-setup/"},{"title":"Subtitles","url":"/subtitles/"},{"title":"Youtube Download","url":"/youtube-download/"}]},{"title":"Metube","type":"tag","url":"/tags/metube/","items":[{"title":"Youtube Download","url":"/youtube-download/"}]},{"title":"Mirrors","type":"tag","url":"/tags/mirrors/","items":[{"title":"å›½å†…é•œåƒèµ„æºæ±‡æ€»","url":"/awesome-mirrors/"}]},{"title":"Monitor","type":"tag","url":"/tags/monitor/","items":[{"title":"Netdata Setup for Debian","url":"/netdata-setup-for-debian/"}]},{"title":"Monorepo","type":"tag","url":"/tags/monorepo/","items":[{"title":"Nodejs Monorepo","url":"/nodejs-monorepo/"}]},{"title":"Movies","type":"tag","url":"/tags/movies/","items":[{"title":"å€¼å¾—è§‚çœ‹çš„ç”µå½±","url":"/awesome-movies/"},{"title":"ç”µå½±ç¬”è®°","url":"/movies/"}]},{"title":"Music","type":"tag","url":"/tags/music/","items":[{"title":"éŸ³ä¹æ”¶è—","url":"/music/"}]},{"title":"NSFW","type":"tag","url":"/tags/nsfw/","items":[{"title":"Awesome NSFW","url":"/awesome-nsfw/"}]},{"title":"Netdata","type":"tag","url":"/tags/netdata/","items":[{"title":"Netdata Setup for Debian","url":"/netdata-setup-for-debian/"}]},{"title":"Netwok","type":"tag","url":"/tags/netwok/","items":[{"title":"Awesome Speed","url":"/awesome-speed/"}]},{"title":"News","type":"tag","url":"/tags/news/","items":[{"title":"Awesome News","url":"/awesome-news/"}]},{"title":"Nginx","type":"tag","url":"/tags/nginx/","items":[{"title":"Nginx Setup for Debian","url":"/nginx-setup-for-debian/"}]},{"title":"Notes","type":"tag","url":"/tags/notes/","items":[{"title":"Awesome Notes","url":"/awesome-notes/"},{"title":"2022å¹´è¯»ä¹¦ç¬”è®°","url":"/books-2022/"},{"title":"è¯»ä¹¦ç¬”è®°","url":"/books/"},{"title":"ç”µå½±ç¬”è®°","url":"/movies/"},{"title":"ç”µè§†å‰§ç¬”è®°","url":"/tv-shows/"}]},{"title":"Now","type":"tag","url":"/tags/now/","items":[{"title":"What Iâ€™m doing now?","url":"/now/"}]},{"title":"Open Source","type":"tag","url":"/tags/open-source/","items":[{"title":"Awesome Open Source","url":"/awesome-open-source/"}]},{"title":"P2P","type":"tag","url":"/tags/p-2-p/","items":[{"title":"Awesome P2P","url":"/awesome-p2p/"}]},{"title":"PHP","type":"tag","url":"/tags/php/","items":[{"title":"Install PHP 8.0 On CentOS 7 / RHEL 7","url":"/install-php8-on-centos7/"}]},{"title":"Peertube","type":"tag","url":"/tags/peertube/","items":[{"title":"Peertube Setup with Caddy Server","url":"/peertube-setup/"}]},{"title":"Postgres","type":"tag","url":"/tags/postgres/","items":[{"title":"Postgres Setup for Debian","url":"/postgres-setup-for-debian/"},{"title":"Postgres Setup for Macos","url":"/postgres-setup-for-macos/"}]},{"title":"Postgresql","type":"tag","url":"/tags/postgresql/","items":[{"title":"Postgresql Tips","url":"/postgresql-tips/"}]},{"title":"Privacy","type":"tag","url":"/tags/privacy/","items":[{"title":"Awesome Privacy","url":"/awesome-privacy/"}]},{"title":"Products","type":"tag","url":"/tags/products/","items":[{"title":"Awesome Products","url":"/awesome-products/"}]},{"title":"Programming-Languages","type":"tag","url":"/tags/programming-languages/","items":[{"title":"Nodejs Setup for Debian","url":"/nodejs-setup-for-debian/"},{"title":"Nodejs Tips","url":"/nodejs-tips/"},{"title":"Go Template Tips","url":"/go-template-tips/"}]},{"title":"Projects","type":"tag","url":"/tags/projects/","items":[{"title":"Projects","url":"/projects/"}]},{"title":"Protocol","type":"tag","url":"/tags/protocol/","items":[{"title":"æœ‰æ„æ€çš„åè®®æ”¶é›†","url":"/awesome-standards/"}]},{"title":"Proxies","type":"tag","url":"/tags/proxies/","items":[{"title":"Awesome Benchmark","url":"/awesome-benchmark/"},{"title":"Caddy File Server Browser with URL Scheme","url":"/caddy-file-server-url-scheme/"},{"title":"Caddy2 Setup for Debian","url":"/caddy2-setup-for-debian/"},{"title":"Open BBR for Debian","url":"/open-bbr-for-debian/"},{"title":"Shadowsocks Rust Setup for Debian","url":"/shadowsocks-rust-setup-for-debian/"}]},{"title":"Quotes","type":"tag","url":"/tags/quotes/","items":[{"title":"æ”¶é›†å‘äººæ·±çœçš„è¯","url":"/awesome-quotes/"},{"title":"åˆ’çº¿çš„ç”µè§†å‰§æˆªå›¾","url":"/awesome-tv-quotes/"}]},{"title":"RSS","type":"tag","url":"/tags/rss/","items":[{"title":"Awesome RSS","url":"/awesome-rss/"}]},{"title":"Radarr","type":"tag","url":"/tags/radarr/","items":[{"title":"Radarr Setup","url":"/radarr-setup/"}]},{"title":"Rclone","type":"tag","url":"/tags/rclone/","items":[{"title":"Rclone Setup","url":"/rclone-setup/"}]},{"title":"Recommend","type":"tag","url":"/tags/recommend/","items":[{"title":"Awesome Algorithm","url":"/awesome-algorithm/"}]},{"title":"Resource","type":"tag","url":"/tags/resource/","items":[{"title":"é«˜è´¨é‡çš„èµ„æºç½‘ç«™æ”¶é›†ï¼ˆç”µå­ä¹¦ï¼Œç”µå½±ï¼Œç”µè§†å‰§ç­‰ï¼‰","url":"/awesome-resources/"}]},{"title":"Ruby","type":"tag","url":"/tags/ruby/","items":[{"title":"Ruby Setup for MacOS","url":"/ruby-setup/"}]},{"title":"Rust","type":"tag","url":"/tags/rust/","items":[{"title":"Awesome Rust","url":"/awesome-rust/"},{"title":"Rust Environment Setup for Debian","url":"/rust-enviroment-setup-for-debian/"},{"title":"Rust Tips","url":"/rust-tips/"},{"title":"Shadowsocks Rust Setup for Debian","url":"/shadowsocks-rust-setup-for-debian/"}]},{"title":"SEO","type":"tag","url":"/tags/seo/","items":[{"title":"Awesome SEO Tools","url":"/awesome-seo/"}]},{"title":"SSH","type":"tag","url":"/tags/ssh/","items":[{"title":"Use ssh key for Git","url":"/git-sshkey/"}]},{"title":"SSL","type":"tag","url":"/tags/ssl/","items":[{"title":"åœ¨ä¸­å›½è‡ªåŠ¨ç”Ÿæˆå…è´¹HTTPSè¯ä¹¦çš„æœ€ä½³æ–¹æ¡ˆ","url":"/auto-https-ssl-in-china/"}]},{"title":"SVG","type":"tag","url":"/tags/svg/","items":[{"title":"SVG","url":"/svg/"}]},{"title":"Satire","type":"tag","url":"/tags/satire/","items":[{"title":"è®½åˆºè¨€è®ºæ”¶é›†","url":"/satire-quotes/"}]},{"title":"Schema","type":"tag","url":"/tags/schema/","items":[{"title":"Awesome Schema","url":"/awesome-schema/"}]},{"title":"Self-Hosted","type":"tag","url":"/tags/self-hosted/","items":[{"title":"Awesome Automations","url":"/awesome-automations/"},{"title":"Awesome Self-hosted","url":"/awesome-selfhosted/"},{"title":"Bazarr Setup","url":"/bazarr-setup/"},{"title":"Jackett Setup","url":"/jackett-setup/"},{"title":"Jellyfin setup","url":"/jellyfin-setup/"},{"title":"Radarr Setup","url":"/radarr-setup/"},{"title":"Sonarr Setup","url":"/sonarr-setup/"},{"title":"Youtube Download","url":"/youtube-download/"}]},{"title":"Semantic","type":"tag","url":"/tags/semantic/","items":[{"title":"Awesome Semantic","url":"/awesome-semantic/"}]},{"title":"Server","type":"tag","url":"/tags/server/","items":[{"title":"Caddy File Server Browser with URL Scheme","url":"/caddy-file-server-url-scheme/"},{"title":"Caddy2 Setup for Debian","url":"/caddy2-setup-for-debian/"},{"title":"Debian Server Setup","url":"/debian-server-setup/"},{"title":"Nodejs Setup for Debian","url":"/nodejs-setup-for-debian/"},{"title":"Open BBR for Debian","url":"/open-bbr-for-debian/"},{"title":"qBittorrent setup for Debian","url":"/qbittorrent-setup-for-debian/"}]},{"title":"Serverless","type":"tag","url":"/tags/serverless/","items":[{"title":"æ”¶é›†ä¸€äº›æœ‰ç”¨çš„æŠ€æœ¯/ç¯å¢ƒé—®é¢˜çš„è§£å†³æ–¹æ¡ˆ","url":"/awesome-tech-anwser/"}]},{"title":"Service","type":"tag","url":"/tags/service/","items":[{"title":"Awesome Services","url":"/awesome-service/"}]},{"title":"Setup","type":"tag","url":"/tags/setup/","items":[{"title":"Bazarr Setup","url":"/bazarr-setup/"},{"title":"Caddy2 Setup for Debian","url":"/caddy2-setup-for-debian/"},{"title":"Debian Server Setup","url":"/debian-server-setup/"},{"title":"Docker Setup","url":"/docker-setup/"},{"title":"FileBrowser Setup","url":"/filebrowser-setup/"},{"title":"Install PHP 8.0 On CentOS 7 / RHEL 7","url":"/install-php8-on-centos7/"},{"title":"Jackett Setup","url":"/jackett-setup/"},{"title":"Jellyfin setup","url":"/jellyfin-setup/"},{"title":"Mastdon Development Setup","url":"/mastdon-development-setup/"},{"title":"Nginx Setup for Debian","url":"/nginx-setup-for-debian/"},{"title":"Nodejs Setup for Debian","url":"/nodejs-setup-for-debian/"},{"title":"Peertube Setup with Caddy Server","url":"/peertube-setup/"},{"title":"Postgres Setup for Debian","url":"/postgres-setup-for-debian/"},{"title":"Postgres Setup for Macos","url":"/postgres-setup-for-macos/"},{"title":"Radarr Setup","url":"/radarr-setup/"},{"title":"Rclone Setup","url":"/rclone-setup/"},{"title":"Ruby Setup for MacOS","url":"/ruby-setup/"},{"title":"Rust Environment Setup for Debian","url":"/rust-enviroment-setup-for-debian/"},{"title":"Shadowsocks Rust Setup for Debian","url":"/shadowsocks-rust-setup-for-debian/"},{"title":"qBittorrent setup for Debian","url":"/qbittorrent-setup-for-debian/"}]},{"title":"Shadowsocks","type":"tag","url":"/tags/shadowsocks/","items":[{"title":"Shadowsocks Rust Setup for Debian","url":"/shadowsocks-rust-setup-for-debian/"}]},{"title":"Social","type":"tag","url":"/tags/social/","items":[{"title":"æ”¶é›†ä¸€äº›æœ‰æ„æ€çš„ç¤¾åŒº","url":"/awesome-communities/"},{"title":"Awesome Products","url":"/awesome-products/"},{"title":"æ”¶é›†æœ‰æ„æ€çš„ç¤¾äº¤åº”ç”¨","url":"/awesome-socials/"}]},{"title":"Sonarr","type":"tag","url":"/tags/sonarr/","items":[{"title":"Sonarr Setup","url":"/sonarr-setup/"}]},{"title":"Sources","type":"tag","url":"/tags/sources/","items":[{"title":"æ¢ç´¢äº’è”ç½‘ä¸Šé«˜è´¨é‡çš„å†…å®¹","url":"/awesome-sources/"}]},{"title":"Speed","type":"tag","url":"/tags/speed/","items":[{"title":"Awesome Speed","url":"/awesome-speed/"}]},{"title":"Standard","type":"tag","url":"/tags/standard/","items":[{"title":"æœ‰æ„æ€çš„åè®®æ”¶é›†","url":"/awesome-standards/"}]},{"title":"Startups","type":"tag","url":"/tags/startups/","items":[{"title":"Awesome Startups","url":"/awesome-startups/"}]},{"title":"Static-Site-Generator","type":"tag","url":"/tags/static-site-generator/","items":[{"title":"Awesome Static Site Generator","url":"/awesome-static-site-generator/"}]},{"title":"Stocks","type":"tag","url":"/tags/stocks/","items":[{"title":"Awesome Investing","url":"/awesome-investing/"},{"title":"æ”¶é›†è‚¡å¸‚ç›¸å…³çš„èµ„æº","url":"/awesome-stocks/"}]},{"title":"Stop","type":"tag","url":"/tags/stop/","items":[{"title":"ä½ åº”è¯¥ç«‹å³åœæ­¢åšçš„äº‹","url":"/stop/"}]},{"title":"Subtitles","type":"tag","url":"/tags/subtitles/","items":[{"title":"Bazarr Setup","url":"/bazarr-setup/"},{"title":"Subtitles","url":"/subtitles/"}]},{"title":"Swift","type":"tag","url":"/tags/swift/","items":[{"title":"Awesome Swift","url":"/awesome-swift/"}]},{"title":"TV","type":"tag","url":"/tags/tv/","items":[{"title":"åˆ’çº¿çš„ç”µè§†å‰§æˆªå›¾","url":"/awesome-tv-quotes/"},{"title":"å€¼å¾—è§‚çœ‹çš„ç”µè§†å‰§","url":"/awesome-tv-shows/"},{"title":"ç”µè§†å‰§ç¬”è®°","url":"/tv-shows/"}]},{"title":"Tech","type":"tag","url":"/tags/tech/","items":[{"title":"æ”¶é›†ä¸€äº›æœ‰ç”¨çš„æŠ€æœ¯/ç¯å¢ƒé—®é¢˜çš„è§£å†³æ–¹æ¡ˆ","url":"/awesome-tech-anwser/"}]},{"title":"Templates","type":"tag","url":"/tags/templates/","items":[{"title":"Awesome Templates","url":"/awesome-templates/"},{"title":"Caddy File Server Browser with URL Scheme","url":"/caddy-file-server-url-scheme/"},{"title":"Go Template Tips","url":"/go-template-tips/"}]},{"title":"Thinking","type":"tag","url":"/tags/thinking/","items":[{"title":"æ‰€æ€æ‰€æƒ³","url":"/thoughts/"}]},{"title":"Tips","type":"tag","url":"/tags/tips/","items":[{"title":"Bash Tips","url":"/bash-tips/"},{"title":"Common URL Scheme","url":"/common-url-scheme/"},{"title":"Deno Tips","url":"/deno-tips/"},{"title":"Docker Common Commands","url":"/docker-common-commands/"},{"title":"æ”¶é›†å¸¸ç”¨GitæŠ€å·§","url":"/git-tips/"},{"title":"æå‡ç”Ÿæ´»è´¨é‡çš„ä¸œè¥¿åˆ—è¡¨","url":"/life-pro/"},{"title":"é«˜è´¨é‡ç”Ÿæ´»æ–¹å¼æ¨è","url":"/life-tips/"},{"title":"Linux Common Commands","url":"/linux-common-commands/"},{"title":"Nodejs Tips","url":"/nodejs-tips/"},{"title":"Postgresql Tips","url":"/postgresql-tips/"},{"title":"Rust Tips","url":"/rust-tips/"},{"title":"Vim Tips","url":"/vim-tips/"},{"title":"VS Code Tips","url":"/vscode-tips/"},{"title":"Go Template Tips","url":"/go-template-tips/"}]},{"title":"Todo","type":"tag","url":"/tags/todo/","items":[{"title":"2022 Goals","url":"/goals-2022/"},{"title":"Todos","url":"/todo/"},{"title":"2021 Goals","url":"/goals-2021/"}]},{"title":"Tools","type":"tag","url":"/tags/tools/","items":[{"title":"Awesome Command Tools","url":"/awesome-cli/"},{"title":"Awesome Editors","url":"/awesome-editors/"},{"title":"Awesome Free","url":"/awesome-free/"},{"title":"Awesome Notes","url":"/awesome-notes/"},{"title":"Awesome Self-hosted","url":"/awesome-selfhosted/"},{"title":"Awesome SEO Tools","url":"/awesome-seo/"},{"title":"Awesome Startups","url":"/awesome-startups/"},{"title":"æœ€å¥½ç”¨çš„å·¥å…·é›†åˆ","url":"/awesome-tools/"},{"title":"æ”¶é›†ä¸€äº›æœ‰æ„æ€çš„ç½‘ç«™","url":"/awesome-websites/"},{"title":"æ”¶é›†Windowsä¸Šå¥½ç©ï¼Œå¥½ç”¨çš„ä¸œè¥¿","url":"/awesome-windows/"}]},{"title":"Torrents","type":"tag","url":"/tags/torrents/","items":[{"title":"Jackett Setup","url":"/jackett-setup/"},{"title":"qBittorrent setup for Debian","url":"/qbittorrent-setup-for-debian/"}]},{"title":"Travel","type":"tag","url":"/tags/travel/","items":[{"title":"æ—…è¡Œæ‰‹ç»­","url":"/travel-approvals/"}]},{"title":"Trends","type":"tag","url":"/tags/trends/","items":[{"title":"äº’è”ç½‘ç›®å½•æ±‡æ€»","url":"/awesome-indexes/"}]},{"title":"Tweet","type":"tag","url":"/tags/tweet/","items":[{"title":"æ‰€æ€æ‰€æƒ³","url":"/thoughts/"}]},{"title":"UI","type":"tag","url":"/tags/ui/","items":[{"title":"Awesome UI","url":"/awesome-ui/"}]},{"title":"URL","type":"tag","url":"/tags/url/","items":[{"title":"Common URL Scheme","url":"/common-url-scheme/"}]},{"title":"VS Code","type":"tag","url":"/tags/vs-code/","items":[{"title":"VS Code Tips","url":"/vscode-tips/"}]},{"title":"Vim","type":"tag","url":"/tags/vim/","items":[{"title":"Vim Tips","url":"/vim-tips/"}]},{"title":"Wikipedia","type":"tag","url":"/tags/wikipedia/","items":[{"title":"æ”¶å½•ä¸€äº›æœ‰æ„æ€çš„ç»´åŸºç™¾ç§‘","url":"/awesome-wikipedia/"}]},{"title":"Windows","type":"tag","url":"/tags/windows/","items":[{"title":"æ”¶é›†Windowsä¸Šå¥½ç©ï¼Œå¥½ç”¨çš„ä¸œè¥¿","url":"/awesome-windows/"}]},{"title":"Wish","type":"tag","url":"/tags/wish/","items":[{"title":"æƒ³ä¹°çš„ä¸œè¥¿åˆ—è¡¨","url":"/wish-lists/"}]},{"title":"Workflows","type":"tag","url":"/tags/workflows/","items":[{"title":"Awesome workflows","url":"/awesome-workflows/"},{"title":"Git workflows","url":"/git-workflows/"},{"title":"Nodejs Monorepo","url":"/nodejs-monorepo/"}]},{"title":"Writing","type":"tag","url":"/tags/writing/","items":[{"title":"å¦‚ä½•å†™ä½œï¼Ÿ","url":"/how-to-write/"}]},{"title":"Year2021","type":"tag","url":"/tags/year-2021/","items":[{"title":"2021å¹´çš„ä¸€äº›è®°å½•","url":"/journal-2021/"},{"title":"2021 Goals","url":"/goals-2021/"}]},{"title":"Year2022","type":"tag","url":"/tags/year-2022/","items":[{"title":"2022 Goals","url":"/goals-2022/"},{"title":"2022å¹´çš„ä¸€äº›è®°å½•","url":"/journal-2022/"}]},{"title":"Youtube","type":"tag","url":"/tags/youtube/","items":[{"title":"Youtube Download","url":"/youtube-download/"}]},{"title":"depression","type":"tag","url":"/tags/depression/","items":[{"title":"æŠ‘éƒç—‡ç›¸å…³èµ„æ–™æ±‡æ€»","url":"/depression/"}]},{"title":"mac","type":"tag","url":"/tags/mac/","items":[{"title":"Mac Setup","url":"/mac-setup/"}]},{"title":"qBittorrent","type":"tag","url":"/tags/q-bittorrent/","items":[{"title":"qBittorrent setup for Debian","url":"/qbittorrent-setup-for-debian/"}]},{"title":"setup","type":"tag","url":"/tags/setup/","items":[{"title":"Mac Setup","url":"/mac-setup/"}]},{"title":"ä¸­æ–‡","type":"tag","url":"/tags/ä¸­æ–‡/","items":[{"title":"æœ‰æ„æ€çš„é—®é¢˜æ”¶é›†","url":"/awesome-answers/"},{"title":"æ”¶é›†ä¸€äº›æœ‰æ„æ€çš„ç¤¾åŒº","url":"/awesome-communities/"},{"title":"æœ‰è¶£çš„æ•°æ®","url":"/awesome-data/"},{"title":"æ”¶é›† Javascript é‡Œå¥½ç”¨çš„åº“","url":"/awesome-js/"},{"title":"å€¼å¾—è§‚çœ‹çš„ç”µå½±","url":"/awesome-movies/"},{"title":"æ”¶é›†å‘äººæ·±çœçš„è¯","url":"/awesome-quotes/"},{"title":"æœ€å¥½ç”¨çš„å·¥å…·é›†åˆ","url":"/awesome-tools/"},{"title":"åˆ’çº¿çš„ç”µè§†å‰§æˆªå›¾","url":"/awesome-tv-quotes/"},{"title":"å€¼å¾—è§‚çœ‹çš„ç”µè§†å‰§","url":"/awesome-tv-shows/"},{"title":"æ”¶é›†ä¸€äº›æœ‰æ„æ€çš„ç½‘ç«™","url":"/awesome-websites/"},{"title":"æ”¶é›†Windowsä¸Šå¥½ç©ï¼Œå¥½ç”¨çš„ä¸œè¥¿","url":"/awesome-windows/"},{"title":"2022å¹´è¯»ä¹¦ç¬”è®°","url":"/books-2022/"},{"title":"è¯»ä¹¦ç¬”è®°","url":"/books/"},{"title":"æ”¶é›†å¸¸ç”¨GitæŠ€å·§","url":"/git-tips/"},{"title":"Licenseæ¯”è¾ƒ","url":"/license-comparison/"},{"title":"ç”µå½±ç¬”è®°","url":"/movies/"},{"title":"æ—…è¡Œæ‰‹ç»­","url":"/travel-approvals/"},{"title":"ç”µè§†å‰§ç¬”è®°","url":"/tv-shows/"}]},{"title":"å†·çŸ¥è¯†","type":"tag","url":"/tags/å†·çŸ¥è¯†/","items":[{"title":"å†·çŸ¥è¯†","url":"/trivia/"}]}]}],"tagsGroups":[{"title":"API","type":"tag","url":"/tags/api/","items":[{"title":"API Tokens","url":"/api-tokens/"},{"title":"Awesome APIs","url":"/awesome-apis/"}]},{"title":"Actions","type":"tag","url":"/tags/actions/","items":[{"title":"How to check if there are uncommited changes in Github Actions?","url":"/github-actions-workflow-check-if-there-is-uncommited-changes/"}]},{"title":"Admin","type":"tag","url":"/tags/admin/","items":[{"title":"Awesome Dashboard","url":"/awesome-dashboard/"}]},{"title":"Algorithm","type":"tag","url":"/tags/algorithm/","items":[{"title":"Awesome Algorithm","url":"/awesome-algorithm/"}]},{"title":"Alternatives","type":"tag","url":"/tags/alternatives/","items":[{"title":"Awesome Alternatives","url":"/awesome-alternatives/"}]},{"title":"Answer","type":"tag","url":"/tags/answer/","items":[{"title":"æœ‰æ„æ€çš„é—®é¢˜æ”¶é›†","url":"/awesome-answers/"}]},{"title":"Application","type":"tag","url":"/tags/application/","items":[{"title":"Awesome Frontend","url":"/awesome-frontend/"}]},{"title":"Applications","type":"tag","url":"/tags/applications/","items":[{"title":"Awesome Applications","url":"/awesome-applications/"}]},{"title":"Approvals","type":"tag","url":"/tags/approvals/","items":[{"title":"æ—…è¡Œæ‰‹ç»­","url":"/travel-approvals/"}]},{"title":"Articles","type":"tag","url":"/tags/articles/","items":[{"title":"å€¼å¾—ä¸€çœ‹çš„æ–‡ç« åˆ—è¡¨","url":"/awesome-articles/"}]},{"title":"Ask","type":"tag","url":"/tags/ask/","items":[{"title":"æœ‰æ„æ€çš„é—®é¢˜æ”¶é›†","url":"/awesome-answers/"}]},{"title":"Auth","type":"tag","url":"/tags/auth/","items":[{"title":"API Tokens","url":"/api-tokens/"},{"title":"Auth Gateway","url":"/auth-gateway/"},{"title":"Use ssh key for Git","url":"/git-sshkey/"}]},{"title":"Automations","type":"tag","url":"/tags/automations/","items":[{"title":"Awesome Automations","url":"/awesome-automations/"}]},{"title":"Awesome","type":"tag","url":"/tags/awesome/","items":[{"title":"Awesome Algorithm","url":"/awesome-algorithm/"},{"title":"Awesome Alternatives","url":"/awesome-alternatives/"},{"title":"æœ‰æ„æ€çš„é—®é¢˜æ”¶é›†","url":"/awesome-answers/"},{"title":"Awesome APIs","url":"/awesome-apis/"},{"title":"Awesome Applications","url":"/awesome-applications/"},{"title":"å€¼å¾—ä¸€çœ‹çš„æ–‡ç« åˆ—è¡¨","url":"/awesome-articles/"},{"title":"Awesome Automations","url":"/awesome-automations/"},{"title":"Awesome Backup","url":"/awesome-backup/"},{"title":"Awesome Benchmark","url":"/awesome-benchmark/"},{"title":"Awesome Bookmarks","url":"/awesome-bookmarks/"},{"title":"Awesome Browsers","url":"/awesome-browsers/"},{"title":"Awesome Chat","url":"/awesome-chat/"},{"title":"Awesome Command Tools","url":"/awesome-cli/"},{"title":"åœ¨ä¸­å›½ä¹°æˆ¿ä¹‹å‰ï¼Œä½ éœ€è¦äº†è§£çš„ä¿¡æ¯æ±‡æ€»","url":"/awesome-cn-house/"},{"title":"Awesome Code Learning","url":"/awesome-code-learning/"},{"title":"æ”¶é›†ä¸€äº›æœ‰æ„æ€çš„ç¤¾åŒº","url":"/awesome-communities/"},{"title":"Awesome Dashboard","url":"/awesome-dashboard/"},{"title":"æœ‰è¶£çš„æ•°æ®","url":"/awesome-data/"},{"title":"Awesome Databases","url":"/awesome-databases/"},{"title":"Awesome Decentralization","url":"/awesome-decentralization/"},{"title":"Awesome Deno","url":"/awesome-deno/"},{"title":"Awesome Editors","url":"/awesome-editors/"},{"title":"Awesome Emails","url":"/awesome-emails.md/"},{"title":"æ”¶é›†è‹±è¯­å­¦ä¹ å·¥å…·","url":"/awesome-english-learning/"},{"title":"Awesome Extensions","url":"/awesome-extensions/"},{"title":"Awesome File Managers","url":"/awesome-file-managers/"},{"title":"Awesome Flutter","url":"/awesome-flutter/"},{"title":"Awesome Free","url":"/awesome-free/"},{"title":"Awesome Frontend","url":"/awesome-frontend/"},{"title":"Awesome Gatsby","url":"/awesome-gatsby/"},{"title":"æ™ºèƒ½å®¶å±…æ–¹æ¡ˆæ±‡æ€»","url":"/awesome-home/"},{"title":"Awesome ID generator","url":"/awesome-id/"},{"title":"äº’è”ç½‘ç›®å½•æ±‡æ€»","url":"/awesome-indexes/"},{"title":"Awesome Interview","url":"/awesome-interview/"},{"title":"Awesome Investing","url":"/awesome-investing/"},{"title":"Awesome Jackett Indexes","url":"/awesome-jackett-indexes/"},{"title":"Awesome Jobs","url":"/awesome-jobs/"},{"title":"Awesome JS Date","url":"/awesome-js-date/"},{"title":"æ”¶é›† Javascript é‡Œå¥½ç”¨çš„åº“","url":"/awesome-js/"},{"title":"Awesome KOL","url":"/awesome-kol/"},{"title":"Awesome List","url":"/awesome-list/"},{"title":"å¸¸è§çš„ä½ä»£ç /æ— ä»£ç åˆ—è¡¨","url":"/awesome-low-code/"},{"title":"å€¼å¾—å®šæœŸå…³æ³¨çš„ç‹¬ç«‹å¼€å‘è€…/åˆ›é€ è€…","url":"/awesome-maker/"},{"title":"å›½å†…é•œåƒèµ„æºæ±‡æ€»","url":"/awesome-mirrors/"},{"title":"å€¼å¾—è§‚çœ‹çš„ç”µå½±","url":"/awesome-movies/"},{"title":"Awesome News","url":"/awesome-news/"},{"title":"Awesome Notes","url":"/awesome-notes/"},{"title":"Awesome NSFW","url":"/awesome-nsfw/"},{"title":"æ”¶é›†å¯ä»¥åœ¨çº¿é˜…è¯»çš„ä¹¦ç±","url":"/awesome-online-books/"},{"title":"Awesome Open Source","url":"/awesome-open-source/"},{"title":"Awesome P2P","url":"/awesome-p2p/"},{"title":"Awesome Privacy","url":"/awesome-privacy/"},{"title":"Awesome Products","url":"/awesome-products/"},{"title":"æ”¶é›†å‘äººæ·±çœçš„è¯","url":"/awesome-quotes/"},{"title":"é«˜è´¨é‡çš„èµ„æºç½‘ç«™æ”¶é›†ï¼ˆç”µå­ä¹¦ï¼Œç”µå½±ï¼Œç”µè§†å‰§ç­‰ï¼‰","url":"/awesome-resources/"},{"title":"Awesome RSS","url":"/awesome-rss/"},{"title":"Awesome Rust","url":"/awesome-rust/"},{"title":"Awesome Schema","url":"/awesome-schema/"},{"title":"Awesome Self-hosted","url":"/awesome-selfhosted/"},{"title":"Awesome Semantic","url":"/awesome-semantic/"},{"title":"Awesome SEO Tools","url":"/awesome-seo/"},{"title":"Awesome Services","url":"/awesome-service/"},{"title":"æ”¶é›†æœ‰æ„æ€çš„ç¤¾äº¤åº”ç”¨","url":"/awesome-socials/"},{"title":"æ¢ç´¢äº’è”ç½‘ä¸Šé«˜è´¨é‡çš„å†…å®¹","url":"/awesome-sources/"},{"title":"Awesome Speed","url":"/awesome-speed/"},{"title":"æœ‰æ„æ€çš„åè®®æ”¶é›†","url":"/awesome-standards/"},{"title":"Awesome Startups","url":"/awesome-startups/"},{"title":"Awesome Static Site Generator","url":"/awesome-static-site-generator/"},{"title":"æ”¶é›†è‚¡å¸‚ç›¸å…³çš„èµ„æº","url":"/awesome-stocks/"},{"title":"Awesome Swift","url":"/awesome-swift/"},{"title":"æ”¶é›†ä¸€äº›æœ‰ç”¨çš„æŠ€æœ¯/ç¯å¢ƒé—®é¢˜çš„è§£å†³æ–¹æ¡ˆ","url":"/awesome-tech-anwser/"},{"title":"Awesome Templates","url":"/awesome-templates/"},{"title":"æœ€å¥½ç”¨çš„å·¥å…·é›†åˆ","url":"/awesome-tools/"},{"title":"å€¼å¾—è§‚çœ‹çš„ç”µè§†å‰§","url":"/awesome-tv-shows/"},{"title":"Awesome UI","url":"/awesome-ui/"},{"title":"æ”¶é›†ä¸€äº›æœ‰æ„æ€çš„ç½‘ç«™","url":"/awesome-websites/"},{"title":"Awesome What Was Your Moment","url":"/awesome-what-was-your-moment/"},{"title":"æ”¶é›†Windowsä¸Šå¥½ç©ï¼Œå¥½ç”¨çš„ä¸œè¥¿","url":"/awesome-windows/"},{"title":"Awesome workflows","url":"/awesome-workflows/"}]},{"title":"BBR","type":"tag","url":"/tags/bbr/","items":[{"title":"Open BBR for Debian","url":"/open-bbr-for-debian/"}]},{"title":"BT","type":"tag","url":"/tags/bt/","items":[{"title":"Jackett Setup","url":"/jackett-setup/"},{"title":"qBittorrent setup for Debian","url":"/qbittorrent-setup-for-debian/"}]},{"title":"Bash","type":"tag","url":"/tags/bash/","items":[{"title":"Awesome Benchmark","url":"/awesome-benchmark/"},{"title":"Bash Tips","url":"/bash-tips/"},{"title":"Linux Common Commands","url":"/linux-common-commands/"}]},{"title":"Benchmark","type":"tag","url":"/tags/benchmark/","items":[{"title":"Awesome Benchmark","url":"/awesome-benchmark/"}]},{"title":"Books","type":"tag","url":"/tags/books/","items":[{"title":"æ”¶é›†å¯ä»¥åœ¨çº¿é˜…è¯»çš„ä¹¦ç±","url":"/awesome-online-books/"},{"title":"2022å¹´è¯»ä¹¦ç¬”è®°","url":"/books-2022/"},{"title":"è¯»ä¹¦ç¬”è®°","url":"/books/"}]},{"title":"Browser","type":"tag","url":"/tags/browser/","items":[{"title":"Awesome Browsers","url":"/awesome-browsers/"}]},{"title":"CSS","type":"tag","url":"/tags/css/","items":[{"title":"Mini Reset CSS","url":"/mini-reset-css/"},{"title":"Smart word break in CSS","url":"/smart-word-break-in-css/"}]},{"title":"Caddy","type":"tag","url":"/tags/caddy/","items":[{"title":"Caddy2 Setup for Debian","url":"/caddy2-setup-for-debian/"}]},{"title":"CentOS","type":"tag","url":"/tags/cent-os/","items":[{"title":"Install PHP 8.0 On CentOS 7 / RHEL 7","url":"/install-php8-on-centos7/"}]},{"title":"Chat","type":"tag","url":"/tags/chat/","items":[{"title":"Awesome Chat","url":"/awesome-chat/"}]},{"title":"China","type":"tag","url":"/tags/china/","items":[{"title":"åœ¨ä¸­å›½ä¹°æˆ¿ä¹‹å‰ï¼Œä½ éœ€è¦äº†è§£çš„ä¿¡æ¯æ±‡æ€»","url":"/awesome-cn-house/"}]},{"title":"Code","type":"tag","url":"/tags/code/","items":[{"title":"Awesome Code Learning","url":"/awesome-code-learning/"}]},{"title":"Command","type":"tag","url":"/tags/command/","items":[{"title":"Awesome Command Tools","url":"/awesome-cli/"}]},{"title":"Commands","type":"tag","url":"/tags/commands/","items":[{"title":"Linux Common Commands","url":"/linux-common-commands/"}]},{"title":"Communities","type":"tag","url":"/tags/communities/","items":[{"title":"æ”¶é›†ä¸€äº›æœ‰æ„æ€çš„ç¤¾åŒº","url":"/awesome-communities/"}]},{"title":"Comparison","type":"tag","url":"/tags/comparison/","items":[{"title":"Licenseæ¯”è¾ƒ","url":"/license-comparison/"}]},{"title":"DDos","type":"tag","url":"/tags/d-dos/","items":[{"title":"Linux Anti DDos","url":"/linux-network/"}]},{"title":"Dashboard","type":"tag","url":"/tags/dashboard/","items":[{"title":"Awesome Dashboard","url":"/awesome-dashboard/"}]},{"title":"Data","type":"tag","url":"/tags/data/","items":[{"title":"æœ‰è¶£çš„æ•°æ®","url":"/awesome-data/"}]},{"title":"Database","type":"tag","url":"/tags/database/","items":[{"title":"Awesome Databases","url":"/awesome-databases/"}]},{"title":"Date","type":"tag","url":"/tags/date/","items":[{"title":"Awesome JS Date","url":"/awesome-js-date/"}]},{"title":"Debian","type":"tag","url":"/tags/debian/","items":[{"title":"Caddy2 Setup for Debian","url":"/caddy2-setup-for-debian/"},{"title":"Debian Server Setup","url":"/debian-server-setup/"},{"title":"Netdata Setup for Debian","url":"/netdata-setup-for-debian/"},{"title":"Nginx Setup for Debian","url":"/nginx-setup-for-debian/"},{"title":"Nodejs Setup for Debian","url":"/nodejs-setup-for-debian/"},{"title":"Open BBR for Debian","url":"/open-bbr-for-debian/"},{"title":"Postgres Setup for Debian","url":"/postgres-setup-for-debian/"},{"title":"Rust Environment Setup for Debian","url":"/rust-enviroment-setup-for-debian/"},{"title":"Shadowsocks Rust Setup for Debian","url":"/shadowsocks-rust-setup-for-debian/"},{"title":"qBittorrent setup for Debian","url":"/qbittorrent-setup-for-debian/"}]},{"title":"Decentralization","type":"tag","url":"/tags/decentralization/","items":[{"title":"Awesome Decentralization","url":"/awesome-decentralization/"}]},{"title":"Deno","type":"tag","url":"/tags/deno/","items":[{"title":"Awesome Deno","url":"/awesome-deno/"},{"title":"Deno Tips","url":"/deno-tips/"}]},{"title":"Development-Environment","type":"tag","url":"/tags/development-environment/","items":[{"title":"æ”¶é›†Windowsä¸Šå¥½ç©ï¼Œå¥½ç”¨çš„ä¸œè¥¿","url":"/awesome-windows/"}]},{"title":"Docker","type":"tag","url":"/tags/docker/","items":[{"title":"Docker Common Commands","url":"/docker-common-commands/"},{"title":"Docker Setup","url":"/docker-setup/"}]},{"title":"Downloads","type":"tag","url":"/tags/downloads/","items":[{"title":"qBittorrent setup for Debian","url":"/qbittorrent-setup-for-debian/"},{"title":"Youtube Download","url":"/youtube-download/"}]},{"title":"Editors","type":"tag","url":"/tags/editors/","items":[{"title":"Awesome Editors","url":"/awesome-editors/"},{"title":"Vim Tips","url":"/vim-tips/"},{"title":"VS Code Tips","url":"/vscode-tips/"}]},{"title":"Email","type":"tag","url":"/tags/email/","items":[{"title":"Awesome Emails","url":"/awesome-emails.md/"}]},{"title":"English","type":"tag","url":"/tags/english/","items":[{"title":"æ”¶é›†è‹±è¯­å­¦ä¹ å·¥å…·","url":"/awesome-english-learning/"}]},{"title":"Explore","type":"tag","url":"/tags/explore/","items":[{"title":"æ¢ç´¢äº’è”ç½‘ä¸Šé«˜è´¨é‡çš„å†…å®¹","url":"/awesome-sources/"}]},{"title":"Extensions","type":"tag","url":"/tags/extensions/","items":[{"title":"Awesome Extensions","url":"/awesome-extensions/"}]},{"title":"FAQ","type":"tag","url":"/tags/faq/","items":[{"title":"æœ‰æ„æ€çš„é—®é¢˜æ”¶é›†","url":"/awesome-answers/"},{"title":"æ”¶é›†ä¸€äº›æœ‰ç”¨çš„æŠ€æœ¯/ç¯å¢ƒé—®é¢˜çš„è§£å†³æ–¹æ¡ˆ","url":"/awesome-tech-anwser/"}]},{"title":"Files","type":"tag","url":"/tags/files/","items":[{"title":"Awesome File Managers","url":"/awesome-file-managers/"},{"title":"Caddy File Server Browser with URL Scheme","url":"/caddy-file-server-url-scheme/"},{"title":"FileBrowser Setup","url":"/filebrowser-setup/"},{"title":"Rclone Setup","url":"/rclone-setup/"}]},{"title":"Flutter","type":"tag","url":"/tags/flutter/","items":[{"title":"Awesome Flutter","url":"/awesome-flutter/"}]},{"title":"Free","type":"tag","url":"/tags/free/","items":[{"title":"Awesome Free","url":"/awesome-free/"}]},{"title":"Front-End","type":"tag","url":"/tags/front-end/","items":[{"title":"Awesome UI","url":"/awesome-ui/"},{"title":"SVG","url":"/svg/"}]},{"title":"Frontend","type":"tag","url":"/tags/frontend/","items":[{"title":"Awesome Frontend","url":"/awesome-frontend/"}]},{"title":"Git","type":"tag","url":"/tags/git/","items":[{"title":"Use ssh key for Git","url":"/git-sshkey/"},{"title":"æ”¶é›†å¸¸ç”¨GitæŠ€å·§","url":"/git-tips/"},{"title":"Git workflows","url":"/git-workflows/"},{"title":"How to check if there are uncommited changes in Github Actions?","url":"/github-actions-workflow-check-if-there-is-uncommited-changes/"}]},{"title":"Github","type":"tag","url":"/tags/github/","items":[{"title":"How to check if there are uncommited changes in Github Actions?","url":"/github-actions-workflow-check-if-there-is-uncommited-changes/"}]},{"title":"Go","type":"tag","url":"/tags/go/","items":[{"title":"Go Template Tips","url":"/go-template-tips/"}]},{"title":"HTTPS","type":"tag","url":"/tags/https/","items":[{"title":"åœ¨ä¸­å›½è‡ªåŠ¨ç”Ÿæˆå…è´¹HTTPSè¯ä¹¦çš„æœ€ä½³æ–¹æ¡ˆ","url":"/auto-https-ssl-in-china/"}]},{"title":"Home","type":"tag","url":"/tags/home/","items":[{"title":"æ™ºèƒ½å®¶å±…æ–¹æ¡ˆæ±‡æ€»","url":"/awesome-home/"}]},{"title":"House","type":"tag","url":"/tags/house/","items":[{"title":"åœ¨ä¸­å›½ä¹°æˆ¿ä¹‹å‰ï¼Œä½ éœ€è¦äº†è§£çš„ä¿¡æ¯æ±‡æ€»","url":"/awesome-cn-house/"}]},{"title":"ID","type":"tag","url":"/tags/id/","items":[{"title":"Awesome ID generator","url":"/awesome-id/"}]},{"title":"Indexes","type":"tag","url":"/tags/indexes/","items":[{"title":"äº’è”ç½‘ç›®å½•æ±‡æ€»","url":"/awesome-indexes/"}]},{"title":"Interview","type":"tag","url":"/tags/interview/","items":[{"title":"Awesome Interview","url":"/awesome-interview/"}]},{"title":"Investing","type":"tag","url":"/tags/investing/","items":[{"title":"Awesome Investing","url":"/awesome-investing/"}]},{"title":"JSOn","type":"tag","url":"/tags/js-on/","items":[{"title":"Awesome Schema","url":"/awesome-schema/"}]},{"title":"Jackett","type":"tag","url":"/tags/jackett/","items":[{"title":"Jackett Setup","url":"/jackett-setup/"},{"title":"qBittorrent setup for Debian","url":"/qbittorrent-setup-for-debian/"}]},{"title":"Javascript","type":"tag","url":"/tags/javascript/","items":[{"title":"Awesome JS Date","url":"/awesome-js-date/"},{"title":"æ”¶é›† Javascript é‡Œå¥½ç”¨çš„åº“","url":"/awesome-js/"},{"title":"Nodejs Monorepo","url":"/nodejs-monorepo/"},{"title":"Nodejs Setup for Debian","url":"/nodejs-setup-for-debian/"},{"title":"Nodejs Tips","url":"/nodejs-tips/"}]},{"title":"Jellyfin","type":"tag","url":"/tags/jellyfin/","items":[{"title":"Jellyfin setup","url":"/jellyfin-setup/"}]},{"title":"Jobs","type":"tag","url":"/tags/jobs/","items":[{"title":"Awesome Jobs","url":"/awesome-jobs/"}]},{"title":"Journal","type":"tag","url":"/tags/journal/","items":[{"title":"2021å¹´çš„ä¸€äº›è®°å½•","url":"/journal-2021/"},{"title":"2022å¹´çš„ä¸€äº›è®°å½•","url":"/journal-2022/"},{"title":"What Iâ€™m doing now?","url":"/now/"}]},{"title":"KOL","type":"tag","url":"/tags/kol/","items":[{"title":"Awesome KOL","url":"/awesome-kol/"}]},{"title":"Language","type":"tag","url":"/tags/language/","items":[{"title":"å‡ºå›½ï¼Œè¿™å‡ å¥è¯å¿…é¡»å­¦ä¼šç”¨å½“åœ°è¯­è¨€æ€ä¹ˆè¯´","url":"/basic-language/"}]},{"title":"Learning","type":"tag","url":"/tags/learning/","items":[{"title":"Awesome Code Learning","url":"/awesome-code-learning/"},{"title":"æ”¶é›†è‹±è¯­å­¦ä¹ å·¥å…·","url":"/awesome-english-learning/"},{"title":"Awesome Rust","url":"/awesome-rust/"}]},{"title":"License","type":"tag","url":"/tags/license/","items":[{"title":"Licenseæ¯”è¾ƒ","url":"/license-comparison/"}]},{"title":"Life","type":"tag","url":"/tags/life/","items":[{"title":"æå‡ç”Ÿæ´»è´¨é‡çš„ä¸œè¥¿åˆ—è¡¨","url":"/life-pro/"},{"title":"é«˜è´¨é‡ç”Ÿæ´»æ–¹å¼æ¨è","url":"/life-tips/"}]},{"title":"Linux","type":"tag","url":"/tags/linux/","items":[{"title":"Linux Common Commands","url":"/linux-common-commands/"},{"title":"Linux Log","url":"/linux-log/"},{"title":"Linux Anti DDos","url":"/linux-network/"}]},{"title":"List","type":"tag","url":"/tags/list/","items":[{"title":"Awesome List","url":"/awesome-list/"},{"title":"å€¼å¾—è§‚çœ‹çš„ç”µè§†å‰§","url":"/awesome-tv-shows/"},{"title":"æå‡ç”Ÿæ´»è´¨é‡çš„ä¸œè¥¿åˆ—è¡¨","url":"/life-pro/"},{"title":"æƒ³ä¹°çš„ä¸œè¥¿åˆ—è¡¨","url":"/wish-lists/"}]},{"title":"Log","type":"tag","url":"/tags/log/","items":[{"title":"Linux Log","url":"/linux-log/"}]},{"title":"Low-Code","type":"tag","url":"/tags/low-code/","items":[{"title":"å¸¸è§çš„ä½ä»£ç /æ— ä»£ç åˆ—è¡¨","url":"/awesome-low-code/"}]},{"title":"MacOS","type":"tag","url":"/tags/mac-os/","items":[{"title":"Postgres Setup for Macos","url":"/postgres-setup-for-macos/"}]},{"title":"Makefile - Templates - Workflows","type":"tag","url":"/tags/makefile-templates-workflows/","items":[{"title":"Makefile Templates","url":"/makefile-templates/"}]},{"title":"Maker","type":"tag","url":"/tags/maker/","items":[{"title":"å€¼å¾—å®šæœŸå…³æ³¨çš„ç‹¬ç«‹å¼€å‘è€…/åˆ›é€ è€…","url":"/awesome-maker/"}]},{"title":"Mastdon","type":"tag","url":"/tags/mastdon/","items":[{"title":"Mastdon Development Setup","url":"/mastdon-development-setup/"}]},{"title":"Me","type":"tag","url":"/tags/me/","items":[{"title":"Everything I Know by Owen","url":"/"},{"title":"About Me and the Wiki","url":"/about/"},{"title":"What Iâ€™m doing now?","url":"/now/"},{"title":"Projects","url":"/projects/"}]},{"title":"Medias","type":"tag","url":"/tags/medias/","items":[{"title":"Bazarr Setup","url":"/bazarr-setup/"},{"title":"Caddy File Server Browser with URL Scheme","url":"/caddy-file-server-url-scheme/"},{"title":"Jackett Setup","url":"/jackett-setup/"},{"title":"Jellyfin setup","url":"/jellyfin-setup/"},{"title":"Radarr Setup","url":"/radarr-setup/"},{"title":"Rclone Setup","url":"/rclone-setup/"},{"title":"Sonarr Setup","url":"/sonarr-setup/"},{"title":"Subtitles","url":"/subtitles/"},{"title":"Youtube Download","url":"/youtube-download/"}]},{"title":"Metube","type":"tag","url":"/tags/metube/","items":[{"title":"Youtube Download","url":"/youtube-download/"}]},{"title":"Mirrors","type":"tag","url":"/tags/mirrors/","items":[{"title":"å›½å†…é•œåƒèµ„æºæ±‡æ€»","url":"/awesome-mirrors/"}]},{"title":"Monitor","type":"tag","url":"/tags/monitor/","items":[{"title":"Netdata Setup for Debian","url":"/netdata-setup-for-debian/"}]},{"title":"Monorepo","type":"tag","url":"/tags/monorepo/","items":[{"title":"Nodejs Monorepo","url":"/nodejs-monorepo/"}]},{"title":"Movies","type":"tag","url":"/tags/movies/","items":[{"title":"å€¼å¾—è§‚çœ‹çš„ç”µå½±","url":"/awesome-movies/"},{"title":"ç”µå½±ç¬”è®°","url":"/movies/"}]},{"title":"Music","type":"tag","url":"/tags/music/","items":[{"title":"éŸ³ä¹æ”¶è—","url":"/music/"}]},{"title":"NSFW","type":"tag","url":"/tags/nsfw/","items":[{"title":"Awesome NSFW","url":"/awesome-nsfw/"}]},{"title":"Netdata","type":"tag","url":"/tags/netdata/","items":[{"title":"Netdata Setup for Debian","url":"/netdata-setup-for-debian/"}]},{"title":"Netwok","type":"tag","url":"/tags/netwok/","items":[{"title":"Awesome Speed","url":"/awesome-speed/"}]},{"title":"News","type":"tag","url":"/tags/news/","items":[{"title":"Awesome News","url":"/awesome-news/"}]},{"title":"Nginx","type":"tag","url":"/tags/nginx/","items":[{"title":"Nginx Setup for Debian","url":"/nginx-setup-for-debian/"}]},{"title":"Notes","type":"tag","url":"/tags/notes/","items":[{"title":"Awesome Notes","url":"/awesome-notes/"},{"title":"2022å¹´è¯»ä¹¦ç¬”è®°","url":"/books-2022/"},{"title":"è¯»ä¹¦ç¬”è®°","url":"/books/"},{"title":"ç”µå½±ç¬”è®°","url":"/movies/"},{"title":"ç”µè§†å‰§ç¬”è®°","url":"/tv-shows/"}]},{"title":"Now","type":"tag","url":"/tags/now/","items":[{"title":"What Iâ€™m doing now?","url":"/now/"}]},{"title":"Open Source","type":"tag","url":"/tags/open-source/","items":[{"title":"Awesome Open Source","url":"/awesome-open-source/"}]},{"title":"P2P","type":"tag","url":"/tags/p-2-p/","items":[{"title":"Awesome P2P","url":"/awesome-p2p/"}]},{"title":"PHP","type":"tag","url":"/tags/php/","items":[{"title":"Install PHP 8.0 On CentOS 7 / RHEL 7","url":"/install-php8-on-centos7/"}]},{"title":"Peertube","type":"tag","url":"/tags/peertube/","items":[{"title":"Peertube Setup with Caddy Server","url":"/peertube-setup/"}]},{"title":"Postgres","type":"tag","url":"/tags/postgres/","items":[{"title":"Postgres Setup for Debian","url":"/postgres-setup-for-debian/"},{"title":"Postgres Setup for Macos","url":"/postgres-setup-for-macos/"}]},{"title":"Postgresql","type":"tag","url":"/tags/postgresql/","items":[{"title":"Postgresql Tips","url":"/postgresql-tips/"}]},{"title":"Privacy","type":"tag","url":"/tags/privacy/","items":[{"title":"Awesome Privacy","url":"/awesome-privacy/"}]},{"title":"Products","type":"tag","url":"/tags/products/","items":[{"title":"Awesome Products","url":"/awesome-products/"}]},{"title":"Programming-Languages","type":"tag","url":"/tags/programming-languages/","items":[{"title":"Nodejs Setup for Debian","url":"/nodejs-setup-for-debian/"},{"title":"Nodejs Tips","url":"/nodejs-tips/"},{"title":"Go Template Tips","url":"/go-template-tips/"}]},{"title":"Projects","type":"tag","url":"/tags/projects/","items":[{"title":"Projects","url":"/projects/"}]},{"title":"Protocol","type":"tag","url":"/tags/protocol/","items":[{"title":"æœ‰æ„æ€çš„åè®®æ”¶é›†","url":"/awesome-standards/"}]},{"title":"Proxies","type":"tag","url":"/tags/proxies/","items":[{"title":"Awesome Benchmark","url":"/awesome-benchmark/"},{"title":"Caddy File Server Browser with URL Scheme","url":"/caddy-file-server-url-scheme/"},{"title":"Caddy2 Setup for Debian","url":"/caddy2-setup-for-debian/"},{"title":"Open BBR for Debian","url":"/open-bbr-for-debian/"},{"title":"Shadowsocks Rust Setup for Debian","url":"/shadowsocks-rust-setup-for-debian/"}]},{"title":"Quotes","type":"tag","url":"/tags/quotes/","items":[{"title":"æ”¶é›†å‘äººæ·±çœçš„è¯","url":"/awesome-quotes/"},{"title":"åˆ’çº¿çš„ç”µè§†å‰§æˆªå›¾","url":"/awesome-tv-quotes/"}]},{"title":"RSS","type":"tag","url":"/tags/rss/","items":[{"title":"Awesome RSS","url":"/awesome-rss/"}]},{"title":"Radarr","type":"tag","url":"/tags/radarr/","items":[{"title":"Radarr Setup","url":"/radarr-setup/"}]},{"title":"Rclone","type":"tag","url":"/tags/rclone/","items":[{"title":"Rclone Setup","url":"/rclone-setup/"}]},{"title":"Recommend","type":"tag","url":"/tags/recommend/","items":[{"title":"Awesome Algorithm","url":"/awesome-algorithm/"}]},{"title":"Resource","type":"tag","url":"/tags/resource/","items":[{"title":"é«˜è´¨é‡çš„èµ„æºç½‘ç«™æ”¶é›†ï¼ˆç”µå­ä¹¦ï¼Œç”µå½±ï¼Œç”µè§†å‰§ç­‰ï¼‰","url":"/awesome-resources/"}]},{"title":"Ruby","type":"tag","url":"/tags/ruby/","items":[{"title":"Ruby Setup for MacOS","url":"/ruby-setup/"}]},{"title":"Rust","type":"tag","url":"/tags/rust/","items":[{"title":"Awesome Rust","url":"/awesome-rust/"},{"title":"Rust Environment Setup for Debian","url":"/rust-enviroment-setup-for-debian/"},{"title":"Rust Tips","url":"/rust-tips/"},{"title":"Shadowsocks Rust Setup for Debian","url":"/shadowsocks-rust-setup-for-debian/"}]},{"title":"SEO","type":"tag","url":"/tags/seo/","items":[{"title":"Awesome SEO Tools","url":"/awesome-seo/"}]},{"title":"SSH","type":"tag","url":"/tags/ssh/","items":[{"title":"Use ssh key for Git","url":"/git-sshkey/"}]},{"title":"SSL","type":"tag","url":"/tags/ssl/","items":[{"title":"åœ¨ä¸­å›½è‡ªåŠ¨ç”Ÿæˆå…è´¹HTTPSè¯ä¹¦çš„æœ€ä½³æ–¹æ¡ˆ","url":"/auto-https-ssl-in-china/"}]},{"title":"SVG","type":"tag","url":"/tags/svg/","items":[{"title":"SVG","url":"/svg/"}]},{"title":"Satire","type":"tag","url":"/tags/satire/","items":[{"title":"è®½åˆºè¨€è®ºæ”¶é›†","url":"/satire-quotes/"}]},{"title":"Schema","type":"tag","url":"/tags/schema/","items":[{"title":"Awesome Schema","url":"/awesome-schema/"}]},{"title":"Self-Hosted","type":"tag","url":"/tags/self-hosted/","items":[{"title":"Awesome Automations","url":"/awesome-automations/"},{"title":"Awesome Self-hosted","url":"/awesome-selfhosted/"},{"title":"Bazarr Setup","url":"/bazarr-setup/"},{"title":"Jackett Setup","url":"/jackett-setup/"},{"title":"Jellyfin setup","url":"/jellyfin-setup/"},{"title":"Radarr Setup","url":"/radarr-setup/"},{"title":"Sonarr Setup","url":"/sonarr-setup/"},{"title":"Youtube Download","url":"/youtube-download/"}]},{"title":"Semantic","type":"tag","url":"/tags/semantic/","items":[{"title":"Awesome Semantic","url":"/awesome-semantic/"}]},{"title":"Server","type":"tag","url":"/tags/server/","items":[{"title":"Caddy File Server Browser with URL Scheme","url":"/caddy-file-server-url-scheme/"},{"title":"Caddy2 Setup for Debian","url":"/caddy2-setup-for-debian/"},{"title":"Debian Server Setup","url":"/debian-server-setup/"},{"title":"Nodejs Setup for Debian","url":"/nodejs-setup-for-debian/"},{"title":"Open BBR for Debian","url":"/open-bbr-for-debian/"},{"title":"qBittorrent setup for Debian","url":"/qbittorrent-setup-for-debian/"}]},{"title":"Serverless","type":"tag","url":"/tags/serverless/","items":[{"title":"æ”¶é›†ä¸€äº›æœ‰ç”¨çš„æŠ€æœ¯/ç¯å¢ƒé—®é¢˜çš„è§£å†³æ–¹æ¡ˆ","url":"/awesome-tech-anwser/"}]},{"title":"Service","type":"tag","url":"/tags/service/","items":[{"title":"Awesome Services","url":"/awesome-service/"}]},{"title":"Setup","type":"tag","url":"/tags/setup/","items":[{"title":"Bazarr Setup","url":"/bazarr-setup/"},{"title":"Caddy2 Setup for Debian","url":"/caddy2-setup-for-debian/"},{"title":"Debian Server Setup","url":"/debian-server-setup/"},{"title":"Docker Setup","url":"/docker-setup/"},{"title":"FileBrowser Setup","url":"/filebrowser-setup/"},{"title":"Install PHP 8.0 On CentOS 7 / RHEL 7","url":"/install-php8-on-centos7/"},{"title":"Jackett Setup","url":"/jackett-setup/"},{"title":"Jellyfin setup","url":"/jellyfin-setup/"},{"title":"Mastdon Development Setup","url":"/mastdon-development-setup/"},{"title":"Nginx Setup for Debian","url":"/nginx-setup-for-debian/"},{"title":"Nodejs Setup for Debian","url":"/nodejs-setup-for-debian/"},{"title":"Peertube Setup with Caddy Server","url":"/peertube-setup/"},{"title":"Postgres Setup for Debian","url":"/postgres-setup-for-debian/"},{"title":"Postgres Setup for Macos","url":"/postgres-setup-for-macos/"},{"title":"Radarr Setup","url":"/radarr-setup/"},{"title":"Rclone Setup","url":"/rclone-setup/"},{"title":"Ruby Setup for MacOS","url":"/ruby-setup/"},{"title":"Rust Environment Setup for Debian","url":"/rust-enviroment-setup-for-debian/"},{"title":"Shadowsocks Rust Setup for Debian","url":"/shadowsocks-rust-setup-for-debian/"},{"title":"qBittorrent setup for Debian","url":"/qbittorrent-setup-for-debian/"}]},{"title":"Shadowsocks","type":"tag","url":"/tags/shadowsocks/","items":[{"title":"Shadowsocks Rust Setup for Debian","url":"/shadowsocks-rust-setup-for-debian/"}]},{"title":"Social","type":"tag","url":"/tags/social/","items":[{"title":"æ”¶é›†ä¸€äº›æœ‰æ„æ€çš„ç¤¾åŒº","url":"/awesome-communities/"},{"title":"Awesome Products","url":"/awesome-products/"},{"title":"æ”¶é›†æœ‰æ„æ€çš„ç¤¾äº¤åº”ç”¨","url":"/awesome-socials/"}]},{"title":"Sonarr","type":"tag","url":"/tags/sonarr/","items":[{"title":"Sonarr Setup","url":"/sonarr-setup/"}]},{"title":"Sources","type":"tag","url":"/tags/sources/","items":[{"title":"æ¢ç´¢äº’è”ç½‘ä¸Šé«˜è´¨é‡çš„å†…å®¹","url":"/awesome-sources/"}]},{"title":"Speed","type":"tag","url":"/tags/speed/","items":[{"title":"Awesome Speed","url":"/awesome-speed/"}]},{"title":"Standard","type":"tag","url":"/tags/standard/","items":[{"title":"æœ‰æ„æ€çš„åè®®æ”¶é›†","url":"/awesome-standards/"}]},{"title":"Startups","type":"tag","url":"/tags/startups/","items":[{"title":"Awesome Startups","url":"/awesome-startups/"}]},{"title":"Static-Site-Generator","type":"tag","url":"/tags/static-site-generator/","items":[{"title":"Awesome Static Site Generator","url":"/awesome-static-site-generator/"}]},{"title":"Stocks","type":"tag","url":"/tags/stocks/","items":[{"title":"Awesome Investing","url":"/awesome-investing/"},{"title":"æ”¶é›†è‚¡å¸‚ç›¸å…³çš„èµ„æº","url":"/awesome-stocks/"}]},{"title":"Stop","type":"tag","url":"/tags/stop/","items":[{"title":"ä½ åº”è¯¥ç«‹å³åœæ­¢åšçš„äº‹","url":"/stop/"}]},{"title":"Subtitles","type":"tag","url":"/tags/subtitles/","items":[{"title":"Bazarr Setup","url":"/bazarr-setup/"},{"title":"Subtitles","url":"/subtitles/"}]},{"title":"Swift","type":"tag","url":"/tags/swift/","items":[{"title":"Awesome Swift","url":"/awesome-swift/"}]},{"title":"TV","type":"tag","url":"/tags/tv/","items":[{"title":"åˆ’çº¿çš„ç”µè§†å‰§æˆªå›¾","url":"/awesome-tv-quotes/"},{"title":"å€¼å¾—è§‚çœ‹çš„ç”µè§†å‰§","url":"/awesome-tv-shows/"},{"title":"ç”µè§†å‰§ç¬”è®°","url":"/tv-shows/"}]},{"title":"Tech","type":"tag","url":"/tags/tech/","items":[{"title":"æ”¶é›†ä¸€äº›æœ‰ç”¨çš„æŠ€æœ¯/ç¯å¢ƒé—®é¢˜çš„è§£å†³æ–¹æ¡ˆ","url":"/awesome-tech-anwser/"}]},{"title":"Templates","type":"tag","url":"/tags/templates/","items":[{"title":"Awesome Templates","url":"/awesome-templates/"},{"title":"Caddy File Server Browser with URL Scheme","url":"/caddy-file-server-url-scheme/"},{"title":"Go Template Tips","url":"/go-template-tips/"}]},{"title":"Thinking","type":"tag","url":"/tags/thinking/","items":[{"title":"æ‰€æ€æ‰€æƒ³","url":"/thoughts/"}]},{"title":"Tips","type":"tag","url":"/tags/tips/","items":[{"title":"Bash Tips","url":"/bash-tips/"},{"title":"Common URL Scheme","url":"/common-url-scheme/"},{"title":"Deno Tips","url":"/deno-tips/"},{"title":"Docker Common Commands","url":"/docker-common-commands/"},{"title":"æ”¶é›†å¸¸ç”¨GitæŠ€å·§","url":"/git-tips/"},{"title":"æå‡ç”Ÿæ´»è´¨é‡çš„ä¸œè¥¿åˆ—è¡¨","url":"/life-pro/"},{"title":"é«˜è´¨é‡ç”Ÿæ´»æ–¹å¼æ¨è","url":"/life-tips/"},{"title":"Linux Common Commands","url":"/linux-common-commands/"},{"title":"Nodejs Tips","url":"/nodejs-tips/"},{"title":"Postgresql Tips","url":"/postgresql-tips/"},{"title":"Rust Tips","url":"/rust-tips/"},{"title":"Vim Tips","url":"/vim-tips/"},{"title":"VS Code Tips","url":"/vscode-tips/"},{"title":"Go Template Tips","url":"/go-template-tips/"}]},{"title":"Todo","type":"tag","url":"/tags/todo/","items":[{"title":"2022 Goals","url":"/goals-2022/"},{"title":"Todos","url":"/todo/"},{"title":"2021 Goals","url":"/goals-2021/"}]},{"title":"Tools","type":"tag","url":"/tags/tools/","items":[{"title":"Awesome Command Tools","url":"/awesome-cli/"},{"title":"Awesome Editors","url":"/awesome-editors/"},{"title":"Awesome Free","url":"/awesome-free/"},{"title":"Awesome Notes","url":"/awesome-notes/"},{"title":"Awesome Self-hosted","url":"/awesome-selfhosted/"},{"title":"Awesome SEO Tools","url":"/awesome-seo/"},{"title":"Awesome Startups","url":"/awesome-startups/"},{"title":"æœ€å¥½ç”¨çš„å·¥å…·é›†åˆ","url":"/awesome-tools/"},{"title":"æ”¶é›†ä¸€äº›æœ‰æ„æ€çš„ç½‘ç«™","url":"/awesome-websites/"},{"title":"æ”¶é›†Windowsä¸Šå¥½ç©ï¼Œå¥½ç”¨çš„ä¸œè¥¿","url":"/awesome-windows/"}]},{"title":"Torrents","type":"tag","url":"/tags/torrents/","items":[{"title":"Jackett Setup","url":"/jackett-setup/"},{"title":"qBittorrent setup for Debian","url":"/qbittorrent-setup-for-debian/"}]},{"title":"Travel","type":"tag","url":"/tags/travel/","items":[{"title":"æ—…è¡Œæ‰‹ç»­","url":"/travel-approvals/"}]},{"title":"Trends","type":"tag","url":"/tags/trends/","items":[{"title":"äº’è”ç½‘ç›®å½•æ±‡æ€»","url":"/awesome-indexes/"}]},{"title":"Tweet","type":"tag","url":"/tags/tweet/","items":[{"title":"æ‰€æ€æ‰€æƒ³","url":"/thoughts/"}]},{"title":"UI","type":"tag","url":"/tags/ui/","items":[{"title":"Awesome UI","url":"/awesome-ui/"}]},{"title":"URL","type":"tag","url":"/tags/url/","items":[{"title":"Common URL Scheme","url":"/common-url-scheme/"}]},{"title":"VS Code","type":"tag","url":"/tags/vs-code/","items":[{"title":"VS Code Tips","url":"/vscode-tips/"}]},{"title":"Vim","type":"tag","url":"/tags/vim/","items":[{"title":"Vim Tips","url":"/vim-tips/"}]},{"title":"Wikipedia","type":"tag","url":"/tags/wikipedia/","items":[{"title":"æ”¶å½•ä¸€äº›æœ‰æ„æ€çš„ç»´åŸºç™¾ç§‘","url":"/awesome-wikipedia/"}]},{"title":"Windows","type":"tag","url":"/tags/windows/","items":[{"title":"æ”¶é›†Windowsä¸Šå¥½ç©ï¼Œå¥½ç”¨çš„ä¸œè¥¿","url":"/awesome-windows/"}]},{"title":"Wish","type":"tag","url":"/tags/wish/","items":[{"title":"æƒ³ä¹°çš„ä¸œè¥¿åˆ—è¡¨","url":"/wish-lists/"}]},{"title":"Workflows","type":"tag","url":"/tags/workflows/","items":[{"title":"Awesome workflows","url":"/awesome-workflows/"},{"title":"Git workflows","url":"/git-workflows/"},{"title":"Nodejs Monorepo","url":"/nodejs-monorepo/"}]},{"title":"Writing","type":"tag","url":"/tags/writing/","items":[{"title":"å¦‚ä½•å†™ä½œï¼Ÿ","url":"/how-to-write/"}]},{"title":"Year2021","type":"tag","url":"/tags/year-2021/","items":[{"title":"2021å¹´çš„ä¸€äº›è®°å½•","url":"/journal-2021/"},{"title":"2021 Goals","url":"/goals-2021/"}]},{"title":"Year2022","type":"tag","url":"/tags/year-2022/","items":[{"title":"2022 Goals","url":"/goals-2022/"},{"title":"2022å¹´çš„ä¸€äº›è®°å½•","url":"/journal-2022/"}]},{"title":"Youtube","type":"tag","url":"/tags/youtube/","items":[{"title":"Youtube Download","url":"/youtube-download/"}]},{"title":"depression","type":"tag","url":"/tags/depression/","items":[{"title":"æŠ‘éƒç—‡ç›¸å…³èµ„æ–™æ±‡æ€»","url":"/depression/"}]},{"title":"mac","type":"tag","url":"/tags/mac/","items":[{"title":"Mac Setup","url":"/mac-setup/"}]},{"title":"qBittorrent","type":"tag","url":"/tags/q-bittorrent/","items":[{"title":"qBittorrent setup for Debian","url":"/qbittorrent-setup-for-debian/"}]},{"title":"setup","type":"tag","url":"/tags/setup/","items":[{"title":"Mac Setup","url":"/mac-setup/"}]},{"title":"ä¸­æ–‡","type":"tag","url":"/tags/ä¸­æ–‡/","items":[{"title":"æœ‰æ„æ€çš„é—®é¢˜æ”¶é›†","url":"/awesome-answers/"},{"title":"æ”¶é›†ä¸€äº›æœ‰æ„æ€çš„ç¤¾åŒº","url":"/awesome-communities/"},{"title":"æœ‰è¶£çš„æ•°æ®","url":"/awesome-data/"},{"title":"æ”¶é›† Javascript é‡Œå¥½ç”¨çš„åº“","url":"/awesome-js/"},{"title":"å€¼å¾—è§‚çœ‹çš„ç”µå½±","url":"/awesome-movies/"},{"title":"æ”¶é›†å‘äººæ·±çœçš„è¯","url":"/awesome-quotes/"},{"title":"æœ€å¥½ç”¨çš„å·¥å…·é›†åˆ","url":"/awesome-tools/"},{"title":"åˆ’çº¿çš„ç”µè§†å‰§æˆªå›¾","url":"/awesome-tv-quotes/"},{"title":"å€¼å¾—è§‚çœ‹çš„ç”µè§†å‰§","url":"/awesome-tv-shows/"},{"title":"æ”¶é›†ä¸€äº›æœ‰æ„æ€çš„ç½‘ç«™","url":"/awesome-websites/"},{"title":"æ”¶é›†Windowsä¸Šå¥½ç©ï¼Œå¥½ç”¨çš„ä¸œè¥¿","url":"/awesome-windows/"},{"title":"2022å¹´è¯»ä¹¦ç¬”è®°","url":"/books-2022/"},{"title":"è¯»ä¹¦ç¬”è®°","url":"/books/"},{"title":"æ”¶é›†å¸¸ç”¨GitæŠ€å·§","url":"/git-tips/"},{"title":"Licenseæ¯”è¾ƒ","url":"/license-comparison/"},{"title":"ç”µå½±ç¬”è®°","url":"/movies/"},{"title":"æ—…è¡Œæ‰‹ç»­","url":"/travel-approvals/"},{"title":"ç”µè§†å‰§ç¬”è®°","url":"/tv-shows/"}]},{"title":"å†·çŸ¥è¯†","type":"tag","url":"/tags/å†·çŸ¥è¯†/","items":[{"title":"å†·çŸ¥è¯†","url":"/trivia/"}]}],"latestPosts":[{"fields":{"slug":"/movies/","title":"ç”µå½±ç¬”è®°","lastUpdatedAt":"2022-03-13T09:09:29.000Z","lastUpdated":"3/13/2022"},"frontmatter":{"draft":false,"tags":["Movies","Notes","ä¸­æ–‡"]}},{"fields":{"slug":"/tv-shows/","title":"ç”µè§†å‰§ç¬”è®°","lastUpdatedAt":"2022-03-13T09:09:29.000Z","lastUpdated":"3/13/2022"},"frontmatter":{"draft":false,"tags":["TV","Notes","ä¸­æ–‡"]}},{"fields":{"slug":"/awesome-quotes/","title":"æ”¶é›†å‘äººæ·±çœçš„è¯","lastUpdatedAt":"2022-03-12T18:11:51.000Z","lastUpdated":"3/12/2022"},"frontmatter":{"draft":false,"tags":["Awesome","Quotes","ä¸­æ–‡"]}},{"fields":{"slug":"/thoughts/","title":"æ‰€æ€æ‰€æƒ³","lastUpdatedAt":"2022-03-12T10:59:12.000Z","lastUpdated":"3/12/2022"},"frontmatter":{"draft":false,"tags":["Thinking","Tweet"]}},{"fields":{"slug":"/books-2022/","title":"2022å¹´è¯»ä¹¦ç¬”è®°","lastUpdatedAt":"2022-03-12T09:54:40.000Z","lastUpdated":"3/12/2022"},"frontmatter":{"draft":false,"tags":["Books","Notes","ä¸­æ–‡"]}},{"fields":{"slug":"/books/","title":"è¯»ä¹¦ç¬”è®°","lastUpdatedAt":"2022-03-12T09:54:40.000Z","lastUpdated":"3/12/2022"},"frontmatter":{"draft":false,"tags":["Books","Notes","ä¸­æ–‡"]}},{"fields":{"slug":"/awesome-answers/","title":"æœ‰æ„æ€çš„é—®é¢˜æ”¶é›†","lastUpdatedAt":"2022-03-11T17:03:26.000Z","lastUpdated":"3/11/2022"},"frontmatter":{"draft":false,"tags":["Awesome","FAQ","Answer","ä¸­æ–‡","Ask"]}},{"fields":{"slug":"/awesome-articles/","title":"å€¼å¾—ä¸€çœ‹çš„æ–‡ç« åˆ—è¡¨","lastUpdatedAt":"2022-03-11T13:57:22.000Z","lastUpdated":"3/11/2022"},"frontmatter":{"draft":false,"tags":["Awesome","Articles"]}},{"fields":{"slug":"/awesome-sources/","title":"æ¢ç´¢äº’è”ç½‘ä¸Šé«˜è´¨é‡çš„å†…å®¹","lastUpdatedAt":"2022-03-11T06:11:57.000Z","lastUpdated":"3/11/2022"},"frontmatter":{"draft":false,"tags":["Awesome","Explore","Sources"]}},{"fields":{"slug":"/","title":"Everything I Know by Owen","lastUpdatedAt":"2022-03-10T17:07:06.000Z","lastUpdated":"3/10/2022"},"frontmatter":{"draft":false,"tags":["Me"]}},{"fields":{"slug":"/awesome-browsers/","title":"Awesome Browsers","lastUpdatedAt":"2022-03-10T16:43:18.000Z","lastUpdated":"3/10/2022"},"frontmatter":{"draft":false,"tags":["Awesome","Browser"]}},{"fields":{"slug":"/satire-quotes/","title":"è®½åˆºè¨€è®ºæ”¶é›†","lastUpdatedAt":"2022-03-10T10:31:57.000Z","lastUpdated":"3/10/2022"},"frontmatter":{"draft":false,"tags":["Satire"]}},{"fields":{"slug":"/awesome-indexes/","title":"äº’è”ç½‘ç›®å½•æ±‡æ€»","lastUpdatedAt":"2022-03-09T08:25:23.000Z","lastUpdated":"3/9/2022"},"frontmatter":{"draft":false,"tags":["Awesome","Indexes","Trends"]}},{"fields":{"slug":"/awesome-ui/","title":"Awesome UI","lastUpdatedAt":"2022-03-09T07:54:15.000Z","lastUpdated":"3/9/2022"},"frontmatter":{"draft":false,"tags":["Awesome","UI","Front-End"]}},{"fields":{"slug":"/about/","title":"About Me and the Wiki","lastUpdatedAt":"2022-03-08T11:45:37.000Z","lastUpdated":"3/8/2022"},"frontmatter":{"draft":false,"tags":["Me"]}}]}},
    "staticQueryHashes": ["2230547434","2320115945","3495835395","451533639"]}