{
    "componentChunkName": "component---node-modules-gatsby-theme-primer-wiki-src-templates-post-query-js",
    "path": "/awesome-rust/",
    "result": {"data":{"mdx":{"id":"3e9d4b1a-084f-51a5-8956-3f5a5827ab97","tableOfContents":{"items":[{"url":"#resources","title":"Resources"},{"url":"#answeres","title":"Answeres"},{"url":"#communities","title":"Communities"},{"url":"#tools","title":"Tools"},{"url":"#libraries","title":"Libraries"},{"url":"#projects","title":"Projects"},{"url":"#applications","title":"Applications"},{"url":"#criticism","title":"Criticism"},{"url":"#jobs","title":"Jobs"}]},"fields":{"title":"Awesome Rust","slug":"/awesome-rust/","url":"https://wiki.owenyoung.com/awesome-rust/","editUrl":"https://github.com/theowenyoung/wiki/tree/main/awesome-rust.md","lastUpdatedAt":"2021-09-21T15:16:07.000Z","lastUpdated":"9/21/2021","gitCreatedAt":"2021-09-05T10:08:42.000Z","shouldShowTitle":true},"frontmatter":{"title":"Awesome Rust","description":null,"imageAlt":null,"tags":["Awesome","Rust","Learning"],"date":null,"dateModified":null,"language":null,"seoTitle":null,"image":null},"body":"var _excluded = [\"components\"];\n\nfunction _extends() { _extends = Object.assign || function (target) { for (var i = 1; i < arguments.length; i++) { var source = arguments[i]; for (var key in source) { if (Object.prototype.hasOwnProperty.call(source, key)) { target[key] = source[key]; } } } return target; }; return _extends.apply(this, arguments); }\n\nfunction _objectWithoutProperties(source, excluded) { if (source == null) return {}; var target = _objectWithoutPropertiesLoose(source, excluded); var key, i; if (Object.getOwnPropertySymbols) { var sourceSymbolKeys = Object.getOwnPropertySymbols(source); for (i = 0; i < sourceSymbolKeys.length; i++) { key = sourceSymbolKeys[i]; if (excluded.indexOf(key) >= 0) continue; if (!Object.prototype.propertyIsEnumerable.call(source, key)) continue; target[key] = source[key]; } } return target; }\n\nfunction _objectWithoutPropertiesLoose(source, excluded) { if (source == null) return {}; var target = {}; var sourceKeys = Object.keys(source); var key, i; for (i = 0; i < sourceKeys.length; i++) { key = sourceKeys[i]; if (excluded.indexOf(key) >= 0) continue; target[key] = source[key]; } return target; }\n\n/* @jsxRuntime classic */\n\n/* @jsx mdx */\nvar _frontmatter = {\n  \"title\": \"Awesome Rust\",\n  \"tags\": [\"Awesome\", \"Rust\", \"Learning\"]\n};\nvar layoutProps = {\n  _frontmatter: _frontmatter\n};\nvar MDXLayout = \"wrapper\";\nreturn function MDXContent(_ref) {\n  var components = _ref.components,\n      props = _objectWithoutProperties(_ref, _excluded);\n\n  return mdx(MDXLayout, _extends({}, layoutProps, props, {\n    components: components,\n    mdxType: \"MDXLayout\"\n  }), mdx(\"p\", null, \"Curating awesome rust resources.\"), mdx(\"h2\", {\n    \"id\": \"resources\"\n  }, \"Resources\"), mdx(\"ul\", null, mdx(\"li\", {\n    parentName: \"ul\"\n  }, mdx(\"a\", {\n    parentName: \"li\",\n    \"href\": \"https://github.com/Dhghomon/easy_rust\"\n  }, \"Easy Rust\"), \" - A book that let you learn rust easy, rust explained using easy English, for non-English native.\", mdx(\"ul\", {\n    parentName: \"li\"\n  }, mdx(\"li\", {\n    parentName: \"ul\"\n  }, mdx(\"a\", {\n    parentName: \"li\",\n    \"href\": \"https://kumakichi.github.io/easy_rust_chs/Chapter_0.html\"\n  }, \"\\u4E2D\\u6587\\u7248\")))), mdx(\"li\", {\n    parentName: \"ul\"\n  }, mdx(\"a\", {\n    parentName: \"li\",\n    \"href\": \"https://github.com/rust-lang/rustlings/\"\n  }, \"rustlings\"), \" - \\uD83E\\uDD80 Small exercises to get you used to reading and writing Rust code!\", mdx(\"ul\", {\n    parentName: \"li\"\n  }, mdx(\"li\", {\n    parentName: \"ul\"\n  }, mdx(\"a\", {\n    parentName: \"li\",\n    \"href\": \"https://egghead.io/courses/learning-rust-by-solving-the-rustlings-exercises-a722\"\n  }, \"Learning Rust by Working Through the Rustlings Exercises\")))), mdx(\"li\", {\n    parentName: \"ul\"\n  }, mdx(\"a\", {\n    parentName: \"li\",\n    \"href\": \"https://github.com/Mercateo/rust-for-node-developers\"\n  }, \"GitHub - Mercateo/rust-for-node-developers: An introduction to the Rust programming language for Node developers.\")), mdx(\"li\", {\n    parentName: \"ul\"\n  }, mdx(\"a\", {\n    parentName: \"li\",\n    \"href\": \"https://doc.rust-lang.org/rust-by-example/index.html\"\n  }, \"Rust by Example\")), mdx(\"li\", {\n    parentName: \"ul\"\n  }, mdx(\"a\", {\n    parentName: \"li\",\n    \"href\": \"https://github.com/ctjhoa/rust-learning\"\n  }, \"rust-learning\"), \" - A bunch of links to blog posts, articles, videos, etc for learning Rust\"), mdx(\"li\", {\n    parentName: \"ul\"\n  }, mdx(\"a\", {\n    parentName: \"li\",\n    \"href\": \"https://github.com/rust-lang-nursery/rust-cookbook\"\n  }, \"rust cookbook\"), \" - This Rust Cookbook is a collection of simple Rust examples that demonstrate good practices to accomplish common programming tasks, using the crates of the Rust ecosystem.\"), mdx(\"li\", {\n    parentName: \"ul\"\n  }, mdx(\"a\", {\n    parentName: \"li\",\n    \"href\": \"https://github.com/rust-unofficial/patterns\"\n  }, \"Rust Design Patterns\"), \" - A catalogue of Rust design patterns, anti-patterns and idioms\"), mdx(\"li\", {\n    parentName: \"ul\"\n  }, mdx(\"a\", {\n    parentName: \"li\",\n    \"href\": \"https://docs.microsoft.com/en-us/learn/paths/rust-first-steps/\"\n  }, \"Microsoft Rust First Class\"), mdx(\"ul\", {\n    parentName: \"li\"\n  }, mdx(\"li\", {\n    parentName: \"ul\"\n  }, mdx(\"a\", {\n    parentName: \"li\",\n    \"href\": \"https://docs.microsoft.com/zh-cn/learn/paths/rust-first-steps/\"\n  }, \"\\u4E2D\\u6587\\u7248\")))), mdx(\"li\", {\n    parentName: \"ul\"\n  }, mdx(\"a\", {\n    parentName: \"li\",\n    \"href\": \"https://github.com/TaKO8Ki/awesome-alternatives-in-rust\"\n  }, \"awesome-alternatives-in-rust\"), \" - A curated list of replacements for existing software written in Rust\"), mdx(\"li\", {\n    parentName: \"ul\"\n  }, mdx(\"a\", {\n    parentName: \"li\",\n    \"href\": \"https://cheats.rs/\"\n  }, \"Rust Language Cheat Sheet\")), mdx(\"li\", {\n    parentName: \"ul\"\n  }, mdx(\"a\", {\n    parentName: \"li\",\n    \"href\": \"https://github.com/dtolnay/proc-macro-workshop\"\n  }, \"Rust Latam: learn procedural macros workshop\")), mdx(\"li\", {\n    parentName: \"ul\"\n  }, mdx(\"a\", {\n    parentName: \"li\",\n    \"href\": \"https://blog.cloudflare.com/workers-rust-sdk/\"\n  }, \"Native Rust support on Cloudflare Workers\"))), mdx(\"h2\", {\n    \"id\": \"answeres\"\n  }, \"Answeres\"), mdx(\"ul\", null, mdx(\"li\", {\n    parentName: \"ul\"\n  }, mdx(\"a\", {\n    parentName: \"li\",\n    \"href\": \"https://zhuanlan.zhihu.com/p/123278299\"\n  }, \"\\u3010\\u7FFB\\u8BD1\\u3011 Rust \\u4E2D\\u7684 String \\u548C&str\")), mdx(\"li\", {\n    parentName: \"ul\"\n  }, mdx(\"a\", {\n    parentName: \"li\",\n    \"href\": \"https://zhuanlan.zhihu.com/p/115651233\"\n  }, \"\\u3010\\u7FFB\\u8BD1\\u3011\\u7EC6\\u8C08 Rust \\u7684\\u6240\\u6709\\u6743\")), mdx(\"li\", {\n    parentName: \"ul\"\n  }, mdx(\"a\", {\n    parentName: \"li\",\n    \"href\": \"https://kaisery.github.io/trpl-zh-cn/\"\n  }, \"Rust \\u7A0B\\u5E8F\\u8BBE\\u8BA1\\u8BED\\u8A00\\u4E2D\\u6587\\u7248\")), mdx(\"li\", {\n    parentName: \"ul\"\n  }, mdx(\"a\", {\n    parentName: \"li\",\n    \"href\": \"https://zhuanlan.zhihu.com/p/356427780\"\n  }, \"\\u3010\\u8BD1\\u3011Rust \\u5B8F\\uFF1A\\u6559\\u7A0B\\u4E0E\\u793A\\u4F8B\\uFF08\\u4E8C\\uFF09\"))), mdx(\"h2\", {\n    \"id\": \"communities\"\n  }, \"Communities\"), mdx(\"ul\", null, mdx(\"li\", {\n    parentName: \"ul\"\n  }, mdx(\"a\", {\n    parentName: \"li\",\n    \"href\": \"https://www.reddit.com/r/rust/top/?t=year\"\n  }, \"Rust Reddit\"))), mdx(\"h2\", {\n    \"id\": \"tools\"\n  }, \"Tools\"), mdx(\"ul\", null, mdx(\"li\", {\n    parentName: \"ul\"\n  }, mdx(\"a\", {\n    parentName: \"li\",\n    \"href\": \"https://github.com/cargo-generate/cargo-generate\"\n  }, \"cargo-generate\"), \" - cargo, make me a project\"), mdx(\"li\", {\n    parentName: \"ul\"\n  }, mdx(\"a\", {\n    parentName: \"li\",\n    \"href\": \"https://github.com/rustwasm/wasm-pack\"\n  }, \"wasm-pack\"), \" - your favorite rust -> wasm workflow tool!\"), mdx(\"li\", {\n    parentName: \"ul\"\n  }, mdx(\"a\", {\n    parentName: \"li\",\n    \"href\": \"https://github.com/Byron/gitoxide\"\n  }, \"gitoxide\"), \" - Git in Rust\"), mdx(\"li\", {\n    parentName: \"ul\"\n  }, mdx(\"a\", {\n    parentName: \"li\",\n    \"href\": \"https://github.com/watchexec/cargo-watch\"\n  }, \"Cargo Watch\"), \" - Cargo watch, hot reload rust.\")), mdx(\"h2\", {\n    \"id\": \"libraries\"\n  }, \"Libraries\"), mdx(\"ul\", null, mdx(\"li\", {\n    parentName: \"ul\"\n  }, mdx(\"a\", {\n    parentName: \"li\",\n    \"href\": \"https://github.com/bevyengine/bevy\"\n  }, \"bevy\"), \" - \\u6E38\\u620F\\u5F15\\u64CE\"), mdx(\"li\", {\n    parentName: \"ul\"\n  }, mdx(\"a\", {\n    parentName: \"li\",\n    \"href\": \"https://github.com/tokio-rs/tokio\"\n  }, \"tokio\"), \" - A runtime for writing reliable, asynchronous, and slim applications with the Rust programming language\"), mdx(\"li\", {\n    parentName: \"ul\"\n  }, mdx(\"a\", {\n    parentName: \"li\",\n    \"href\": \"https://github.com/SergioBenitez/Rocket\"\n  }, \"Rocket\"), \" - A web framework for Rust.\"), mdx(\"li\", {\n    parentName: \"ul\"\n  }, mdx(\"a\", {\n    parentName: \"li\",\n    \"href\": \"https://github.com/tokio-rs/axum\"\n  }, \"axum\"), \" - web framework\"), mdx(\"li\", {\n    parentName: \"ul\"\n  }, mdx(\"a\", {\n    parentName: \"li\",\n    \"href\": \"https://github.com/linebender/druid\"\n  }, \"A data-first Rust-native UI toolkit. Druid\"), \" - A data-first Rust-native UI design toolkit.\"), mdx(\"li\", {\n    parentName: \"ul\"\n  }, mdx(\"a\", {\n    parentName: \"li\",\n    \"href\": \"https://github.com/mandreyel/cratetorrent\"\n  }, \"cratetorrent\"), \" - A BitTorrent V1 engine library for Rust (and currently Linux) #Torrents\"), mdx(\"li\", {\n    parentName: \"ul\"\n  }, mdx(\"a\", {\n    parentName: \"li\",\n    \"href\": \"https://github.com/emilk/egui\"\n  }, \"egui\"), \" - GUI library in Rust\"), mdx(\"li\", {\n    parentName: \"ul\"\n  }, mdx(\"a\", {\n    parentName: \"li\",\n    \"href\": \"https://github.com/TeXitoi/structopt\"\n  }, \"structopt\"), \" - Parse command line arguments by defining a struct. It combines clap with custom derive.\"), mdx(\"li\", {\n    parentName: \"ul\"\n  }, mdx(\"a\", {\n    parentName: \"li\",\n    \"href\": \"https://github.com/telegram-rs/telegram-bot\"\n  }, \"telegram-bot\"), \" - Rust Library for creating a Telegram Bot\"), mdx(\"li\", {\n    parentName: \"ul\"\n  }, mdx(\"a\", {\n    parentName: \"li\",\n    \"href\": \"https://github.com/dtolnay/anyhow\"\n  }, \"anyhow\"), \" - General error handle\"), mdx(\"li\", {\n    parentName: \"ul\"\n  }, mdx(\"a\", {\n    parentName: \"li\",\n    \"href\": \"https://github.com/dtolnay/thiserror\"\n  }, \"thiserror\"), \" - Specific error handle\"), mdx(\"li\", {\n    parentName: \"ul\"\n  }, mdx(\"a\", {\n    parentName: \"li\",\n    \"href\": \"https://github.com/ayrat555/frankenstein\"\n  }, \"frankenstein\"), \" - telegram bot api\"), mdx(\"li\", {\n    parentName: \"ul\"\n  }, mdx(\"a\", {\n    parentName: \"li\",\n    \"href\": \"https://github.com/mehcode/config-rs\"\n  }, \"config-rs\"), \" - Default config for rs\")), mdx(\"h2\", {\n    \"id\": \"projects\"\n  }, \"Projects\"), mdx(\"ul\", null, mdx(\"li\", {\n    parentName: \"ul\"\n  }, mdx(\"a\", {\n    parentName: \"li\",\n    \"href\": \"https://github.com/tokio-rs/mini-redis/\"\n  }, \"mini-redis\"), \" - based on tokio, redis example\")), mdx(\"h2\", {\n    \"id\": \"applications\"\n  }, \"Applications\"), mdx(\"ul\", null, mdx(\"li\", {\n    parentName: \"ul\"\n  }, mdx(\"a\", {\n    parentName: \"li\",\n    \"href\": \"https://github.com/max-niederman/ttyper\"\n  }, \"ttyper\"), \" - Terminal-based typing test.\"), mdx(\"li\", {\n    parentName: \"ul\"\n  }, mdx(\"a\", {\n    parentName: \"li\",\n    \"href\": \"https://github.com/TaKO8Ki/gobang\"\n  }, \"gobang\"), \" - A cross-platform TUI database management tool written in Rust\")), mdx(\"h2\", {\n    \"id\": \"criticism\"\n  }, \"Criticism\"), mdx(\"ul\", null, mdx(\"li\", {\n    parentName: \"ul\"\n  }, mdx(\"a\", {\n    parentName: \"li\",\n    \"href\": \"https://matklad.github.io/2020/09/20/why-not-rust.html\"\n  }, \"Why not Rust\"))), mdx(\"h2\", {\n    \"id\": \"jobs\"\n  }, \"Jobs\"), mdx(\"ul\", null, mdx(\"li\", {\n    parentName: \"ul\"\n  }, mdx(\"a\", {\n    parentName: \"li\",\n    \"href\": \"https://rust.careers/\"\n  }, \"Rust Careers\"))));\n}\n;\nMDXContent.isMDXComponent = true;","rawBody":"---\ntitle: Awesome Rust\ntags:\n  - Awesome\n  - Rust\n  - Learning\n---\n\nCurating awesome rust resources.\n\n## Resources\n\n- [Easy Rust](https://github.com/Dhghomon/easy_rust) - A book that let you learn rust easy, rust explained using easy English, for non-English native.\n  - [ä¸­æ–‡ç‰ˆ](https://kumakichi.github.io/easy_rust_chs/Chapter_0.html)\n- [rustlings](https://github.com/rust-lang/rustlings/) - ğŸ¦€ Small exercises to get you used to reading and writing Rust code!\n  - [Learning Rust by Working Through the Rustlings Exercises](https://egghead.io/courses/learning-rust-by-solving-the-rustlings-exercises-a722)\n- [GitHub - Mercateo/rust-for-node-developers: An introduction to the Rust programming language for Node developers.](https://github.com/Mercateo/rust-for-node-developers)\n- [Rust by Example](https://doc.rust-lang.org/rust-by-example/index.html)\n- [rust-learning](https://github.com/ctjhoa/rust-learning) - A bunch of links to blog posts, articles, videos, etc for learning Rust\n- [rust cookbook](https://github.com/rust-lang-nursery/rust-cookbook) - This Rust Cookbook is a collection of simple Rust examples that demonstrate good practices to accomplish common programming tasks, using the crates of the Rust ecosystem.\n- [Rust Design Patterns](https://github.com/rust-unofficial/patterns) - A catalogue of Rust design patterns, anti-patterns and idioms\n- [Microsoft Rust First Class](https://docs.microsoft.com/en-us/learn/paths/rust-first-steps/)\n  - [ä¸­æ–‡ç‰ˆ](https://docs.microsoft.com/zh-cn/learn/paths/rust-first-steps/)\n- [awesome-alternatives-in-rust](https://github.com/TaKO8Ki/awesome-alternatives-in-rust) - A curated list of replacements for existing software written in Rust\n- [Rust Language Cheat Sheet](https://cheats.rs/)\n- [Rust Latam: learn procedural macros workshop](https://github.com/dtolnay/proc-macro-workshop)\n- [Native Rust support on Cloudflare Workers](https://blog.cloudflare.com/workers-rust-sdk/)\n\n## Answeres\n\n- [ã€ç¿»è¯‘ã€‘ Rust ä¸­çš„ String å’Œ&str](https://zhuanlan.zhihu.com/p/123278299)\n- [ã€ç¿»è¯‘ã€‘ç»†è°ˆ Rust çš„æ‰€æœ‰æƒ](https://zhuanlan.zhihu.com/p/115651233)\n- [Rust ç¨‹åºè®¾è®¡è¯­è¨€ä¸­æ–‡ç‰ˆ](https://kaisery.github.io/trpl-zh-cn/)\n- [ã€è¯‘ã€‘Rust å®ï¼šæ•™ç¨‹ä¸ç¤ºä¾‹ï¼ˆäºŒï¼‰](https://zhuanlan.zhihu.com/p/356427780)\n\n## Communities\n\n- [Rust Reddit](https://www.reddit.com/r/rust/top/?t=year)\n\n## Tools\n\n- [cargo-generate](https://github.com/cargo-generate/cargo-generate) - cargo, make me a project\n- [wasm-pack](https://github.com/rustwasm/wasm-pack) - your favorite rust -> wasm workflow tool!\n- [gitoxide](https://github.com/Byron/gitoxide) - Git in Rust\n- [Cargo Watch](https://github.com/watchexec/cargo-watch) - Cargo watch, hot reload rust.\n\n## Libraries\n\n- [bevy](https://github.com/bevyengine/bevy) - æ¸¸æˆå¼•æ“\n- [tokio](https://github.com/tokio-rs/tokio) - A runtime for writing reliable, asynchronous, and slim applications with the Rust programming language\n- [Rocket](https://github.com/SergioBenitez/Rocket) - A web framework for Rust.\n- [axum](https://github.com/tokio-rs/axum) - web framework\n- [A data-first Rust-native UI toolkit. Druid](https://github.com/linebender/druid) - A data-first Rust-native UI design toolkit.\n- [cratetorrent](https://github.com/mandreyel/cratetorrent) - A BitTorrent V1 engine library for Rust (and currently Linux) #Torrents\n- [egui](https://github.com/emilk/egui) - GUI library in Rust\n- [structopt](https://github.com/TeXitoi/structopt) - Parse command line arguments by defining a struct. It combines clap with custom derive.\n- [telegram-bot](https://github.com/telegram-rs/telegram-bot) - Rust Library for creating a Telegram Bot\n- [anyhow](https://github.com/dtolnay/anyhow) - General error handle\n- [thiserror](https://github.com/dtolnay/thiserror) - Specific error handle\n- [frankenstein](https://github.com/ayrat555/frankenstein) - telegram bot api\n- [config-rs](https://github.com/mehcode/config-rs) - Default config for rs\n\n## Projects\n\n- [mini-redis](https://github.com/tokio-rs/mini-redis/) - based on tokio, redis example\n\n## Applications\n\n- [ttyper](https://github.com/max-niederman/ttyper) - Terminal-based typing test.\n- [gobang](https://github.com/TaKO8Ki/gobang) - A cross-platform TUI database management tool written in Rust\n\n## Criticism\n\n- [Why not Rust](https://matklad.github.io/2020/09/20/why-not-rust.html)\n\n## Jobs\n\n- [Rust Careers](https://rust.careers/)\n","excerpt":"Curating awesome rust resources. Resources Easy Rust  - A book that let you learn rust easy, rust explained using easy English, for non-Engâ€¦","outboundReferences":[],"inboundReferences":[]},"tagsOutbound":{"nodes":[{"frontmatter":{"title":"Awesome Algorithm","tags":["Awesome","Algorithm","Recommend"]},"fields":{"slug":"/awesome-algorithm/","title":"Awesome Algorithm","lastUpdated":"9/5/2021","lastUpdatedAt":"2021-09-05T06:09:14.000Z","gitCreatedAt":"2021-09-05T06:09:14.000Z"}},{"frontmatter":{"title":"Awesome Alternatives","tags":["Awesome","Alternatives"]},"fields":{"slug":"/awesome-alternatives/","title":"Awesome Alternatives","lastUpdated":"9/23/2021","lastUpdatedAt":"2021-09-23T18:12:56.000Z","gitCreatedAt":"2021-09-12T18:29:05.000Z"}},{"frontmatter":{"title":"æœ‰æ„æ€çš„é—®é¢˜æ”¶é›†","tags":["Awesome","FAQ","Answer","ä¸­æ–‡"]},"fields":{"slug":"/awesome-answers/","title":"æœ‰æ„æ€çš„é—®é¢˜æ”¶é›†","lastUpdated":"9/13/2021","lastUpdatedAt":"2021-09-13T11:34:16.000Z","gitCreatedAt":"2021-09-05T04:49:34.000Z"}},{"frontmatter":{"title":"Awesome Applications","tags":["Awesome","Applications"]},"fields":{"slug":"/awesome-applications/","title":"Awesome Applications","lastUpdated":"9/13/2021","lastUpdatedAt":"2021-09-13T16:02:50.000Z","gitCreatedAt":"2021-09-12T18:29:05.000Z"}},{"frontmatter":{"title":"Awesome Automations","tags":["Awesome","Automations","Self-Hosted"]},"fields":{"slug":"/awesome-automations/","title":"Awesome Automations","lastUpdated":"9/12/2021","lastUpdatedAt":"2021-09-12T07:41:32.000Z","gitCreatedAt":"2021-09-03T05:53:38.000Z"}},{"frontmatter":{"title":"","tags":["Awesome"]},"fields":{"slug":"/awesome-backup/","title":"Awesome Backup","lastUpdated":"8/27/2021","lastUpdatedAt":"2021-08-27T02:25:34.000Z","gitCreatedAt":"2021-08-27T02:25:34.000Z"}},{"frontmatter":{"title":"","tags":["Benchmark","Proxies","Bash","Awesome"]},"fields":{"slug":"/awesome-benchmark/","title":"Awesome Benchmark","lastUpdated":"8/27/2021","lastUpdatedAt":"2021-08-27T02:25:34.000Z","gitCreatedAt":"2021-08-27T02:25:34.000Z"}},{"frontmatter":{"title":"","tags":["Awesome"]},"fields":{"slug":"/awesome-bookmarks/","title":"Awesome Bookmarks","lastUpdated":"8/27/2021","lastUpdatedAt":"2021-08-27T02:25:34.000Z","gitCreatedAt":"2021-08-27T02:25:34.000Z"}},{"frontmatter":{"title":"","tags":["Awesome","Browser"]},"fields":{"slug":"/awesome-browsers/","title":"Awesome Browsers","lastUpdated":"9/12/2021","lastUpdatedAt":"2021-09-12T07:41:32.000Z","gitCreatedAt":"2021-09-04T02:41:10.000Z"}},{"frontmatter":{"title":"","tags":["Awesome","Code","Leaning"]},"fields":{"slug":"/awesome-code-learning/","title":"Awesome Code Learning","lastUpdated":"9/4/2021","lastUpdatedAt":"2021-09-04T07:51:54.000Z","gitCreatedAt":"2021-09-04T07:51:54.000Z"}},{"frontmatter":{"title":"","tags":["Awesome","Communities","Social","ä¸­æ–‡"]},"fields":{"slug":"/awesome-communities/","title":"æ”¶é›†ä¸€äº›æœ‰æ„æ€çš„ç¤¾åŒº","lastUpdated":"9/13/2021","lastUpdatedAt":"2021-09-13T16:02:50.000Z","gitCreatedAt":"2021-09-04T07:51:54.000Z"}},{"frontmatter":{"title":"Awesome Decentralization","tags":["Awesome","Decentralization"]},"fields":{"slug":"/awesome-decentralization/","title":"Awesome Decentralization","lastUpdated":"9/25/2021","lastUpdatedAt":"2021-09-25T06:38:19.000Z","gitCreatedAt":"2021-09-24T11:05:17.000Z"}},{"frontmatter":{"title":"","tags":["Awesome","Editors","Tools"]},"fields":{"slug":"/awesome-editors/","title":"Awesome-Editors","lastUpdated":"9/4/2021","lastUpdatedAt":"2021-09-04T02:41:10.000Z","gitCreatedAt":"2021-09-04T02:41:10.000Z"}},{"frontmatter":{"title":"","tags":["Awesome","English","Learning"]},"fields":{"slug":"/awesome-english-learning/","title":"æ”¶é›†è‹±è¯­å­¦ä¹ å·¥å…·","lastUpdated":"9/22/2021","lastUpdatedAt":"2021-09-22T18:26:49.000Z","gitCreatedAt":"2021-09-04T02:41:10.000Z"}},{"frontmatter":{"title":"","tags":["Awesome","Explore"]},"fields":{"slug":"/awesome-explore/","title":"Awesome Explore","lastUpdated":"9/20/2021","lastUpdatedAt":"2021-09-20T11:35:59.000Z","gitCreatedAt":"2021-09-04T01:08:18.000Z"}},{"frontmatter":{"title":"","tags":["Awesome","Files"]},"fields":{"slug":"/awesome-file-managers/","title":"Awesome File Managers","lastUpdated":"8/27/2021","lastUpdatedAt":"2021-08-27T03:43:35.000Z","gitCreatedAt":"2021-08-27T02:25:34.000Z"}},{"frontmatter":{"title":"Awesome Free","tags":["Free","Awesome","Tools"]},"fields":{"slug":"/awesome-free/","title":"Awesome Free","lastUpdated":"9/4/2021","lastUpdatedAt":"2021-09-04T07:51:54.000Z","gitCreatedAt":"2021-08-29T20:06:24.000Z"}},{"frontmatter":{"title":"","tags":["Awesome"]},"fields":{"slug":"/awesome-gatsby/","title":"Awesome Gatsby","lastUpdated":"8/29/2021","lastUpdatedAt":"2021-08-29T20:06:24.000Z","gitCreatedAt":"2021-08-27T02:25:34.000Z"}},{"frontmatter":{"title":"Awesome Indexes","tags":["Awesome","Indexes","Trends"]},"fields":{"slug":"/awesome-indexes/","title":"Awesome Indexes","lastUpdated":"9/12/2021","lastUpdatedAt":"2021-09-12T10:34:26.000Z","gitCreatedAt":"2021-09-12T10:34:26.000Z"}},{"frontmatter":{"title":"Awesome Interview","tags":["Awesome","Interview"]},"fields":{"slug":"/awesome-interview/","title":"Awesome Interview","lastUpdated":"9/5/2021","lastUpdatedAt":"2021-09-05T04:49:34.000Z","gitCreatedAt":"2021-09-05T04:49:34.000Z"}},{"frontmatter":{"title":"","tags":["Awesome","Investing","Stocks"]},"fields":{"slug":"/awesome-investing/","title":"Awesome Investing","lastUpdated":"9/4/2021","lastUpdatedAt":"2021-09-04T07:51:54.000Z","gitCreatedAt":"2021-09-04T07:51:54.000Z"}},{"frontmatter":{"title":"","tags":["Awesome"]},"fields":{"slug":"/awesome-jackett-indexes/","title":"Awesome Jackett Indexes","lastUpdated":"8/27/2021","lastUpdatedAt":"2021-08-27T02:25:34.000Z","gitCreatedAt":"2021-08-27T02:25:34.000Z"}},{"frontmatter":{"title":"","tags":["Awesome","Javascript","Date"]},"fields":{"slug":"/awesome-js-date/","title":"Awesome JS Date","lastUpdated":"8/27/2021","lastUpdatedAt":"2021-08-27T02:25:34.000Z","gitCreatedAt":"2021-08-27T02:25:34.000Z"}},{"frontmatter":{"title":"æ”¶é›† Javascript é‡Œå¥½ç”¨çš„åº“","tags":["Awesome","Javascript","ä¸­æ–‡"]},"fields":{"slug":"/awesome-js/","title":"æ”¶é›† Javascript é‡Œå¥½ç”¨çš„åº“","lastUpdated":"9/5/2021","lastUpdatedAt":"2021-09-05T06:09:14.000Z","gitCreatedAt":"2021-08-29T20:06:24.000Z"}},{"frontmatter":{"title":"Awesome List","tags":["Awesome","List"]},"fields":{"slug":"/awesome-list/","title":"Awesome List","lastUpdated":"9/12/2021","lastUpdatedAt":"2021-09-12T18:29:05.000Z","gitCreatedAt":"2021-08-29T20:06:24.000Z"}},{"frontmatter":{"title":"å€¼å¾—è§‚çœ‹çš„ç”µå½±","tags":["Movies","Awesome","ä¸­æ–‡"]},"fields":{"slug":"/awesome-movies/","title":"å€¼å¾—è§‚çœ‹çš„ç”µå½±","lastUpdated":"9/3/2021","lastUpdatedAt":"2021-09-03T05:53:38.000Z","gitCreatedAt":"2021-09-03T05:53:38.000Z"}},{"frontmatter":{"title":"Awesome Notes","tags":["Awesome","Notes","Tools"]},"fields":{"slug":"/awesome-notes/","title":"Awesome Notes","lastUpdated":"8/31/2021","lastUpdatedAt":"2021-08-31T04:16:33.000Z","gitCreatedAt":"2021-08-31T00:37:15.000Z"}},{"frontmatter":{"title":"","tags":["Awesome","P2P"]},"fields":{"slug":"/awesome-p2p/","title":"Awesome P2P","lastUpdated":"9/22/2021","lastUpdatedAt":"2021-09-22T18:13:38.000Z","gitCreatedAt":"2021-09-04T07:51:54.000Z"}},{"frontmatter":{"title":"Awesome Privacy","tags":["Awesome","Privacy"]},"fields":{"slug":"/awesome-privacy/","title":"Awesome Privacy","lastUpdated":"9/12/2021","lastUpdatedAt":"2021-09-12T18:29:05.000Z","gitCreatedAt":"2021-09-05T04:49:34.000Z"}},{"frontmatter":{"title":"","tags":["Awesome","Social","Products"]},"fields":{"slug":"/awesome-products/","title":"Awesome Products","lastUpdated":"9/5/2021","lastUpdatedAt":"2021-09-05T04:49:34.000Z","gitCreatedAt":"2021-09-05T04:49:34.000Z"}},{"frontmatter":{"title":"æ”¶é›†å‘äººæ·±çœçš„è¯","tags":["Awesome","Quotes","ä¸­æ–‡"]},"fields":{"slug":"/awesome-quotes/","title":"æ”¶é›†å‘äººæ·±çœçš„è¯","lastUpdated":"9/13/2021","lastUpdatedAt":"2021-09-13T11:34:16.000Z","gitCreatedAt":"2021-09-05T04:49:34.000Z"}},{"frontmatter":{"title":"Awesome RSS","tags":["RSS","Awesome"]},"fields":{"slug":"/awesome-rss/","title":"Awesome RSS","lastUpdated":"9/25/2021","lastUpdatedAt":"2021-09-25T06:38:19.000Z","gitCreatedAt":"2021-09-25T06:38:19.000Z"}},{"frontmatter":{"title":"Awesome Rust","tags":["Awesome","Rust","Learning"]},"fields":{"slug":"/awesome-rust/","title":"Awesome Rust","lastUpdated":"9/21/2021","lastUpdatedAt":"2021-09-21T15:16:07.000Z","gitCreatedAt":"2021-09-05T10:08:42.000Z"}},{"frontmatter":{"title":"","tags":["Awesome","Self-Hosted","Tools"]},"fields":{"slug":"/awesome-selfhosted/","title":"Awesome Self-hosted","lastUpdated":"9/12/2021","lastUpdatedAt":"2021-09-12T10:34:17.000Z","gitCreatedAt":"2021-09-04T01:08:18.000Z"}},{"frontmatter":{"title":"Awesome SEO Tools","tags":["SEO","Awesome","Tools"]},"fields":{"slug":"/awesome-seo/","title":"Awesome SEO Tools","lastUpdated":"8/30/2021","lastUpdatedAt":"2021-08-30T16:14:42.000Z","gitCreatedAt":"2021-08-30T16:14:42.000Z"}},{"frontmatter":{"title":"Awesome Services","tags":["Awesome","Service"]},"fields":{"slug":"/awesome-service/","title":"Awesome Services","lastUpdated":"9/22/2021","lastUpdatedAt":"2021-09-22T18:13:38.000Z","gitCreatedAt":"2021-09-10T07:25:10.000Z"}},{"frontmatter":{"title":"","tags":["Social","Awesome"]},"fields":{"slug":"/awesome-socials/","title":"æ”¶é›†æœ‰æ„æ€çš„ç¤¾äº¤åº”ç”¨","lastUpdated":"9/23/2021","lastUpdatedAt":"2021-09-23T18:12:56.000Z","gitCreatedAt":"2021-08-27T02:25:34.000Z"}},{"frontmatter":{"title":"Awesome Speed","tags":["Awesome","Speed","Netwok"]},"fields":{"slug":"/awesome-speed/","title":"Awesome Speed","lastUpdated":"9/6/2021","lastUpdatedAt":"2021-09-06T16:52:24.000Z","gitCreatedAt":"2021-09-06T16:52:24.000Z"}},{"frontmatter":{"title":"","tags":["Awesome","Startups","Tools"]},"fields":{"slug":"/awesome-startups/","title":"Awesome Startups","lastUpdated":"9/19/2021","lastUpdatedAt":"2021-09-19T03:42:23.000Z","gitCreatedAt":"2021-09-04T01:08:18.000Z"}},{"frontmatter":{"title":"","tags":["Awesome","Static-Site-Generator"]},"fields":{"slug":"/awesome-static-site-generator/","title":"Awesome Static Site Generator","lastUpdated":"8/27/2021","lastUpdatedAt":"2021-08-27T02:25:34.000Z","gitCreatedAt":"2021-08-27T02:25:34.000Z"}},{"frontmatter":{"title":"æ”¶é›†ä¸€äº›æœ‰ç”¨çš„æŠ€æœ¯/ç¯å¢ƒé—®é¢˜çš„è§£å†³æ–¹æ¡ˆ","tags":["Awesome","FAQ","Tech","Serverless"]},"fields":{"slug":"/awesome-tech-anwser/","title":"æ”¶é›†ä¸€äº›æœ‰ç”¨çš„æŠ€æœ¯/ç¯å¢ƒé—®é¢˜çš„è§£å†³æ–¹æ¡ˆ","lastUpdated":"9/10/2021","lastUpdatedAt":"2021-09-10T09:43:29.000Z","gitCreatedAt":"2021-09-10T09:43:29.000Z"}},{"frontmatter":{"title":"Awesome Templates","tags":["Awesome","Templates"]},"fields":{"slug":"/awesome-templates/","title":"Awesome Templates","lastUpdated":"9/22/2021","lastUpdatedAt":"2021-09-22T15:17:38.000Z","gitCreatedAt":"2021-09-22T15:17:38.000Z"}},{"frontmatter":{"title":"æœ€å¥½ç”¨çš„å·¥å…·é›†åˆ","tags":["Awesome","Tools","ä¸­æ–‡"]},"fields":{"slug":"/awesome-tools/","title":"æœ€å¥½ç”¨çš„å·¥å…·é›†åˆ","lastUpdated":"9/25/2021","lastUpdatedAt":"2021-09-25T09:43:34.000Z","gitCreatedAt":"2021-08-29T20:06:24.000Z"}},{"frontmatter":{"title":"å€¼å¾—è§‚çœ‹çš„ç”µè§†å‰§","tags":["Awesome","TV","List","ä¸­æ–‡"]},"fields":{"slug":"/awesome-tv-shows/","title":"å€¼å¾—è§‚çœ‹çš„ç”µè§†å‰§","lastUpdated":"9/13/2021","lastUpdatedAt":"2021-09-13T11:34:16.000Z","gitCreatedAt":"2021-09-03T05:53:38.000Z"}},{"frontmatter":{"title":"","tags":["Awesome","UI","Front-End"]},"fields":{"slug":"/awesome-ui/","title":"Awesome UI","lastUpdated":"9/11/2021","lastUpdatedAt":"2021-09-11T13:23:45.000Z","gitCreatedAt":"2021-08-27T02:25:34.000Z"}},{"frontmatter":{"title":"æ”¶é›†ä¸€äº›å¥½ç©çš„ç½‘ç«™","tags":["Awesome","Tools","ä¸­æ–‡"]},"fields":{"slug":"/awesome-websites/","title":"æ”¶é›†ä¸€äº›å¥½ç©çš„ç½‘ç«™","lastUpdated":"9/12/2021","lastUpdatedAt":"2021-09-12T18:29:05.000Z","gitCreatedAt":"2021-08-29T20:06:24.000Z"}},{"frontmatter":{"title":"Awesome What Was Your Moment","tags":["Awesome"]},"fields":{"slug":"/awesome-what-was-your-moment/","title":"Awesome What Was Your Moment","lastUpdated":"9/5/2021","lastUpdatedAt":"2021-09-05T10:08:42.000Z","gitCreatedAt":"2021-09-05T10:08:42.000Z"}},{"frontmatter":{"title":"æ”¶é›†Windowsä¸Šå¥½ç©ï¼Œå¥½ç”¨çš„ä¸œè¥¿","tags":["Windows","Awesome","Tools","Development-Environment","ä¸­æ–‡"]},"fields":{"slug":"/awesome-windows/","title":"æ”¶é›†Windowsä¸Šå¥½ç©ï¼Œå¥½ç”¨çš„ä¸œè¥¿","lastUpdated":"9/13/2021","lastUpdatedAt":"2021-09-13T11:34:16.000Z","gitCreatedAt":"2021-08-31T23:51:23.000Z"}},{"frontmatter":{"title":"","tags":["Rust","Debian","Setup"]},"fields":{"slug":"/rust-enviroment-setup-for-debian/","title":"Rust Environment Setup for Debian","lastUpdated":"8/27/2021","lastUpdatedAt":"2021-08-27T02:25:34.000Z","gitCreatedAt":"2021-08-27T02:25:34.000Z"}},{"frontmatter":{"title":"","tags":["Shadowsocks","Rust","Setup","Debian","Proxies"]},"fields":{"slug":"/shadowsocks-rust-setup-for-debian/","title":"Shadowsocks Rust Setup for Debian","lastUpdated":"9/2/2021","lastUpdatedAt":"2021-09-02T08:49:05.000Z","gitCreatedAt":"2021-08-27T02:25:34.000Z"}},{"frontmatter":{"title":"æ”¶é›†è‚¡å¸‚ç›¸å…³çš„èµ„æº","tags":["Awesome","Stocks"]},"fields":{"slug":"/journal/awesome-stocks/","title":"æ”¶é›†è‚¡å¸‚ç›¸å…³çš„èµ„æº","lastUpdated":"9/22/2021","lastUpdatedAt":"2021-09-22T18:13:38.000Z","gitCreatedAt":"2021-09-22T18:13:38.000Z"}}]}},"pageContext":{"tags":["Awesome","Rust","Learning"],"slug":"/awesome-rust/","sidebarItems":[],"tagsGroups":[{"title":"2021-09","type":"tag","url":"/tags/2021-09/","items":[{"title":"Journal Entry, Sunday, September 05, 2021","url":"/journal/daily-note-2021-09-05/"},{"title":"Journal Entry, Friday, September 10, 2021","url":"/journal/daily-note-2021-09-10/"},{"title":"Journal Entry, Saturday, September 11, 2021","url":"/journal/daily-note-2021-09-11/"},{"title":"Journal Entry, Sunday, September 12, 2021","url":"/journal/daily-note-2021-09-12/"},{"title":"Journal Entry, Wednesday, September 15, 2021","url":"/journal/daily-note-2021-09-15/"},{"title":"Journal Entry, Friday, September 17, 2021","url":"/journal/daily-note-2021-09-17/"},{"title":"Journal Entry, Thursday, September 23, 2021","url":"/journal/daily-note-2021-09-23/"}]},{"title":"API","type":"tag","url":"/tags/api/","items":[{"title":"API Tokens","url":"/api-tokens/"}]},{"title":"Algorithm","type":"tag","url":"/tags/algorithm/","items":[{"title":"Awesome Algorithm","url":"/awesome-algorithm/"}]},{"title":"Alternatives","type":"tag","url":"/tags/alternatives/","items":[{"title":"Awesome Alternatives","url":"/awesome-alternatives/"}]},{"title":"Answer","type":"tag","url":"/tags/answer/","items":[{"title":"æœ‰æ„æ€çš„é—®é¢˜æ”¶é›†","url":"/awesome-answers/"}]},{"title":"Applications","type":"tag","url":"/tags/applications/","items":[{"title":"Awesome Applications","url":"/awesome-applications/"}]},{"title":"Approvals","type":"tag","url":"/tags/approvals/","items":[{"title":"æ—…è¡Œæ‰‹ç»­","url":"/travel-approvals/"}]},{"title":"Auth","type":"tag","url":"/tags/auth/","items":[{"title":"API Tokens","url":"/api-tokens/"},{"title":"Auth Gateway","url":"/auth-gateway/"},{"title":"Use ssh key for Git","url":"/git-sshkey/"}]},{"title":"Automations","type":"tag","url":"/tags/automations/","items":[{"title":"Awesome Automations","url":"/awesome-automations/"}]},{"title":"Awesome","type":"tag","url":"/tags/awesome/","items":[{"title":"Awesome Algorithm","url":"/awesome-algorithm/"},{"title":"Awesome Alternatives","url":"/awesome-alternatives/"},{"title":"æœ‰æ„æ€çš„é—®é¢˜æ”¶é›†","url":"/awesome-answers/"},{"title":"Awesome Applications","url":"/awesome-applications/"},{"title":"Awesome Automations","url":"/awesome-automations/"},{"title":"Awesome Backup","url":"/awesome-backup/"},{"title":"Awesome Benchmark","url":"/awesome-benchmark/"},{"title":"Awesome Bookmarks","url":"/awesome-bookmarks/"},{"title":"Awesome Browsers","url":"/awesome-browsers/"},{"title":"Awesome Code Learning","url":"/awesome-code-learning/"},{"title":"æ”¶é›†ä¸€äº›æœ‰æ„æ€çš„ç¤¾åŒº","url":"/awesome-communities/"},{"title":"Awesome Decentralization","url":"/awesome-decentralization/"},{"title":"Awesome-Editors","url":"/awesome-editors/"},{"title":"æ”¶é›†è‹±è¯­å­¦ä¹ å·¥å…·","url":"/awesome-english-learning/"},{"title":"Awesome Explore","url":"/awesome-explore/"},{"title":"Awesome File Managers","url":"/awesome-file-managers/"},{"title":"Awesome Free","url":"/awesome-free/"},{"title":"Awesome Gatsby","url":"/awesome-gatsby/"},{"title":"Awesome Indexes","url":"/awesome-indexes/"},{"title":"Awesome Interview","url":"/awesome-interview/"},{"title":"Awesome Investing","url":"/awesome-investing/"},{"title":"Awesome Jackett Indexes","url":"/awesome-jackett-indexes/"},{"title":"Awesome JS Date","url":"/awesome-js-date/"},{"title":"æ”¶é›† Javascript é‡Œå¥½ç”¨çš„åº“","url":"/awesome-js/"},{"title":"Awesome List","url":"/awesome-list/"},{"title":"å€¼å¾—è§‚çœ‹çš„ç”µå½±","url":"/awesome-movies/"},{"title":"Awesome Notes","url":"/awesome-notes/"},{"title":"Awesome P2P","url":"/awesome-p2p/"},{"title":"Awesome Privacy","url":"/awesome-privacy/"},{"title":"Awesome Products","url":"/awesome-products/"},{"title":"æ”¶é›†å‘äººæ·±çœçš„è¯","url":"/awesome-quotes/"},{"title":"Awesome RSS","url":"/awesome-rss/"},{"title":"Awesome Rust","url":"/awesome-rust/"},{"title":"Awesome Self-hosted","url":"/awesome-selfhosted/"},{"title":"Awesome SEO Tools","url":"/awesome-seo/"},{"title":"Awesome Services","url":"/awesome-service/"},{"title":"æ”¶é›†æœ‰æ„æ€çš„ç¤¾äº¤åº”ç”¨","url":"/awesome-socials/"},{"title":"Awesome Speed","url":"/awesome-speed/"},{"title":"Awesome Startups","url":"/awesome-startups/"},{"title":"Awesome Static Site Generator","url":"/awesome-static-site-generator/"},{"title":"æ”¶é›†ä¸€äº›æœ‰ç”¨çš„æŠ€æœ¯/ç¯å¢ƒé—®é¢˜çš„è§£å†³æ–¹æ¡ˆ","url":"/awesome-tech-anwser/"},{"title":"Awesome Templates","url":"/awesome-templates/"},{"title":"æœ€å¥½ç”¨çš„å·¥å…·é›†åˆ","url":"/awesome-tools/"},{"title":"å€¼å¾—è§‚çœ‹çš„ç”µè§†å‰§","url":"/awesome-tv-shows/"},{"title":"Awesome UI","url":"/awesome-ui/"},{"title":"æ”¶é›†ä¸€äº›å¥½ç©çš„ç½‘ç«™","url":"/awesome-websites/"},{"title":"Awesome What Was Your Moment","url":"/awesome-what-was-your-moment/"},{"title":"æ”¶é›†Windowsä¸Šå¥½ç©ï¼Œå¥½ç”¨çš„ä¸œè¥¿","url":"/awesome-windows/"},{"title":"æ”¶é›†è‚¡å¸‚ç›¸å…³çš„èµ„æº","url":"/journal/awesome-stocks/"}]},{"title":"BBR","type":"tag","url":"/tags/bbr/","items":[{"title":"Open BBR for Debian","url":"/open-bbr-for-debian/"}]},{"title":"BT","type":"tag","url":"/tags/bt/","items":[{"title":"Jackett Setup","url":"/jackett-setup/"},{"title":"qBittorrent setup for Debian","url":"/qbittorrent-setup-for-debian/"}]},{"title":"Bash","type":"tag","url":"/tags/bash/","items":[{"title":"Awesome Benchmark","url":"/awesome-benchmark/"},{"title":"Linux Common Commands","url":"/linux-common-commands/"}]},{"title":"Benchmark","type":"tag","url":"/tags/benchmark/","items":[{"title":"Awesome Benchmark","url":"/awesome-benchmark/"}]},{"title":"Books","type":"tag","url":"/tags/books/","items":[{"title":"è¯»ä¹¦ç¬”è®°","url":"/books/"}]},{"title":"Browser","type":"tag","url":"/tags/browser/","items":[{"title":"Awesome Browsers","url":"/awesome-browsers/"}]},{"title":"CSS","type":"tag","url":"/tags/css/","items":[{"title":"Mini Reset CSS","url":"/mini-reset-css/"},{"title":"Smart word break in CSS","url":"/smart-word-break-in-css/"}]},{"title":"Caddy","type":"tag","url":"/tags/caddy/","items":[{"title":"Caddy2 Setup for Debian","url":"/caddy2-setup-for-debian/"}]},{"title":"CentOS","type":"tag","url":"/tags/cent-os/","items":[{"title":"Install PHP 8.0 On CentOS 7 / RHEL 7","url":"/install-php8-on-centos7/"}]},{"title":"Code","type":"tag","url":"/tags/code/","items":[{"title":"Awesome Code Learning","url":"/awesome-code-learning/"}]},{"title":"Commands","type":"tag","url":"/tags/commands/","items":[{"title":"Linux Common Commands","url":"/linux-common-commands/"}]},{"title":"Communities","type":"tag","url":"/tags/communities/","items":[{"title":"æ”¶é›†ä¸€äº›æœ‰æ„æ€çš„ç¤¾åŒº","url":"/awesome-communities/"}]},{"title":"Comparison","type":"tag","url":"/tags/comparison/","items":[{"title":"Licenseæ¯”è¾ƒ","url":"/license-comparison/"}]},{"title":"Date","type":"tag","url":"/tags/date/","items":[{"title":"Awesome JS Date","url":"/awesome-js-date/"}]},{"title":"Debian","type":"tag","url":"/tags/debian/","items":[{"title":"Caddy2 Setup for Debian","url":"/caddy2-setup-for-debian/"},{"title":"Debian Server Setup","url":"/debian-server-setup/"},{"title":"Netdata Setup for Debian","url":"/netdata-setup-for-debian/"},{"title":"Nodejs Setup for Debian","url":"/nodejs-setup-for-debian/"},{"title":"Open BBR for Debian","url":"/open-bbr-for-debian/"},{"title":"qBittorrent setup for Debian","url":"/qbittorrent-setup-for-debian/"},{"title":"Rust Environment Setup for Debian","url":"/rust-enviroment-setup-for-debian/"},{"title":"Shadowsocks Rust Setup for Debian","url":"/shadowsocks-rust-setup-for-debian/"}]},{"title":"Decentralization","type":"tag","url":"/tags/decentralization/","items":[{"title":"Awesome Decentralization","url":"/awesome-decentralization/"}]},{"title":"Development-Environment","type":"tag","url":"/tags/development-environment/","items":[{"title":"æ”¶é›†Windowsä¸Šå¥½ç©ï¼Œå¥½ç”¨çš„ä¸œè¥¿","url":"/awesome-windows/"}]},{"title":"Docker","type":"tag","url":"/tags/docker/","items":[{"title":"Docker Common Commands","url":"/docker-common-commands/"},{"title":"Docker Setup","url":"/docker-setup/"}]},{"title":"Downloads","type":"tag","url":"/tags/downloads/","items":[{"title":"qBittorrent setup for Debian","url":"/qbittorrent-setup-for-debian/"},{"title":"Youtube Download","url":"/youtube-download/"}]},{"title":"Editors","type":"tag","url":"/tags/editors/","items":[{"title":"Awesome-Editors","url":"/awesome-editors/"},{"title":"Vim Tips","url":"/vim-tips/"},{"title":"VS Code Tips","url":"/vscode-tips/"}]},{"title":"English","type":"tag","url":"/tags/english/","items":[{"title":"æ”¶é›†è‹±è¯­å­¦ä¹ å·¥å…·","url":"/awesome-english-learning/"}]},{"title":"Explore","type":"tag","url":"/tags/explore/","items":[{"title":"Awesome Explore","url":"/awesome-explore/"}]},{"title":"FAQ","type":"tag","url":"/tags/faq/","items":[{"title":"æœ‰æ„æ€çš„é—®é¢˜æ”¶é›†","url":"/awesome-answers/"},{"title":"æ”¶é›†ä¸€äº›æœ‰ç”¨çš„æŠ€æœ¯/ç¯å¢ƒé—®é¢˜çš„è§£å†³æ–¹æ¡ˆ","url":"/awesome-tech-anwser/"}]},{"title":"Files","type":"tag","url":"/tags/files/","items":[{"title":"Awesome File Managers","url":"/awesome-file-managers/"},{"title":"Caddy File Server Browser with URL Scheme","url":"/caddy-file-server-url-scheme/"},{"title":"FileBrowser Setup","url":"/filebrowser-setup/"},{"title":"Rclone Setup","url":"/rclone-setup/"}]},{"title":"Free","type":"tag","url":"/tags/free/","items":[{"title":"Awesome Free","url":"/awesome-free/"}]},{"title":"Front-End","type":"tag","url":"/tags/front-end/","items":[{"title":"Awesome UI","url":"/awesome-ui/"},{"title":"SVG","url":"/svg/"}]},{"title":"Git","type":"tag","url":"/tags/git/","items":[{"title":"Use ssh key for Git","url":"/git-sshkey/"},{"title":"æ”¶é›†å¸¸ç”¨GitæŠ€å·§","url":"/git-tips/"},{"title":"Git workflows","url":"/git-workflows/"}]},{"title":"Go","type":"tag","url":"/tags/go/","items":[{"title":"Go Template Tips","url":"/go-template-tips/"}]},{"title":"Indexes","type":"tag","url":"/tags/indexes/","items":[{"title":"Awesome Indexes","url":"/awesome-indexes/"}]},{"title":"Interview","type":"tag","url":"/tags/interview/","items":[{"title":"Awesome Interview","url":"/awesome-interview/"}]},{"title":"Investing","type":"tag","url":"/tags/investing/","items":[{"title":"Awesome Investing","url":"/awesome-investing/"}]},{"title":"Jackett","type":"tag","url":"/tags/jackett/","items":[{"title":"Jackett Setup","url":"/jackett-setup/"},{"title":"qBittorrent setup for Debian","url":"/qbittorrent-setup-for-debian/"}]},{"title":"Javascript","type":"tag","url":"/tags/javascript/","items":[{"title":"Awesome JS Date","url":"/awesome-js-date/"},{"title":"æ”¶é›† Javascript é‡Œå¥½ç”¨çš„åº“","url":"/awesome-js/"},{"title":"Nodejs Monorepo","url":"/nodejs-monorepo/"},{"title":"Nodejs Setup for Debian","url":"/nodejs-setup-for-debian/"},{"title":"Nodejs Tips","url":"/nodejs-tips/"}]},{"title":"Jellyfin","type":"tag","url":"/tags/jellyfin/","items":[{"title":"Jellyfin setup","url":"/jellyfin-setup/"}]},{"title":"Journal","type":"tag","url":"/tags/journal/","items":[{"title":"What Iâ€™m doing now?","url":"/now/"},{"title":"Journal Entry, Sunday, September 05, 2021","url":"/journal/daily-note-2021-09-05/"},{"title":"Journal Entry, Friday, September 10, 2021","url":"/journal/daily-note-2021-09-10/"},{"title":"Journal Entry, Saturday, September 11, 2021","url":"/journal/daily-note-2021-09-11/"},{"title":"Journal Entry, Sunday, September 12, 2021","url":"/journal/daily-note-2021-09-12/"},{"title":"Journal Entry, Wednesday, September 15, 2021","url":"/journal/daily-note-2021-09-15/"},{"title":"Journal Entry, Friday, September 17, 2021","url":"/journal/daily-note-2021-09-17/"},{"title":"Journal Entry, Thursday, September 23, 2021","url":"/journal/daily-note-2021-09-23/"}]},{"title":"Leaning","type":"tag","url":"/tags/leaning/","items":[{"title":"Awesome Code Learning","url":"/awesome-code-learning/"}]},{"title":"Learning","type":"tag","url":"/tags/learning/","items":[{"title":"æ”¶é›†è‹±è¯­å­¦ä¹ å·¥å…·","url":"/awesome-english-learning/"},{"title":"Awesome Rust","url":"/awesome-rust/"}]},{"title":"License","type":"tag","url":"/tags/license/","items":[{"title":"Licenseæ¯”è¾ƒ","url":"/license-comparison/"}]},{"title":"Linux","type":"tag","url":"/tags/linux/","items":[{"title":"Linux Common Commands","url":"/linux-common-commands/"}]},{"title":"List","type":"tag","url":"/tags/list/","items":[{"title":"Awesome List","url":"/awesome-list/"},{"title":"å€¼å¾—è§‚çœ‹çš„ç”µè§†å‰§","url":"/awesome-tv-shows/"}]},{"title":"MacOS","type":"tag","url":"/tags/mac-os/","items":[{"title":"Postgres Setup for Macos","url":"/postgres-setup-for-macos/"}]},{"title":"Makefile - Templates - Workflows","type":"tag","url":"/tags/makefile-templates-workflows/","items":[{"title":"Makefile Templates","url":"/makefile-templates/"}]},{"title":"Mastdon","type":"tag","url":"/tags/mastdon/","items":[{"title":"Mastdon Development Setup","url":"/mastdon-development-setup/"}]},{"title":"Me","type":"tag","url":"/tags/me/","items":[{"title":"Everything I Know by Owen","url":"/"},{"title":"About Me","url":"/about/"},{"title":"What Iâ€™m doing now?","url":"/now/"},{"title":"Projects","url":"/projects/"}]},{"title":"Medias","type":"tag","url":"/tags/medias/","items":[{"title":"Bazarr Setup","url":"/bazarr-setup/"},{"title":"Caddy File Server Browser with URL Scheme","url":"/caddy-file-server-url-scheme/"},{"title":"Jackett Setup","url":"/jackett-setup/"},{"title":"Jellyfin setup","url":"/jellyfin-setup/"},{"title":"Radarr Setup","url":"/radarr-setup/"},{"title":"Rclone Setup","url":"/rclone-setup/"},{"title":"Sonarr Setup","url":"/sonarr-setup/"},{"title":"Subtitles","url":"/subtitles/"},{"title":"Youtube Download","url":"/youtube-download/"}]},{"title":"Metube","type":"tag","url":"/tags/metube/","items":[{"title":"Youtube Download","url":"/youtube-download/"}]},{"title":"Monitor","type":"tag","url":"/tags/monitor/","items":[{"title":"Netdata Setup for Debian","url":"/netdata-setup-for-debian/"}]},{"title":"Monorepo","type":"tag","url":"/tags/monorepo/","items":[{"title":"Nodejs Monorepo","url":"/nodejs-monorepo/"}]},{"title":"Movies","type":"tag","url":"/tags/movies/","items":[{"title":"å€¼å¾—è§‚çœ‹çš„ç”µå½±","url":"/awesome-movies/"},{"title":"ç”µå½±ç¬”è®°","url":"/movies/"}]},{"title":"Netdata","type":"tag","url":"/tags/netdata/","items":[{"title":"Netdata Setup for Debian","url":"/netdata-setup-for-debian/"}]},{"title":"Netwok","type":"tag","url":"/tags/netwok/","items":[{"title":"Awesome Speed","url":"/awesome-speed/"}]},{"title":"Notes","type":"tag","url":"/tags/notes/","items":[{"title":"Awesome Notes","url":"/awesome-notes/"},{"title":"è¯»ä¹¦ç¬”è®°","url":"/books/"},{"title":"ç”µå½±ç¬”è®°","url":"/movies/"},{"title":"ç”µè§†å‰§ç¬”è®°","url":"/tv-shows/"}]},{"title":"Now","type":"tag","url":"/tags/now/","items":[{"title":"What Iâ€™m doing now?","url":"/now/"}]},{"title":"P2P","type":"tag","url":"/tags/p-2-p/","items":[{"title":"Awesome P2P","url":"/awesome-p2p/"}]},{"title":"PHP","type":"tag","url":"/tags/php/","items":[{"title":"Install PHP 8.0 On CentOS 7 / RHEL 7","url":"/install-php8-on-centos7/"}]},{"title":"Postgres","type":"tag","url":"/tags/postgres/","items":[{"title":"Postgres Setup for Macos","url":"/postgres-setup-for-macos/"}]},{"title":"Privacy","type":"tag","url":"/tags/privacy/","items":[{"title":"Awesome Privacy","url":"/awesome-privacy/"}]},{"title":"Products","type":"tag","url":"/tags/products/","items":[{"title":"Awesome Products","url":"/awesome-products/"}]},{"title":"Programming-Languages","type":"tag","url":"/tags/programming-languages/","items":[{"title":"Go Template Tips","url":"/go-template-tips/"},{"title":"Nodejs Setup for Debian","url":"/nodejs-setup-for-debian/"},{"title":"Nodejs Tips","url":"/nodejs-tips/"}]},{"title":"Projects","type":"tag","url":"/tags/projects/","items":[{"title":"Projects","url":"/projects/"}]},{"title":"Proxies","type":"tag","url":"/tags/proxies/","items":[{"title":"Awesome Benchmark","url":"/awesome-benchmark/"},{"title":"Caddy File Server Browser with URL Scheme","url":"/caddy-file-server-url-scheme/"},{"title":"Caddy2 Setup for Debian","url":"/caddy2-setup-for-debian/"},{"title":"Open BBR for Debian","url":"/open-bbr-for-debian/"},{"title":"Shadowsocks Rust Setup for Debian","url":"/shadowsocks-rust-setup-for-debian/"}]},{"title":"Quotes","type":"tag","url":"/tags/quotes/","items":[{"title":"æ”¶é›†å‘äººæ·±çœçš„è¯","url":"/awesome-quotes/"},{"title":"åˆ’çº¿çš„ç”µè§†å‰§æˆªå›¾","url":"/awesome-tv-quotes/"}]},{"title":"RSS","type":"tag","url":"/tags/rss/","items":[{"title":"Awesome RSS","url":"/awesome-rss/"}]},{"title":"Radarr","type":"tag","url":"/tags/radarr/","items":[{"title":"Radarr Setup","url":"/radarr-setup/"}]},{"title":"Rclone","type":"tag","url":"/tags/rclone/","items":[{"title":"Rclone Setup","url":"/rclone-setup/"}]},{"title":"Recommend","type":"tag","url":"/tags/recommend/","items":[{"title":"Awesome Algorithm","url":"/awesome-algorithm/"}]},{"title":"Ruby","type":"tag","url":"/tags/ruby/","items":[{"title":"Ruby Setup for MacOS","url":"/ruby-setup/"}]},{"title":"Rust","type":"tag","url":"/tags/rust/","items":[{"title":"Awesome Rust","url":"/awesome-rust/"},{"title":"Rust Environment Setup for Debian","url":"/rust-enviroment-setup-for-debian/"},{"title":"Shadowsocks Rust Setup for Debian","url":"/shadowsocks-rust-setup-for-debian/"}]},{"title":"SEO","type":"tag","url":"/tags/seo/","items":[{"title":"Awesome SEO Tools","url":"/awesome-seo/"}]},{"title":"SSH","type":"tag","url":"/tags/ssh/","items":[{"title":"Use ssh key for Git","url":"/git-sshkey/"}]},{"title":"SVG","type":"tag","url":"/tags/svg/","items":[{"title":"SVG","url":"/svg/"}]},{"title":"Self-Hosted","type":"tag","url":"/tags/self-hosted/","items":[{"title":"Awesome Automations","url":"/awesome-automations/"},{"title":"Awesome Self-hosted","url":"/awesome-selfhosted/"},{"title":"Bazarr Setup","url":"/bazarr-setup/"},{"title":"Jackett Setup","url":"/jackett-setup/"},{"title":"Jellyfin setup","url":"/jellyfin-setup/"},{"title":"Radarr Setup","url":"/radarr-setup/"},{"title":"Sonarr Setup","url":"/sonarr-setup/"},{"title":"Youtube Download","url":"/youtube-download/"}]},{"title":"Server","type":"tag","url":"/tags/server/","items":[{"title":"Caddy File Server Browser with URL Scheme","url":"/caddy-file-server-url-scheme/"},{"title":"Caddy2 Setup for Debian","url":"/caddy2-setup-for-debian/"},{"title":"Debian Server Setup","url":"/debian-server-setup/"},{"title":"Nodejs Setup for Debian","url":"/nodejs-setup-for-debian/"},{"title":"Open BBR for Debian","url":"/open-bbr-for-debian/"},{"title":"qBittorrent setup for Debian","url":"/qbittorrent-setup-for-debian/"}]},{"title":"Serverless","type":"tag","url":"/tags/serverless/","items":[{"title":"æ”¶é›†ä¸€äº›æœ‰ç”¨çš„æŠ€æœ¯/ç¯å¢ƒé—®é¢˜çš„è§£å†³æ–¹æ¡ˆ","url":"/awesome-tech-anwser/"}]},{"title":"Service","type":"tag","url":"/tags/service/","items":[{"title":"Awesome Services","url":"/awesome-service/"}]},{"title":"Setup","type":"tag","url":"/tags/setup/","items":[{"title":"Bazarr Setup","url":"/bazarr-setup/"},{"title":"Caddy2 Setup for Debian","url":"/caddy2-setup-for-debian/"},{"title":"Debian Server Setup","url":"/debian-server-setup/"},{"title":"Docker Setup","url":"/docker-setup/"},{"title":"FileBrowser Setup","url":"/filebrowser-setup/"},{"title":"Install PHP 8.0 On CentOS 7 / RHEL 7","url":"/install-php8-on-centos7/"},{"title":"Jackett Setup","url":"/jackett-setup/"},{"title":"Jellyfin setup","url":"/jellyfin-setup/"},{"title":"Mastdon Development Setup","url":"/mastdon-development-setup/"},{"title":"Nodejs Setup for Debian","url":"/nodejs-setup-for-debian/"},{"title":"Postgres Setup for Macos","url":"/postgres-setup-for-macos/"},{"title":"qBittorrent setup for Debian","url":"/qbittorrent-setup-for-debian/"},{"title":"Radarr Setup","url":"/radarr-setup/"},{"title":"Rclone Setup","url":"/rclone-setup/"},{"title":"Ruby Setup for MacOS","url":"/ruby-setup/"},{"title":"Rust Environment Setup for Debian","url":"/rust-enviroment-setup-for-debian/"},{"title":"Shadowsocks Rust Setup for Debian","url":"/shadowsocks-rust-setup-for-debian/"}]},{"title":"Shadowsocks","type":"tag","url":"/tags/shadowsocks/","items":[{"title":"Shadowsocks Rust Setup for Debian","url":"/shadowsocks-rust-setup-for-debian/"}]},{"title":"Social","type":"tag","url":"/tags/social/","items":[{"title":"æ”¶é›†ä¸€äº›æœ‰æ„æ€çš„ç¤¾åŒº","url":"/awesome-communities/"},{"title":"Awesome Products","url":"/awesome-products/"},{"title":"æ”¶é›†æœ‰æ„æ€çš„ç¤¾äº¤åº”ç”¨","url":"/awesome-socials/"}]},{"title":"Sonarr","type":"tag","url":"/tags/sonarr/","items":[{"title":"Sonarr Setup","url":"/sonarr-setup/"}]},{"title":"Speed","type":"tag","url":"/tags/speed/","items":[{"title":"Awesome Speed","url":"/awesome-speed/"}]},{"title":"Startups","type":"tag","url":"/tags/startups/","items":[{"title":"Awesome Startups","url":"/awesome-startups/"}]},{"title":"Static-Site-Generator","type":"tag","url":"/tags/static-site-generator/","items":[{"title":"Awesome Static Site Generator","url":"/awesome-static-site-generator/"}]},{"title":"Stocks","type":"tag","url":"/tags/stocks/","items":[{"title":"Awesome Investing","url":"/awesome-investing/"},{"title":"æ”¶é›†è‚¡å¸‚ç›¸å…³çš„èµ„æº","url":"/journal/awesome-stocks/"}]},{"title":"Subtitles","type":"tag","url":"/tags/subtitles/","items":[{"title":"Bazarr Setup","url":"/bazarr-setup/"},{"title":"Subtitles","url":"/subtitles/"}]},{"title":"TV","type":"tag","url":"/tags/tv/","items":[{"title":"åˆ’çº¿çš„ç”µè§†å‰§æˆªå›¾","url":"/awesome-tv-quotes/"},{"title":"å€¼å¾—è§‚çœ‹çš„ç”µè§†å‰§","url":"/awesome-tv-shows/"},{"title":"ç”µè§†å‰§ç¬”è®°","url":"/tv-shows/"}]},{"title":"Tech","type":"tag","url":"/tags/tech/","items":[{"title":"æ”¶é›†ä¸€äº›æœ‰ç”¨çš„æŠ€æœ¯/ç¯å¢ƒé—®é¢˜çš„è§£å†³æ–¹æ¡ˆ","url":"/awesome-tech-anwser/"}]},{"title":"Templates","type":"tag","url":"/tags/templates/","items":[{"title":"Awesome Templates","url":"/awesome-templates/"},{"title":"Caddy File Server Browser with URL Scheme","url":"/caddy-file-server-url-scheme/"},{"title":"Go Template Tips","url":"/go-template-tips/"}]},{"title":"Tips","type":"tag","url":"/tags/tips/","items":[{"title":"Common URL Scheme","url":"/common-url-scheme/"},{"title":"Docker Common Commands","url":"/docker-common-commands/"},{"title":"æ”¶é›†å¸¸ç”¨GitæŠ€å·§","url":"/git-tips/"},{"title":"Go Template Tips","url":"/go-template-tips/"},{"title":"Linux Common Commands","url":"/linux-common-commands/"},{"title":"Nodejs Tips","url":"/nodejs-tips/"},{"title":"Vim Tips","url":"/vim-tips/"},{"title":"VS Code Tips","url":"/vscode-tips/"}]},{"title":"Todo","type":"tag","url":"/tags/todo/","items":[{"title":"2021 Goals","url":"/goals-2021/"}]},{"title":"Tools","type":"tag","url":"/tags/tools/","items":[{"title":"Awesome-Editors","url":"/awesome-editors/"},{"title":"Awesome Free","url":"/awesome-free/"},{"title":"Awesome Notes","url":"/awesome-notes/"},{"title":"Awesome Self-hosted","url":"/awesome-selfhosted/"},{"title":"Awesome SEO Tools","url":"/awesome-seo/"},{"title":"Awesome Startups","url":"/awesome-startups/"},{"title":"æœ€å¥½ç”¨çš„å·¥å…·é›†åˆ","url":"/awesome-tools/"},{"title":"æ”¶é›†ä¸€äº›å¥½ç©çš„ç½‘ç«™","url":"/awesome-websites/"},{"title":"æ”¶é›†Windowsä¸Šå¥½ç©ï¼Œå¥½ç”¨çš„ä¸œè¥¿","url":"/awesome-windows/"}]},{"title":"Torrents","type":"tag","url":"/tags/torrents/","items":[{"title":"Jackett Setup","url":"/jackett-setup/"},{"title":"qBittorrent setup for Debian","url":"/qbittorrent-setup-for-debian/"}]},{"title":"Travel","type":"tag","url":"/tags/travel/","items":[{"title":"æ—…è¡Œæ‰‹ç»­","url":"/travel-approvals/"}]},{"title":"Trends","type":"tag","url":"/tags/trends/","items":[{"title":"Awesome Indexes","url":"/awesome-indexes/"}]},{"title":"UI","type":"tag","url":"/tags/ui/","items":[{"title":"Awesome UI","url":"/awesome-ui/"}]},{"title":"URL","type":"tag","url":"/tags/url/","items":[{"title":"Common URL Scheme","url":"/common-url-scheme/"}]},{"title":"VS Code","type":"tag","url":"/tags/vs-code/","items":[{"title":"VS Code Tips","url":"/vscode-tips/"}]},{"title":"Vim","type":"tag","url":"/tags/vim/","items":[{"title":"Vim Tips","url":"/vim-tips/"}]},{"title":"Windows","type":"tag","url":"/tags/windows/","items":[{"title":"æ”¶é›†Windowsä¸Šå¥½ç©ï¼Œå¥½ç”¨çš„ä¸œè¥¿","url":"/awesome-windows/"}]},{"title":"Workflows","type":"tag","url":"/tags/workflows/","items":[{"title":"Git workflows","url":"/git-workflows/"},{"title":"Nodejs Monorepo","url":"/nodejs-monorepo/"}]},{"title":"Year2021","type":"tag","url":"/tags/year-2021/","items":[{"title":"2021 Goals","url":"/goals-2021/"},{"title":"Journal Entry, Sunday, September 05, 2021","url":"/journal/daily-note-2021-09-05/"},{"title":"Journal Entry, Friday, September 10, 2021","url":"/journal/daily-note-2021-09-10/"},{"title":"Journal Entry, Saturday, September 11, 2021","url":"/journal/daily-note-2021-09-11/"},{"title":"Journal Entry, Sunday, September 12, 2021","url":"/journal/daily-note-2021-09-12/"},{"title":"Journal Entry, Wednesday, September 15, 2021","url":"/journal/daily-note-2021-09-15/"},{"title":"Journal Entry, Friday, September 17, 2021","url":"/journal/daily-note-2021-09-17/"},{"title":"Journal Entry, Thursday, September 23, 2021","url":"/journal/daily-note-2021-09-23/"}]},{"title":"Youtube","type":"tag","url":"/tags/youtube/","items":[{"title":"Youtube Download","url":"/youtube-download/"}]},{"title":"qBittorrent","type":"tag","url":"/tags/q-bittorrent/","items":[{"title":"qBittorrent setup for Debian","url":"/qbittorrent-setup-for-debian/"}]},{"title":"ä¸­æ–‡","type":"tag","url":"/tags/ä¸­æ–‡/","items":[{"title":"æœ‰æ„æ€çš„é—®é¢˜æ”¶é›†","url":"/awesome-answers/"},{"title":"æ”¶é›†ä¸€äº›æœ‰æ„æ€çš„ç¤¾åŒº","url":"/awesome-communities/"},{"title":"æ”¶é›† Javascript é‡Œå¥½ç”¨çš„åº“","url":"/awesome-js/"},{"title":"å€¼å¾—è§‚çœ‹çš„ç”µå½±","url":"/awesome-movies/"},{"title":"æ”¶é›†å‘äººæ·±çœçš„è¯","url":"/awesome-quotes/"},{"title":"æœ€å¥½ç”¨çš„å·¥å…·é›†åˆ","url":"/awesome-tools/"},{"title":"åˆ’çº¿çš„ç”µè§†å‰§æˆªå›¾","url":"/awesome-tv-quotes/"},{"title":"å€¼å¾—è§‚çœ‹çš„ç”µè§†å‰§","url":"/awesome-tv-shows/"},{"title":"æ”¶é›†ä¸€äº›å¥½ç©çš„ç½‘ç«™","url":"/awesome-websites/"},{"title":"æ”¶é›†Windowsä¸Šå¥½ç©ï¼Œå¥½ç”¨çš„ä¸œè¥¿","url":"/awesome-windows/"},{"title":"è¯»ä¹¦ç¬”è®°","url":"/books/"},{"title":"æ”¶é›†å¸¸ç”¨GitæŠ€å·§","url":"/git-tips/"},{"title":"Licenseæ¯”è¾ƒ","url":"/license-comparison/"},{"title":"ç”µå½±ç¬”è®°","url":"/movies/"},{"title":"æ—…è¡Œæ‰‹ç»­","url":"/travel-approvals/"},{"title":"ç”µè§†å‰§ç¬”è®°","url":"/tv-shows/"}]}],"latestPosts":[{"fields":{"slug":"/awesome-tools/","title":"æœ€å¥½ç”¨çš„å·¥å…·é›†åˆ","lastUpdatedAt":"2021-09-25T09:43:34.000Z","lastUpdated":"9/25/2021"},"frontmatter":{"draft":false,"tags":["Awesome","Tools","ä¸­æ–‡"]}},{"fields":{"slug":"/awesome-decentralization/","title":"Awesome Decentralization","lastUpdatedAt":"2021-09-25T06:38:19.000Z","lastUpdated":"9/25/2021"},"frontmatter":{"draft":false,"tags":["Awesome","Decentralization"]}},{"fields":{"slug":"/awesome-rss/","title":"Awesome RSS","lastUpdatedAt":"2021-09-25T06:38:19.000Z","lastUpdated":"9/25/2021"},"frontmatter":{"draft":false,"tags":["RSS","Awesome"]}},{"fields":{"slug":"/awesome-tv-quotes/","title":"åˆ’çº¿çš„ç”µè§†å‰§æˆªå›¾","lastUpdatedAt":"2021-09-25T06:38:19.000Z","lastUpdated":"9/25/2021"},"frontmatter":{"draft":false,"tags":["TV","Quotes","ä¸­æ–‡"]}},{"fields":{"slug":"/docker-common-commands/","title":"Docker Common Commands","lastUpdatedAt":"2021-09-25T03:16:54.000Z","lastUpdated":"9/25/2021"},"frontmatter":{"draft":false,"tags":["Docker","Tips"]}},{"fields":{"slug":"/mastdon-development-setup/","title":"Mastdon Development Setup","lastUpdatedAt":"2021-09-24T11:05:17.000Z","lastUpdated":"9/24/2021"},"frontmatter":{"draft":false,"tags":["Mastdon","Setup"]}},{"fields":{"slug":"/postgres-setup-for-macos/","title":"Postgres Setup for Macos","lastUpdatedAt":"2021-09-24T11:05:17.000Z","lastUpdated":"9/24/2021"},"frontmatter":{"draft":false,"tags":["Postgres","MacOS","Setup"]}},{"fields":{"slug":"/ruby-setup/","title":"Ruby Setup for MacOS","lastUpdatedAt":"2021-09-24T11:05:17.000Z","lastUpdated":"9/24/2021"},"frontmatter":{"draft":false,"tags":["Setup","Ruby"]}},{"fields":{"slug":"/awesome-alternatives/","title":"Awesome Alternatives","lastUpdatedAt":"2021-09-23T18:12:56.000Z","lastUpdated":"9/23/2021"},"frontmatter":{"draft":false,"tags":["Awesome","Alternatives"]}},{"fields":{"slug":"/awesome-socials/","title":"æ”¶é›†æœ‰æ„æ€çš„ç¤¾äº¤åº”ç”¨","lastUpdatedAt":"2021-09-23T18:12:56.000Z","lastUpdated":"9/23/2021"},"frontmatter":{"draft":false,"tags":["Social","Awesome"]}},{"fields":{"slug":"/awesome-english-learning/","title":"æ”¶é›†è‹±è¯­å­¦ä¹ å·¥å…·","lastUpdatedAt":"2021-09-22T18:26:49.000Z","lastUpdated":"9/22/2021"},"frontmatter":{"draft":false,"tags":["Awesome","English","Learning"]}},{"fields":{"slug":"/awesome-p2p/","title":"Awesome P2P","lastUpdatedAt":"2021-09-22T18:13:38.000Z","lastUpdated":"9/22/2021"},"frontmatter":{"draft":false,"tags":["Awesome","P2P"]}},{"fields":{"slug":"/awesome-service/","title":"Awesome Services","lastUpdatedAt":"2021-09-22T18:13:38.000Z","lastUpdated":"9/22/2021"},"frontmatter":{"draft":false,"tags":["Awesome","Service"]}},{"fields":{"slug":"/journal/awesome-stocks/","title":"æ”¶é›†è‚¡å¸‚ç›¸å…³çš„èµ„æº","lastUpdatedAt":"2021-09-22T18:13:38.000Z","lastUpdated":"9/22/2021"},"frontmatter":{"draft":false,"tags":["Awesome","Stocks"]}},{"fields":{"slug":"/journal/daily-note-2021-09-23/","title":"Journal Entry, Thursday, September 23, 2021","lastUpdatedAt":"2021-09-22T18:13:38.000Z","lastUpdated":"9/22/2021"},"frontmatter":{"draft":false,"tags":["Journal","Year2021","2021-09"]}}]}},
    "staticQueryHashes": ["2320115945","2668576509","3495835395","451533639"]}