{
    "componentChunkName": "component---node-modules-gatsby-theme-primer-wiki-src-templates-post-query-js",
    "path": "/awesome-selfhosted/",
    "result": {"data":{"mdx":{"id":"dc5207a2-2b31-5140-9bc8-36f7a244aa7b","tableOfContents":{"items":[{"url":"#awesome-self-hosted","title":"Awesome Self-hosted","items":[{"url":"#kol","title":"KOL"},{"url":"#time-tracking","title":"Time tracking"},{"url":"#shopping","title":"Shopping"},{"url":"#services","title":"Services"},{"url":"#medias","title":"Medias"},{"url":"#paas","title":"PAAS"},{"url":"#federation","title":"Federation"},{"url":"#old-school","title":"Old school"},{"url":"#livestreaming","title":"Livestreaming"},{"url":"#admin","title":"Admin"},{"url":"#chat","title":"Chat"},{"url":"#deploy","title":"Deploy"},{"url":"#music","title":"Music"}]}]},"fields":{"title":"Awesome Self-hosted","slug":"/awesome-selfhosted/","url":"https://wiki.owenyoung.com/awesome-selfhosted/","editUrl":"https://github.com/theowenyoung/wiki/tree/main/awesome-selfhosted.md","lastUpdatedAt":"2022-02-18T02:50:04.000Z","lastUpdated":"2/18/2022","gitCreatedAt":"2021-09-04T01:08:18.000Z","shouldShowTitle":false},"frontmatter":{"title":"","description":null,"imageAlt":null,"tags":["Awesome","Self-Hosted","Tools"],"date":null,"dateModified":null,"language":null,"seoTitle":null,"image":null},"body":"var _excluded = [\"components\"];\n\nfunction _extends() { _extends = Object.assign || function (target) { for (var i = 1; i < arguments.length; i++) { var source = arguments[i]; for (var key in source) { if (Object.prototype.hasOwnProperty.call(source, key)) { target[key] = source[key]; } } } return target; }; return _extends.apply(this, arguments); }\n\nfunction _objectWithoutProperties(source, excluded) { if (source == null) return {}; var target = _objectWithoutPropertiesLoose(source, excluded); var key, i; if (Object.getOwnPropertySymbols) { var sourceSymbolKeys = Object.getOwnPropertySymbols(source); for (i = 0; i < sourceSymbolKeys.length; i++) { key = sourceSymbolKeys[i]; if (excluded.indexOf(key) >= 0) continue; if (!Object.prototype.propertyIsEnumerable.call(source, key)) continue; target[key] = source[key]; } } return target; }\n\nfunction _objectWithoutPropertiesLoose(source, excluded) { if (source == null) return {}; var target = {}; var sourceKeys = Object.keys(source); var key, i; for (i = 0; i < sourceKeys.length; i++) { key = sourceKeys[i]; if (excluded.indexOf(key) >= 0) continue; target[key] = source[key]; } return target; }\n\n/* @jsxRuntime classic */\n\n/* @jsx mdx */\nvar _frontmatter = {\n  \"tags\": [\"Awesome\", \"Self-Hosted\", \"Tools\"]\n};\nvar layoutProps = {\n  _frontmatter: _frontmatter\n};\nvar MDXLayout = \"wrapper\";\nreturn function MDXContent(_ref) {\n  var components = _ref.components,\n      props = _objectWithoutProperties(_ref, _excluded);\n\n  return mdx(MDXLayout, _extends({}, layoutProps, props, {\n    components: components,\n    mdxType: \"MDXLayout\"\n  }), mdx(\"h1\", {\n    \"id\": \"awesome-self-hosted\"\n  }, \"Awesome Self-hosted\"), mdx(\"h2\", {\n    \"id\": \"kol\"\n  }, \"KOL\"), mdx(\"ul\", null, mdx(\"li\", {\n    parentName: \"ul\"\n  }, mdx(\"a\", {\n    parentName: \"li\",\n    \"href\": \"https://github.com/calendso/calendso\"\n  }, \"calendso/calendso: The open-source Calendly alternative. (github.com)\"), \" - Make an appointment, connect with your calendar\")), mdx(\"h2\", {\n    \"id\": \"time-tracking\"\n  }, \"Time tracking\"), mdx(\"ul\", null, mdx(\"li\", {\n    parentName: \"ul\"\n  }, mdx(\"a\", {\n    parentName: \"li\",\n    \"href\": \"https://github.com/almarklein/timetagger\"\n  }, \"timetagger\"), \" - Tag your time, get the insight\")), mdx(\"h2\", {\n    \"id\": \"shopping\"\n  }, \"Shopping\"), mdx(\"ul\", null, mdx(\"li\", {\n    parentName: \"ul\"\n  }, mdx(\"a\", {\n    parentName: \"li\",\n    \"href\": \"https://github.com/medusajs/medusa\"\n  }, \"Mpedussa\"), \" - Shopify alternative #Alternative\")), mdx(\"h2\", {\n    \"id\": \"services\"\n  }, \"Services\"), mdx(\"ul\", null, mdx(\"li\", {\n    parentName: \"ul\"\n  }, mdx(\"a\", {\n    parentName: \"li\",\n    \"href\": \"https://github.com/LibreTranslate/LibreTranslate\"\n  }, \"LibreTranslate\"), \" - Free and Open Source Machine Translation API. 100% self-hosted, no limits, no ties to proprietary translation services.\")), mdx(\"h2\", {\n    \"id\": \"medias\"\n  }, \"Medias\"), mdx(\"ul\", null, mdx(\"li\", {\n    parentName: \"ul\"\n  }, mdx(\"a\", {\n    parentName: \"li\",\n    \"href\": \"https://github.com/hauxir/rapidbay\"\n  }, \"RapidBay\"), \" - Self-hosted torrent video streaming service compatible with Chromecast and AppleTV deployable in the cloud\")), mdx(\"h2\", {\n    \"id\": \"paas\"\n  }, \"PAAS\"), mdx(\"ul\", null, mdx(\"li\", {\n    parentName: \"ul\"\n  }, mdx(\"a\", {\n    parentName: \"li\",\n    \"href\": \"https://www.cloudron.io/index.html\"\n  }, \"cloudron\")), mdx(\"li\", {\n    parentName: \"ul\"\n  }, mdx(\"a\", {\n    parentName: \"li\",\n    \"href\": \"https://sandstorm.io/\"\n  }, \"sandstorm\")), mdx(\"li\", {\n    parentName: \"ul\"\n  }, mdx(\"a\", {\n    parentName: \"li\",\n    \"href\": \"https://freedombox.org/\"\n  }, \"freedombox\"))), mdx(\"h2\", {\n    \"id\": \"federation\"\n  }, \"Federation\"), mdx(\"ul\", null, mdx(\"li\", {\n    parentName: \"ul\"\n  }, mdx(\"a\", {\n    parentName: \"li\",\n    \"href\": \"https://joinmobilizon.org/en/\"\n  }, \"Mobilizon\"), \" - Mobilizon is a tool that helps you find, create and organize events.\"), mdx(\"li\", {\n    parentName: \"ul\"\n  }, mdx(\"a\", {\n    parentName: \"li\",\n    \"href\": \"https://github.com/orbitdb/orbit\"\n  }, \"Orbit\"), \" - A distributed, serverless, peer-to-peer chat application on IPFS.\"), mdx(\"li\", {\n    parentName: \"ul\"\n  }, mdx(\"a\", {\n    parentName: \"li\",\n    \"href\": \"https://github.com/irislib/iris-messenger\"\n  }, \"Iris\"), \" - Decentralized messenger\"), mdx(\"li\", {\n    parentName: \"ul\"\n  }, mdx(\"a\", {\n    parentName: \"li\",\n    \"href\": \"https://twt.social/\"\n  }, \"Twt.social\"), \" - Twt.social is a new Social Media platform\")), mdx(\"h2\", {\n    \"id\": \"old-school\"\n  }, \"Old school\"), mdx(\"ul\", null, mdx(\"li\", {\n    parentName: \"ul\"\n  }, mdx(\"a\", {\n    parentName: \"li\",\n    \"href\": \"https://gemini.circumlunar.space/\"\n  }, \"gemini\"), \" - Gemini is a new internet protocol which: Is heavier than gopher, Is lighter than the web, Will not replace either, Strives for maximum power to weight ratio, Takes user privacy very seriously\")), mdx(\"h2\", {\n    \"id\": \"livestreaming\"\n  }, \"Livestreaming\"), mdx(\"ul\", null, mdx(\"li\", {\n    parentName: \"ul\"\n  }, mdx(\"a\", {\n    parentName: \"li\",\n    \"href\": \"https://github.com/GRVYDEV/Project-Lightspeed\"\n  }, \"Lightspeed\"), \" - A self contained OBS -> FTL -> WebRTC live streaming server. Comprised of 3 parts once configured anyone can achieve sub-second OBS to the browser livestreaming\")), mdx(\"h2\", {\n    \"id\": \"admin\"\n  }, \"Admin\"), mdx(\"ul\", null, mdx(\"li\", {\n    parentName: \"ul\"\n  }, mdx(\"a\", {\n    parentName: \"li\",\n    \"href\": \"https://github.com/ToolJet/ToolJet/\"\n  }, \"ToolJet\"), \" - ToolJet is an open-source low-code platform for building and deploying internal tools with minimal engineering efforts \\uD83D\\uDE80\")), mdx(\"h2\", {\n    \"id\": \"chat\"\n  }, \"Chat\"), mdx(\"ul\", null, mdx(\"li\", {\n    parentName: \"ul\"\n  }, mdx(\"a\", {\n    parentName: \"li\",\n    \"href\": \"https://github.com/mattermost/mattermost-server\"\n  }, \"mattermost\"), \" - Mattermost is an open source platform for secure collaboration across the entire software development lifecycle.\"), mdx(\"li\", {\n    parentName: \"ul\"\n  }, mdx(\"a\", {\n    parentName: \"li\",\n    \"href\": \"https://gitlab.com/famedly/conduit\"\n  }, \"conduit\"), \" - Conduit is a simple, fast and reliable chat server powered by Matrix\")), mdx(\"h2\", {\n    \"id\": \"deploy\"\n  }, \"Deploy\"), mdx(\"ul\", null, mdx(\"li\", {\n    parentName: \"ul\"\n  }, mdx(\"a\", {\n    parentName: \"li\",\n    \"href\": \"https://github.com/adnanh/webhook\"\n  }, \"Webhook\"), \" - webhook is a lightweight incoming webhook server to run shell commands\")), mdx(\"h2\", {\n    \"id\": \"music\"\n  }, \"Music\"), mdx(\"ul\", null, mdx(\"li\", {\n    parentName: \"ul\"\n  }, mdx(\"a\", {\n    parentName: \"li\",\n    \"href\": \"https://github.com/izderadicka/audioserve\"\n  }, \"music server in rust\"))));\n}\n;\nMDXContent.isMDXComponent = true;","rawBody":"---\ntags:\n  - Awesome\n  - Self-Hosted\n  - Tools\n---\n\n# Awesome Self-hosted\n\n## KOL\n\n- [calendso/calendso: The open-source Calendly alternative. (github.com)](https://github.com/calendso/calendso) - Make an appointment, connect with your calendar\n\n## Time tracking\n\n- [timetagger](https://github.com/almarklein/timetagger) - Tag your time, get the insight\n\n## Shopping\n\n- [Mpedussa](https://github.com/medusajs/medusa) - Shopify alternative #Alternative\n\n## Services\n\n- [LibreTranslate](https://github.com/LibreTranslate/LibreTranslate) - Free and Open Source Machine Translation API. 100% self-hosted, no limits, no ties to proprietary translation services.\n\n## Medias\n\n- [RapidBay](https://github.com/hauxir/rapidbay) - Self-hosted torrent video streaming service compatible with Chromecast and AppleTV deployable in the cloud\n\n## PAAS\n\n- [cloudron](https://www.cloudron.io/index.html)\n- [sandstorm](https://sandstorm.io/)\n- [freedombox](https://freedombox.org/)\n\n## Federation\n\n- [Mobilizon](https://joinmobilizon.org/en/) - Mobilizon is a tool that helps you find, create and organize events.\n- [Orbit](https://github.com/orbitdb/orbit) - A distributed, serverless, peer-to-peer chat application on IPFS.\n- [Iris](https://github.com/irislib/iris-messenger) - Decentralized messenger\n- [Twt.social](https://twt.social/) - Twt.social is a new Social Media platform\n\n## Old school\n\n- [gemini](https://gemini.circumlunar.space/) - Gemini is a new internet protocol which: Is heavier than gopher, Is lighter than the web, Will not replace either, Strives for maximum power to weight ratio, Takes user privacy very seriously\n\n## Livestreaming\n\n- [Lightspeed](https://github.com/GRVYDEV/Project-Lightspeed) - A self contained OBS -> FTL -> WebRTC live streaming server. Comprised of 3 parts once configured anyone can achieve sub-second OBS to the browser livestreaming\n\n## Admin\n\n- [ToolJet](https://github.com/ToolJet/ToolJet/) - ToolJet is an open-source low-code platform for building and deploying internal tools with minimal engineering efforts ğŸš€\n\n## Chat\n\n- [mattermost](https://github.com/mattermost/mattermost-server) - Mattermost is an open source platform for secure collaboration across the entire software development lifecycle.\n- [conduit](https://gitlab.com/famedly/conduit) - Conduit is a simple, fast and reliable chat server powered by Matrix\n\n## Deploy\n\n- [Webhook](https://github.com/adnanh/webhook) - webhook is a lightweight incoming webhook server to run shell commands\n\n## Music\n\n- [music server in rust](https://github.com/izderadicka/audioserve)\n","excerpt":"Awesome Self-hosted KOL calendso/calendso: The open-source Calendly alternative. (github.com)  - Make an appointment, connect with your calâ€¦","outboundReferences":[],"inboundReferences":[]},"tagsOutbound":{"nodes":[{"frontmatter":{"title":"æœ‰æ„æ€çš„é—®é¢˜æ”¶é›†","tags":["Awesome","FAQ","Answer","ä¸­æ–‡","Ask"]},"fields":{"slug":"/answers/","title":"æœ‰æ„æ€çš„é—®é¢˜æ”¶é›†","lastUpdated":"3/15/2022","lastUpdatedAt":"2022-03-15T13:26:12.000Z","gitCreatedAt":"2022-03-15T13:26:12.000Z"}},{"frontmatter":{"title":"Awesome Algorithm","tags":["Awesome","Algorithm","Recommend"]},"fields":{"slug":"/awesome-algorithm/","title":"Awesome Algorithm","lastUpdated":"9/5/2021","lastUpdatedAt":"2021-09-05T06:09:14.000Z","gitCreatedAt":"2021-09-05T06:09:14.000Z"}},{"frontmatter":{"title":"Awesome Alternatives","tags":["Awesome","Alternatives"]},"fields":{"slug":"/awesome-alternatives/","title":"Awesome Alternatives","lastUpdated":"3/15/2022","lastUpdatedAt":"2022-03-15T20:25:50.000Z","gitCreatedAt":"2021-09-12T18:29:05.000Z"}},{"frontmatter":{"title":"Awesome APIs","tags":["Awesome","API"]},"fields":{"slug":"/awesome-apis/","title":"Awesome APIs","lastUpdated":"2/19/2022","lastUpdatedAt":"2022-02-19T04:56:53.000Z","gitCreatedAt":"2021-10-12T07:22:35.000Z"}},{"frontmatter":{"title":"å€¼å¾—ä¸€çœ‹çš„æ–‡ç« åˆ—è¡¨","tags":["Awesome","Articles"]},"fields":{"slug":"/awesome-articles/","title":"å€¼å¾—ä¸€çœ‹çš„æ–‡ç« åˆ—è¡¨","lastUpdated":"3/15/2022","lastUpdatedAt":"2022-03-15T20:25:50.000Z","gitCreatedAt":"2021-12-19T22:36:06.000Z"}},{"frontmatter":{"title":"Awesome Automations","tags":["Awesome","Automations","Self-Hosted"]},"fields":{"slug":"/awesome-automations/","title":"Awesome Automations","lastUpdated":"9/12/2021","lastUpdatedAt":"2021-09-12T07:41:32.000Z","gitCreatedAt":"2021-09-03T05:53:38.000Z"}},{"frontmatter":{"title":"","tags":["Awesome"]},"fields":{"slug":"/awesome-backup/","title":"Awesome Backup","lastUpdated":"8/27/2021","lastUpdatedAt":"2021-08-27T02:25:34.000Z","gitCreatedAt":"2021-08-27T02:25:34.000Z"}},{"frontmatter":{"title":"","tags":["Benchmark","Proxies","Bash","Awesome"]},"fields":{"slug":"/awesome-benchmark/","title":"Awesome Benchmark","lastUpdated":"9/28/2021","lastUpdatedAt":"2021-09-28T07:14:03.000Z","gitCreatedAt":"2021-08-27T02:25:34.000Z"}},{"frontmatter":{"title":"","tags":["Awesome"]},"fields":{"slug":"/awesome-bookmarks/","title":"Awesome Bookmarks","lastUpdated":"8/27/2021","lastUpdatedAt":"2021-08-27T02:25:34.000Z","gitCreatedAt":"2021-08-27T02:25:34.000Z"}},{"frontmatter":{"title":"","tags":["Awesome","Browser"]},"fields":{"slug":"/awesome-browsers/","title":"Awesome Browsers","lastUpdated":"3/15/2022","lastUpdatedAt":"2022-03-15T16:50:33.000Z","gitCreatedAt":"2021-09-04T02:41:10.000Z"}},{"frontmatter":{"title":"Awesome Chat","tags":["Awesome","Chat"]},"fields":{"slug":"/awesome-chat/","title":"Awesome Chat","lastUpdated":"3/13/2022","lastUpdatedAt":"2022-03-13T18:23:58.000Z","gitCreatedAt":"2021-10-12T07:22:35.000Z"}},{"frontmatter":{"title":"Awesome Command Tools","tags":["Awesome","Tools","Command"]},"fields":{"slug":"/awesome-cli/","title":"Awesome Command Tools","lastUpdated":"3/8/2022","lastUpdatedAt":"2022-03-08T04:17:56.000Z","gitCreatedAt":"2022-03-08T04:17:56.000Z"}},{"frontmatter":{"title":"åœ¨ä¸­å›½ä¹°æˆ¿ä¹‹å‰ï¼Œä½ éœ€è¦äº†è§£çš„ä¿¡æ¯æ±‡æ€»","tags":["Awesome","House","China"]},"fields":{"slug":"/awesome-cn-house/","title":"åœ¨ä¸­å›½ä¹°æˆ¿ä¹‹å‰ï¼Œä½ éœ€è¦äº†è§£çš„ä¿¡æ¯æ±‡æ€»","lastUpdated":"2/11/2022","lastUpdatedAt":"2022-02-11T11:54:43.000Z","gitCreatedAt":"2022-02-11T11:54:43.000Z"}},{"frontmatter":{"title":"","tags":["Awesome","Code","Learning"]},"fields":{"slug":"/awesome-code-learning/","title":"Awesome Code Learning","lastUpdated":"12/13/2021","lastUpdatedAt":"2021-12-13T14:27:33.000Z","gitCreatedAt":"2021-09-04T07:51:54.000Z"}},{"frontmatter":{"title":"","tags":["Awesome","Communities","Social","ä¸­æ–‡"]},"fields":{"slug":"/awesome-communities/","title":"æ”¶é›†ä¸€äº›æœ‰æ„æ€çš„ç¤¾åŒº","lastUpdated":"3/17/2022","lastUpdatedAt":"2022-03-17T18:33:31.000Z","gitCreatedAt":"2021-09-04T07:51:54.000Z"}},{"frontmatter":{"title":"Awesome Dashboard","tags":["Awesome","Admin","Dashboard"]},"fields":{"slug":"/awesome-dashboard/","title":"Awesome Dashboard","lastUpdated":"1/28/2022","lastUpdatedAt":"2022-01-28T15:56:55.000Z","gitCreatedAt":"2022-01-28T15:56:55.000Z"}},{"frontmatter":{"title":"æœ‰è¶£çš„æ•°æ®","tags":["Data","Awesome","ä¸­æ–‡"]},"fields":{"slug":"/awesome-data/","title":"æœ‰è¶£çš„æ•°æ®","lastUpdated":"3/6/2022","lastUpdatedAt":"2022-03-06T09:09:39.000Z","gitCreatedAt":"2022-02-21T01:59:18.000Z"}},{"frontmatter":{"title":"Awesome Databases","tags":["Awesome","Database"]},"fields":{"slug":"/awesome-databases/","title":"Awesome Databases","lastUpdated":"1/30/2022","lastUpdatedAt":"2022-01-30T07:47:59.000Z","gitCreatedAt":"2021-09-28T07:14:03.000Z"}},{"frontmatter":{"title":"Awesome Decentralization","tags":["Awesome","Decentralization"]},"fields":{"slug":"/awesome-decentralization/","title":"Awesome Decentralization","lastUpdated":"3/15/2022","lastUpdatedAt":"2022-03-15T20:25:50.000Z","gitCreatedAt":"2021-09-24T11:05:17.000Z"}},{"frontmatter":{"title":"Awesome Deno","tags":["Awesome","Deno"]},"fields":{"slug":"/awesome-deno/","title":"Awesome Deno","lastUpdated":"1/22/2022","lastUpdatedAt":"2022-01-22T11:04:34.000Z","gitCreatedAt":"2021-09-25T19:02:30.000Z"}},{"frontmatter":{"title":"Awesome Editors","tags":["Awesome","Editors","Tools"]},"fields":{"slug":"/awesome-editors/","title":"Awesome Editors","lastUpdated":"1/24/2022","lastUpdatedAt":"2022-01-24T14:37:03.000Z","gitCreatedAt":"2021-09-04T02:41:10.000Z"}},{"frontmatter":{"title":"Awesome Emails","tags":["Awesome","Email"]},"fields":{"slug":"/awesome-emails.md/","title":"Awesome Emails","lastUpdated":"10/10/2021","lastUpdatedAt":"2021-10-10T23:24:14.000Z","gitCreatedAt":"2021-10-10T23:24:14.000Z"}},{"frontmatter":{"title":"","tags":["Awesome","English","Learning"]},"fields":{"slug":"/awesome-english-learning/","title":"æ”¶é›†è‹±è¯­å­¦ä¹ å·¥å…·","lastUpdated":"3/17/2022","lastUpdatedAt":"2022-03-17T15:17:12.000Z","gitCreatedAt":"2021-09-04T02:41:10.000Z"}},{"frontmatter":{"title":"Awesome Extensions","tags":["Awesome","Extensions"]},"fields":{"slug":"/awesome-extensions/","title":"Awesome Extensions","lastUpdated":"1/29/2022","lastUpdatedAt":"2022-01-29T17:28:39.000Z","gitCreatedAt":"2022-01-29T17:28:39.000Z"}},{"frontmatter":{"title":"","tags":["Awesome","Files"]},"fields":{"slug":"/awesome-file-managers/","title":"Awesome File Managers","lastUpdated":"8/27/2021","lastUpdatedAt":"2021-08-27T03:43:35.000Z","gitCreatedAt":"2021-08-27T02:25:34.000Z"}},{"frontmatter":{"title":"Awesome Flutter","tags":["Awesome","Flutter"]},"fields":{"slug":"/awesome-flutter/","title":"Awesome Flutter","lastUpdated":"2/13/2022","lastUpdatedAt":"2022-02-13T17:40:05.000Z","gitCreatedAt":"2021-10-11T13:41:00.000Z"}},{"frontmatter":{"title":"Awesome Free","tags":["Free","Awesome","Tools"]},"fields":{"slug":"/awesome-free/","title":"Awesome Free","lastUpdated":"3/7/2022","lastUpdatedAt":"2022-03-07T15:47:04.000Z","gitCreatedAt":"2021-08-29T20:06:24.000Z"}},{"frontmatter":{"title":"Awesome Frontend","tags":["Awesome","Frontend","Application"]},"fields":{"slug":"/awesome-frontend/","title":"Awesome Frontend","lastUpdated":"3/6/2022","lastUpdatedAt":"2022-03-06T08:07:02.000Z","gitCreatedAt":"2022-03-06T08:07:02.000Z"}},{"frontmatter":{"title":"","tags":["Awesome"]},"fields":{"slug":"/awesome-gatsby/","title":"Awesome Gatsby","lastUpdated":"8/29/2021","lastUpdatedAt":"2021-08-29T20:06:24.000Z","gitCreatedAt":"2021-08-27T02:25:34.000Z"}},{"frontmatter":{"title":"æ™ºèƒ½å®¶å±…æ–¹æ¡ˆæ±‡æ€»","tags":["Awesome","Home"]},"fields":{"slug":"/awesome-home/","title":"æ™ºèƒ½å®¶å±…æ–¹æ¡ˆæ±‡æ€»","lastUpdated":"2/2/2022","lastUpdatedAt":"2022-02-02T17:59:25.000Z","gitCreatedAt":"2022-02-02T17:59:25.000Z"}},{"frontmatter":{"title":"Awesome ID generator","tags":["Awesome","ID"]},"fields":{"slug":"/awesome-id/","title":"Awesome ID generator","lastUpdated":"1/10/2022","lastUpdatedAt":"2022-01-10T20:56:53.000Z","gitCreatedAt":"2021-11-13T06:51:26.000Z"}},{"frontmatter":{"title":"Awesome Interview","tags":["Awesome","Interview"]},"fields":{"slug":"/awesome-interview/","title":"Awesome Interview","lastUpdated":"9/5/2021","lastUpdatedAt":"2021-09-05T04:49:34.000Z","gitCreatedAt":"2021-09-05T04:49:34.000Z"}},{"frontmatter":{"title":"","tags":["Awesome","Investing","Stocks"]},"fields":{"slug":"/awesome-investing/","title":"Awesome Investing","lastUpdated":"9/4/2021","lastUpdatedAt":"2021-09-04T07:51:54.000Z","gitCreatedAt":"2021-09-04T07:51:54.000Z"}},{"frontmatter":{"title":"","tags":["Awesome"]},"fields":{"slug":"/awesome-jackett-indexes/","title":"Awesome Jackett Indexes","lastUpdated":"8/27/2021","lastUpdatedAt":"2021-08-27T02:25:34.000Z","gitCreatedAt":"2021-08-27T02:25:34.000Z"}},{"frontmatter":{"title":"Awesome Jobs","tags":["Awesome","Jobs"]},"fields":{"slug":"/awesome-jobs/","title":"Awesome Jobs","lastUpdated":"3/15/2022","lastUpdatedAt":"2022-03-15T20:25:50.000Z","gitCreatedAt":"2021-10-12T07:22:35.000Z"}},{"frontmatter":{"title":"","tags":["Awesome","Javascript","Date"]},"fields":{"slug":"/awesome-js-date/","title":"Awesome JS Date","lastUpdated":"8/27/2021","lastUpdatedAt":"2021-08-27T02:25:34.000Z","gitCreatedAt":"2021-08-27T02:25:34.000Z"}},{"frontmatter":{"title":"æ”¶é›† Javascript é‡Œå¥½ç”¨çš„åº“","tags":["Awesome","Javascript","ä¸­æ–‡"]},"fields":{"slug":"/awesome-js/","title":"æ”¶é›† Javascript é‡Œå¥½ç”¨çš„åº“","lastUpdated":"1/28/2022","lastUpdatedAt":"2022-01-28T15:56:55.000Z","gitCreatedAt":"2021-08-29T20:06:24.000Z"}},{"frontmatter":{"title":"Awesome KOL","tags":["Awesome","KOL"]},"fields":{"slug":"/awesome-kol/","title":"Awesome KOL","lastUpdated":"10/4/2021","lastUpdatedAt":"2021-10-04T19:24:25.000Z","gitCreatedAt":"2021-10-04T19:24:25.000Z"}},{"frontmatter":{"title":"å¸¸è§çš„ä½ä»£ç /æ— ä»£ç åˆ—è¡¨","tags":["Awesome","Low-Code"]},"fields":{"slug":"/awesome-low-code/","title":"å¸¸è§çš„ä½ä»£ç /æ— ä»£ç åˆ—è¡¨","lastUpdated":"10/12/2021","lastUpdatedAt":"2021-10-12T07:22:35.000Z","gitCreatedAt":"2021-10-12T07:22:35.000Z"}},{"frontmatter":{"title":"å€¼å¾—å®šæœŸå…³æ³¨çš„ç‹¬ç«‹å¼€å‘è€…/åˆ›é€ è€…","tags":["Awesome","Maker"]},"fields":{"slug":"/awesome-maker/","title":"å€¼å¾—å®šæœŸå…³æ³¨çš„ç‹¬ç«‹å¼€å‘è€…/åˆ›é€ è€…","lastUpdated":"2/15/2022","lastUpdatedAt":"2022-02-15T22:03:41.000Z","gitCreatedAt":"2022-02-15T03:43:44.000Z"}},{"frontmatter":{"title":"å›½å†…é•œåƒèµ„æºæ±‡æ€»","tags":["Awesome","Mirrors"]},"fields":{"slug":"/awesome-mirrors/","title":"å›½å†…é•œåƒèµ„æºæ±‡æ€»","lastUpdated":"11/21/2021","lastUpdatedAt":"2021-11-21T16:27:36.000Z","gitCreatedAt":"2021-11-01T22:47:18.000Z"}},{"frontmatter":{"title":"å€¼å¾—è§‚çœ‹çš„ç”µå½±","tags":["Movies","Awesome","ä¸­æ–‡"]},"fields":{"slug":"/awesome-movies/","title":"å€¼å¾—è§‚çœ‹çš„ç”µå½±","lastUpdated":"9/3/2021","lastUpdatedAt":"2021-09-03T05:53:38.000Z","gitCreatedAt":"2021-09-03T05:53:38.000Z"}},{"frontmatter":{"title":"Awesome News","tags":["Awesome","News"]},"fields":{"slug":"/awesome-news/","title":"Awesome News","lastUpdated":"9/25/2021","lastUpdatedAt":"2021-09-25T12:40:57.000Z","gitCreatedAt":"2021-09-25T12:40:57.000Z"}},{"frontmatter":{"title":"Awesome Notes","tags":["Awesome","Notes","Tools"]},"fields":{"slug":"/awesome-notes/","title":"Awesome Notes","lastUpdated":"8/31/2021","lastUpdatedAt":"2021-08-31T04:16:33.000Z","gitCreatedAt":"2021-08-31T00:37:15.000Z"}},{"frontmatter":{"title":"Awesome NSFW","tags":["NSFW","Awesome"]},"fields":{"slug":"/awesome-nsfw/","title":"Awesome NSFW","lastUpdated":"1/28/2022","lastUpdatedAt":"2022-01-28T13:23:56.000Z","gitCreatedAt":"2022-01-28T13:23:56.000Z"}},{"frontmatter":{"title":"æ”¶é›†å¯ä»¥åœ¨çº¿é˜…è¯»çš„ä¹¦ç±","tags":["Awesome","Books"]},"fields":{"slug":"/awesome-online-books/","title":"æ”¶é›†å¯ä»¥åœ¨çº¿é˜…è¯»çš„ä¹¦ç±","lastUpdated":"11/13/2021","lastUpdatedAt":"2021-11-13T06:51:26.000Z","gitCreatedAt":"2021-11-13T06:51:26.000Z"}},{"frontmatter":{"title":"Awesome Open Source","tags":["Awesome","Open Source"]},"fields":{"slug":"/awesome-open-source/","title":"Awesome Open Source","lastUpdated":"3/15/2022","lastUpdatedAt":"2022-03-15T16:50:33.000Z","gitCreatedAt":"2022-01-12T06:26:27.000Z"}},{"frontmatter":{"title":"Awesome Privacy","tags":["Awesome","Privacy"]},"fields":{"slug":"/awesome-privacy/","title":"Awesome Privacy","lastUpdated":"10/11/2021","lastUpdatedAt":"2021-10-11T15:49:10.000Z","gitCreatedAt":"2021-09-05T04:49:34.000Z"}},{"frontmatter":{"title":"","tags":["Awesome","Social","Products"]},"fields":{"slug":"/awesome-products/","title":"Awesome Products","lastUpdated":"9/5/2021","lastUpdatedAt":"2021-09-05T04:49:34.000Z","gitCreatedAt":"2021-09-05T04:49:34.000Z"}},{"frontmatter":{"title":"é«˜è´¨é‡çš„èµ„æºç½‘ç«™æ”¶é›†ï¼ˆç”µå­ä¹¦ï¼Œç”µå½±ï¼Œç”µè§†å‰§ç­‰ï¼‰","tags":["Awesome","Resource"]},"fields":{"slug":"/awesome-resources/","title":"é«˜è´¨é‡çš„èµ„æºç½‘ç«™æ”¶é›†ï¼ˆç”µå­ä¹¦ï¼Œç”µå½±ï¼Œç”µè§†å‰§ç­‰ï¼‰","lastUpdated":"3/8/2022","lastUpdatedAt":"2022-03-08T08:33:09.000Z","gitCreatedAt":"2022-03-05T03:45:03.000Z"}},{"frontmatter":{"title":"Awesome RSS","tags":["RSS","Awesome"]},"fields":{"slug":"/awesome-rss/","title":"Awesome RSS","lastUpdated":"9/25/2021","lastUpdatedAt":"2021-09-25T06:38:19.000Z","gitCreatedAt":"2021-09-25T06:38:19.000Z"}},{"frontmatter":{"title":"Awesome Rust","tags":["Awesome","Rust","Learning"]},"fields":{"slug":"/awesome-rust/","title":"Awesome Rust","lastUpdated":"2/6/2022","lastUpdatedAt":"2022-02-06T12:12:58.000Z","gitCreatedAt":"2021-09-05T10:08:42.000Z"}},{"frontmatter":{"title":"Awesome Schema","tags":["Awesome","Schema","JSOn"]},"fields":{"slug":"/awesome-schema/","title":"Awesome Schema","lastUpdated":"1/15/2022","lastUpdatedAt":"2022-01-15T09:57:32.000Z","gitCreatedAt":"2022-01-15T08:46:05.000Z"}},{"frontmatter":{"title":"","tags":["Awesome","Self-Hosted","Tools"]},"fields":{"slug":"/awesome-selfhosted/","title":"Awesome Self-hosted","lastUpdated":"2/18/2022","lastUpdatedAt":"2022-02-18T02:50:04.000Z","gitCreatedAt":"2021-09-04T01:08:18.000Z"}},{"frontmatter":{"title":"Awesome Semantic","tags":["Awesome","Semantic"]},"fields":{"slug":"/awesome-semantic/","title":"Awesome Semantic","lastUpdated":"1/21/2022","lastUpdatedAt":"2022-01-21T08:49:36.000Z","gitCreatedAt":"2022-01-15T08:46:05.000Z"}},{"frontmatter":{"title":"Awesome SEO Tools","tags":["SEO","Awesome","Tools"]},"fields":{"slug":"/awesome-seo/","title":"Awesome SEO Tools","lastUpdated":"8/30/2021","lastUpdatedAt":"2021-08-30T16:14:42.000Z","gitCreatedAt":"2021-08-30T16:14:42.000Z"}},{"frontmatter":{"title":"Awesome Services","tags":["Awesome","Service"]},"fields":{"slug":"/awesome-service/","title":"Awesome Services","lastUpdated":"10/19/2021","lastUpdatedAt":"2021-10-19T06:38:57.000Z","gitCreatedAt":"2021-09-10T07:25:10.000Z"}},{"frontmatter":{"title":"","tags":["Social","Awesome"]},"fields":{"slug":"/awesome-socials/","title":"æ”¶é›†æœ‰æ„æ€çš„ç¤¾äº¤åº”ç”¨","lastUpdated":"12/19/2021","lastUpdatedAt":"2021-12-19T22:36:06.000Z","gitCreatedAt":"2021-08-27T02:25:34.000Z"}},{"frontmatter":{"title":"Awesome Speed","tags":["Awesome","Speed","Netwok"]},"fields":{"slug":"/awesome-speed/","title":"Awesome Speed","lastUpdated":"9/6/2021","lastUpdatedAt":"2021-09-06T16:52:24.000Z","gitCreatedAt":"2021-09-06T16:52:24.000Z"}},{"frontmatter":{"title":"æœ‰æ„æ€çš„åè®®æ”¶é›†","tags":["Awesome","Protocol","Standard"]},"fields":{"slug":"/awesome-standards/","title":"æœ‰æ„æ€çš„åè®®æ”¶é›†","lastUpdated":"2/15/2022","lastUpdatedAt":"2022-02-15T17:46:31.000Z","gitCreatedAt":"2022-02-15T17:46:31.000Z"}},{"frontmatter":{"title":"","tags":["Awesome","Startups","Tools"]},"fields":{"slug":"/awesome-startups/","title":"Awesome Startups","lastUpdated":"3/8/2022","lastUpdatedAt":"2022-03-08T08:33:09.000Z","gitCreatedAt":"2021-09-04T01:08:18.000Z"}},{"frontmatter":{"title":"","tags":["Awesome","Static-Site-Generator"]},"fields":{"slug":"/awesome-static-site-generator/","title":"Awesome Static Site Generator","lastUpdated":"12/31/2021","lastUpdatedAt":"2021-12-31T03:02:42.000Z","gitCreatedAt":"2021-08-27T02:25:34.000Z"}},{"frontmatter":{"title":"æ”¶é›†è‚¡å¸‚ç›¸å…³çš„èµ„æº","tags":["Awesome","Stocks"]},"fields":{"slug":"/awesome-stocks/","title":"æ”¶é›†è‚¡å¸‚ç›¸å…³çš„èµ„æº","lastUpdated":"3/8/2022","lastUpdatedAt":"2022-03-08T11:22:55.000Z","gitCreatedAt":"2022-03-08T11:22:55.000Z"}},{"frontmatter":{"title":"Awesome Swift","tags":["Awesome","Swift"]},"fields":{"slug":"/awesome-swift/","title":"Awesome Swift","lastUpdated":"10/1/2021","lastUpdatedAt":"2021-10-01T07:50:27.000Z","gitCreatedAt":"2021-09-29T09:48:05.000Z"}},{"frontmatter":{"title":"æ”¶é›†ä¸€äº›æœ‰ç”¨çš„æŠ€æœ¯/ç¯å¢ƒé—®é¢˜çš„è§£å†³æ–¹æ¡ˆ","tags":["Awesome","FAQ","Tech","Serverless"]},"fields":{"slug":"/awesome-tech-anwser/","title":"æ”¶é›†ä¸€äº›æœ‰ç”¨çš„æŠ€æœ¯/ç¯å¢ƒé—®é¢˜çš„è§£å†³æ–¹æ¡ˆ","lastUpdated":"9/10/2021","lastUpdatedAt":"2021-09-10T09:43:29.000Z","gitCreatedAt":"2021-09-10T09:43:29.000Z"}},{"frontmatter":{"title":"Awesome Templates","tags":["Awesome","Templates"]},"fields":{"slug":"/awesome-templates/","title":"Awesome Templates","lastUpdated":"1/29/2022","lastUpdatedAt":"2022-01-29T17:28:39.000Z","gitCreatedAt":"2021-09-22T15:17:38.000Z"}},{"frontmatter":{"title":"å€¼å¾—è§‚çœ‹çš„ç”µè§†å‰§","tags":["Awesome","TV","List","ä¸­æ–‡"]},"fields":{"slug":"/awesome-tv-shows/","title":"å€¼å¾—è§‚çœ‹çš„ç”µè§†å‰§","lastUpdated":"9/13/2021","lastUpdatedAt":"2021-09-13T11:34:16.000Z","gitCreatedAt":"2021-09-03T05:53:38.000Z"}},{"frontmatter":{"title":"","tags":["Awesome","UI","Front-End"]},"fields":{"slug":"/awesome-ui/","title":"Awesome UI","lastUpdated":"3/9/2022","lastUpdatedAt":"2022-03-09T07:54:15.000Z","gitCreatedAt":"2021-08-27T02:25:34.000Z"}},{"frontmatter":{"title":"Awesome What Was Your Moment","tags":["Awesome"]},"fields":{"slug":"/awesome-what-was-your-moment/","title":"Awesome What Was Your Moment","lastUpdated":"9/5/2021","lastUpdatedAt":"2021-09-05T10:08:42.000Z","gitCreatedAt":"2021-09-05T10:08:42.000Z"}},{"frontmatter":{"title":"æ”¶é›†Windowsä¸Šå¥½ç©ï¼Œå¥½ç”¨çš„ä¸œè¥¿","tags":["Windows","Awesome","Tools","Development-Environment","ä¸­æ–‡"]},"fields":{"slug":"/awesome-windows/","title":"æ”¶é›†Windowsä¸Šå¥½ç©ï¼Œå¥½ç”¨çš„ä¸œè¥¿","lastUpdated":"9/13/2021","lastUpdatedAt":"2021-09-13T11:34:16.000Z","gitCreatedAt":"2021-08-31T23:51:23.000Z"}},{"frontmatter":{"title":"Awesome workflows","tags":["Awesome","Workflows"]},"fields":{"slug":"/awesome-workflows/","title":"Awesome workflows","lastUpdated":"2/15/2022","lastUpdatedAt":"2022-02-15T03:43:44.000Z","gitCreatedAt":"2021-10-12T07:22:35.000Z"}},{"frontmatter":{"title":"","tags":["Medias","Subtitles","Setup","Self-Hosted"]},"fields":{"slug":"/bazarr-setup/","title":"Bazarr Setup","lastUpdated":"8/27/2021","lastUpdatedAt":"2021-08-27T02:25:34.000Z","gitCreatedAt":"2021-08-27T02:25:34.000Z"}},{"frontmatter":{"title":"äº’è”ç½‘ç›®å½•æ±‡æ€»","tags":["Awesome","Indexes","Trends"]},"fields":{"slug":"/indexes/","title":"äº’è”ç½‘ç›®å½•æ±‡æ€»","lastUpdated":"3/17/2022","lastUpdatedAt":"2022-03-17T18:33:31.000Z","gitCreatedAt":"2022-03-15T13:26:12.000Z"}},{"frontmatter":{"title":"æ”¶é›†ä¸€äº›ç»™äººçµæ„Ÿçš„ä¸œè¥¿","tags":["Awesome","Tools","ä¸­æ–‡","Things","Inspires"]},"fields":{"slug":"/inspires/","title":"æ”¶é›†ä¸€äº›ç»™äººçµæ„Ÿçš„ä¸œè¥¿","lastUpdated":"3/17/2022","lastUpdatedAt":"2022-03-17T20:46:50.000Z","gitCreatedAt":"2022-03-15T16:50:33.000Z"}},{"frontmatter":{"title":"å€¼å¾—å…³æ³¨çš„/æœ‰è¶£çš„äºº","tags":["Awesome","People","Following"]},"fields":{"slug":"/people/","title":"å€¼å¾—å…³æ³¨çš„/æœ‰è¶£çš„äºº","lastUpdated":"3/17/2022","lastUpdatedAt":"2022-03-17T18:33:47.000Z","gitCreatedAt":"2022-03-17T18:33:47.000Z"}},{"frontmatter":{"title":"æ”¶é›†å‘äººæ·±çœçš„è¯","tags":["Awesome","Quotes","ä¸­æ–‡"]},"fields":{"slug":"/quotes/","title":"æ”¶é›†å‘äººæ·±çœçš„è¯","lastUpdated":"3/17/2022","lastUpdatedAt":"2022-03-17T22:59:53.000Z","gitCreatedAt":"2022-03-15T13:26:12.000Z"}},{"frontmatter":{"title":"","tags":["Medias","Radarr","Setup","Self-Hosted"]},"fields":{"slug":"/radarr-setup/","title":"Radarr Setup","lastUpdated":"8/27/2021","lastUpdatedAt":"2021-08-27T02:25:34.000Z","gitCreatedAt":"2021-08-27T02:25:34.000Z"}},{"frontmatter":{"title":"","tags":["Medias","Self-Hosted","Sonarr"]},"fields":{"slug":"/sonarr-setup/","title":"Sonarr Setup","lastUpdated":"8/27/2021","lastUpdatedAt":"2021-08-27T02:25:34.000Z","gitCreatedAt":"2021-08-27T02:25:34.000Z"}},{"frontmatter":{"title":"","tags":["Awesome","Explore","Sources"]},"fields":{"slug":"/sources/","title":"æ¢ç´¢äº’è”ç½‘ä¸Šé«˜è´¨é‡çš„å†…å®¹","lastUpdated":"3/17/2022","lastUpdatedAt":"2022-03-17T22:59:53.000Z","gitCreatedAt":"2022-03-15T13:26:12.000Z"}},{"frontmatter":{"title":"æœ€å¥½ç”¨çš„å·¥å…·é›†åˆ","tags":["Awesome","Tools","ä¸­æ–‡"]},"fields":{"slug":"/tools/","title":"æœ€å¥½ç”¨çš„å·¥å…·é›†åˆ","lastUpdated":"3/17/2022","lastUpdatedAt":"2022-03-17T22:59:53.000Z","gitCreatedAt":"2022-03-15T13:26:12.000Z"}},{"frontmatter":{"title":"","tags":["Medias","Youtube","Downloads","Self-Hosted","Metube"]},"fields":{"slug":"/youtube-download/","title":"Youtube Download","lastUpdated":"8/27/2021","lastUpdatedAt":"2021-08-27T02:25:34.000Z","gitCreatedAt":"2021-08-27T02:25:34.000Z"}},{"frontmatter":{"title":"","tags":["Medias","Jellyfin","Setup","Self-Hosted"]},"fields":{"slug":"/jellyfin-setup/","title":"Jellyfin setup","lastUpdated":"8/27/2021","lastUpdatedAt":"2021-08-27T02:25:34.000Z","gitCreatedAt":"2021-08-27T02:25:34.000Z"}},{"frontmatter":{"title":"","tags":["Medias","Jackett","Torrents","BT","Self-Hosted","Setup"]},"fields":{"slug":"/jackett-setup/","title":"Jackett Setup","lastUpdated":"8/27/2021","lastUpdatedAt":"2021-08-27T02:25:34.000Z","gitCreatedAt":"2021-08-27T02:25:34.000Z"}}]}},"pageContext":{"tags":["Awesome","Self-Hosted","Tools"],"slug":"/awesome-selfhosted/","sidebarItems":[{"title":"","items":[{"title":"Recently Updated","url":"/latest/","collapse":true,"indent":false,"items":[{"title":"03-17: 2022å¹´è¯»ä¹¦ç¬”è®°","url":"/books-2022/"},{"title":"03-17: æ”¶é›†å‘äººæ·±çœçš„è¯","url":"/quotes/"},{"title":"03-17: æ¢ç´¢äº’è”ç½‘ä¸Šé«˜è´¨é‡çš„å†…å®¹","url":"/sources/"},{"title":"03-17: æ‰€æ€æ‰€æƒ³","url":"/thoughts/"},{"title":"03-17: æœ€å¥½ç”¨çš„å·¥å…·é›†åˆ","url":"/tools/"},{"title":"03-17: æ”¶é›†ä¸€äº›ç»™äººçµæ„Ÿçš„ä¸œè¥¿","url":"/inspires/"},{"title":"03-17: å€¼å¾—å…³æ³¨çš„/æœ‰è¶£çš„äºº","url":"/people/"},{"title":"03-17: Everything I Know by Owen","url":"/"},{"title":"03-17: æ”¶é›†ä¸€äº›æœ‰æ„æ€çš„ç¤¾åŒº","url":"/awesome-communities/"},{"title":"03-17: è¯»ä¹¦ç¬”è®°","url":"/books/"},{"title":"03-17: äº’è”ç½‘ç›®å½•æ±‡æ€»","url":"/indexes/"},{"title":"03-17: ç”µå½±ç¬”è®°","url":"/movies/"},{"title":"03-17: æ”¶é›†è‹±è¯­å­¦ä¹ å·¥å…·","url":"/awesome-english-learning/"},{"title":"03-15: Awesome Alternatives","url":"/awesome-alternatives/"},{"title":"03-15: å€¼å¾—ä¸€çœ‹çš„æ–‡ç« åˆ—è¡¨","url":"/awesome-articles/"}]}]},{"title":"Tags","items":[{"title":"API","type":"tag","url":"/tags/api/","items":[{"title":"API Tokens","url":"/api-tokens/"},{"title":"Awesome APIs","url":"/awesome-apis/"}]},{"title":"Actions","type":"tag","url":"/tags/actions/","items":[{"title":"How to check if there are uncommited changes in Github Actions?","url":"/github-actions-workflow-check-if-there-is-uncommited-changes/"}]},{"title":"Admin","type":"tag","url":"/tags/admin/","items":[{"title":"Awesome Dashboard","url":"/awesome-dashboard/"}]},{"title":"Algorithm","type":"tag","url":"/tags/algorithm/","items":[{"title":"Awesome Algorithm","url":"/awesome-algorithm/"}]},{"title":"Alternatives","type":"tag","url":"/tags/alternatives/","items":[{"title":"Awesome Alternatives","url":"/awesome-alternatives/"}]},{"title":"Answer","type":"tag","url":"/tags/answer/","items":[{"title":"æœ‰æ„æ€çš„é—®é¢˜æ”¶é›†","url":"/answers/"}]},{"title":"Application","type":"tag","url":"/tags/application/","items":[{"title":"Awesome Frontend","url":"/awesome-frontend/"}]},{"title":"Approvals","type":"tag","url":"/tags/approvals/","items":[{"title":"æ—…è¡Œæ‰‹ç»­","url":"/travel-approvals/"}]},{"title":"Articles","type":"tag","url":"/tags/articles/","items":[{"title":"å€¼å¾—ä¸€çœ‹çš„æ–‡ç« åˆ—è¡¨","url":"/awesome-articles/"}]},{"title":"Ask","type":"tag","url":"/tags/ask/","items":[{"title":"æœ‰æ„æ€çš„é—®é¢˜æ”¶é›†","url":"/answers/"}]},{"title":"Auth","type":"tag","url":"/tags/auth/","items":[{"title":"Auth Gateway","url":"/auth-gateway/"},{"title":"API Tokens","url":"/api-tokens/"},{"title":"Use ssh key for Git","url":"/git-sshkey/"}]},{"title":"Automations","type":"tag","url":"/tags/automations/","items":[{"title":"Awesome Automations","url":"/awesome-automations/"}]},{"title":"Awesome","type":"tag","url":"/tags/awesome/","items":[{"title":"æœ‰æ„æ€çš„é—®é¢˜æ”¶é›†","url":"/answers/"},{"title":"Awesome Algorithm","url":"/awesome-algorithm/"},{"title":"Awesome Alternatives","url":"/awesome-alternatives/"},{"title":"Awesome APIs","url":"/awesome-apis/"},{"title":"å€¼å¾—ä¸€çœ‹çš„æ–‡ç« åˆ—è¡¨","url":"/awesome-articles/"},{"title":"Awesome Automations","url":"/awesome-automations/"},{"title":"Awesome Backup","url":"/awesome-backup/"},{"title":"Awesome Benchmark","url":"/awesome-benchmark/"},{"title":"Awesome Bookmarks","url":"/awesome-bookmarks/"},{"title":"Awesome Browsers","url":"/awesome-browsers/"},{"title":"Awesome Chat","url":"/awesome-chat/"},{"title":"Awesome Command Tools","url":"/awesome-cli/"},{"title":"åœ¨ä¸­å›½ä¹°æˆ¿ä¹‹å‰ï¼Œä½ éœ€è¦äº†è§£çš„ä¿¡æ¯æ±‡æ€»","url":"/awesome-cn-house/"},{"title":"Awesome Code Learning","url":"/awesome-code-learning/"},{"title":"æ”¶é›†ä¸€äº›æœ‰æ„æ€çš„ç¤¾åŒº","url":"/awesome-communities/"},{"title":"Awesome Dashboard","url":"/awesome-dashboard/"},{"title":"æœ‰è¶£çš„æ•°æ®","url":"/awesome-data/"},{"title":"Awesome Databases","url":"/awesome-databases/"},{"title":"Awesome Decentralization","url":"/awesome-decentralization/"},{"title":"Awesome Deno","url":"/awesome-deno/"},{"title":"Awesome Editors","url":"/awesome-editors/"},{"title":"Awesome Emails","url":"/awesome-emails.md/"},{"title":"æ”¶é›†è‹±è¯­å­¦ä¹ å·¥å…·","url":"/awesome-english-learning/"},{"title":"Awesome Extensions","url":"/awesome-extensions/"},{"title":"Awesome File Managers","url":"/awesome-file-managers/"},{"title":"Awesome Flutter","url":"/awesome-flutter/"},{"title":"Awesome Free","url":"/awesome-free/"},{"title":"Awesome Frontend","url":"/awesome-frontend/"},{"title":"Awesome Gatsby","url":"/awesome-gatsby/"},{"title":"æ™ºèƒ½å®¶å±…æ–¹æ¡ˆæ±‡æ€»","url":"/awesome-home/"},{"title":"Awesome ID generator","url":"/awesome-id/"},{"title":"Awesome Interview","url":"/awesome-interview/"},{"title":"Awesome Investing","url":"/awesome-investing/"},{"title":"Awesome Jackett Indexes","url":"/awesome-jackett-indexes/"},{"title":"Awesome Jobs","url":"/awesome-jobs/"},{"title":"Awesome JS Date","url":"/awesome-js-date/"},{"title":"æ”¶é›† Javascript é‡Œå¥½ç”¨çš„åº“","url":"/awesome-js/"},{"title":"Awesome KOL","url":"/awesome-kol/"},{"title":"å¸¸è§çš„ä½ä»£ç /æ— ä»£ç åˆ—è¡¨","url":"/awesome-low-code/"},{"title":"å€¼å¾—å®šæœŸå…³æ³¨çš„ç‹¬ç«‹å¼€å‘è€…/åˆ›é€ è€…","url":"/awesome-maker/"},{"title":"å›½å†…é•œåƒèµ„æºæ±‡æ€»","url":"/awesome-mirrors/"},{"title":"å€¼å¾—è§‚çœ‹çš„ç”µå½±","url":"/awesome-movies/"},{"title":"Awesome News","url":"/awesome-news/"},{"title":"Awesome Notes","url":"/awesome-notes/"},{"title":"Awesome NSFW","url":"/awesome-nsfw/"},{"title":"æ”¶é›†å¯ä»¥åœ¨çº¿é˜…è¯»çš„ä¹¦ç±","url":"/awesome-online-books/"},{"title":"Awesome Open Source","url":"/awesome-open-source/"},{"title":"Awesome Privacy","url":"/awesome-privacy/"},{"title":"Awesome Products","url":"/awesome-products/"},{"title":"é«˜è´¨é‡çš„èµ„æºç½‘ç«™æ”¶é›†ï¼ˆç”µå­ä¹¦ï¼Œç”µå½±ï¼Œç”µè§†å‰§ç­‰ï¼‰","url":"/awesome-resources/"},{"title":"Awesome RSS","url":"/awesome-rss/"},{"title":"Awesome Rust","url":"/awesome-rust/"},{"title":"Awesome Schema","url":"/awesome-schema/"},{"title":"Awesome Self-hosted","url":"/awesome-selfhosted/"},{"title":"Awesome Semantic","url":"/awesome-semantic/"},{"title":"Awesome SEO Tools","url":"/awesome-seo/"},{"title":"Awesome Services","url":"/awesome-service/"},{"title":"æ”¶é›†æœ‰æ„æ€çš„ç¤¾äº¤åº”ç”¨","url":"/awesome-socials/"},{"title":"Awesome Speed","url":"/awesome-speed/"},{"title":"æœ‰æ„æ€çš„åè®®æ”¶é›†","url":"/awesome-standards/"},{"title":"Awesome Startups","url":"/awesome-startups/"},{"title":"Awesome Static Site Generator","url":"/awesome-static-site-generator/"},{"title":"æ”¶é›†è‚¡å¸‚ç›¸å…³çš„èµ„æº","url":"/awesome-stocks/"},{"title":"Awesome Swift","url":"/awesome-swift/"},{"title":"æ”¶é›†ä¸€äº›æœ‰ç”¨çš„æŠ€æœ¯/ç¯å¢ƒé—®é¢˜çš„è§£å†³æ–¹æ¡ˆ","url":"/awesome-tech-anwser/"},{"title":"Awesome Templates","url":"/awesome-templates/"},{"title":"å€¼å¾—è§‚çœ‹çš„ç”µè§†å‰§","url":"/awesome-tv-shows/"},{"title":"Awesome UI","url":"/awesome-ui/"},{"title":"Awesome What Was Your Moment","url":"/awesome-what-was-your-moment/"},{"title":"æ”¶é›†Windowsä¸Šå¥½ç©ï¼Œå¥½ç”¨çš„ä¸œè¥¿","url":"/awesome-windows/"},{"title":"Awesome workflows","url":"/awesome-workflows/"},{"title":"äº’è”ç½‘ç›®å½•æ±‡æ€»","url":"/indexes/"},{"title":"æ”¶é›†ä¸€äº›ç»™äººçµæ„Ÿçš„ä¸œè¥¿","url":"/inspires/"},{"title":"å€¼å¾—å…³æ³¨çš„/æœ‰è¶£çš„äºº","url":"/people/"},{"title":"æ”¶é›†å‘äººæ·±çœçš„è¯","url":"/quotes/"},{"title":"æ¢ç´¢äº’è”ç½‘ä¸Šé«˜è´¨é‡çš„å†…å®¹","url":"/sources/"},{"title":"æœ€å¥½ç”¨çš„å·¥å…·é›†åˆ","url":"/tools/"}]},{"title":"BBR","type":"tag","url":"/tags/bbr/","items":[{"title":"Open BBR for Debian","url":"/open-bbr-for-debian/"}]},{"title":"BT","type":"tag","url":"/tags/bt/","items":[{"title":"qBittorrent setup for Debian","url":"/qbittorrent-setup-for-debian/"},{"title":"Jackett Setup","url":"/jackett-setup/"}]},{"title":"Bash","type":"tag","url":"/tags/bash/","items":[{"title":"Awesome Benchmark","url":"/awesome-benchmark/"},{"title":"Bash Tips","url":"/bash-tips/"},{"title":"Linux Common Commands","url":"/linux-common-commands/"}]},{"title":"Benchmark","type":"tag","url":"/tags/benchmark/","items":[{"title":"Awesome Benchmark","url":"/awesome-benchmark/"}]},{"title":"Books","type":"tag","url":"/tags/books/","items":[{"title":"æ”¶é›†å¯ä»¥åœ¨çº¿é˜…è¯»çš„ä¹¦ç±","url":"/awesome-online-books/"},{"title":"2022å¹´è¯»ä¹¦ç¬”è®°","url":"/books-2022/"},{"title":"è¯»ä¹¦ç¬”è®°","url":"/books/"}]},{"title":"Browser","type":"tag","url":"/tags/browser/","items":[{"title":"Awesome Browsers","url":"/awesome-browsers/"}]},{"title":"CSS","type":"tag","url":"/tags/css/","items":[{"title":"Mini Reset CSS","url":"/mini-reset-css/"},{"title":"Smart word break in CSS","url":"/smart-word-break-in-css/"}]},{"title":"Caddy","type":"tag","url":"/tags/caddy/","items":[{"title":"Caddy2 Setup for Debian","url":"/caddy2-setup-for-debian/"}]},{"title":"CentOS","type":"tag","url":"/tags/cent-os/","items":[{"title":"Install PHP 8.0 On CentOS 7 / RHEL 7","url":"/install-php8-on-centos7/"}]},{"title":"Chat","type":"tag","url":"/tags/chat/","items":[{"title":"Awesome Chat","url":"/awesome-chat/"}]},{"title":"China","type":"tag","url":"/tags/china/","items":[{"title":"åœ¨ä¸­å›½ä¹°æˆ¿ä¹‹å‰ï¼Œä½ éœ€è¦äº†è§£çš„ä¿¡æ¯æ±‡æ€»","url":"/awesome-cn-house/"}]},{"title":"Code","type":"tag","url":"/tags/code/","items":[{"title":"Awesome Code Learning","url":"/awesome-code-learning/"}]},{"title":"Command","type":"tag","url":"/tags/command/","items":[{"title":"Awesome Command Tools","url":"/awesome-cli/"}]},{"title":"Commands","type":"tag","url":"/tags/commands/","items":[{"title":"Linux Common Commands","url":"/linux-common-commands/"}]},{"title":"Communities","type":"tag","url":"/tags/communities/","items":[{"title":"æ”¶é›†ä¸€äº›æœ‰æ„æ€çš„ç¤¾åŒº","url":"/awesome-communities/"}]},{"title":"Comparison","type":"tag","url":"/tags/comparison/","items":[{"title":"Licenseæ¯”è¾ƒ","url":"/license-comparison/"}]},{"title":"DDos","type":"tag","url":"/tags/d-dos/","items":[{"title":"Linux Anti DDos","url":"/linux-network/"}]},{"title":"Dashboard","type":"tag","url":"/tags/dashboard/","items":[{"title":"Awesome Dashboard","url":"/awesome-dashboard/"}]},{"title":"Data","type":"tag","url":"/tags/data/","items":[{"title":"æœ‰è¶£çš„æ•°æ®","url":"/awesome-data/"}]},{"title":"Database","type":"tag","url":"/tags/database/","items":[{"title":"Awesome Databases","url":"/awesome-databases/"}]},{"title":"Date","type":"tag","url":"/tags/date/","items":[{"title":"Awesome JS Date","url":"/awesome-js-date/"}]},{"title":"Debian","type":"tag","url":"/tags/debian/","items":[{"title":"Caddy2 Setup for Debian","url":"/caddy2-setup-for-debian/"},{"title":"Debian Server Setup","url":"/debian-server-setup/"},{"title":"Netdata Setup for Debian","url":"/netdata-setup-for-debian/"},{"title":"Nginx Setup for Debian","url":"/nginx-setup-for-debian/"},{"title":"Nodejs Setup for Debian","url":"/nodejs-setup-for-debian/"},{"title":"Open BBR for Debian","url":"/open-bbr-for-debian/"},{"title":"Postgres Setup for Debian","url":"/postgres-setup-for-debian/"},{"title":"qBittorrent setup for Debian","url":"/qbittorrent-setup-for-debian/"},{"title":"Rust Environment Setup for Debian","url":"/rust-enviroment-setup-for-debian/"},{"title":"Shadowsocks Rust Setup for Debian","url":"/shadowsocks-rust-setup-for-debian/"}]},{"title":"Decentralization","type":"tag","url":"/tags/decentralization/","items":[{"title":"Awesome Decentralization","url":"/awesome-decentralization/"}]},{"title":"Deno","type":"tag","url":"/tags/deno/","items":[{"title":"Awesome Deno","url":"/awesome-deno/"},{"title":"Deno Tips","url":"/deno-tips/"}]},{"title":"Development-Environment","type":"tag","url":"/tags/development-environment/","items":[{"title":"æ”¶é›†Windowsä¸Šå¥½ç©ï¼Œå¥½ç”¨çš„ä¸œè¥¿","url":"/awesome-windows/"}]},{"title":"Docker","type":"tag","url":"/tags/docker/","items":[{"title":"Docker Common Commands","url":"/docker-common-commands/"},{"title":"Docker Setup","url":"/docker-setup/"}]},{"title":"Downloads","type":"tag","url":"/tags/downloads/","items":[{"title":"qBittorrent setup for Debian","url":"/qbittorrent-setup-for-debian/"},{"title":"Youtube Download","url":"/youtube-download/"}]},{"title":"Editors","type":"tag","url":"/tags/editors/","items":[{"title":"Awesome Editors","url":"/awesome-editors/"},{"title":"Vim Tips","url":"/vim-tips/"},{"title":"VS Code Tips","url":"/vscode-tips/"}]},{"title":"Email","type":"tag","url":"/tags/email/","items":[{"title":"Awesome Emails","url":"/awesome-emails.md/"}]},{"title":"English","type":"tag","url":"/tags/english/","items":[{"title":"æ”¶é›†è‹±è¯­å­¦ä¹ å·¥å…·","url":"/awesome-english-learning/"}]},{"title":"Explore","type":"tag","url":"/tags/explore/","items":[{"title":"æ¢ç´¢äº’è”ç½‘ä¸Šé«˜è´¨é‡çš„å†…å®¹","url":"/sources/"}]},{"title":"Extensions","type":"tag","url":"/tags/extensions/","items":[{"title":"Awesome Extensions","url":"/awesome-extensions/"}]},{"title":"FAQ","type":"tag","url":"/tags/faq/","items":[{"title":"æœ‰æ„æ€çš„é—®é¢˜æ”¶é›†","url":"/answers/"},{"title":"æ”¶é›†ä¸€äº›æœ‰ç”¨çš„æŠ€æœ¯/ç¯å¢ƒé—®é¢˜çš„è§£å†³æ–¹æ¡ˆ","url":"/awesome-tech-anwser/"}]},{"title":"Files","type":"tag","url":"/tags/files/","items":[{"title":"Awesome File Managers","url":"/awesome-file-managers/"},{"title":"Caddy File Server Browser with URL Scheme","url":"/caddy-file-server-url-scheme/"},{"title":"FileBrowser Setup","url":"/filebrowser-setup/"},{"title":"Rclone Setup","url":"/rclone-setup/"}]},{"title":"Flutter","type":"tag","url":"/tags/flutter/","items":[{"title":"Awesome Flutter","url":"/awesome-flutter/"}]},{"title":"Following","type":"tag","url":"/tags/following/","items":[{"title":"å€¼å¾—å…³æ³¨çš„/æœ‰è¶£çš„äºº","url":"/people/"}]},{"title":"Free","type":"tag","url":"/tags/free/","items":[{"title":"Awesome Free","url":"/awesome-free/"}]},{"title":"Front-End","type":"tag","url":"/tags/front-end/","items":[{"title":"Awesome UI","url":"/awesome-ui/"},{"title":"SVG","url":"/svg/"}]},{"title":"Frontend","type":"tag","url":"/tags/frontend/","items":[{"title":"Awesome Frontend","url":"/awesome-frontend/"}]},{"title":"Git","type":"tag","url":"/tags/git/","items":[{"title":"Use ssh key for Git","url":"/git-sshkey/"},{"title":"æ”¶é›†å¸¸ç”¨GitæŠ€å·§","url":"/git-tips/"},{"title":"Git workflows","url":"/git-workflows/"},{"title":"How to check if there are uncommited changes in Github Actions?","url":"/github-actions-workflow-check-if-there-is-uncommited-changes/"}]},{"title":"Github","type":"tag","url":"/tags/github/","items":[{"title":"How to check if there are uncommited changes in Github Actions?","url":"/github-actions-workflow-check-if-there-is-uncommited-changes/"}]},{"title":"Go","type":"tag","url":"/tags/go/","items":[{"title":"Go Template Tips","url":"/go-template-tips/"}]},{"title":"HTTPS","type":"tag","url":"/tags/https/","items":[{"title":"åœ¨ä¸­å›½è‡ªåŠ¨ç”Ÿæˆå…è´¹HTTPSè¯ä¹¦çš„æœ€ä½³æ–¹æ¡ˆ","url":"/auto-https-ssl-in-china/"}]},{"title":"Home","type":"tag","url":"/tags/home/","items":[{"title":"æ™ºèƒ½å®¶å±…æ–¹æ¡ˆæ±‡æ€»","url":"/awesome-home/"}]},{"title":"House","type":"tag","url":"/tags/house/","items":[{"title":"åœ¨ä¸­å›½ä¹°æˆ¿ä¹‹å‰ï¼Œä½ éœ€è¦äº†è§£çš„ä¿¡æ¯æ±‡æ€»","url":"/awesome-cn-house/"}]},{"title":"ID","type":"tag","url":"/tags/id/","items":[{"title":"Awesome ID generator","url":"/awesome-id/"}]},{"title":"Indexes","type":"tag","url":"/tags/indexes/","items":[{"title":"äº’è”ç½‘ç›®å½•æ±‡æ€»","url":"/indexes/"}]},{"title":"Inspires","type":"tag","url":"/tags/inspires/","items":[{"title":"æ”¶é›†ä¸€äº›ç»™äººçµæ„Ÿçš„ä¸œè¥¿","url":"/inspires/"}]},{"title":"Interview","type":"tag","url":"/tags/interview/","items":[{"title":"Awesome Interview","url":"/awesome-interview/"}]},{"title":"Investing","type":"tag","url":"/tags/investing/","items":[{"title":"Awesome Investing","url":"/awesome-investing/"}]},{"title":"JSOn","type":"tag","url":"/tags/js-on/","items":[{"title":"Awesome Schema","url":"/awesome-schema/"}]},{"title":"Jackett","type":"tag","url":"/tags/jackett/","items":[{"title":"qBittorrent setup for Debian","url":"/qbittorrent-setup-for-debian/"},{"title":"Jackett Setup","url":"/jackett-setup/"}]},{"title":"Javascript","type":"tag","url":"/tags/javascript/","items":[{"title":"Awesome JS Date","url":"/awesome-js-date/"},{"title":"æ”¶é›† Javascript é‡Œå¥½ç”¨çš„åº“","url":"/awesome-js/"},{"title":"Nodejs Monorepo","url":"/nodejs-monorepo/"},{"title":"Nodejs Setup for Debian","url":"/nodejs-setup-for-debian/"},{"title":"Nodejs Tips","url":"/nodejs-tips/"}]},{"title":"Jellyfin","type":"tag","url":"/tags/jellyfin/","items":[{"title":"Jellyfin setup","url":"/jellyfin-setup/"}]},{"title":"Jobs","type":"tag","url":"/tags/jobs/","items":[{"title":"Awesome Jobs","url":"/awesome-jobs/"}]},{"title":"Jokes","type":"tag","url":"/tags/jokes/","items":[{"title":"ç¬‘è¯æ”¶é›†","url":"/jokes/"}]},{"title":"Journal","type":"tag","url":"/tags/journal/","items":[{"title":"2022å¹´çš„ä¸€äº›è®°å½•","url":"/journal-2022/"},{"title":"2021å¹´çš„ä¸€äº›è®°å½•","url":"/journal-2021/"},{"title":"What Iâ€™m doing now?","url":"/now/"}]},{"title":"KOL","type":"tag","url":"/tags/kol/","items":[{"title":"Awesome KOL","url":"/awesome-kol/"}]},{"title":"Language","type":"tag","url":"/tags/language/","items":[{"title":"å‡ºå›½ï¼Œè¿™å‡ å¥è¯å¿…é¡»å­¦ä¼šç”¨å½“åœ°è¯­è¨€æ€ä¹ˆè¯´","url":"/basic-language/"}]},{"title":"Learning","type":"tag","url":"/tags/learning/","items":[{"title":"Awesome Code Learning","url":"/awesome-code-learning/"},{"title":"æ”¶é›†è‹±è¯­å­¦ä¹ å·¥å…·","url":"/awesome-english-learning/"},{"title":"Awesome Rust","url":"/awesome-rust/"}]},{"title":"License","type":"tag","url":"/tags/license/","items":[{"title":"Licenseæ¯”è¾ƒ","url":"/license-comparison/"}]},{"title":"Life","type":"tag","url":"/tags/life/","items":[{"title":"æå‡ç”Ÿæ´»è´¨é‡çš„ä¸œè¥¿åˆ—è¡¨","url":"/life-pro/"},{"title":"é«˜è´¨é‡ç”Ÿæ´»æ–¹å¼æ¨è","url":"/life-tips/"}]},{"title":"Linux","type":"tag","url":"/tags/linux/","items":[{"title":"Linux Common Commands","url":"/linux-common-commands/"},{"title":"Linux Log","url":"/linux-log/"},{"title":"Linux Anti DDos","url":"/linux-network/"}]},{"title":"List","type":"tag","url":"/tags/list/","items":[{"title":"å€¼å¾—è§‚çœ‹çš„ç”µè§†å‰§","url":"/awesome-tv-shows/"},{"title":"æå‡ç”Ÿæ´»è´¨é‡çš„ä¸œè¥¿åˆ—è¡¨","url":"/life-pro/"},{"title":"æƒ³ä¹°çš„ä¸œè¥¿åˆ—è¡¨","url":"/wish-lists/"}]},{"title":"Log","type":"tag","url":"/tags/log/","items":[{"title":"Linux Log","url":"/linux-log/"}]},{"title":"Low-Code","type":"tag","url":"/tags/low-code/","items":[{"title":"å¸¸è§çš„ä½ä»£ç /æ— ä»£ç åˆ—è¡¨","url":"/awesome-low-code/"}]},{"title":"MacOS","type":"tag","url":"/tags/mac-os/","items":[{"title":"Postgres Setup for Macos","url":"/postgres-setup-for-macos/"}]},{"title":"Makefile - Templates - Workflows","type":"tag","url":"/tags/makefile-templates-workflows/","items":[{"title":"Makefile Templates","url":"/makefile-templates/"}]},{"title":"Maker","type":"tag","url":"/tags/maker/","items":[{"title":"å€¼å¾—å®šæœŸå…³æ³¨çš„ç‹¬ç«‹å¼€å‘è€…/åˆ›é€ è€…","url":"/awesome-maker/"}]},{"title":"Mastdon","type":"tag","url":"/tags/mastdon/","items":[{"title":"Mastdon Development Setup","url":"/mastdon-development-setup/"}]},{"title":"Me","type":"tag","url":"/tags/me/","items":[{"title":"Everything I Know by Owen","url":"/"},{"title":"About Me and the Wiki","url":"/about/"},{"title":"What Iâ€™m doing now?","url":"/now/"},{"title":"Projects","url":"/projects/"}]},{"title":"Medias","type":"tag","url":"/tags/medias/","items":[{"title":"Bazarr Setup","url":"/bazarr-setup/"},{"title":"Caddy File Server Browser with URL Scheme","url":"/caddy-file-server-url-scheme/"},{"title":"Radarr Setup","url":"/radarr-setup/"},{"title":"Rclone Setup","url":"/rclone-setup/"},{"title":"Sonarr Setup","url":"/sonarr-setup/"},{"title":"Subtitles","url":"/subtitles/"},{"title":"Youtube Download","url":"/youtube-download/"},{"title":"Jellyfin setup","url":"/jellyfin-setup/"},{"title":"Jackett Setup","url":"/jackett-setup/"}]},{"title":"Metube","type":"tag","url":"/tags/metube/","items":[{"title":"Youtube Download","url":"/youtube-download/"}]},{"title":"Mirrors","type":"tag","url":"/tags/mirrors/","items":[{"title":"å›½å†…é•œåƒèµ„æºæ±‡æ€»","url":"/awesome-mirrors/"}]},{"title":"Monitor","type":"tag","url":"/tags/monitor/","items":[{"title":"Netdata Setup for Debian","url":"/netdata-setup-for-debian/"}]},{"title":"Monorepo","type":"tag","url":"/tags/monorepo/","items":[{"title":"Nodejs Monorepo","url":"/nodejs-monorepo/"}]},{"title":"Movies","type":"tag","url":"/tags/movies/","items":[{"title":"å€¼å¾—è§‚çœ‹çš„ç”µå½±","url":"/awesome-movies/"},{"title":"ç”µå½±ç¬”è®°","url":"/movies/"}]},{"title":"Music","type":"tag","url":"/tags/music/","items":[{"title":"éŸ³ä¹æ”¶è—","url":"/music/"}]},{"title":"NSFW","type":"tag","url":"/tags/nsfw/","items":[{"title":"Awesome NSFW","url":"/awesome-nsfw/"}]},{"title":"Netdata","type":"tag","url":"/tags/netdata/","items":[{"title":"Netdata Setup for Debian","url":"/netdata-setup-for-debian/"}]},{"title":"Netwok","type":"tag","url":"/tags/netwok/","items":[{"title":"Awesome Speed","url":"/awesome-speed/"}]},{"title":"News","type":"tag","url":"/tags/news/","items":[{"title":"Awesome News","url":"/awesome-news/"}]},{"title":"Nginx","type":"tag","url":"/tags/nginx/","items":[{"title":"Nginx Setup for Debian","url":"/nginx-setup-for-debian/"}]},{"title":"Notes","type":"tag","url":"/tags/notes/","items":[{"title":"Awesome Notes","url":"/awesome-notes/"},{"title":"2022å¹´è¯»ä¹¦ç¬”è®°","url":"/books-2022/"},{"title":"è¯»ä¹¦ç¬”è®°","url":"/books/"},{"title":"ç”µå½±ç¬”è®°","url":"/movies/"},{"title":"ç”µè§†å‰§ç¬”è®°","url":"/tv-shows/"}]},{"title":"Now","type":"tag","url":"/tags/now/","items":[{"title":"What Iâ€™m doing now?","url":"/now/"}]},{"title":"Open Source","type":"tag","url":"/tags/open-source/","items":[{"title":"Awesome Open Source","url":"/awesome-open-source/"}]},{"title":"PHP","type":"tag","url":"/tags/php/","items":[{"title":"Install PHP 8.0 On CentOS 7 / RHEL 7","url":"/install-php8-on-centos7/"}]},{"title":"Peertube","type":"tag","url":"/tags/peertube/","items":[{"title":"Peertube Setup with Caddy Server","url":"/peertube-setup/"}]},{"title":"People","type":"tag","url":"/tags/people/","items":[{"title":"å€¼å¾—å…³æ³¨çš„/æœ‰è¶£çš„äºº","url":"/people/"}]},{"title":"Postgres","type":"tag","url":"/tags/postgres/","items":[{"title":"Postgres Setup for Debian","url":"/postgres-setup-for-debian/"},{"title":"Postgres Setup for Macos","url":"/postgres-setup-for-macos/"}]},{"title":"Postgresql","type":"tag","url":"/tags/postgresql/","items":[{"title":"Postgresql Tips","url":"/postgresql-tips/"}]},{"title":"Privacy","type":"tag","url":"/tags/privacy/","items":[{"title":"Awesome Privacy","url":"/awesome-privacy/"}]},{"title":"Products","type":"tag","url":"/tags/products/","items":[{"title":"Awesome Products","url":"/awesome-products/"}]},{"title":"Programming-Languages","type":"tag","url":"/tags/programming-languages/","items":[{"title":"Go Template Tips","url":"/go-template-tips/"},{"title":"Nodejs Setup for Debian","url":"/nodejs-setup-for-debian/"},{"title":"Nodejs Tips","url":"/nodejs-tips/"}]},{"title":"Projects","type":"tag","url":"/tags/projects/","items":[{"title":"Projects","url":"/projects/"}]},{"title":"Protocol","type":"tag","url":"/tags/protocol/","items":[{"title":"æœ‰æ„æ€çš„åè®®æ”¶é›†","url":"/awesome-standards/"}]},{"title":"Proxies","type":"tag","url":"/tags/proxies/","items":[{"title":"Awesome Benchmark","url":"/awesome-benchmark/"},{"title":"Caddy File Server Browser with URL Scheme","url":"/caddy-file-server-url-scheme/"},{"title":"Caddy2 Setup for Debian","url":"/caddy2-setup-for-debian/"},{"title":"Open BBR for Debian","url":"/open-bbr-for-debian/"},{"title":"Shadowsocks Rust Setup for Debian","url":"/shadowsocks-rust-setup-for-debian/"}]},{"title":"Quotes","type":"tag","url":"/tags/quotes/","items":[{"title":"åˆ’çº¿çš„ç”µè§†å‰§æˆªå›¾","url":"/awesome-tv-quotes/"},{"title":"æ”¶é›†å‘äººæ·±çœçš„è¯","url":"/quotes/"}]},{"title":"RSS","type":"tag","url":"/tags/rss/","items":[{"title":"Awesome RSS","url":"/awesome-rss/"}]},{"title":"Radarr","type":"tag","url":"/tags/radarr/","items":[{"title":"Radarr Setup","url":"/radarr-setup/"}]},{"title":"Rclone","type":"tag","url":"/tags/rclone/","items":[{"title":"Rclone Setup","url":"/rclone-setup/"}]},{"title":"Recommend","type":"tag","url":"/tags/recommend/","items":[{"title":"Awesome Algorithm","url":"/awesome-algorithm/"}]},{"title":"Resource","type":"tag","url":"/tags/resource/","items":[{"title":"é«˜è´¨é‡çš„èµ„æºç½‘ç«™æ”¶é›†ï¼ˆç”µå­ä¹¦ï¼Œç”µå½±ï¼Œç”µè§†å‰§ç­‰ï¼‰","url":"/awesome-resources/"}]},{"title":"Ruby","type":"tag","url":"/tags/ruby/","items":[{"title":"Ruby Setup for MacOS","url":"/ruby-setup/"}]},{"title":"Rust","type":"tag","url":"/tags/rust/","items":[{"title":"Awesome Rust","url":"/awesome-rust/"},{"title":"Rust Environment Setup for Debian","url":"/rust-enviroment-setup-for-debian/"},{"title":"Rust Tips","url":"/rust-tips/"},{"title":"Shadowsocks Rust Setup for Debian","url":"/shadowsocks-rust-setup-for-debian/"}]},{"title":"SEO","type":"tag","url":"/tags/seo/","items":[{"title":"Awesome SEO Tools","url":"/awesome-seo/"}]},{"title":"SSH","type":"tag","url":"/tags/ssh/","items":[{"title":"Use ssh key for Git","url":"/git-sshkey/"}]},{"title":"SSL","type":"tag","url":"/tags/ssl/","items":[{"title":"åœ¨ä¸­å›½è‡ªåŠ¨ç”Ÿæˆå…è´¹HTTPSè¯ä¹¦çš„æœ€ä½³æ–¹æ¡ˆ","url":"/auto-https-ssl-in-china/"}]},{"title":"SVG","type":"tag","url":"/tags/svg/","items":[{"title":"SVG","url":"/svg/"}]},{"title":"Satire","type":"tag","url":"/tags/satire/","items":[{"title":"è®½åˆºè¨€è®ºæ”¶é›†","url":"/satire-quotes/"}]},{"title":"Schema","type":"tag","url":"/tags/schema/","items":[{"title":"Awesome Schema","url":"/awesome-schema/"}]},{"title":"Self-Hosted","type":"tag","url":"/tags/self-hosted/","items":[{"title":"Awesome Automations","url":"/awesome-automations/"},{"title":"Awesome Self-hosted","url":"/awesome-selfhosted/"},{"title":"Bazarr Setup","url":"/bazarr-setup/"},{"title":"Radarr Setup","url":"/radarr-setup/"},{"title":"Sonarr Setup","url":"/sonarr-setup/"},{"title":"Youtube Download","url":"/youtube-download/"},{"title":"Jellyfin setup","url":"/jellyfin-setup/"},{"title":"Jackett Setup","url":"/jackett-setup/"}]},{"title":"Semantic","type":"tag","url":"/tags/semantic/","items":[{"title":"Awesome Semantic","url":"/awesome-semantic/"}]},{"title":"Server","type":"tag","url":"/tags/server/","items":[{"title":"Caddy File Server Browser with URL Scheme","url":"/caddy-file-server-url-scheme/"},{"title":"Caddy2 Setup for Debian","url":"/caddy2-setup-for-debian/"},{"title":"Debian Server Setup","url":"/debian-server-setup/"},{"title":"Nodejs Setup for Debian","url":"/nodejs-setup-for-debian/"},{"title":"Open BBR for Debian","url":"/open-bbr-for-debian/"},{"title":"qBittorrent setup for Debian","url":"/qbittorrent-setup-for-debian/"}]},{"title":"Serverless","type":"tag","url":"/tags/serverless/","items":[{"title":"æ”¶é›†ä¸€äº›æœ‰ç”¨çš„æŠ€æœ¯/ç¯å¢ƒé—®é¢˜çš„è§£å†³æ–¹æ¡ˆ","url":"/awesome-tech-anwser/"}]},{"title":"Service","type":"tag","url":"/tags/service/","items":[{"title":"Awesome Services","url":"/awesome-service/"}]},{"title":"Setup","type":"tag","url":"/tags/setup/","items":[{"title":"Bazarr Setup","url":"/bazarr-setup/"},{"title":"Caddy2 Setup for Debian","url":"/caddy2-setup-for-debian/"},{"title":"Debian Server Setup","url":"/debian-server-setup/"},{"title":"Docker Setup","url":"/docker-setup/"},{"title":"FileBrowser Setup","url":"/filebrowser-setup/"},{"title":"Install PHP 8.0 On CentOS 7 / RHEL 7","url":"/install-php8-on-centos7/"},{"title":"Mastdon Development Setup","url":"/mastdon-development-setup/"},{"title":"Nginx Setup for Debian","url":"/nginx-setup-for-debian/"},{"title":"Nodejs Setup for Debian","url":"/nodejs-setup-for-debian/"},{"title":"Peertube Setup with Caddy Server","url":"/peertube-setup/"},{"title":"Postgres Setup for Debian","url":"/postgres-setup-for-debian/"},{"title":"Postgres Setup for Macos","url":"/postgres-setup-for-macos/"},{"title":"qBittorrent setup for Debian","url":"/qbittorrent-setup-for-debian/"},{"title":"Radarr Setup","url":"/radarr-setup/"},{"title":"Rclone Setup","url":"/rclone-setup/"},{"title":"Ruby Setup for MacOS","url":"/ruby-setup/"},{"title":"Rust Environment Setup for Debian","url":"/rust-enviroment-setup-for-debian/"},{"title":"Shadowsocks Rust Setup for Debian","url":"/shadowsocks-rust-setup-for-debian/"},{"title":"Jellyfin setup","url":"/jellyfin-setup/"},{"title":"Jackett Setup","url":"/jackett-setup/"}]},{"title":"Shadowsocks","type":"tag","url":"/tags/shadowsocks/","items":[{"title":"Shadowsocks Rust Setup for Debian","url":"/shadowsocks-rust-setup-for-debian/"}]},{"title":"Social","type":"tag","url":"/tags/social/","items":[{"title":"æ”¶é›†ä¸€äº›æœ‰æ„æ€çš„ç¤¾åŒº","url":"/awesome-communities/"},{"title":"Awesome Products","url":"/awesome-products/"},{"title":"æ”¶é›†æœ‰æ„æ€çš„ç¤¾äº¤åº”ç”¨","url":"/awesome-socials/"}]},{"title":"Sonarr","type":"tag","url":"/tags/sonarr/","items":[{"title":"Sonarr Setup","url":"/sonarr-setup/"}]},{"title":"Sources","type":"tag","url":"/tags/sources/","items":[{"title":"æ¢ç´¢äº’è”ç½‘ä¸Šé«˜è´¨é‡çš„å†…å®¹","url":"/sources/"}]},{"title":"Speed","type":"tag","url":"/tags/speed/","items":[{"title":"Awesome Speed","url":"/awesome-speed/"}]},{"title":"Standard","type":"tag","url":"/tags/standard/","items":[{"title":"æœ‰æ„æ€çš„åè®®æ”¶é›†","url":"/awesome-standards/"}]},{"title":"Startups","type":"tag","url":"/tags/startups/","items":[{"title":"Awesome Startups","url":"/awesome-startups/"}]},{"title":"Static-Site-Generator","type":"tag","url":"/tags/static-site-generator/","items":[{"title":"Awesome Static Site Generator","url":"/awesome-static-site-generator/"}]},{"title":"Stocks","type":"tag","url":"/tags/stocks/","items":[{"title":"Awesome Investing","url":"/awesome-investing/"},{"title":"æ”¶é›†è‚¡å¸‚ç›¸å…³çš„èµ„æº","url":"/awesome-stocks/"}]},{"title":"Stop","type":"tag","url":"/tags/stop/","items":[{"title":"ä½ åº”è¯¥ç«‹å³åœæ­¢åšçš„äº‹","url":"/stop/"}]},{"title":"Subtitles","type":"tag","url":"/tags/subtitles/","items":[{"title":"Bazarr Setup","url":"/bazarr-setup/"},{"title":"Subtitles","url":"/subtitles/"}]},{"title":"Swift","type":"tag","url":"/tags/swift/","items":[{"title":"Awesome Swift","url":"/awesome-swift/"}]},{"title":"TV","type":"tag","url":"/tags/tv/","items":[{"title":"åˆ’çº¿çš„ç”µè§†å‰§æˆªå›¾","url":"/awesome-tv-quotes/"},{"title":"å€¼å¾—è§‚çœ‹çš„ç”µè§†å‰§","url":"/awesome-tv-shows/"},{"title":"ç”µè§†å‰§ç¬”è®°","url":"/tv-shows/"}]},{"title":"Tech","type":"tag","url":"/tags/tech/","items":[{"title":"æ”¶é›†ä¸€äº›æœ‰ç”¨çš„æŠ€æœ¯/ç¯å¢ƒé—®é¢˜çš„è§£å†³æ–¹æ¡ˆ","url":"/awesome-tech-anwser/"}]},{"title":"Templates","type":"tag","url":"/tags/templates/","items":[{"title":"Awesome Templates","url":"/awesome-templates/"},{"title":"Caddy File Server Browser with URL Scheme","url":"/caddy-file-server-url-scheme/"},{"title":"Go Template Tips","url":"/go-template-tips/"}]},{"title":"Things","type":"tag","url":"/tags/things/","items":[{"title":"æ”¶é›†ä¸€äº›ç»™äººçµæ„Ÿçš„ä¸œè¥¿","url":"/inspires/"}]},{"title":"Thinking","type":"tag","url":"/tags/thinking/","items":[{"title":"æ‰€æ€æ‰€æƒ³","url":"/thoughts/"}]},{"title":"Tips","type":"tag","url":"/tags/tips/","items":[{"title":"Bash Tips","url":"/bash-tips/"},{"title":"Common URL Scheme","url":"/common-url-scheme/"},{"title":"Deno Tips","url":"/deno-tips/"},{"title":"Docker Common Commands","url":"/docker-common-commands/"},{"title":"æ”¶é›†å¸¸ç”¨GitæŠ€å·§","url":"/git-tips/"},{"title":"Go Template Tips","url":"/go-template-tips/"},{"title":"æå‡ç”Ÿæ´»è´¨é‡çš„ä¸œè¥¿åˆ—è¡¨","url":"/life-pro/"},{"title":"é«˜è´¨é‡ç”Ÿæ´»æ–¹å¼æ¨è","url":"/life-tips/"},{"title":"Linux Common Commands","url":"/linux-common-commands/"},{"title":"Nodejs Tips","url":"/nodejs-tips/"},{"title":"Postgresql Tips","url":"/postgresql-tips/"},{"title":"Rust Tips","url":"/rust-tips/"},{"title":"Vim Tips","url":"/vim-tips/"},{"title":"VS Code Tips","url":"/vscode-tips/"}]},{"title":"Todo","type":"tag","url":"/tags/todo/","items":[{"title":"2021 Goals","url":"/goals-2021/"},{"title":"2022 Goals","url":"/goals-2022/"},{"title":"Todos","url":"/todo/"}]},{"title":"Tools","type":"tag","url":"/tags/tools/","items":[{"title":"Awesome Command Tools","url":"/awesome-cli/"},{"title":"Awesome Editors","url":"/awesome-editors/"},{"title":"Awesome Free","url":"/awesome-free/"},{"title":"Awesome Notes","url":"/awesome-notes/"},{"title":"Awesome Self-hosted","url":"/awesome-selfhosted/"},{"title":"Awesome SEO Tools","url":"/awesome-seo/"},{"title":"Awesome Startups","url":"/awesome-startups/"},{"title":"æ”¶é›†Windowsä¸Šå¥½ç©ï¼Œå¥½ç”¨çš„ä¸œè¥¿","url":"/awesome-windows/"},{"title":"æ”¶é›†ä¸€äº›ç»™äººçµæ„Ÿçš„ä¸œè¥¿","url":"/inspires/"},{"title":"æœ€å¥½ç”¨çš„å·¥å…·é›†åˆ","url":"/tools/"}]},{"title":"Torrents","type":"tag","url":"/tags/torrents/","items":[{"title":"qBittorrent setup for Debian","url":"/qbittorrent-setup-for-debian/"},{"title":"Jackett Setup","url":"/jackett-setup/"}]},{"title":"Travel","type":"tag","url":"/tags/travel/","items":[{"title":"æ—…è¡Œæ‰‹ç»­","url":"/travel-approvals/"}]},{"title":"Trends","type":"tag","url":"/tags/trends/","items":[{"title":"äº’è”ç½‘ç›®å½•æ±‡æ€»","url":"/indexes/"}]},{"title":"Tweet","type":"tag","url":"/tags/tweet/","items":[{"title":"æ‰€æ€æ‰€æƒ³","url":"/thoughts/"}]},{"title":"UI","type":"tag","url":"/tags/ui/","items":[{"title":"Awesome UI","url":"/awesome-ui/"}]},{"title":"URL","type":"tag","url":"/tags/url/","items":[{"title":"Common URL Scheme","url":"/common-url-scheme/"}]},{"title":"VS Code","type":"tag","url":"/tags/vs-code/","items":[{"title":"VS Code Tips","url":"/vscode-tips/"}]},{"title":"Vim","type":"tag","url":"/tags/vim/","items":[{"title":"Vim Tips","url":"/vim-tips/"}]},{"title":"Wikipedia","type":"tag","url":"/tags/wikipedia/","items":[{"title":"æ”¶å½•ä¸€äº›æœ‰æ„æ€çš„ç»´åŸºç™¾ç§‘","url":"/awesome-wikipedia/"}]},{"title":"Windows","type":"tag","url":"/tags/windows/","items":[{"title":"æ”¶é›†Windowsä¸Šå¥½ç©ï¼Œå¥½ç”¨çš„ä¸œè¥¿","url":"/awesome-windows/"}]},{"title":"Wish","type":"tag","url":"/tags/wish/","items":[{"title":"æƒ³ä¹°çš„ä¸œè¥¿åˆ—è¡¨","url":"/wish-lists/"}]},{"title":"Workflows","type":"tag","url":"/tags/workflows/","items":[{"title":"Awesome workflows","url":"/awesome-workflows/"},{"title":"Git workflows","url":"/git-workflows/"},{"title":"Nodejs Monorepo","url":"/nodejs-monorepo/"}]},{"title":"Writing","type":"tag","url":"/tags/writing/","items":[{"title":"å¦‚ä½•å†™ä½œï¼Ÿ","url":"/how-to-write/"}]},{"title":"Year2021","type":"tag","url":"/tags/year-2021/","items":[{"title":"2021 Goals","url":"/goals-2021/"},{"title":"2021å¹´çš„ä¸€äº›è®°å½•","url":"/journal-2021/"}]},{"title":"Year2022","type":"tag","url":"/tags/year-2022/","items":[{"title":"2022 Goals","url":"/goals-2022/"},{"title":"2022å¹´çš„ä¸€äº›è®°å½•","url":"/journal-2022/"}]},{"title":"Youtube","type":"tag","url":"/tags/youtube/","items":[{"title":"Youtube Download","url":"/youtube-download/"}]},{"title":"depression","type":"tag","url":"/tags/depression/","items":[{"title":"æŠ‘éƒç—‡ç›¸å…³èµ„æ–™æ±‡æ€»","url":"/depression/"}]},{"title":"mac","type":"tag","url":"/tags/mac/","items":[{"title":"Mac Setup","url":"/mac-setup/"}]},{"title":"qBittorrent","type":"tag","url":"/tags/q-bittorrent/","items":[{"title":"qBittorrent setup for Debian","url":"/qbittorrent-setup-for-debian/"}]},{"title":"setup","type":"tag","url":"/tags/setup/","items":[{"title":"Mac Setup","url":"/mac-setup/"}]},{"title":"ä¸­æ–‡","type":"tag","url":"/tags/ä¸­æ–‡/","items":[{"title":"æœ‰æ„æ€çš„é—®é¢˜æ”¶é›†","url":"/answers/"},{"title":"æ”¶é›†ä¸€äº›æœ‰æ„æ€çš„ç¤¾åŒº","url":"/awesome-communities/"},{"title":"æœ‰è¶£çš„æ•°æ®","url":"/awesome-data/"},{"title":"æ”¶é›† Javascript é‡Œå¥½ç”¨çš„åº“","url":"/awesome-js/"},{"title":"å€¼å¾—è§‚çœ‹çš„ç”µå½±","url":"/awesome-movies/"},{"title":"åˆ’çº¿çš„ç”µè§†å‰§æˆªå›¾","url":"/awesome-tv-quotes/"},{"title":"å€¼å¾—è§‚çœ‹çš„ç”µè§†å‰§","url":"/awesome-tv-shows/"},{"title":"æ”¶é›†Windowsä¸Šå¥½ç©ï¼Œå¥½ç”¨çš„ä¸œè¥¿","url":"/awesome-windows/"},{"title":"2022å¹´è¯»ä¹¦ç¬”è®°","url":"/books-2022/"},{"title":"è¯»ä¹¦ç¬”è®°","url":"/books/"},{"title":"æ”¶é›†å¸¸ç”¨GitæŠ€å·§","url":"/git-tips/"},{"title":"æ”¶é›†ä¸€äº›ç»™äººçµæ„Ÿçš„ä¸œè¥¿","url":"/inspires/"},{"title":"Licenseæ¯”è¾ƒ","url":"/license-comparison/"},{"title":"ç”µå½±ç¬”è®°","url":"/movies/"},{"title":"æ”¶é›†å‘äººæ·±çœçš„è¯","url":"/quotes/"},{"title":"æœ€å¥½ç”¨çš„å·¥å…·é›†åˆ","url":"/tools/"},{"title":"æ—…è¡Œæ‰‹ç»­","url":"/travel-approvals/"},{"title":"ç”µè§†å‰§ç¬”è®°","url":"/tv-shows/"}]},{"title":"å†·çŸ¥è¯†","type":"tag","url":"/tags/å†·çŸ¥è¯†/","items":[{"title":"å†·çŸ¥è¯†","url":"/trivia/"}]}]}],"tagsGroups":[{"title":"API","type":"tag","url":"/tags/api/","items":[{"title":"API Tokens","url":"/api-tokens/"},{"title":"Awesome APIs","url":"/awesome-apis/"}]},{"title":"Actions","type":"tag","url":"/tags/actions/","items":[{"title":"How to check if there are uncommited changes in Github Actions?","url":"/github-actions-workflow-check-if-there-is-uncommited-changes/"}]},{"title":"Admin","type":"tag","url":"/tags/admin/","items":[{"title":"Awesome Dashboard","url":"/awesome-dashboard/"}]},{"title":"Algorithm","type":"tag","url":"/tags/algorithm/","items":[{"title":"Awesome Algorithm","url":"/awesome-algorithm/"}]},{"title":"Alternatives","type":"tag","url":"/tags/alternatives/","items":[{"title":"Awesome Alternatives","url":"/awesome-alternatives/"}]},{"title":"Answer","type":"tag","url":"/tags/answer/","items":[{"title":"æœ‰æ„æ€çš„é—®é¢˜æ”¶é›†","url":"/answers/"}]},{"title":"Application","type":"tag","url":"/tags/application/","items":[{"title":"Awesome Frontend","url":"/awesome-frontend/"}]},{"title":"Approvals","type":"tag","url":"/tags/approvals/","items":[{"title":"æ—…è¡Œæ‰‹ç»­","url":"/travel-approvals/"}]},{"title":"Articles","type":"tag","url":"/tags/articles/","items":[{"title":"å€¼å¾—ä¸€çœ‹çš„æ–‡ç« åˆ—è¡¨","url":"/awesome-articles/"}]},{"title":"Ask","type":"tag","url":"/tags/ask/","items":[{"title":"æœ‰æ„æ€çš„é—®é¢˜æ”¶é›†","url":"/answers/"}]},{"title":"Auth","type":"tag","url":"/tags/auth/","items":[{"title":"Auth Gateway","url":"/auth-gateway/"},{"title":"API Tokens","url":"/api-tokens/"},{"title":"Use ssh key for Git","url":"/git-sshkey/"}]},{"title":"Automations","type":"tag","url":"/tags/automations/","items":[{"title":"Awesome Automations","url":"/awesome-automations/"}]},{"title":"Awesome","type":"tag","url":"/tags/awesome/","items":[{"title":"æœ‰æ„æ€çš„é—®é¢˜æ”¶é›†","url":"/answers/"},{"title":"Awesome Algorithm","url":"/awesome-algorithm/"},{"title":"Awesome Alternatives","url":"/awesome-alternatives/"},{"title":"Awesome APIs","url":"/awesome-apis/"},{"title":"å€¼å¾—ä¸€çœ‹çš„æ–‡ç« åˆ—è¡¨","url":"/awesome-articles/"},{"title":"Awesome Automations","url":"/awesome-automations/"},{"title":"Awesome Backup","url":"/awesome-backup/"},{"title":"Awesome Benchmark","url":"/awesome-benchmark/"},{"title":"Awesome Bookmarks","url":"/awesome-bookmarks/"},{"title":"Awesome Browsers","url":"/awesome-browsers/"},{"title":"Awesome Chat","url":"/awesome-chat/"},{"title":"Awesome Command Tools","url":"/awesome-cli/"},{"title":"åœ¨ä¸­å›½ä¹°æˆ¿ä¹‹å‰ï¼Œä½ éœ€è¦äº†è§£çš„ä¿¡æ¯æ±‡æ€»","url":"/awesome-cn-house/"},{"title":"Awesome Code Learning","url":"/awesome-code-learning/"},{"title":"æ”¶é›†ä¸€äº›æœ‰æ„æ€çš„ç¤¾åŒº","url":"/awesome-communities/"},{"title":"Awesome Dashboard","url":"/awesome-dashboard/"},{"title":"æœ‰è¶£çš„æ•°æ®","url":"/awesome-data/"},{"title":"Awesome Databases","url":"/awesome-databases/"},{"title":"Awesome Decentralization","url":"/awesome-decentralization/"},{"title":"Awesome Deno","url":"/awesome-deno/"},{"title":"Awesome Editors","url":"/awesome-editors/"},{"title":"Awesome Emails","url":"/awesome-emails.md/"},{"title":"æ”¶é›†è‹±è¯­å­¦ä¹ å·¥å…·","url":"/awesome-english-learning/"},{"title":"Awesome Extensions","url":"/awesome-extensions/"},{"title":"Awesome File Managers","url":"/awesome-file-managers/"},{"title":"Awesome Flutter","url":"/awesome-flutter/"},{"title":"Awesome Free","url":"/awesome-free/"},{"title":"Awesome Frontend","url":"/awesome-frontend/"},{"title":"Awesome Gatsby","url":"/awesome-gatsby/"},{"title":"æ™ºèƒ½å®¶å±…æ–¹æ¡ˆæ±‡æ€»","url":"/awesome-home/"},{"title":"Awesome ID generator","url":"/awesome-id/"},{"title":"Awesome Interview","url":"/awesome-interview/"},{"title":"Awesome Investing","url":"/awesome-investing/"},{"title":"Awesome Jackett Indexes","url":"/awesome-jackett-indexes/"},{"title":"Awesome Jobs","url":"/awesome-jobs/"},{"title":"Awesome JS Date","url":"/awesome-js-date/"},{"title":"æ”¶é›† Javascript é‡Œå¥½ç”¨çš„åº“","url":"/awesome-js/"},{"title":"Awesome KOL","url":"/awesome-kol/"},{"title":"å¸¸è§çš„ä½ä»£ç /æ— ä»£ç åˆ—è¡¨","url":"/awesome-low-code/"},{"title":"å€¼å¾—å®šæœŸå…³æ³¨çš„ç‹¬ç«‹å¼€å‘è€…/åˆ›é€ è€…","url":"/awesome-maker/"},{"title":"å›½å†…é•œåƒèµ„æºæ±‡æ€»","url":"/awesome-mirrors/"},{"title":"å€¼å¾—è§‚çœ‹çš„ç”µå½±","url":"/awesome-movies/"},{"title":"Awesome News","url":"/awesome-news/"},{"title":"Awesome Notes","url":"/awesome-notes/"},{"title":"Awesome NSFW","url":"/awesome-nsfw/"},{"title":"æ”¶é›†å¯ä»¥åœ¨çº¿é˜…è¯»çš„ä¹¦ç±","url":"/awesome-online-books/"},{"title":"Awesome Open Source","url":"/awesome-open-source/"},{"title":"Awesome Privacy","url":"/awesome-privacy/"},{"title":"Awesome Products","url":"/awesome-products/"},{"title":"é«˜è´¨é‡çš„èµ„æºç½‘ç«™æ”¶é›†ï¼ˆç”µå­ä¹¦ï¼Œç”µå½±ï¼Œç”µè§†å‰§ç­‰ï¼‰","url":"/awesome-resources/"},{"title":"Awesome RSS","url":"/awesome-rss/"},{"title":"Awesome Rust","url":"/awesome-rust/"},{"title":"Awesome Schema","url":"/awesome-schema/"},{"title":"Awesome Self-hosted","url":"/awesome-selfhosted/"},{"title":"Awesome Semantic","url":"/awesome-semantic/"},{"title":"Awesome SEO Tools","url":"/awesome-seo/"},{"title":"Awesome Services","url":"/awesome-service/"},{"title":"æ”¶é›†æœ‰æ„æ€çš„ç¤¾äº¤åº”ç”¨","url":"/awesome-socials/"},{"title":"Awesome Speed","url":"/awesome-speed/"},{"title":"æœ‰æ„æ€çš„åè®®æ”¶é›†","url":"/awesome-standards/"},{"title":"Awesome Startups","url":"/awesome-startups/"},{"title":"Awesome Static Site Generator","url":"/awesome-static-site-generator/"},{"title":"æ”¶é›†è‚¡å¸‚ç›¸å…³çš„èµ„æº","url":"/awesome-stocks/"},{"title":"Awesome Swift","url":"/awesome-swift/"},{"title":"æ”¶é›†ä¸€äº›æœ‰ç”¨çš„æŠ€æœ¯/ç¯å¢ƒé—®é¢˜çš„è§£å†³æ–¹æ¡ˆ","url":"/awesome-tech-anwser/"},{"title":"Awesome Templates","url":"/awesome-templates/"},{"title":"å€¼å¾—è§‚çœ‹çš„ç”µè§†å‰§","url":"/awesome-tv-shows/"},{"title":"Awesome UI","url":"/awesome-ui/"},{"title":"Awesome What Was Your Moment","url":"/awesome-what-was-your-moment/"},{"title":"æ”¶é›†Windowsä¸Šå¥½ç©ï¼Œå¥½ç”¨çš„ä¸œè¥¿","url":"/awesome-windows/"},{"title":"Awesome workflows","url":"/awesome-workflows/"},{"title":"äº’è”ç½‘ç›®å½•æ±‡æ€»","url":"/indexes/"},{"title":"æ”¶é›†ä¸€äº›ç»™äººçµæ„Ÿçš„ä¸œè¥¿","url":"/inspires/"},{"title":"å€¼å¾—å…³æ³¨çš„/æœ‰è¶£çš„äºº","url":"/people/"},{"title":"æ”¶é›†å‘äººæ·±çœçš„è¯","url":"/quotes/"},{"title":"æ¢ç´¢äº’è”ç½‘ä¸Šé«˜è´¨é‡çš„å†…å®¹","url":"/sources/"},{"title":"æœ€å¥½ç”¨çš„å·¥å…·é›†åˆ","url":"/tools/"}]},{"title":"BBR","type":"tag","url":"/tags/bbr/","items":[{"title":"Open BBR for Debian","url":"/open-bbr-for-debian/"}]},{"title":"BT","type":"tag","url":"/tags/bt/","items":[{"title":"qBittorrent setup for Debian","url":"/qbittorrent-setup-for-debian/"},{"title":"Jackett Setup","url":"/jackett-setup/"}]},{"title":"Bash","type":"tag","url":"/tags/bash/","items":[{"title":"Awesome Benchmark","url":"/awesome-benchmark/"},{"title":"Bash Tips","url":"/bash-tips/"},{"title":"Linux Common Commands","url":"/linux-common-commands/"}]},{"title":"Benchmark","type":"tag","url":"/tags/benchmark/","items":[{"title":"Awesome Benchmark","url":"/awesome-benchmark/"}]},{"title":"Books","type":"tag","url":"/tags/books/","items":[{"title":"æ”¶é›†å¯ä»¥åœ¨çº¿é˜…è¯»çš„ä¹¦ç±","url":"/awesome-online-books/"},{"title":"2022å¹´è¯»ä¹¦ç¬”è®°","url":"/books-2022/"},{"title":"è¯»ä¹¦ç¬”è®°","url":"/books/"}]},{"title":"Browser","type":"tag","url":"/tags/browser/","items":[{"title":"Awesome Browsers","url":"/awesome-browsers/"}]},{"title":"CSS","type":"tag","url":"/tags/css/","items":[{"title":"Mini Reset CSS","url":"/mini-reset-css/"},{"title":"Smart word break in CSS","url":"/smart-word-break-in-css/"}]},{"title":"Caddy","type":"tag","url":"/tags/caddy/","items":[{"title":"Caddy2 Setup for Debian","url":"/caddy2-setup-for-debian/"}]},{"title":"CentOS","type":"tag","url":"/tags/cent-os/","items":[{"title":"Install PHP 8.0 On CentOS 7 / RHEL 7","url":"/install-php8-on-centos7/"}]},{"title":"Chat","type":"tag","url":"/tags/chat/","items":[{"title":"Awesome Chat","url":"/awesome-chat/"}]},{"title":"China","type":"tag","url":"/tags/china/","items":[{"title":"åœ¨ä¸­å›½ä¹°æˆ¿ä¹‹å‰ï¼Œä½ éœ€è¦äº†è§£çš„ä¿¡æ¯æ±‡æ€»","url":"/awesome-cn-house/"}]},{"title":"Code","type":"tag","url":"/tags/code/","items":[{"title":"Awesome Code Learning","url":"/awesome-code-learning/"}]},{"title":"Command","type":"tag","url":"/tags/command/","items":[{"title":"Awesome Command Tools","url":"/awesome-cli/"}]},{"title":"Commands","type":"tag","url":"/tags/commands/","items":[{"title":"Linux Common Commands","url":"/linux-common-commands/"}]},{"title":"Communities","type":"tag","url":"/tags/communities/","items":[{"title":"æ”¶é›†ä¸€äº›æœ‰æ„æ€çš„ç¤¾åŒº","url":"/awesome-communities/"}]},{"title":"Comparison","type":"tag","url":"/tags/comparison/","items":[{"title":"Licenseæ¯”è¾ƒ","url":"/license-comparison/"}]},{"title":"DDos","type":"tag","url":"/tags/d-dos/","items":[{"title":"Linux Anti DDos","url":"/linux-network/"}]},{"title":"Dashboard","type":"tag","url":"/tags/dashboard/","items":[{"title":"Awesome Dashboard","url":"/awesome-dashboard/"}]},{"title":"Data","type":"tag","url":"/tags/data/","items":[{"title":"æœ‰è¶£çš„æ•°æ®","url":"/awesome-data/"}]},{"title":"Database","type":"tag","url":"/tags/database/","items":[{"title":"Awesome Databases","url":"/awesome-databases/"}]},{"title":"Date","type":"tag","url":"/tags/date/","items":[{"title":"Awesome JS Date","url":"/awesome-js-date/"}]},{"title":"Debian","type":"tag","url":"/tags/debian/","items":[{"title":"Caddy2 Setup for Debian","url":"/caddy2-setup-for-debian/"},{"title":"Debian Server Setup","url":"/debian-server-setup/"},{"title":"Netdata Setup for Debian","url":"/netdata-setup-for-debian/"},{"title":"Nginx Setup for Debian","url":"/nginx-setup-for-debian/"},{"title":"Nodejs Setup for Debian","url":"/nodejs-setup-for-debian/"},{"title":"Open BBR for Debian","url":"/open-bbr-for-debian/"},{"title":"Postgres Setup for Debian","url":"/postgres-setup-for-debian/"},{"title":"qBittorrent setup for Debian","url":"/qbittorrent-setup-for-debian/"},{"title":"Rust Environment Setup for Debian","url":"/rust-enviroment-setup-for-debian/"},{"title":"Shadowsocks Rust Setup for Debian","url":"/shadowsocks-rust-setup-for-debian/"}]},{"title":"Decentralization","type":"tag","url":"/tags/decentralization/","items":[{"title":"Awesome Decentralization","url":"/awesome-decentralization/"}]},{"title":"Deno","type":"tag","url":"/tags/deno/","items":[{"title":"Awesome Deno","url":"/awesome-deno/"},{"title":"Deno Tips","url":"/deno-tips/"}]},{"title":"Development-Environment","type":"tag","url":"/tags/development-environment/","items":[{"title":"æ”¶é›†Windowsä¸Šå¥½ç©ï¼Œå¥½ç”¨çš„ä¸œè¥¿","url":"/awesome-windows/"}]},{"title":"Docker","type":"tag","url":"/tags/docker/","items":[{"title":"Docker Common Commands","url":"/docker-common-commands/"},{"title":"Docker Setup","url":"/docker-setup/"}]},{"title":"Downloads","type":"tag","url":"/tags/downloads/","items":[{"title":"qBittorrent setup for Debian","url":"/qbittorrent-setup-for-debian/"},{"title":"Youtube Download","url":"/youtube-download/"}]},{"title":"Editors","type":"tag","url":"/tags/editors/","items":[{"title":"Awesome Editors","url":"/awesome-editors/"},{"title":"Vim Tips","url":"/vim-tips/"},{"title":"VS Code Tips","url":"/vscode-tips/"}]},{"title":"Email","type":"tag","url":"/tags/email/","items":[{"title":"Awesome Emails","url":"/awesome-emails.md/"}]},{"title":"English","type":"tag","url":"/tags/english/","items":[{"title":"æ”¶é›†è‹±è¯­å­¦ä¹ å·¥å…·","url":"/awesome-english-learning/"}]},{"title":"Explore","type":"tag","url":"/tags/explore/","items":[{"title":"æ¢ç´¢äº’è”ç½‘ä¸Šé«˜è´¨é‡çš„å†…å®¹","url":"/sources/"}]},{"title":"Extensions","type":"tag","url":"/tags/extensions/","items":[{"title":"Awesome Extensions","url":"/awesome-extensions/"}]},{"title":"FAQ","type":"tag","url":"/tags/faq/","items":[{"title":"æœ‰æ„æ€çš„é—®é¢˜æ”¶é›†","url":"/answers/"},{"title":"æ”¶é›†ä¸€äº›æœ‰ç”¨çš„æŠ€æœ¯/ç¯å¢ƒé—®é¢˜çš„è§£å†³æ–¹æ¡ˆ","url":"/awesome-tech-anwser/"}]},{"title":"Files","type":"tag","url":"/tags/files/","items":[{"title":"Awesome File Managers","url":"/awesome-file-managers/"},{"title":"Caddy File Server Browser with URL Scheme","url":"/caddy-file-server-url-scheme/"},{"title":"FileBrowser Setup","url":"/filebrowser-setup/"},{"title":"Rclone Setup","url":"/rclone-setup/"}]},{"title":"Flutter","type":"tag","url":"/tags/flutter/","items":[{"title":"Awesome Flutter","url":"/awesome-flutter/"}]},{"title":"Following","type":"tag","url":"/tags/following/","items":[{"title":"å€¼å¾—å…³æ³¨çš„/æœ‰è¶£çš„äºº","url":"/people/"}]},{"title":"Free","type":"tag","url":"/tags/free/","items":[{"title":"Awesome Free","url":"/awesome-free/"}]},{"title":"Front-End","type":"tag","url":"/tags/front-end/","items":[{"title":"Awesome UI","url":"/awesome-ui/"},{"title":"SVG","url":"/svg/"}]},{"title":"Frontend","type":"tag","url":"/tags/frontend/","items":[{"title":"Awesome Frontend","url":"/awesome-frontend/"}]},{"title":"Git","type":"tag","url":"/tags/git/","items":[{"title":"Use ssh key for Git","url":"/git-sshkey/"},{"title":"æ”¶é›†å¸¸ç”¨GitæŠ€å·§","url":"/git-tips/"},{"title":"Git workflows","url":"/git-workflows/"},{"title":"How to check if there are uncommited changes in Github Actions?","url":"/github-actions-workflow-check-if-there-is-uncommited-changes/"}]},{"title":"Github","type":"tag","url":"/tags/github/","items":[{"title":"How to check if there are uncommited changes in Github Actions?","url":"/github-actions-workflow-check-if-there-is-uncommited-changes/"}]},{"title":"Go","type":"tag","url":"/tags/go/","items":[{"title":"Go Template Tips","url":"/go-template-tips/"}]},{"title":"HTTPS","type":"tag","url":"/tags/https/","items":[{"title":"åœ¨ä¸­å›½è‡ªåŠ¨ç”Ÿæˆå…è´¹HTTPSè¯ä¹¦çš„æœ€ä½³æ–¹æ¡ˆ","url":"/auto-https-ssl-in-china/"}]},{"title":"Home","type":"tag","url":"/tags/home/","items":[{"title":"æ™ºèƒ½å®¶å±…æ–¹æ¡ˆæ±‡æ€»","url":"/awesome-home/"}]},{"title":"House","type":"tag","url":"/tags/house/","items":[{"title":"åœ¨ä¸­å›½ä¹°æˆ¿ä¹‹å‰ï¼Œä½ éœ€è¦äº†è§£çš„ä¿¡æ¯æ±‡æ€»","url":"/awesome-cn-house/"}]},{"title":"ID","type":"tag","url":"/tags/id/","items":[{"title":"Awesome ID generator","url":"/awesome-id/"}]},{"title":"Indexes","type":"tag","url":"/tags/indexes/","items":[{"title":"äº’è”ç½‘ç›®å½•æ±‡æ€»","url":"/indexes/"}]},{"title":"Inspires","type":"tag","url":"/tags/inspires/","items":[{"title":"æ”¶é›†ä¸€äº›ç»™äººçµæ„Ÿçš„ä¸œè¥¿","url":"/inspires/"}]},{"title":"Interview","type":"tag","url":"/tags/interview/","items":[{"title":"Awesome Interview","url":"/awesome-interview/"}]},{"title":"Investing","type":"tag","url":"/tags/investing/","items":[{"title":"Awesome Investing","url":"/awesome-investing/"}]},{"title":"JSOn","type":"tag","url":"/tags/js-on/","items":[{"title":"Awesome Schema","url":"/awesome-schema/"}]},{"title":"Jackett","type":"tag","url":"/tags/jackett/","items":[{"title":"qBittorrent setup for Debian","url":"/qbittorrent-setup-for-debian/"},{"title":"Jackett Setup","url":"/jackett-setup/"}]},{"title":"Javascript","type":"tag","url":"/tags/javascript/","items":[{"title":"Awesome JS Date","url":"/awesome-js-date/"},{"title":"æ”¶é›† Javascript é‡Œå¥½ç”¨çš„åº“","url":"/awesome-js/"},{"title":"Nodejs Monorepo","url":"/nodejs-monorepo/"},{"title":"Nodejs Setup for Debian","url":"/nodejs-setup-for-debian/"},{"title":"Nodejs Tips","url":"/nodejs-tips/"}]},{"title":"Jellyfin","type":"tag","url":"/tags/jellyfin/","items":[{"title":"Jellyfin setup","url":"/jellyfin-setup/"}]},{"title":"Jobs","type":"tag","url":"/tags/jobs/","items":[{"title":"Awesome Jobs","url":"/awesome-jobs/"}]},{"title":"Jokes","type":"tag","url":"/tags/jokes/","items":[{"title":"ç¬‘è¯æ”¶é›†","url":"/jokes/"}]},{"title":"Journal","type":"tag","url":"/tags/journal/","items":[{"title":"2022å¹´çš„ä¸€äº›è®°å½•","url":"/journal-2022/"},{"title":"2021å¹´çš„ä¸€äº›è®°å½•","url":"/journal-2021/"},{"title":"What Iâ€™m doing now?","url":"/now/"}]},{"title":"KOL","type":"tag","url":"/tags/kol/","items":[{"title":"Awesome KOL","url":"/awesome-kol/"}]},{"title":"Language","type":"tag","url":"/tags/language/","items":[{"title":"å‡ºå›½ï¼Œè¿™å‡ å¥è¯å¿…é¡»å­¦ä¼šç”¨å½“åœ°è¯­è¨€æ€ä¹ˆè¯´","url":"/basic-language/"}]},{"title":"Learning","type":"tag","url":"/tags/learning/","items":[{"title":"Awesome Code Learning","url":"/awesome-code-learning/"},{"title":"æ”¶é›†è‹±è¯­å­¦ä¹ å·¥å…·","url":"/awesome-english-learning/"},{"title":"Awesome Rust","url":"/awesome-rust/"}]},{"title":"License","type":"tag","url":"/tags/license/","items":[{"title":"Licenseæ¯”è¾ƒ","url":"/license-comparison/"}]},{"title":"Life","type":"tag","url":"/tags/life/","items":[{"title":"æå‡ç”Ÿæ´»è´¨é‡çš„ä¸œè¥¿åˆ—è¡¨","url":"/life-pro/"},{"title":"é«˜è´¨é‡ç”Ÿæ´»æ–¹å¼æ¨è","url":"/life-tips/"}]},{"title":"Linux","type":"tag","url":"/tags/linux/","items":[{"title":"Linux Common Commands","url":"/linux-common-commands/"},{"title":"Linux Log","url":"/linux-log/"},{"title":"Linux Anti DDos","url":"/linux-network/"}]},{"title":"List","type":"tag","url":"/tags/list/","items":[{"title":"å€¼å¾—è§‚çœ‹çš„ç”µè§†å‰§","url":"/awesome-tv-shows/"},{"title":"æå‡ç”Ÿæ´»è´¨é‡çš„ä¸œè¥¿åˆ—è¡¨","url":"/life-pro/"},{"title":"æƒ³ä¹°çš„ä¸œè¥¿åˆ—è¡¨","url":"/wish-lists/"}]},{"title":"Log","type":"tag","url":"/tags/log/","items":[{"title":"Linux Log","url":"/linux-log/"}]},{"title":"Low-Code","type":"tag","url":"/tags/low-code/","items":[{"title":"å¸¸è§çš„ä½ä»£ç /æ— ä»£ç åˆ—è¡¨","url":"/awesome-low-code/"}]},{"title":"MacOS","type":"tag","url":"/tags/mac-os/","items":[{"title":"Postgres Setup for Macos","url":"/postgres-setup-for-macos/"}]},{"title":"Makefile - Templates - Workflows","type":"tag","url":"/tags/makefile-templates-workflows/","items":[{"title":"Makefile Templates","url":"/makefile-templates/"}]},{"title":"Maker","type":"tag","url":"/tags/maker/","items":[{"title":"å€¼å¾—å®šæœŸå…³æ³¨çš„ç‹¬ç«‹å¼€å‘è€…/åˆ›é€ è€…","url":"/awesome-maker/"}]},{"title":"Mastdon","type":"tag","url":"/tags/mastdon/","items":[{"title":"Mastdon Development Setup","url":"/mastdon-development-setup/"}]},{"title":"Me","type":"tag","url":"/tags/me/","items":[{"title":"Everything I Know by Owen","url":"/"},{"title":"About Me and the Wiki","url":"/about/"},{"title":"What Iâ€™m doing now?","url":"/now/"},{"title":"Projects","url":"/projects/"}]},{"title":"Medias","type":"tag","url":"/tags/medias/","items":[{"title":"Bazarr Setup","url":"/bazarr-setup/"},{"title":"Caddy File Server Browser with URL Scheme","url":"/caddy-file-server-url-scheme/"},{"title":"Radarr Setup","url":"/radarr-setup/"},{"title":"Rclone Setup","url":"/rclone-setup/"},{"title":"Sonarr Setup","url":"/sonarr-setup/"},{"title":"Subtitles","url":"/subtitles/"},{"title":"Youtube Download","url":"/youtube-download/"},{"title":"Jellyfin setup","url":"/jellyfin-setup/"},{"title":"Jackett Setup","url":"/jackett-setup/"}]},{"title":"Metube","type":"tag","url":"/tags/metube/","items":[{"title":"Youtube Download","url":"/youtube-download/"}]},{"title":"Mirrors","type":"tag","url":"/tags/mirrors/","items":[{"title":"å›½å†…é•œåƒèµ„æºæ±‡æ€»","url":"/awesome-mirrors/"}]},{"title":"Monitor","type":"tag","url":"/tags/monitor/","items":[{"title":"Netdata Setup for Debian","url":"/netdata-setup-for-debian/"}]},{"title":"Monorepo","type":"tag","url":"/tags/monorepo/","items":[{"title":"Nodejs Monorepo","url":"/nodejs-monorepo/"}]},{"title":"Movies","type":"tag","url":"/tags/movies/","items":[{"title":"å€¼å¾—è§‚çœ‹çš„ç”µå½±","url":"/awesome-movies/"},{"title":"ç”µå½±ç¬”è®°","url":"/movies/"}]},{"title":"Music","type":"tag","url":"/tags/music/","items":[{"title":"éŸ³ä¹æ”¶è—","url":"/music/"}]},{"title":"NSFW","type":"tag","url":"/tags/nsfw/","items":[{"title":"Awesome NSFW","url":"/awesome-nsfw/"}]},{"title":"Netdata","type":"tag","url":"/tags/netdata/","items":[{"title":"Netdata Setup for Debian","url":"/netdata-setup-for-debian/"}]},{"title":"Netwok","type":"tag","url":"/tags/netwok/","items":[{"title":"Awesome Speed","url":"/awesome-speed/"}]},{"title":"News","type":"tag","url":"/tags/news/","items":[{"title":"Awesome News","url":"/awesome-news/"}]},{"title":"Nginx","type":"tag","url":"/tags/nginx/","items":[{"title":"Nginx Setup for Debian","url":"/nginx-setup-for-debian/"}]},{"title":"Notes","type":"tag","url":"/tags/notes/","items":[{"title":"Awesome Notes","url":"/awesome-notes/"},{"title":"2022å¹´è¯»ä¹¦ç¬”è®°","url":"/books-2022/"},{"title":"è¯»ä¹¦ç¬”è®°","url":"/books/"},{"title":"ç”µå½±ç¬”è®°","url":"/movies/"},{"title":"ç”µè§†å‰§ç¬”è®°","url":"/tv-shows/"}]},{"title":"Now","type":"tag","url":"/tags/now/","items":[{"title":"What Iâ€™m doing now?","url":"/now/"}]},{"title":"Open Source","type":"tag","url":"/tags/open-source/","items":[{"title":"Awesome Open Source","url":"/awesome-open-source/"}]},{"title":"PHP","type":"tag","url":"/tags/php/","items":[{"title":"Install PHP 8.0 On CentOS 7 / RHEL 7","url":"/install-php8-on-centos7/"}]},{"title":"Peertube","type":"tag","url":"/tags/peertube/","items":[{"title":"Peertube Setup with Caddy Server","url":"/peertube-setup/"}]},{"title":"People","type":"tag","url":"/tags/people/","items":[{"title":"å€¼å¾—å…³æ³¨çš„/æœ‰è¶£çš„äºº","url":"/people/"}]},{"title":"Postgres","type":"tag","url":"/tags/postgres/","items":[{"title":"Postgres Setup for Debian","url":"/postgres-setup-for-debian/"},{"title":"Postgres Setup for Macos","url":"/postgres-setup-for-macos/"}]},{"title":"Postgresql","type":"tag","url":"/tags/postgresql/","items":[{"title":"Postgresql Tips","url":"/postgresql-tips/"}]},{"title":"Privacy","type":"tag","url":"/tags/privacy/","items":[{"title":"Awesome Privacy","url":"/awesome-privacy/"}]},{"title":"Products","type":"tag","url":"/tags/products/","items":[{"title":"Awesome Products","url":"/awesome-products/"}]},{"title":"Programming-Languages","type":"tag","url":"/tags/programming-languages/","items":[{"title":"Go Template Tips","url":"/go-template-tips/"},{"title":"Nodejs Setup for Debian","url":"/nodejs-setup-for-debian/"},{"title":"Nodejs Tips","url":"/nodejs-tips/"}]},{"title":"Projects","type":"tag","url":"/tags/projects/","items":[{"title":"Projects","url":"/projects/"}]},{"title":"Protocol","type":"tag","url":"/tags/protocol/","items":[{"title":"æœ‰æ„æ€çš„åè®®æ”¶é›†","url":"/awesome-standards/"}]},{"title":"Proxies","type":"tag","url":"/tags/proxies/","items":[{"title":"Awesome Benchmark","url":"/awesome-benchmark/"},{"title":"Caddy File Server Browser with URL Scheme","url":"/caddy-file-server-url-scheme/"},{"title":"Caddy2 Setup for Debian","url":"/caddy2-setup-for-debian/"},{"title":"Open BBR for Debian","url":"/open-bbr-for-debian/"},{"title":"Shadowsocks Rust Setup for Debian","url":"/shadowsocks-rust-setup-for-debian/"}]},{"title":"Quotes","type":"tag","url":"/tags/quotes/","items":[{"title":"åˆ’çº¿çš„ç”µè§†å‰§æˆªå›¾","url":"/awesome-tv-quotes/"},{"title":"æ”¶é›†å‘äººæ·±çœçš„è¯","url":"/quotes/"}]},{"title":"RSS","type":"tag","url":"/tags/rss/","items":[{"title":"Awesome RSS","url":"/awesome-rss/"}]},{"title":"Radarr","type":"tag","url":"/tags/radarr/","items":[{"title":"Radarr Setup","url":"/radarr-setup/"}]},{"title":"Rclone","type":"tag","url":"/tags/rclone/","items":[{"title":"Rclone Setup","url":"/rclone-setup/"}]},{"title":"Recommend","type":"tag","url":"/tags/recommend/","items":[{"title":"Awesome Algorithm","url":"/awesome-algorithm/"}]},{"title":"Resource","type":"tag","url":"/tags/resource/","items":[{"title":"é«˜è´¨é‡çš„èµ„æºç½‘ç«™æ”¶é›†ï¼ˆç”µå­ä¹¦ï¼Œç”µå½±ï¼Œç”µè§†å‰§ç­‰ï¼‰","url":"/awesome-resources/"}]},{"title":"Ruby","type":"tag","url":"/tags/ruby/","items":[{"title":"Ruby Setup for MacOS","url":"/ruby-setup/"}]},{"title":"Rust","type":"tag","url":"/tags/rust/","items":[{"title":"Awesome Rust","url":"/awesome-rust/"},{"title":"Rust Environment Setup for Debian","url":"/rust-enviroment-setup-for-debian/"},{"title":"Rust Tips","url":"/rust-tips/"},{"title":"Shadowsocks Rust Setup for Debian","url":"/shadowsocks-rust-setup-for-debian/"}]},{"title":"SEO","type":"tag","url":"/tags/seo/","items":[{"title":"Awesome SEO Tools","url":"/awesome-seo/"}]},{"title":"SSH","type":"tag","url":"/tags/ssh/","items":[{"title":"Use ssh key for Git","url":"/git-sshkey/"}]},{"title":"SSL","type":"tag","url":"/tags/ssl/","items":[{"title":"åœ¨ä¸­å›½è‡ªåŠ¨ç”Ÿæˆå…è´¹HTTPSè¯ä¹¦çš„æœ€ä½³æ–¹æ¡ˆ","url":"/auto-https-ssl-in-china/"}]},{"title":"SVG","type":"tag","url":"/tags/svg/","items":[{"title":"SVG","url":"/svg/"}]},{"title":"Satire","type":"tag","url":"/tags/satire/","items":[{"title":"è®½åˆºè¨€è®ºæ”¶é›†","url":"/satire-quotes/"}]},{"title":"Schema","type":"tag","url":"/tags/schema/","items":[{"title":"Awesome Schema","url":"/awesome-schema/"}]},{"title":"Self-Hosted","type":"tag","url":"/tags/self-hosted/","items":[{"title":"Awesome Automations","url":"/awesome-automations/"},{"title":"Awesome Self-hosted","url":"/awesome-selfhosted/"},{"title":"Bazarr Setup","url":"/bazarr-setup/"},{"title":"Radarr Setup","url":"/radarr-setup/"},{"title":"Sonarr Setup","url":"/sonarr-setup/"},{"title":"Youtube Download","url":"/youtube-download/"},{"title":"Jellyfin setup","url":"/jellyfin-setup/"},{"title":"Jackett Setup","url":"/jackett-setup/"}]},{"title":"Semantic","type":"tag","url":"/tags/semantic/","items":[{"title":"Awesome Semantic","url":"/awesome-semantic/"}]},{"title":"Server","type":"tag","url":"/tags/server/","items":[{"title":"Caddy File Server Browser with URL Scheme","url":"/caddy-file-server-url-scheme/"},{"title":"Caddy2 Setup for Debian","url":"/caddy2-setup-for-debian/"},{"title":"Debian Server Setup","url":"/debian-server-setup/"},{"title":"Nodejs Setup for Debian","url":"/nodejs-setup-for-debian/"},{"title":"Open BBR for Debian","url":"/open-bbr-for-debian/"},{"title":"qBittorrent setup for Debian","url":"/qbittorrent-setup-for-debian/"}]},{"title":"Serverless","type":"tag","url":"/tags/serverless/","items":[{"title":"æ”¶é›†ä¸€äº›æœ‰ç”¨çš„æŠ€æœ¯/ç¯å¢ƒé—®é¢˜çš„è§£å†³æ–¹æ¡ˆ","url":"/awesome-tech-anwser/"}]},{"title":"Service","type":"tag","url":"/tags/service/","items":[{"title":"Awesome Services","url":"/awesome-service/"}]},{"title":"Setup","type":"tag","url":"/tags/setup/","items":[{"title":"Bazarr Setup","url":"/bazarr-setup/"},{"title":"Caddy2 Setup for Debian","url":"/caddy2-setup-for-debian/"},{"title":"Debian Server Setup","url":"/debian-server-setup/"},{"title":"Docker Setup","url":"/docker-setup/"},{"title":"FileBrowser Setup","url":"/filebrowser-setup/"},{"title":"Install PHP 8.0 On CentOS 7 / RHEL 7","url":"/install-php8-on-centos7/"},{"title":"Mastdon Development Setup","url":"/mastdon-development-setup/"},{"title":"Nginx Setup for Debian","url":"/nginx-setup-for-debian/"},{"title":"Nodejs Setup for Debian","url":"/nodejs-setup-for-debian/"},{"title":"Peertube Setup with Caddy Server","url":"/peertube-setup/"},{"title":"Postgres Setup for Debian","url":"/postgres-setup-for-debian/"},{"title":"Postgres Setup for Macos","url":"/postgres-setup-for-macos/"},{"title":"qBittorrent setup for Debian","url":"/qbittorrent-setup-for-debian/"},{"title":"Radarr Setup","url":"/radarr-setup/"},{"title":"Rclone Setup","url":"/rclone-setup/"},{"title":"Ruby Setup for MacOS","url":"/ruby-setup/"},{"title":"Rust Environment Setup for Debian","url":"/rust-enviroment-setup-for-debian/"},{"title":"Shadowsocks Rust Setup for Debian","url":"/shadowsocks-rust-setup-for-debian/"},{"title":"Jellyfin setup","url":"/jellyfin-setup/"},{"title":"Jackett Setup","url":"/jackett-setup/"}]},{"title":"Shadowsocks","type":"tag","url":"/tags/shadowsocks/","items":[{"title":"Shadowsocks Rust Setup for Debian","url":"/shadowsocks-rust-setup-for-debian/"}]},{"title":"Social","type":"tag","url":"/tags/social/","items":[{"title":"æ”¶é›†ä¸€äº›æœ‰æ„æ€çš„ç¤¾åŒº","url":"/awesome-communities/"},{"title":"Awesome Products","url":"/awesome-products/"},{"title":"æ”¶é›†æœ‰æ„æ€çš„ç¤¾äº¤åº”ç”¨","url":"/awesome-socials/"}]},{"title":"Sonarr","type":"tag","url":"/tags/sonarr/","items":[{"title":"Sonarr Setup","url":"/sonarr-setup/"}]},{"title":"Sources","type":"tag","url":"/tags/sources/","items":[{"title":"æ¢ç´¢äº’è”ç½‘ä¸Šé«˜è´¨é‡çš„å†…å®¹","url":"/sources/"}]},{"title":"Speed","type":"tag","url":"/tags/speed/","items":[{"title":"Awesome Speed","url":"/awesome-speed/"}]},{"title":"Standard","type":"tag","url":"/tags/standard/","items":[{"title":"æœ‰æ„æ€çš„åè®®æ”¶é›†","url":"/awesome-standards/"}]},{"title":"Startups","type":"tag","url":"/tags/startups/","items":[{"title":"Awesome Startups","url":"/awesome-startups/"}]},{"title":"Static-Site-Generator","type":"tag","url":"/tags/static-site-generator/","items":[{"title":"Awesome Static Site Generator","url":"/awesome-static-site-generator/"}]},{"title":"Stocks","type":"tag","url":"/tags/stocks/","items":[{"title":"Awesome Investing","url":"/awesome-investing/"},{"title":"æ”¶é›†è‚¡å¸‚ç›¸å…³çš„èµ„æº","url":"/awesome-stocks/"}]},{"title":"Stop","type":"tag","url":"/tags/stop/","items":[{"title":"ä½ åº”è¯¥ç«‹å³åœæ­¢åšçš„äº‹","url":"/stop/"}]},{"title":"Subtitles","type":"tag","url":"/tags/subtitles/","items":[{"title":"Bazarr Setup","url":"/bazarr-setup/"},{"title":"Subtitles","url":"/subtitles/"}]},{"title":"Swift","type":"tag","url":"/tags/swift/","items":[{"title":"Awesome Swift","url":"/awesome-swift/"}]},{"title":"TV","type":"tag","url":"/tags/tv/","items":[{"title":"åˆ’çº¿çš„ç”µè§†å‰§æˆªå›¾","url":"/awesome-tv-quotes/"},{"title":"å€¼å¾—è§‚çœ‹çš„ç”µè§†å‰§","url":"/awesome-tv-shows/"},{"title":"ç”µè§†å‰§ç¬”è®°","url":"/tv-shows/"}]},{"title":"Tech","type":"tag","url":"/tags/tech/","items":[{"title":"æ”¶é›†ä¸€äº›æœ‰ç”¨çš„æŠ€æœ¯/ç¯å¢ƒé—®é¢˜çš„è§£å†³æ–¹æ¡ˆ","url":"/awesome-tech-anwser/"}]},{"title":"Templates","type":"tag","url":"/tags/templates/","items":[{"title":"Awesome Templates","url":"/awesome-templates/"},{"title":"Caddy File Server Browser with URL Scheme","url":"/caddy-file-server-url-scheme/"},{"title":"Go Template Tips","url":"/go-template-tips/"}]},{"title":"Things","type":"tag","url":"/tags/things/","items":[{"title":"æ”¶é›†ä¸€äº›ç»™äººçµæ„Ÿçš„ä¸œè¥¿","url":"/inspires/"}]},{"title":"Thinking","type":"tag","url":"/tags/thinking/","items":[{"title":"æ‰€æ€æ‰€æƒ³","url":"/thoughts/"}]},{"title":"Tips","type":"tag","url":"/tags/tips/","items":[{"title":"Bash Tips","url":"/bash-tips/"},{"title":"Common URL Scheme","url":"/common-url-scheme/"},{"title":"Deno Tips","url":"/deno-tips/"},{"title":"Docker Common Commands","url":"/docker-common-commands/"},{"title":"æ”¶é›†å¸¸ç”¨GitæŠ€å·§","url":"/git-tips/"},{"title":"Go Template Tips","url":"/go-template-tips/"},{"title":"æå‡ç”Ÿæ´»è´¨é‡çš„ä¸œè¥¿åˆ—è¡¨","url":"/life-pro/"},{"title":"é«˜è´¨é‡ç”Ÿæ´»æ–¹å¼æ¨è","url":"/life-tips/"},{"title":"Linux Common Commands","url":"/linux-common-commands/"},{"title":"Nodejs Tips","url":"/nodejs-tips/"},{"title":"Postgresql Tips","url":"/postgresql-tips/"},{"title":"Rust Tips","url":"/rust-tips/"},{"title":"Vim Tips","url":"/vim-tips/"},{"title":"VS Code Tips","url":"/vscode-tips/"}]},{"title":"Todo","type":"tag","url":"/tags/todo/","items":[{"title":"2021 Goals","url":"/goals-2021/"},{"title":"2022 Goals","url":"/goals-2022/"},{"title":"Todos","url":"/todo/"}]},{"title":"Tools","type":"tag","url":"/tags/tools/","items":[{"title":"Awesome Command Tools","url":"/awesome-cli/"},{"title":"Awesome Editors","url":"/awesome-editors/"},{"title":"Awesome Free","url":"/awesome-free/"},{"title":"Awesome Notes","url":"/awesome-notes/"},{"title":"Awesome Self-hosted","url":"/awesome-selfhosted/"},{"title":"Awesome SEO Tools","url":"/awesome-seo/"},{"title":"Awesome Startups","url":"/awesome-startups/"},{"title":"æ”¶é›†Windowsä¸Šå¥½ç©ï¼Œå¥½ç”¨çš„ä¸œè¥¿","url":"/awesome-windows/"},{"title":"æ”¶é›†ä¸€äº›ç»™äººçµæ„Ÿçš„ä¸œè¥¿","url":"/inspires/"},{"title":"æœ€å¥½ç”¨çš„å·¥å…·é›†åˆ","url":"/tools/"}]},{"title":"Torrents","type":"tag","url":"/tags/torrents/","items":[{"title":"qBittorrent setup for Debian","url":"/qbittorrent-setup-for-debian/"},{"title":"Jackett Setup","url":"/jackett-setup/"}]},{"title":"Travel","type":"tag","url":"/tags/travel/","items":[{"title":"æ—…è¡Œæ‰‹ç»­","url":"/travel-approvals/"}]},{"title":"Trends","type":"tag","url":"/tags/trends/","items":[{"title":"äº’è”ç½‘ç›®å½•æ±‡æ€»","url":"/indexes/"}]},{"title":"Tweet","type":"tag","url":"/tags/tweet/","items":[{"title":"æ‰€æ€æ‰€æƒ³","url":"/thoughts/"}]},{"title":"UI","type":"tag","url":"/tags/ui/","items":[{"title":"Awesome UI","url":"/awesome-ui/"}]},{"title":"URL","type":"tag","url":"/tags/url/","items":[{"title":"Common URL Scheme","url":"/common-url-scheme/"}]},{"title":"VS Code","type":"tag","url":"/tags/vs-code/","items":[{"title":"VS Code Tips","url":"/vscode-tips/"}]},{"title":"Vim","type":"tag","url":"/tags/vim/","items":[{"title":"Vim Tips","url":"/vim-tips/"}]},{"title":"Wikipedia","type":"tag","url":"/tags/wikipedia/","items":[{"title":"æ”¶å½•ä¸€äº›æœ‰æ„æ€çš„ç»´åŸºç™¾ç§‘","url":"/awesome-wikipedia/"}]},{"title":"Windows","type":"tag","url":"/tags/windows/","items":[{"title":"æ”¶é›†Windowsä¸Šå¥½ç©ï¼Œå¥½ç”¨çš„ä¸œè¥¿","url":"/awesome-windows/"}]},{"title":"Wish","type":"tag","url":"/tags/wish/","items":[{"title":"æƒ³ä¹°çš„ä¸œè¥¿åˆ—è¡¨","url":"/wish-lists/"}]},{"title":"Workflows","type":"tag","url":"/tags/workflows/","items":[{"title":"Awesome workflows","url":"/awesome-workflows/"},{"title":"Git workflows","url":"/git-workflows/"},{"title":"Nodejs Monorepo","url":"/nodejs-monorepo/"}]},{"title":"Writing","type":"tag","url":"/tags/writing/","items":[{"title":"å¦‚ä½•å†™ä½œï¼Ÿ","url":"/how-to-write/"}]},{"title":"Year2021","type":"tag","url":"/tags/year-2021/","items":[{"title":"2021 Goals","url":"/goals-2021/"},{"title":"2021å¹´çš„ä¸€äº›è®°å½•","url":"/journal-2021/"}]},{"title":"Year2022","type":"tag","url":"/tags/year-2022/","items":[{"title":"2022 Goals","url":"/goals-2022/"},{"title":"2022å¹´çš„ä¸€äº›è®°å½•","url":"/journal-2022/"}]},{"title":"Youtube","type":"tag","url":"/tags/youtube/","items":[{"title":"Youtube Download","url":"/youtube-download/"}]},{"title":"depression","type":"tag","url":"/tags/depression/","items":[{"title":"æŠ‘éƒç—‡ç›¸å…³èµ„æ–™æ±‡æ€»","url":"/depression/"}]},{"title":"mac","type":"tag","url":"/tags/mac/","items":[{"title":"Mac Setup","url":"/mac-setup/"}]},{"title":"qBittorrent","type":"tag","url":"/tags/q-bittorrent/","items":[{"title":"qBittorrent setup for Debian","url":"/qbittorrent-setup-for-debian/"}]},{"title":"setup","type":"tag","url":"/tags/setup/","items":[{"title":"Mac Setup","url":"/mac-setup/"}]},{"title":"ä¸­æ–‡","type":"tag","url":"/tags/ä¸­æ–‡/","items":[{"title":"æœ‰æ„æ€çš„é—®é¢˜æ”¶é›†","url":"/answers/"},{"title":"æ”¶é›†ä¸€äº›æœ‰æ„æ€çš„ç¤¾åŒº","url":"/awesome-communities/"},{"title":"æœ‰è¶£çš„æ•°æ®","url":"/awesome-data/"},{"title":"æ”¶é›† Javascript é‡Œå¥½ç”¨çš„åº“","url":"/awesome-js/"},{"title":"å€¼å¾—è§‚çœ‹çš„ç”µå½±","url":"/awesome-movies/"},{"title":"åˆ’çº¿çš„ç”µè§†å‰§æˆªå›¾","url":"/awesome-tv-quotes/"},{"title":"å€¼å¾—è§‚çœ‹çš„ç”µè§†å‰§","url":"/awesome-tv-shows/"},{"title":"æ”¶é›†Windowsä¸Šå¥½ç©ï¼Œå¥½ç”¨çš„ä¸œè¥¿","url":"/awesome-windows/"},{"title":"2022å¹´è¯»ä¹¦ç¬”è®°","url":"/books-2022/"},{"title":"è¯»ä¹¦ç¬”è®°","url":"/books/"},{"title":"æ”¶é›†å¸¸ç”¨GitæŠ€å·§","url":"/git-tips/"},{"title":"æ”¶é›†ä¸€äº›ç»™äººçµæ„Ÿçš„ä¸œè¥¿","url":"/inspires/"},{"title":"Licenseæ¯”è¾ƒ","url":"/license-comparison/"},{"title":"ç”µå½±ç¬”è®°","url":"/movies/"},{"title":"æ”¶é›†å‘äººæ·±çœçš„è¯","url":"/quotes/"},{"title":"æœ€å¥½ç”¨çš„å·¥å…·é›†åˆ","url":"/tools/"},{"title":"æ—…è¡Œæ‰‹ç»­","url":"/travel-approvals/"},{"title":"ç”µè§†å‰§ç¬”è®°","url":"/tv-shows/"}]},{"title":"å†·çŸ¥è¯†","type":"tag","url":"/tags/å†·çŸ¥è¯†/","items":[{"title":"å†·çŸ¥è¯†","url":"/trivia/"}]}],"latestPosts":[{"fields":{"slug":"/books-2022/","title":"2022å¹´è¯»ä¹¦ç¬”è®°","lastUpdatedAt":"2022-03-17T22:59:53.000Z","lastUpdated":"3/17/2022"},"frontmatter":{"draft":false,"tags":["Books","Notes","ä¸­æ–‡"]}},{"fields":{"slug":"/quotes/","title":"æ”¶é›†å‘äººæ·±çœçš„è¯","lastUpdatedAt":"2022-03-17T22:59:53.000Z","lastUpdated":"3/17/2022"},"frontmatter":{"draft":false,"tags":["Awesome","Quotes","ä¸­æ–‡"]}},{"fields":{"slug":"/sources/","title":"æ¢ç´¢äº’è”ç½‘ä¸Šé«˜è´¨é‡çš„å†…å®¹","lastUpdatedAt":"2022-03-17T22:59:53.000Z","lastUpdated":"3/17/2022"},"frontmatter":{"draft":false,"tags":["Awesome","Explore","Sources"]}},{"fields":{"slug":"/thoughts/","title":"æ‰€æ€æ‰€æƒ³","lastUpdatedAt":"2022-03-17T22:59:53.000Z","lastUpdated":"3/17/2022"},"frontmatter":{"draft":false,"tags":["Thinking","Tweet"]}},{"fields":{"slug":"/tools/","title":"æœ€å¥½ç”¨çš„å·¥å…·é›†åˆ","lastUpdatedAt":"2022-03-17T22:59:53.000Z","lastUpdated":"3/17/2022"},"frontmatter":{"draft":false,"tags":["Awesome","Tools","ä¸­æ–‡"]}},{"fields":{"slug":"/inspires/","title":"æ”¶é›†ä¸€äº›ç»™äººçµæ„Ÿçš„ä¸œè¥¿","lastUpdatedAt":"2022-03-17T20:46:50.000Z","lastUpdated":"3/17/2022"},"frontmatter":{"draft":false,"tags":["Awesome","Tools","ä¸­æ–‡","Things","Inspires"]}},{"fields":{"slug":"/people/","title":"å€¼å¾—å…³æ³¨çš„/æœ‰è¶£çš„äºº","lastUpdatedAt":"2022-03-17T18:33:47.000Z","lastUpdated":"3/17/2022"},"frontmatter":{"draft":false,"tags":["Awesome","People","Following"]}},{"fields":{"slug":"/","title":"Everything I Know by Owen","lastUpdatedAt":"2022-03-17T18:33:31.000Z","lastUpdated":"3/17/2022"},"frontmatter":{"draft":false,"tags":["Me"]}},{"fields":{"slug":"/awesome-communities/","title":"æ”¶é›†ä¸€äº›æœ‰æ„æ€çš„ç¤¾åŒº","lastUpdatedAt":"2022-03-17T18:33:31.000Z","lastUpdated":"3/17/2022"},"frontmatter":{"draft":false,"tags":["Awesome","Communities","Social","ä¸­æ–‡"]}},{"fields":{"slug":"/books/","title":"è¯»ä¹¦ç¬”è®°","lastUpdatedAt":"2022-03-17T18:33:31.000Z","lastUpdated":"3/17/2022"},"frontmatter":{"draft":false,"tags":["Books","Notes","ä¸­æ–‡"]}},{"fields":{"slug":"/indexes/","title":"äº’è”ç½‘ç›®å½•æ±‡æ€»","lastUpdatedAt":"2022-03-17T18:33:31.000Z","lastUpdated":"3/17/2022"},"frontmatter":{"draft":false,"tags":["Awesome","Indexes","Trends"]}},{"fields":{"slug":"/movies/","title":"ç”µå½±ç¬”è®°","lastUpdatedAt":"2022-03-17T18:33:31.000Z","lastUpdated":"3/17/2022"},"frontmatter":{"draft":false,"tags":["Movies","Notes","ä¸­æ–‡"]}},{"fields":{"slug":"/awesome-english-learning/","title":"æ”¶é›†è‹±è¯­å­¦ä¹ å·¥å…·","lastUpdatedAt":"2022-03-17T15:17:12.000Z","lastUpdated":"3/17/2022"},"frontmatter":{"draft":false,"tags":["Awesome","English","Learning"]}},{"fields":{"slug":"/awesome-alternatives/","title":"Awesome Alternatives","lastUpdatedAt":"2022-03-15T20:25:50.000Z","lastUpdated":"3/15/2022"},"frontmatter":{"draft":false,"tags":["Awesome","Alternatives"]}},{"fields":{"slug":"/awesome-articles/","title":"å€¼å¾—ä¸€çœ‹çš„æ–‡ç« åˆ—è¡¨","lastUpdatedAt":"2022-03-15T20:25:50.000Z","lastUpdated":"3/15/2022"},"frontmatter":{"draft":false,"tags":["Awesome","Articles"]}}]}},
    "staticQueryHashes": ["2230547434","2320115945","3495835395","451533639"]}