{
    "componentChunkName": "component---node-modules-gatsby-theme-primer-wiki-src-templates-post-query-js",
    "path": "/awesome-list/",
    "result": {"data":{"mdx":{"id":"d6eb8e73-4ef2-5e34-88a0-217a5595cf64","tableOfContents":{"items":[{"url":"#awesome","title":"Awesome"},{"url":"#social","title":"Social"},{"url":"#communities","title":"Communities"},{"url":"#startup","title":"Startup"},{"url":"#freelancer","title":"Freelancer"},{"url":"#hr","title":"HR"},{"url":"#market","title":"Market"},{"url":"#api","title":"API"},{"url":"#travel","title":"Travel"},{"url":"#media","title":"Media"}]},"fields":{"title":"Awesome List","slug":"/awesome-list/","url":"https://wiki.owenyoung.com/awesome-list/","editUrl":"https://github.com/theowenyoung/wiki/tree/main/awesome-list.md","lastUpdatedAt":"2021-09-12T18:29:05.000Z","lastUpdated":"9/12/2021","gitCreatedAt":"2021-08-29T20:06:24.000Z","shouldShowTitle":true},"frontmatter":{"title":"Awesome List","description":null,"imageAlt":null,"tags":["Awesome","List"],"date":null,"dateModified":null,"language":null,"seoTitle":null,"image":null},"body":"var _excluded = [\"components\"];\n\nfunction _extends() { _extends = Object.assign || function (target) { for (var i = 1; i < arguments.length; i++) { var source = arguments[i]; for (var key in source) { if (Object.prototype.hasOwnProperty.call(source, key)) { target[key] = source[key]; } } } return target; }; return _extends.apply(this, arguments); }\n\nfunction _objectWithoutProperties(source, excluded) { if (source == null) return {}; var target = _objectWithoutPropertiesLoose(source, excluded); var key, i; if (Object.getOwnPropertySymbols) { var sourceSymbolKeys = Object.getOwnPropertySymbols(source); for (i = 0; i < sourceSymbolKeys.length; i++) { key = sourceSymbolKeys[i]; if (excluded.indexOf(key) >= 0) continue; if (!Object.prototype.propertyIsEnumerable.call(source, key)) continue; target[key] = source[key]; } } return target; }\n\nfunction _objectWithoutPropertiesLoose(source, excluded) { if (source == null) return {}; var target = {}; var sourceKeys = Object.keys(source); var key, i; for (i = 0; i < sourceKeys.length; i++) { key = sourceKeys[i]; if (excluded.indexOf(key) >= 0) continue; target[key] = source[key]; } return target; }\n\n/* @jsxRuntime classic */\n\n/* @jsx mdx */\nvar _frontmatter = {\n  \"title\": \"Awesome List\",\n  \"tags\": [\"Awesome\", \"List\"]\n};\nvar layoutProps = {\n  _frontmatter: _frontmatter\n};\nvar MDXLayout = \"wrapper\";\nreturn function MDXContent(_ref) {\n  var components = _ref.components,\n      props = _objectWithoutProperties(_ref, _excluded);\n\n  return mdx(MDXLayout, _extends({}, layoutProps, props, {\n    components: components,\n    mdxType: \"MDXLayout\"\n  }), mdx(\"p\", null, \"Curating the best of list on the internet with good summaries from others.\"), mdx(\"h2\", {\n    \"id\": \"awesome\"\n  }, \"Awesome\"), mdx(\"ul\", null, mdx(\"li\", {\n    parentName: \"ul\"\n  }, mdx(\"a\", {\n    parentName: \"li\",\n    \"href\": \"https://github.com/sindresorhus/awesome\"\n  }, \"GitHub - sindresorhus/awesome: \\uD83D\\uDE0E Awesome lists about all kinds of interesting topics\"))), mdx(\"h2\", {\n    \"id\": \"social\"\n  }, \"Social\"), mdx(\"ul\", null, mdx(\"li\", {\n    parentName: \"ul\"\n  }, mdx(\"a\", {\n    parentName: \"li\",\n    \"href\": \"https://redditlist.io\"\n  }, \"Reddit List\"), \" - Discover Subreddits for different topics\"), mdx(\"li\", {\n    parentName: \"ul\"\n  }, mdx(\"a\", {\n    parentName: \"li\",\n    \"href\": \"https://github.com/croqaz/awesome-decentralized\"\n  }, \"awesome-decentralized\"))), mdx(\"h2\", {\n    \"id\": \"communities\"\n  }, \"Communities\"), mdx(\"ul\", null, mdx(\"li\", {\n    parentName: \"ul\"\n  }, mdx(\"a\", {\n    parentName: \"li\",\n    \"href\": \"https://thehiveindex.com/\"\n  }, \"Hive Index\"), \" - Find online communities, find your people.\")), mdx(\"h2\", {\n    \"id\": \"startup\"\n  }, \"Startup\"), mdx(\"ul\", null, mdx(\"li\", {\n    parentName: \"ul\"\n  }, mdx(\"a\", {\n    parentName: \"li\",\n    \"href\": \"https://startuplaunchlist.com\"\n  }, \"STARTUP LAUNCH LIST\"), \" - A\\u200Brticle list you need to read before launching a startup.\")), mdx(\"h2\", {\n    \"id\": \"freelancer\"\n  }, \"Freelancer\"), mdx(\"ul\", null, mdx(\"li\", {\n    parentName: \"ul\"\n  }, mdx(\"a\", {\n    parentName: \"li\",\n    \"href\": \"https://nira.com/templates/freelancer-templates/\"\n  }, \"Freelancer Resources List\"), \" - All the free resources and templates you need to get work done as a freelancer\")), mdx(\"h2\", {\n    \"id\": \"hr\"\n  }, \"HR\"), mdx(\"ul\", null, mdx(\"li\", {\n    parentName: \"ul\"\n  }, mdx(\"a\", {\n    parentName: \"li\",\n    \"href\": \"https://nomadlist.com\"\n  }, \"Nomad List\"), \" - The biggest crowdsourced list of cities in the world to help you choose where to go next.\")), mdx(\"h2\", {\n    \"id\": \"market\"\n  }, \"Market\"), mdx(\"ul\", null, mdx(\"li\", {\n    parentName: \"ul\"\n  }, mdx(\"a\", {\n    parentName: \"li\",\n    \"href\": \"https://nira.com/templates/marketing-templates/\"\n  }, \"Marketing Resources List\"), \" - The biggest collection of free marketing resources\")), mdx(\"h2\", {\n    \"id\": \"api\"\n  }, \"API\"), mdx(\"ul\", null, mdx(\"li\", {\n    parentName: \"ul\"\n  }, mdx(\"a\", {\n    parentName: \"li\",\n    \"href\": \"https://apilist.fun/\"\n  }, \"API list\"), \" - A collective list of APIs\")), mdx(\"h2\", {\n    \"id\": \"travel\"\n  }, \"Travel\"), mdx(\"ul\", null, mdx(\"li\", {\n    parentName: \"ul\"\n  }, mdx(\"a\", {\n    parentName: \"li\",\n    \"href\": \"https://visalist.io\"\n  }, \"Visa List\"), \" - Know where you can travel with your passport tension free\"), mdx(\"li\", {\n    parentName: \"ul\"\n  }, mdx(\"a\", {\n    parentName: \"li\",\n    \"href\": \"https://www.reddit.com/r/AskReddit/comments/om38bx/what_is_one_country_that_you_will_never_visit/\"\n  }, \"What is one country that you will never visit again?\")), mdx(\"li\", {\n    parentName: \"ul\"\n  }, mdx(\"a\", {\n    parentName: \"li\",\n    \"href\": \"https://www.reddit.com/r/AskReddit/comments/omnrxb/what_is_one_country_you_will_gladly_visit_again/\"\n  }, \"What is one country you will gladly visit again? : AskReddit\"))), mdx(\"h2\", {\n    \"id\": \"media\"\n  }, \"Media\"), mdx(\"ul\", null, mdx(\"li\", {\n    parentName: \"ul\"\n  }, mdx(\"a\", {\n    parentName: \"li\",\n    \"href\": \"https://airtable.com/shriIvyyV3gAJf0x4/tblcakhoBi0A33QhB/viwWIaPD1CBQtE5e1\"\n  }, \"Tech Blogs List\"), \" - Curated list of 3,800+ tech journalists\")));\n}\n;\nMDXContent.isMDXComponent = true;","rawBody":"---\ntitle: Awesome List\ntags:\n  - Awesome\n  - List\n---\n\nCurating the best of list on the internet with good summaries from others.\n\n## Awesome\n\n- [GitHub - sindresorhus/awesome: ğŸ˜ Awesome lists about all kinds of interesting topics](https://github.com/sindresorhus/awesome)\n\n## Social\n\n- [Reddit List](https://redditlist.io) - Discover Subreddits for different topics\n- [awesome-decentralized](https://github.com/croqaz/awesome-decentralized)\n\n## Communities\n\n- [Hive Index](https://thehiveindex.com/) - Find online communities, find your people.\n\n## Startup\n\n- [STARTUP LAUNCH LIST](https://startuplaunchlist.com) - Aâ€‹rticle list you need to read before launching a startup.\n\n## Freelancer\n\n- [Freelancer Resources List](https://nira.com/templates/freelancer-templates/) - All the free resources and templates you need to get work done as a freelancer\n\n## HR\n\n- [Nomad List](https://nomadlist.com) - The biggest crowdsourced list of cities in the world to help you choose where to go next.\n\n## Market\n\n- [Marketing Resources List](https://nira.com/templates/marketing-templates/) - The biggest collection of free marketing resources\n\n## API\n\n- [API list](https://apilist.fun/) - A collective list of APIs\n\n## Travel\n\n- [Visa List](https://visalist.io) - Know where you can travel with your passport tension free\n- [What is one country that you will never visit again?](https://www.reddit.com/r/AskReddit/comments/om38bx/what_is_one_country_that_you_will_never_visit/)\n- [What is one country you will gladly visit again? : AskReddit](https://www.reddit.com/r/AskReddit/comments/omnrxb/what_is_one_country_you_will_gladly_visit_again/)\n\n## Media\n\n- [Tech Blogs List](https://airtable.com/shriIvyyV3gAJf0x4/tblcakhoBi0A33QhB/viwWIaPD1CBQtE5e1) - Curated list of 3,800+ tech journalists\n","excerpt":"Curating the best of list on the internet with good summaries from others. Awesome GitHub - sindresorhus/awesome: ğŸ˜ Awesome lists about allâ€¦","outboundReferences":[],"inboundReferences":[]},"tagsOutbound":{"nodes":[{"frontmatter":{"title":"Awesome Algorithm","tags":["Awesome","Algorithm","Recommend"]},"fields":{"slug":"/awesome-algorithm/","title":"Awesome Algorithm","lastUpdated":"9/5/2021","lastUpdatedAt":"2021-09-05T06:09:14.000Z","gitCreatedAt":"2021-09-05T06:09:14.000Z"}},{"frontmatter":{"title":"Awesome Alternatives","tags":["Awesome","Alternatives"]},"fields":{"slug":"/awesome-alternatives/","title":"Awesome Alternatives","lastUpdated":"9/12/2021","lastUpdatedAt":"2021-09-12T18:29:05.000Z","gitCreatedAt":"2021-09-12T18:29:05.000Z"}},{"frontmatter":{"title":"æœ‰æ„æ€çš„é—®é¢˜æ”¶é›†","tags":["Awesome","FAQ","Answer","ä¸­æ–‡"]},"fields":{"slug":"/awesome-answers/","title":"æœ‰æ„æ€çš„é—®é¢˜æ”¶é›†","lastUpdated":"9/13/2021","lastUpdatedAt":"2021-09-13T11:34:16.000Z","gitCreatedAt":"2021-09-05T04:49:34.000Z"}},{"frontmatter":{"title":"Awesome Applications","tags":["Awesome","Applications"]},"fields":{"slug":"/awesome-applications/","title":"Awesome Applications","lastUpdated":"9/13/2021","lastUpdatedAt":"2021-09-13T16:02:50.000Z","gitCreatedAt":"2021-09-12T18:29:05.000Z"}},{"frontmatter":{"title":"Awesome Automations","tags":["Awesome","Automations","Self-Hosted"]},"fields":{"slug":"/awesome-automations/","title":"Awesome Automations","lastUpdated":"9/12/2021","lastUpdatedAt":"2021-09-12T07:41:32.000Z","gitCreatedAt":"2021-09-03T05:53:38.000Z"}},{"frontmatter":{"title":"","tags":["Awesome"]},"fields":{"slug":"/awesome-backup/","title":"Awesome Backup","lastUpdated":"8/27/2021","lastUpdatedAt":"2021-08-27T02:25:34.000Z","gitCreatedAt":"2021-08-27T02:25:34.000Z"}},{"frontmatter":{"title":"","tags":["Benchmark","Proxies","Bash","Awesome"]},"fields":{"slug":"/awesome-benchmark/","title":"Awesome Benchmark","lastUpdated":"8/27/2021","lastUpdatedAt":"2021-08-27T02:25:34.000Z","gitCreatedAt":"2021-08-27T02:25:34.000Z"}},{"frontmatter":{"title":"","tags":["Awesome"]},"fields":{"slug":"/awesome-bookmarks/","title":"Awesome Bookmarks","lastUpdated":"8/27/2021","lastUpdatedAt":"2021-08-27T02:25:34.000Z","gitCreatedAt":"2021-08-27T02:25:34.000Z"}},{"frontmatter":{"title":"","tags":["Awesome","Browser"]},"fields":{"slug":"/awesome-browsers/","title":"Awesome Browsers","lastUpdated":"9/12/2021","lastUpdatedAt":"2021-09-12T07:41:32.000Z","gitCreatedAt":"2021-09-04T02:41:10.000Z"}},{"frontmatter":{"title":"","tags":["Awesome","Code","Leaning"]},"fields":{"slug":"/awesome-code-learning/","title":"Awesome Code Learning","lastUpdated":"9/4/2021","lastUpdatedAt":"2021-09-04T07:51:54.000Z","gitCreatedAt":"2021-09-04T07:51:54.000Z"}},{"frontmatter":{"title":"","tags":["Awesome","Communities","Social","ä¸­æ–‡"]},"fields":{"slug":"/awesome-communities/","title":"æ”¶é›†ä¸€äº›æœ‰æ„æ€çš„ç¤¾åŒº","lastUpdated":"9/13/2021","lastUpdatedAt":"2021-09-13T16:02:50.000Z","gitCreatedAt":"2021-09-04T07:51:54.000Z"}},{"frontmatter":{"title":"","tags":["Awesome","Editors","Tools"]},"fields":{"slug":"/awesome-editors/","title":"Awesome-Editors","lastUpdated":"9/4/2021","lastUpdatedAt":"2021-09-04T02:41:10.000Z","gitCreatedAt":"2021-09-04T02:41:10.000Z"}},{"frontmatter":{"title":"","tags":["Awesome","English","Learning"]},"fields":{"slug":"/awesome-english-learning/","title":"æ”¶é›†è‹±è¯­å­¦ä¹ å·¥å…·","lastUpdated":"9/5/2021","lastUpdatedAt":"2021-09-05T10:08:42.000Z","gitCreatedAt":"2021-09-04T02:41:10.000Z"}},{"frontmatter":{"title":"","tags":["Awesome","Explore"]},"fields":{"slug":"/awesome-explore/","title":"Awesome Explore","lastUpdated":"9/20/2021","lastUpdatedAt":"2021-09-20T11:35:59.000Z","gitCreatedAt":"2021-09-04T01:08:18.000Z"}},{"frontmatter":{"title":"","tags":["Awesome","Files"]},"fields":{"slug":"/awesome-file-managers/","title":"Awesome File Managers","lastUpdated":"8/27/2021","lastUpdatedAt":"2021-08-27T03:43:35.000Z","gitCreatedAt":"2021-08-27T02:25:34.000Z"}},{"frontmatter":{"title":"Awesome Free","tags":["Free","Awesome","Tools"]},"fields":{"slug":"/awesome-free/","title":"Awesome Free","lastUpdated":"9/4/2021","lastUpdatedAt":"2021-09-04T07:51:54.000Z","gitCreatedAt":"2021-08-29T20:06:24.000Z"}},{"frontmatter":{"title":"","tags":["Awesome"]},"fields":{"slug":"/awesome-gatsby/","title":"Awesome Gatsby","lastUpdated":"8/29/2021","lastUpdatedAt":"2021-08-29T20:06:24.000Z","gitCreatedAt":"2021-08-27T02:25:34.000Z"}},{"frontmatter":{"title":"Awesome Indexes","tags":["Awesome","Indexes","Trends"]},"fields":{"slug":"/awesome-indexes/","title":"Awesome Indexes","lastUpdated":"9/12/2021","lastUpdatedAt":"2021-09-12T10:34:26.000Z","gitCreatedAt":"2021-09-12T10:34:26.000Z"}},{"frontmatter":{"title":"Awesome Interview","tags":["Awesome","Interview"]},"fields":{"slug":"/awesome-interview/","title":"Awesome Interview","lastUpdated":"9/5/2021","lastUpdatedAt":"2021-09-05T04:49:34.000Z","gitCreatedAt":"2021-09-05T04:49:34.000Z"}},{"frontmatter":{"title":"","tags":["Awesome","Investing","Stocks"]},"fields":{"slug":"/awesome-investing/","title":"Awesome Investing","lastUpdated":"9/4/2021","lastUpdatedAt":"2021-09-04T07:51:54.000Z","gitCreatedAt":"2021-09-04T07:51:54.000Z"}},{"frontmatter":{"title":"","tags":["Awesome"]},"fields":{"slug":"/awesome-jackett-indexes/","title":"Awesome Jackett Indexes","lastUpdated":"8/27/2021","lastUpdatedAt":"2021-08-27T02:25:34.000Z","gitCreatedAt":"2021-08-27T02:25:34.000Z"}},{"frontmatter":{"title":"","tags":["Awesome","Javascript","Date"]},"fields":{"slug":"/awesome-js-date/","title":"Awesome JS Date","lastUpdated":"8/27/2021","lastUpdatedAt":"2021-08-27T02:25:34.000Z","gitCreatedAt":"2021-08-27T02:25:34.000Z"}},{"frontmatter":{"title":"æ”¶é›† Javascript é‡Œå¥½ç”¨çš„åº“","tags":["Awesome","Javascript","ä¸­æ–‡"]},"fields":{"slug":"/awesome-js/","title":"æ”¶é›† Javascript é‡Œå¥½ç”¨çš„åº“","lastUpdated":"9/5/2021","lastUpdatedAt":"2021-09-05T06:09:14.000Z","gitCreatedAt":"2021-08-29T20:06:24.000Z"}},{"frontmatter":{"title":"Awesome List","tags":["Awesome","List"]},"fields":{"slug":"/awesome-list/","title":"Awesome List","lastUpdated":"9/12/2021","lastUpdatedAt":"2021-09-12T18:29:05.000Z","gitCreatedAt":"2021-08-29T20:06:24.000Z"}},{"frontmatter":{"title":"å€¼å¾—è§‚çœ‹çš„ç”µå½±","tags":["Movies","Awesome","ä¸­æ–‡"]},"fields":{"slug":"/awesome-movies/","title":"å€¼å¾—è§‚çœ‹çš„ç”µå½±","lastUpdated":"9/3/2021","lastUpdatedAt":"2021-09-03T05:53:38.000Z","gitCreatedAt":"2021-09-03T05:53:38.000Z"}},{"frontmatter":{"title":"Awesome Notes","tags":["Awesome","Notes","Tools"]},"fields":{"slug":"/awesome-notes/","title":"Awesome Notes","lastUpdated":"8/31/2021","lastUpdatedAt":"2021-08-31T04:16:33.000Z","gitCreatedAt":"2021-08-31T00:37:15.000Z"}},{"frontmatter":{"title":"","tags":["Awesome","P2P"]},"fields":{"slug":"/awesome-p2p/","title":"Awesome P2P","lastUpdated":"9/12/2021","lastUpdatedAt":"2021-09-12T10:34:17.000Z","gitCreatedAt":"2021-09-04T07:51:54.000Z"}},{"frontmatter":{"title":"Awesome Privacy","tags":["Awesome","Privacy"]},"fields":{"slug":"/awesome-privacy/","title":"Awesome Privacy","lastUpdated":"9/12/2021","lastUpdatedAt":"2021-09-12T18:29:05.000Z","gitCreatedAt":"2021-09-05T04:49:34.000Z"}},{"frontmatter":{"title":"","tags":["Awesome","Social","Products"]},"fields":{"slug":"/awesome-products/","title":"Awesome Products","lastUpdated":"9/5/2021","lastUpdatedAt":"2021-09-05T04:49:34.000Z","gitCreatedAt":"2021-09-05T04:49:34.000Z"}},{"frontmatter":{"title":"æ”¶é›†å‘äººæ·±çœçš„è¯","tags":["Awesome","Quotes","ä¸­æ–‡"]},"fields":{"slug":"/awesome-quotes/","title":"æ”¶é›†å‘äººæ·±çœçš„è¯","lastUpdated":"9/13/2021","lastUpdatedAt":"2021-09-13T11:34:16.000Z","gitCreatedAt":"2021-09-05T04:49:34.000Z"}},{"frontmatter":{"title":"Awesome Rust","tags":["Awesome","Rust","Learning"]},"fields":{"slug":"/awesome-rust/","title":"Awesome Rust","lastUpdated":"9/21/2021","lastUpdatedAt":"2021-09-21T15:16:07.000Z","gitCreatedAt":"2021-09-05T10:08:42.000Z"}},{"frontmatter":{"title":"","tags":["Awesome","Self-Hosted","Tools"]},"fields":{"slug":"/awesome-selfhosted/","title":"Awesome Self-hosted","lastUpdated":"9/12/2021","lastUpdatedAt":"2021-09-12T10:34:17.000Z","gitCreatedAt":"2021-09-04T01:08:18.000Z"}},{"frontmatter":{"title":"Awesome SEO Tools","tags":["SEO","Awesome","Tools"]},"fields":{"slug":"/awesome-seo/","title":"Awesome SEO Tools","lastUpdated":"8/30/2021","lastUpdatedAt":"2021-08-30T16:14:42.000Z","gitCreatedAt":"2021-08-30T16:14:42.000Z"}},{"frontmatter":{"title":"Awesome Services","tags":["Awesome","Service"]},"fields":{"slug":"/awesome-service/","title":"Awesome Services","lastUpdated":"9/19/2021","lastUpdatedAt":"2021-09-19T03:42:23.000Z","gitCreatedAt":"2021-09-10T07:25:10.000Z"}},{"frontmatter":{"title":"","tags":["Social","Awesome"]},"fields":{"slug":"/awesome-socials/","title":"æ”¶é›†æœ‰æ„æ€çš„ç¤¾äº¤åº”ç”¨","lastUpdated":"9/10/2021","lastUpdatedAt":"2021-09-10T09:43:29.000Z","gitCreatedAt":"2021-08-27T02:25:34.000Z"}},{"frontmatter":{"title":"Awesome Speed","tags":["Awesome","Speed","Netwok"]},"fields":{"slug":"/awesome-speed/","title":"Awesome Speed","lastUpdated":"9/6/2021","lastUpdatedAt":"2021-09-06T16:52:24.000Z","gitCreatedAt":"2021-09-06T16:52:24.000Z"}},{"frontmatter":{"title":"","tags":["Awesome","Startups","Tools"]},"fields":{"slug":"/awesome-startups/","title":"Awesome Startups","lastUpdated":"9/19/2021","lastUpdatedAt":"2021-09-19T03:42:23.000Z","gitCreatedAt":"2021-09-04T01:08:18.000Z"}},{"frontmatter":{"title":"","tags":["Awesome","Static-Site-Generator"]},"fields":{"slug":"/awesome-static-site-generator/","title":"Awesome Static Site Generator","lastUpdated":"8/27/2021","lastUpdatedAt":"2021-08-27T02:25:34.000Z","gitCreatedAt":"2021-08-27T02:25:34.000Z"}},{"frontmatter":{"title":"æ”¶é›†ä¸€äº›æœ‰ç”¨çš„æŠ€æœ¯/ç¯å¢ƒé—®é¢˜çš„è§£å†³æ–¹æ¡ˆ","tags":["Awesome","FAQ","Tech","Serverless"]},"fields":{"slug":"/awesome-tech-anwser/","title":"æ”¶é›†ä¸€äº›æœ‰ç”¨çš„æŠ€æœ¯/ç¯å¢ƒé—®é¢˜çš„è§£å†³æ–¹æ¡ˆ","lastUpdated":"9/10/2021","lastUpdatedAt":"2021-09-10T09:43:29.000Z","gitCreatedAt":"2021-09-10T09:43:29.000Z"}},{"frontmatter":{"title":"Awesome Templates","tags":["Awesome","Templates"]},"fields":{"slug":"/awesome-templates/","title":"Awesome Templates","lastUpdated":"9/22/2021","lastUpdatedAt":"2021-09-22T15:17:38.000Z","gitCreatedAt":"2021-09-22T15:17:38.000Z"}},{"frontmatter":{"title":"æœ€å¥½ç”¨çš„å·¥å…·é›†åˆ","tags":["Awesome","Tools","ä¸­æ–‡"]},"fields":{"slug":"/awesome-tools/","title":"æœ€å¥½ç”¨çš„å·¥å…·é›†åˆ","lastUpdated":"9/16/2021","lastUpdatedAt":"2021-09-16T06:12:30.000Z","gitCreatedAt":"2021-08-29T20:06:24.000Z"}},{"frontmatter":{"title":"å€¼å¾—è§‚çœ‹çš„ç”µè§†å‰§","tags":["Awesome","TV","List","ä¸­æ–‡"]},"fields":{"slug":"/awesome-tv-shows/","title":"å€¼å¾—è§‚çœ‹çš„ç”µè§†å‰§","lastUpdated":"9/13/2021","lastUpdatedAt":"2021-09-13T11:34:16.000Z","gitCreatedAt":"2021-09-03T05:53:38.000Z"}},{"frontmatter":{"title":"","tags":["Awesome","UI","Front-End"]},"fields":{"slug":"/awesome-ui/","title":"Awesome UI","lastUpdated":"9/11/2021","lastUpdatedAt":"2021-09-11T13:23:45.000Z","gitCreatedAt":"2021-08-27T02:25:34.000Z"}},{"frontmatter":{"title":"æ”¶é›†ä¸€äº›å¥½ç©çš„ç½‘ç«™","tags":["Awesome","Tools","ä¸­æ–‡"]},"fields":{"slug":"/awesome-websites/","title":"æ”¶é›†ä¸€äº›å¥½ç©çš„ç½‘ç«™","lastUpdated":"9/12/2021","lastUpdatedAt":"2021-09-12T18:29:05.000Z","gitCreatedAt":"2021-08-29T20:06:24.000Z"}},{"frontmatter":{"title":"Awesome What Was Your Moment","tags":["Awesome"]},"fields":{"slug":"/awesome-what-was-your-moment/","title":"Awesome What Was Your Moment","lastUpdated":"9/5/2021","lastUpdatedAt":"2021-09-05T10:08:42.000Z","gitCreatedAt":"2021-09-05T10:08:42.000Z"}},{"frontmatter":{"title":"æ”¶é›†Windowsä¸Šå¥½ç©ï¼Œå¥½ç”¨çš„ä¸œè¥¿","tags":["Windows","Awesome","Tools","Development-Environment","ä¸­æ–‡"]},"fields":{"slug":"/awesome-windows/","title":"æ”¶é›†Windowsä¸Šå¥½ç©ï¼Œå¥½ç”¨çš„ä¸œè¥¿","lastUpdated":"9/13/2021","lastUpdatedAt":"2021-09-13T11:34:16.000Z","gitCreatedAt":"2021-08-31T23:51:23.000Z"}}]}},"pageContext":{"tags":["Awesome","List"],"slug":"/awesome-list/","sidebarItems":[],"tagsGroups":[{"title":"2021-09","type":"tag","url":"/tags/2021-09/","items":[{"title":"Journal Entry, Sunday, September 05, 2021","url":"/journal/daily-note-2021-09-05/"},{"title":"Journal Entry, Friday, September 10, 2021","url":"/journal/daily-note-2021-09-10/"},{"title":"Journal Entry, Saturday, September 11, 2021","url":"/journal/daily-note-2021-09-11/"},{"title":"Journal Entry, Friday, September 17, 2021","url":"/journal/daily-note-2021-09-17/"},{"title":"Journal Entry, Wednesday, September 15, 2021","url":"/journal/daily-note-2021-09-15/"},{"title":"Journal Entry, Sunday, September 12, 2021","url":"/journal/daily-note-2021-09-12/"}]},{"title":"API","type":"tag","url":"/tags/api/","items":[{"title":"API Tokens","url":"/api-tokens/"}]},{"title":"Algorithm","type":"tag","url":"/tags/algorithm/","items":[{"title":"Awesome Algorithm","url":"/awesome-algorithm/"}]},{"title":"Alternatives","type":"tag","url":"/tags/alternatives/","items":[{"title":"Awesome Alternatives","url":"/awesome-alternatives/"}]},{"title":"Answer","type":"tag","url":"/tags/answer/","items":[{"title":"æœ‰æ„æ€çš„é—®é¢˜æ”¶é›†","url":"/awesome-answers/"}]},{"title":"Applications","type":"tag","url":"/tags/applications/","items":[{"title":"Awesome Applications","url":"/awesome-applications/"}]},{"title":"Approvals","type":"tag","url":"/tags/approvals/","items":[{"title":"æ—…è¡Œæ‰‹ç»­","url":"/travel-approvals/"}]},{"title":"Auth","type":"tag","url":"/tags/auth/","items":[{"title":"API Tokens","url":"/api-tokens/"},{"title":"Auth Gateway","url":"/auth-gateway/"},{"title":"Use ssh key for Git","url":"/git-sshkey/"}]},{"title":"Automations","type":"tag","url":"/tags/automations/","items":[{"title":"Awesome Automations","url":"/awesome-automations/"}]},{"title":"Awesome","type":"tag","url":"/tags/awesome/","items":[{"title":"Awesome Algorithm","url":"/awesome-algorithm/"},{"title":"Awesome Alternatives","url":"/awesome-alternatives/"},{"title":"æœ‰æ„æ€çš„é—®é¢˜æ”¶é›†","url":"/awesome-answers/"},{"title":"Awesome Applications","url":"/awesome-applications/"},{"title":"Awesome Automations","url":"/awesome-automations/"},{"title":"Awesome Backup","url":"/awesome-backup/"},{"title":"Awesome Benchmark","url":"/awesome-benchmark/"},{"title":"Awesome Bookmarks","url":"/awesome-bookmarks/"},{"title":"Awesome Browsers","url":"/awesome-browsers/"},{"title":"Awesome Code Learning","url":"/awesome-code-learning/"},{"title":"æ”¶é›†ä¸€äº›æœ‰æ„æ€çš„ç¤¾åŒº","url":"/awesome-communities/"},{"title":"Awesome-Editors","url":"/awesome-editors/"},{"title":"æ”¶é›†è‹±è¯­å­¦ä¹ å·¥å…·","url":"/awesome-english-learning/"},{"title":"Awesome Explore","url":"/awesome-explore/"},{"title":"Awesome File Managers","url":"/awesome-file-managers/"},{"title":"Awesome Free","url":"/awesome-free/"},{"title":"Awesome Gatsby","url":"/awesome-gatsby/"},{"title":"Awesome Indexes","url":"/awesome-indexes/"},{"title":"Awesome Interview","url":"/awesome-interview/"},{"title":"Awesome Investing","url":"/awesome-investing/"},{"title":"Awesome Jackett Indexes","url":"/awesome-jackett-indexes/"},{"title":"Awesome JS Date","url":"/awesome-js-date/"},{"title":"æ”¶é›† Javascript é‡Œå¥½ç”¨çš„åº“","url":"/awesome-js/"},{"title":"Awesome List","url":"/awesome-list/"},{"title":"å€¼å¾—è§‚çœ‹çš„ç”µå½±","url":"/awesome-movies/"},{"title":"Awesome Notes","url":"/awesome-notes/"},{"title":"Awesome P2P","url":"/awesome-p2p/"},{"title":"Awesome Privacy","url":"/awesome-privacy/"},{"title":"Awesome Products","url":"/awesome-products/"},{"title":"æ”¶é›†å‘äººæ·±çœçš„è¯","url":"/awesome-quotes/"},{"title":"Awesome Rust","url":"/awesome-rust/"},{"title":"Awesome Self-hosted","url":"/awesome-selfhosted/"},{"title":"Awesome SEO Tools","url":"/awesome-seo/"},{"title":"Awesome Services","url":"/awesome-service/"},{"title":"æ”¶é›†æœ‰æ„æ€çš„ç¤¾äº¤åº”ç”¨","url":"/awesome-socials/"},{"title":"Awesome Speed","url":"/awesome-speed/"},{"title":"Awesome Startups","url":"/awesome-startups/"},{"title":"Awesome Static Site Generator","url":"/awesome-static-site-generator/"},{"title":"æ”¶é›†ä¸€äº›æœ‰ç”¨çš„æŠ€æœ¯/ç¯å¢ƒé—®é¢˜çš„è§£å†³æ–¹æ¡ˆ","url":"/awesome-tech-anwser/"},{"title":"Awesome Templates","url":"/awesome-templates/"},{"title":"æœ€å¥½ç”¨çš„å·¥å…·é›†åˆ","url":"/awesome-tools/"},{"title":"å€¼å¾—è§‚çœ‹çš„ç”µè§†å‰§","url":"/awesome-tv-shows/"},{"title":"Awesome UI","url":"/awesome-ui/"},{"title":"æ”¶é›†ä¸€äº›å¥½ç©çš„ç½‘ç«™","url":"/awesome-websites/"},{"title":"Awesome What Was Your Moment","url":"/awesome-what-was-your-moment/"},{"title":"æ”¶é›†Windowsä¸Šå¥½ç©ï¼Œå¥½ç”¨çš„ä¸œè¥¿","url":"/awesome-windows/"}]},{"title":"BBR","type":"tag","url":"/tags/bbr/","items":[{"title":"Open BBR for Debian","url":"/open-bbr-for-debian/"}]},{"title":"BT","type":"tag","url":"/tags/bt/","items":[{"title":"Jackett Setup","url":"/jackett-setup/"},{"title":"qBittorrent setup for Debian","url":"/qbittorrent-setup-for-debian/"}]},{"title":"Bash","type":"tag","url":"/tags/bash/","items":[{"title":"Awesome Benchmark","url":"/awesome-benchmark/"},{"title":"Linux Common Commands","url":"/linux-common-commands/"}]},{"title":"Benchmark","type":"tag","url":"/tags/benchmark/","items":[{"title":"Awesome Benchmark","url":"/awesome-benchmark/"}]},{"title":"Books","type":"tag","url":"/tags/books/","items":[{"title":"è¯»ä¹¦ç¬”è®°","url":"/books/"}]},{"title":"Browser","type":"tag","url":"/tags/browser/","items":[{"title":"Awesome Browsers","url":"/awesome-browsers/"}]},{"title":"CSS","type":"tag","url":"/tags/css/","items":[{"title":"Mini Reset CSS","url":"/mini-reset-css/"},{"title":"Smart word break in CSS","url":"/smart-word-break-in-css/"}]},{"title":"Caddy","type":"tag","url":"/tags/caddy/","items":[{"title":"Caddy2 Setup for Debian","url":"/caddy2-setup-for-debian/"}]},{"title":"CentOS","type":"tag","url":"/tags/cent-os/","items":[{"title":"Install PHP 8.0 On CentOS 7 / RHEL 7","url":"/install-php8-on-centos7/"}]},{"title":"Code","type":"tag","url":"/tags/code/","items":[{"title":"Awesome Code Learning","url":"/awesome-code-learning/"}]},{"title":"Commands","type":"tag","url":"/tags/commands/","items":[{"title":"Linux Common Commands","url":"/linux-common-commands/"}]},{"title":"Communities","type":"tag","url":"/tags/communities/","items":[{"title":"æ”¶é›†ä¸€äº›æœ‰æ„æ€çš„ç¤¾åŒº","url":"/awesome-communities/"}]},{"title":"Comparison","type":"tag","url":"/tags/comparison/","items":[{"title":"Licenseæ¯”è¾ƒ","url":"/license-comparison/"}]},{"title":"Date","type":"tag","url":"/tags/date/","items":[{"title":"Awesome JS Date","url":"/awesome-js-date/"}]},{"title":"Debian","type":"tag","url":"/tags/debian/","items":[{"title":"Caddy2 Setup for Debian","url":"/caddy2-setup-for-debian/"},{"title":"Debian Server Setup","url":"/debian-server-setup/"},{"title":"Netdata Setup for Debian","url":"/netdata-setup-for-debian/"},{"title":"Nodejs Setup for Debian","url":"/nodejs-setup-for-debian/"},{"title":"Open BBR for Debian","url":"/open-bbr-for-debian/"},{"title":"qBittorrent setup for Debian","url":"/qbittorrent-setup-for-debian/"},{"title":"Rust Environment Setup for Debian","url":"/rust-enviroment-setup-for-debian/"},{"title":"Shadowsocks Rust Setup for Debian","url":"/shadowsocks-rust-setup-for-debian/"}]},{"title":"Development-Environment","type":"tag","url":"/tags/development-environment/","items":[{"title":"æ”¶é›†Windowsä¸Šå¥½ç©ï¼Œå¥½ç”¨çš„ä¸œè¥¿","url":"/awesome-windows/"}]},{"title":"Docker","type":"tag","url":"/tags/docker/","items":[{"title":"Docker Setup","url":"/docker-setup/"}]},{"title":"Downloads","type":"tag","url":"/tags/downloads/","items":[{"title":"qBittorrent setup for Debian","url":"/qbittorrent-setup-for-debian/"},{"title":"Youtube Download","url":"/youtube-download/"}]},{"title":"Editors","type":"tag","url":"/tags/editors/","items":[{"title":"Awesome-Editors","url":"/awesome-editors/"},{"title":"Vim Tips","url":"/vim-tips/"},{"title":"VS Code Tips","url":"/vscode-tips/"}]},{"title":"English","type":"tag","url":"/tags/english/","items":[{"title":"æ”¶é›†è‹±è¯­å­¦ä¹ å·¥å…·","url":"/awesome-english-learning/"}]},{"title":"Explore","type":"tag","url":"/tags/explore/","items":[{"title":"Awesome Explore","url":"/awesome-explore/"}]},{"title":"FAQ","type":"tag","url":"/tags/faq/","items":[{"title":"æœ‰æ„æ€çš„é—®é¢˜æ”¶é›†","url":"/awesome-answers/"},{"title":"æ”¶é›†ä¸€äº›æœ‰ç”¨çš„æŠ€æœ¯/ç¯å¢ƒé—®é¢˜çš„è§£å†³æ–¹æ¡ˆ","url":"/awesome-tech-anwser/"}]},{"title":"Files","type":"tag","url":"/tags/files/","items":[{"title":"Awesome File Managers","url":"/awesome-file-managers/"},{"title":"Caddy File Server Browser with URL Scheme","url":"/caddy-file-server-url-scheme/"},{"title":"FileBrowser Setup","url":"/filebrowser-setup/"},{"title":"Rclone Setup","url":"/rclone-setup/"}]},{"title":"Free","type":"tag","url":"/tags/free/","items":[{"title":"Awesome Free","url":"/awesome-free/"}]},{"title":"Front-End","type":"tag","url":"/tags/front-end/","items":[{"title":"Awesome UI","url":"/awesome-ui/"},{"title":"SVG","url":"/svg/"}]},{"title":"Git","type":"tag","url":"/tags/git/","items":[{"title":"Use ssh key for Git","url":"/git-sshkey/"},{"title":"æ”¶é›†å¸¸ç”¨GitæŠ€å·§","url":"/git-tips/"},{"title":"Git workflows","url":"/git-workflows/"}]},{"title":"Go","type":"tag","url":"/tags/go/","items":[{"title":"Go Template Tips","url":"/go-template-tips/"}]},{"title":"Indexes","type":"tag","url":"/tags/indexes/","items":[{"title":"Awesome Indexes","url":"/awesome-indexes/"}]},{"title":"Interview","type":"tag","url":"/tags/interview/","items":[{"title":"Awesome Interview","url":"/awesome-interview/"}]},{"title":"Investing","type":"tag","url":"/tags/investing/","items":[{"title":"Awesome Investing","url":"/awesome-investing/"}]},{"title":"Jackett","type":"tag","url":"/tags/jackett/","items":[{"title":"Jackett Setup","url":"/jackett-setup/"},{"title":"qBittorrent setup for Debian","url":"/qbittorrent-setup-for-debian/"}]},{"title":"Javascript","type":"tag","url":"/tags/javascript/","items":[{"title":"Awesome JS Date","url":"/awesome-js-date/"},{"title":"æ”¶é›† Javascript é‡Œå¥½ç”¨çš„åº“","url":"/awesome-js/"},{"title":"Nodejs Monorepo","url":"/nodejs-monorepo/"},{"title":"Nodejs Setup for Debian","url":"/nodejs-setup-for-debian/"},{"title":"Nodejs Tips","url":"/nodejs-tips/"}]},{"title":"Jellyfin","type":"tag","url":"/tags/jellyfin/","items":[{"title":"Jellyfin setup","url":"/jellyfin-setup/"}]},{"title":"Journal","type":"tag","url":"/tags/journal/","items":[{"title":"What Iâ€™m doing now?","url":"/now/"},{"title":"Journal Entry, Sunday, September 05, 2021","url":"/journal/daily-note-2021-09-05/"},{"title":"Journal Entry, Friday, September 10, 2021","url":"/journal/daily-note-2021-09-10/"},{"title":"Journal Entry, Saturday, September 11, 2021","url":"/journal/daily-note-2021-09-11/"},{"title":"Journal Entry, Friday, September 17, 2021","url":"/journal/daily-note-2021-09-17/"},{"title":"Journal Entry, Wednesday, September 15, 2021","url":"/journal/daily-note-2021-09-15/"},{"title":"Journal Entry, Sunday, September 12, 2021","url":"/journal/daily-note-2021-09-12/"}]},{"title":"Leaning","type":"tag","url":"/tags/leaning/","items":[{"title":"Awesome Code Learning","url":"/awesome-code-learning/"}]},{"title":"Learning","type":"tag","url":"/tags/learning/","items":[{"title":"æ”¶é›†è‹±è¯­å­¦ä¹ å·¥å…·","url":"/awesome-english-learning/"},{"title":"Awesome Rust","url":"/awesome-rust/"}]},{"title":"License","type":"tag","url":"/tags/license/","items":[{"title":"Licenseæ¯”è¾ƒ","url":"/license-comparison/"}]},{"title":"Linux","type":"tag","url":"/tags/linux/","items":[{"title":"Linux Common Commands","url":"/linux-common-commands/"}]},{"title":"List","type":"tag","url":"/tags/list/","items":[{"title":"Awesome List","url":"/awesome-list/"},{"title":"å€¼å¾—è§‚çœ‹çš„ç”µè§†å‰§","url":"/awesome-tv-shows/"}]},{"title":"Makefile - Templates - Workflows","type":"tag","url":"/tags/makefile-templates-workflows/","items":[{"title":"Makefile Templates","url":"/makefile-templates/"}]},{"title":"Me","type":"tag","url":"/tags/me/","items":[{"title":"Everything I Know by Owen","url":"/"},{"title":"About Me","url":"/about/"},{"title":"What Iâ€™m doing now?","url":"/now/"},{"title":"Projects","url":"/projects/"}]},{"title":"Medias","type":"tag","url":"/tags/medias/","items":[{"title":"Bazarr Setup","url":"/bazarr-setup/"},{"title":"Caddy File Server Browser with URL Scheme","url":"/caddy-file-server-url-scheme/"},{"title":"Jackett Setup","url":"/jackett-setup/"},{"title":"Jellyfin setup","url":"/jellyfin-setup/"},{"title":"Radarr Setup","url":"/radarr-setup/"},{"title":"Rclone Setup","url":"/rclone-setup/"},{"title":"Sonarr Setup","url":"/sonarr-setup/"},{"title":"Subtitles","url":"/subtitles/"},{"title":"Youtube Download","url":"/youtube-download/"}]},{"title":"Metube","type":"tag","url":"/tags/metube/","items":[{"title":"Youtube Download","url":"/youtube-download/"}]},{"title":"Monitor","type":"tag","url":"/tags/monitor/","items":[{"title":"Netdata Setup for Debian","url":"/netdata-setup-for-debian/"}]},{"title":"Monorepo","type":"tag","url":"/tags/monorepo/","items":[{"title":"Nodejs Monorepo","url":"/nodejs-monorepo/"}]},{"title":"Movies","type":"tag","url":"/tags/movies/","items":[{"title":"å€¼å¾—è§‚çœ‹çš„ç”µå½±","url":"/awesome-movies/"},{"title":"ç”µå½±ç¬”è®°","url":"/movies/"}]},{"title":"Netdata","type":"tag","url":"/tags/netdata/","items":[{"title":"Netdata Setup for Debian","url":"/netdata-setup-for-debian/"}]},{"title":"Netwok","type":"tag","url":"/tags/netwok/","items":[{"title":"Awesome Speed","url":"/awesome-speed/"}]},{"title":"Notes","type":"tag","url":"/tags/notes/","items":[{"title":"Awesome Notes","url":"/awesome-notes/"},{"title":"è¯»ä¹¦ç¬”è®°","url":"/books/"},{"title":"ç”µå½±ç¬”è®°","url":"/movies/"},{"title":"ç”µè§†å‰§ç¬”è®°","url":"/tv-shows/"}]},{"title":"Now","type":"tag","url":"/tags/now/","items":[{"title":"What Iâ€™m doing now?","url":"/now/"}]},{"title":"P2P","type":"tag","url":"/tags/p-2-p/","items":[{"title":"Awesome P2P","url":"/awesome-p2p/"}]},{"title":"PHP","type":"tag","url":"/tags/php/","items":[{"title":"Install PHP 8.0 On CentOS 7 / RHEL 7","url":"/install-php8-on-centos7/"}]},{"title":"Privacy","type":"tag","url":"/tags/privacy/","items":[{"title":"Awesome Privacy","url":"/awesome-privacy/"}]},{"title":"Products","type":"tag","url":"/tags/products/","items":[{"title":"Awesome Products","url":"/awesome-products/"}]},{"title":"Programming-Languages","type":"tag","url":"/tags/programming-languages/","items":[{"title":"Go Template Tips","url":"/go-template-tips/"},{"title":"Nodejs Setup for Debian","url":"/nodejs-setup-for-debian/"},{"title":"Nodejs Tips","url":"/nodejs-tips/"}]},{"title":"Projects","type":"tag","url":"/tags/projects/","items":[{"title":"Projects","url":"/projects/"}]},{"title":"Proxies","type":"tag","url":"/tags/proxies/","items":[{"title":"Awesome Benchmark","url":"/awesome-benchmark/"},{"title":"Caddy File Server Browser with URL Scheme","url":"/caddy-file-server-url-scheme/"},{"title":"Caddy2 Setup for Debian","url":"/caddy2-setup-for-debian/"},{"title":"Open BBR for Debian","url":"/open-bbr-for-debian/"},{"title":"Shadowsocks Rust Setup for Debian","url":"/shadowsocks-rust-setup-for-debian/"}]},{"title":"Quotes","type":"tag","url":"/tags/quotes/","items":[{"title":"æ”¶é›†å‘äººæ·±çœçš„è¯","url":"/awesome-quotes/"},{"title":"åˆ’çº¿çš„ç”µè§†å‰§æˆªå›¾","url":"/awesome-tv-quotes/"}]},{"title":"Radarr","type":"tag","url":"/tags/radarr/","items":[{"title":"Radarr Setup","url":"/radarr-setup/"}]},{"title":"Rclone","type":"tag","url":"/tags/rclone/","items":[{"title":"Rclone Setup","url":"/rclone-setup/"}]},{"title":"Recommend","type":"tag","url":"/tags/recommend/","items":[{"title":"Awesome Algorithm","url":"/awesome-algorithm/"}]},{"title":"Rust","type":"tag","url":"/tags/rust/","items":[{"title":"Awesome Rust","url":"/awesome-rust/"},{"title":"Rust Environment Setup for Debian","url":"/rust-enviroment-setup-for-debian/"},{"title":"Shadowsocks Rust Setup for Debian","url":"/shadowsocks-rust-setup-for-debian/"}]},{"title":"SEO","type":"tag","url":"/tags/seo/","items":[{"title":"Awesome SEO Tools","url":"/awesome-seo/"}]},{"title":"SSH","type":"tag","url":"/tags/ssh/","items":[{"title":"Use ssh key for Git","url":"/git-sshkey/"}]},{"title":"SVG","type":"tag","url":"/tags/svg/","items":[{"title":"SVG","url":"/svg/"}]},{"title":"Self-Hosted","type":"tag","url":"/tags/self-hosted/","items":[{"title":"Awesome Automations","url":"/awesome-automations/"},{"title":"Awesome Self-hosted","url":"/awesome-selfhosted/"},{"title":"Bazarr Setup","url":"/bazarr-setup/"},{"title":"Jackett Setup","url":"/jackett-setup/"},{"title":"Jellyfin setup","url":"/jellyfin-setup/"},{"title":"Radarr Setup","url":"/radarr-setup/"},{"title":"Sonarr Setup","url":"/sonarr-setup/"},{"title":"Youtube Download","url":"/youtube-download/"}]},{"title":"Server","type":"tag","url":"/tags/server/","items":[{"title":"Caddy File Server Browser with URL Scheme","url":"/caddy-file-server-url-scheme/"},{"title":"Caddy2 Setup for Debian","url":"/caddy2-setup-for-debian/"},{"title":"Debian Server Setup","url":"/debian-server-setup/"},{"title":"Nodejs Setup for Debian","url":"/nodejs-setup-for-debian/"},{"title":"Open BBR for Debian","url":"/open-bbr-for-debian/"},{"title":"qBittorrent setup for Debian","url":"/qbittorrent-setup-for-debian/"}]},{"title":"Serverless","type":"tag","url":"/tags/serverless/","items":[{"title":"æ”¶é›†ä¸€äº›æœ‰ç”¨çš„æŠ€æœ¯/ç¯å¢ƒé—®é¢˜çš„è§£å†³æ–¹æ¡ˆ","url":"/awesome-tech-anwser/"}]},{"title":"Service","type":"tag","url":"/tags/service/","items":[{"title":"Awesome Services","url":"/awesome-service/"}]},{"title":"Setup","type":"tag","url":"/tags/setup/","items":[{"title":"Bazarr Setup","url":"/bazarr-setup/"},{"title":"Caddy2 Setup for Debian","url":"/caddy2-setup-for-debian/"},{"title":"Debian Server Setup","url":"/debian-server-setup/"},{"title":"Docker Setup","url":"/docker-setup/"},{"title":"FileBrowser Setup","url":"/filebrowser-setup/"},{"title":"Install PHP 8.0 On CentOS 7 / RHEL 7","url":"/install-php8-on-centos7/"},{"title":"Jackett Setup","url":"/jackett-setup/"},{"title":"Jellyfin setup","url":"/jellyfin-setup/"},{"title":"Nodejs Setup for Debian","url":"/nodejs-setup-for-debian/"},{"title":"qBittorrent setup for Debian","url":"/qbittorrent-setup-for-debian/"},{"title":"Radarr Setup","url":"/radarr-setup/"},{"title":"Rclone Setup","url":"/rclone-setup/"},{"title":"Rust Environment Setup for Debian","url":"/rust-enviroment-setup-for-debian/"},{"title":"Shadowsocks Rust Setup for Debian","url":"/shadowsocks-rust-setup-for-debian/"}]},{"title":"Shadowsocks","type":"tag","url":"/tags/shadowsocks/","items":[{"title":"Shadowsocks Rust Setup for Debian","url":"/shadowsocks-rust-setup-for-debian/"}]},{"title":"Social","type":"tag","url":"/tags/social/","items":[{"title":"æ”¶é›†ä¸€äº›æœ‰æ„æ€çš„ç¤¾åŒº","url":"/awesome-communities/"},{"title":"Awesome Products","url":"/awesome-products/"},{"title":"æ”¶é›†æœ‰æ„æ€çš„ç¤¾äº¤åº”ç”¨","url":"/awesome-socials/"}]},{"title":"Sonarr","type":"tag","url":"/tags/sonarr/","items":[{"title":"Sonarr Setup","url":"/sonarr-setup/"}]},{"title":"Speed","type":"tag","url":"/tags/speed/","items":[{"title":"Awesome Speed","url":"/awesome-speed/"}]},{"title":"Startups","type":"tag","url":"/tags/startups/","items":[{"title":"Awesome Startups","url":"/awesome-startups/"}]},{"title":"Static-Site-Generator","type":"tag","url":"/tags/static-site-generator/","items":[{"title":"Awesome Static Site Generator","url":"/awesome-static-site-generator/"}]},{"title":"Stocks","type":"tag","url":"/tags/stocks/","items":[{"title":"Awesome Investing","url":"/awesome-investing/"}]},{"title":"Subtitles","type":"tag","url":"/tags/subtitles/","items":[{"title":"Bazarr Setup","url":"/bazarr-setup/"},{"title":"Subtitles","url":"/subtitles/"}]},{"title":"TV","type":"tag","url":"/tags/tv/","items":[{"title":"åˆ’çº¿çš„ç”µè§†å‰§æˆªå›¾","url":"/awesome-tv-quotes/"},{"title":"å€¼å¾—è§‚çœ‹çš„ç”µè§†å‰§","url":"/awesome-tv-shows/"},{"title":"ç”µè§†å‰§ç¬”è®°","url":"/tv-shows/"}]},{"title":"Tech","type":"tag","url":"/tags/tech/","items":[{"title":"æ”¶é›†ä¸€äº›æœ‰ç”¨çš„æŠ€æœ¯/ç¯å¢ƒé—®é¢˜çš„è§£å†³æ–¹æ¡ˆ","url":"/awesome-tech-anwser/"}]},{"title":"Templates","type":"tag","url":"/tags/templates/","items":[{"title":"Awesome Templates","url":"/awesome-templates/"},{"title":"Caddy File Server Browser with URL Scheme","url":"/caddy-file-server-url-scheme/"},{"title":"Go Template Tips","url":"/go-template-tips/"}]},{"title":"Tips","type":"tag","url":"/tags/tips/","items":[{"title":"Common URL Scheme","url":"/common-url-scheme/"},{"title":"æ”¶é›†å¸¸ç”¨GitæŠ€å·§","url":"/git-tips/"},{"title":"Go Template Tips","url":"/go-template-tips/"},{"title":"Linux Common Commands","url":"/linux-common-commands/"},{"title":"Nodejs Tips","url":"/nodejs-tips/"},{"title":"Vim Tips","url":"/vim-tips/"},{"title":"VS Code Tips","url":"/vscode-tips/"}]},{"title":"Todo","type":"tag","url":"/tags/todo/","items":[{"title":"2021 Goals","url":"/goals-2021/"}]},{"title":"Tools","type":"tag","url":"/tags/tools/","items":[{"title":"Awesome-Editors","url":"/awesome-editors/"},{"title":"Awesome Free","url":"/awesome-free/"},{"title":"Awesome Notes","url":"/awesome-notes/"},{"title":"Awesome Self-hosted","url":"/awesome-selfhosted/"},{"title":"Awesome SEO Tools","url":"/awesome-seo/"},{"title":"Awesome Startups","url":"/awesome-startups/"},{"title":"æœ€å¥½ç”¨çš„å·¥å…·é›†åˆ","url":"/awesome-tools/"},{"title":"æ”¶é›†ä¸€äº›å¥½ç©çš„ç½‘ç«™","url":"/awesome-websites/"},{"title":"æ”¶é›†Windowsä¸Šå¥½ç©ï¼Œå¥½ç”¨çš„ä¸œè¥¿","url":"/awesome-windows/"}]},{"title":"Torrents","type":"tag","url":"/tags/torrents/","items":[{"title":"Jackett Setup","url":"/jackett-setup/"},{"title":"qBittorrent setup for Debian","url":"/qbittorrent-setup-for-debian/"}]},{"title":"Travel","type":"tag","url":"/tags/travel/","items":[{"title":"æ—…è¡Œæ‰‹ç»­","url":"/travel-approvals/"}]},{"title":"Trends","type":"tag","url":"/tags/trends/","items":[{"title":"Awesome Indexes","url":"/awesome-indexes/"}]},{"title":"UI","type":"tag","url":"/tags/ui/","items":[{"title":"Awesome UI","url":"/awesome-ui/"}]},{"title":"URL","type":"tag","url":"/tags/url/","items":[{"title":"Common URL Scheme","url":"/common-url-scheme/"}]},{"title":"VS Code","type":"tag","url":"/tags/vs-code/","items":[{"title":"VS Code Tips","url":"/vscode-tips/"}]},{"title":"Vim","type":"tag","url":"/tags/vim/","items":[{"title":"Vim Tips","url":"/vim-tips/"}]},{"title":"Windows","type":"tag","url":"/tags/windows/","items":[{"title":"æ”¶é›†Windowsä¸Šå¥½ç©ï¼Œå¥½ç”¨çš„ä¸œè¥¿","url":"/awesome-windows/"}]},{"title":"Workflows","type":"tag","url":"/tags/workflows/","items":[{"title":"Git workflows","url":"/git-workflows/"},{"title":"Nodejs Monorepo","url":"/nodejs-monorepo/"}]},{"title":"Year2021","type":"tag","url":"/tags/year-2021/","items":[{"title":"2021 Goals","url":"/goals-2021/"},{"title":"Journal Entry, Sunday, September 05, 2021","url":"/journal/daily-note-2021-09-05/"},{"title":"Journal Entry, Friday, September 10, 2021","url":"/journal/daily-note-2021-09-10/"},{"title":"Journal Entry, Saturday, September 11, 2021","url":"/journal/daily-note-2021-09-11/"},{"title":"Journal Entry, Friday, September 17, 2021","url":"/journal/daily-note-2021-09-17/"},{"title":"Journal Entry, Wednesday, September 15, 2021","url":"/journal/daily-note-2021-09-15/"},{"title":"Journal Entry, Sunday, September 12, 2021","url":"/journal/daily-note-2021-09-12/"}]},{"title":"Youtube","type":"tag","url":"/tags/youtube/","items":[{"title":"Youtube Download","url":"/youtube-download/"}]},{"title":"qBittorrent","type":"tag","url":"/tags/q-bittorrent/","items":[{"title":"qBittorrent setup for Debian","url":"/qbittorrent-setup-for-debian/"}]},{"title":"ä¸­æ–‡","type":"tag","url":"/tags/ä¸­æ–‡/","items":[{"title":"æœ‰æ„æ€çš„é—®é¢˜æ”¶é›†","url":"/awesome-answers/"},{"title":"æ”¶é›†ä¸€äº›æœ‰æ„æ€çš„ç¤¾åŒº","url":"/awesome-communities/"},{"title":"æ”¶é›† Javascript é‡Œå¥½ç”¨çš„åº“","url":"/awesome-js/"},{"title":"å€¼å¾—è§‚çœ‹çš„ç”µå½±","url":"/awesome-movies/"},{"title":"æ”¶é›†å‘äººæ·±çœçš„è¯","url":"/awesome-quotes/"},{"title":"æœ€å¥½ç”¨çš„å·¥å…·é›†åˆ","url":"/awesome-tools/"},{"title":"åˆ’çº¿çš„ç”µè§†å‰§æˆªå›¾","url":"/awesome-tv-quotes/"},{"title":"å€¼å¾—è§‚çœ‹çš„ç”µè§†å‰§","url":"/awesome-tv-shows/"},{"title":"æ”¶é›†ä¸€äº›å¥½ç©çš„ç½‘ç«™","url":"/awesome-websites/"},{"title":"æ”¶é›†Windowsä¸Šå¥½ç©ï¼Œå¥½ç”¨çš„ä¸œè¥¿","url":"/awesome-windows/"},{"title":"è¯»ä¹¦ç¬”è®°","url":"/books/"},{"title":"æ”¶é›†å¸¸ç”¨GitæŠ€å·§","url":"/git-tips/"},{"title":"Licenseæ¯”è¾ƒ","url":"/license-comparison/"},{"title":"ç”µå½±ç¬”è®°","url":"/movies/"},{"title":"æ—…è¡Œæ‰‹ç»­","url":"/travel-approvals/"},{"title":"ç”µè§†å‰§ç¬”è®°","url":"/tv-shows/"}]}],"latestPosts":[{"fields":{"slug":"/awesome-templates/","title":"Awesome Templates","lastUpdatedAt":"2021-09-22T15:17:38.000Z","lastUpdated":"9/22/2021"},"frontmatter":{"draft":false,"tags":["Awesome","Templates"]}},{"fields":{"slug":"/awesome-rust/","title":"Awesome Rust","lastUpdatedAt":"2021-09-21T15:16:07.000Z","lastUpdated":"9/21/2021"},"frontmatter":{"draft":false,"tags":["Awesome","Rust","Learning"]}},{"fields":{"slug":"/linux-common-commands/","title":"Linux Common Commands","lastUpdatedAt":"2021-09-21T15:16:07.000Z","lastUpdated":"9/21/2021"},"frontmatter":{"draft":false,"tags":["Tips","Linux","Commands","Bash"]}},{"fields":{"slug":"/awesome-explore/","title":"Awesome Explore","lastUpdatedAt":"2021-09-20T11:35:59.000Z","lastUpdated":"9/20/2021"},"frontmatter":{"draft":false,"tags":["Awesome","Explore"]}},{"fields":{"slug":"/books/","title":"è¯»ä¹¦ç¬”è®°","lastUpdatedAt":"2021-09-20T11:35:59.000Z","lastUpdated":"9/20/2021"},"frontmatter":{"draft":false,"tags":["Books","Notes","ä¸­æ–‡"]}},{"fields":{"slug":"/tv-shows/","title":"ç”µè§†å‰§ç¬”è®°","lastUpdatedAt":"2021-09-20T11:35:59.000Z","lastUpdated":"9/20/2021"},"frontmatter":{"draft":false,"tags":["TV","Notes","ä¸­æ–‡"]}},{"fields":{"slug":"/awesome-service/","title":"Awesome Services","lastUpdatedAt":"2021-09-19T03:42:23.000Z","lastUpdated":"9/19/2021"},"frontmatter":{"draft":false,"tags":["Awesome","Service"]}},{"fields":{"slug":"/awesome-startups/","title":"Awesome Startups","lastUpdatedAt":"2021-09-19T03:42:23.000Z","lastUpdated":"9/19/2021"},"frontmatter":{"draft":false,"tags":["Awesome","Startups","Tools"]}},{"fields":{"slug":"/awesome-tv-quotes/","title":"åˆ’çº¿çš„ç”µè§†å‰§æˆªå›¾","lastUpdatedAt":"2021-09-19T03:42:23.000Z","lastUpdated":"9/19/2021"},"frontmatter":{"draft":false,"tags":["TV","Quotes","ä¸­æ–‡"]}},{"fields":{"slug":"/journal/daily-note-2021-09-17/","title":"Journal Entry, Friday, September 17, 2021","lastUpdatedAt":"2021-09-19T03:42:23.000Z","lastUpdated":"9/19/2021"},"frontmatter":{"draft":false,"tags":["Journal","Year2021","2021-09"]}},{"fields":{"slug":"/awesome-tools/","title":"æœ€å¥½ç”¨çš„å·¥å…·é›†åˆ","lastUpdatedAt":"2021-09-16T06:12:30.000Z","lastUpdated":"9/16/2021"},"frontmatter":{"draft":false,"tags":["Awesome","Tools","ä¸­æ–‡"]}},{"fields":{"slug":"/","title":"Everything I Know by Owen","lastUpdatedAt":"2021-09-15T16:06:20.000Z","lastUpdated":"9/15/2021"},"frontmatter":{"draft":false,"tags":["Me"]}},{"fields":{"slug":"/journal/daily-note-2021-09-15/","title":"Journal Entry, Wednesday, September 15, 2021","lastUpdatedAt":"2021-09-15T16:06:20.000Z","lastUpdated":"9/15/2021"},"frontmatter":{"draft":false,"tags":["Journal","Year2021","2021-09"]}},{"fields":{"slug":"/movies/","title":"ç”µå½±ç¬”è®°","lastUpdatedAt":"2021-09-14T10:16:06.000Z","lastUpdated":"9/14/2021"},"frontmatter":{"draft":false,"tags":["Movies","Notes","ä¸­æ–‡"]}},{"fields":{"slug":"/awesome-applications/","title":"Awesome Applications","lastUpdatedAt":"2021-09-13T16:02:50.000Z","lastUpdated":"9/13/2021"},"frontmatter":{"draft":false,"tags":["Awesome","Applications"]}}]}},
    "staticQueryHashes": ["2320115945","2668576509","3495835395","451533639"]}